date,employee_title,location,employee_status,review_title,years_at_company,helpful,pros,cons,advice_to_mgmt,rating_overall,rating_balance,rating_culture,rating_career,rating_comp,rating_mgmt
2019-02-24, Content Moderator,"Austin, TX",Former Employee ,Tech bro hell,More than a year,0,"Hopefully got my worst corporate experience out of the way early working here.

They somehow make it on the best places to work list every year yet there are a lot of articles about the awful experiences people have doing this work so must have an amazing PR team.","Team leads are basically grown up babysitters who’s job it is to micromanage the people actually doing work but literally nothing else. Seriously TLs don’t know how to do anything but get paid the most good luck trying to bring up real issues they’re more interested in making friendships and givings hugs then finding solutions for how awful people feel working here.

You will never get promoted if you complain to your TLs about how they never do anything managerial.

Can’t tell you how many times as a woman I was told I was dramatic and to chill out when trying to address issues. If you’re a male and have outbursts it’s cool you’ll get a promotion.

Everyone and I mean EVERYONE knows how terrible being employed here is but they work on replacing people not taking care of anyone good at their job.

The responsibly falls on a few good people to carry a project of about 20-30 with maybe 1 person getting compensated for their effort.","I don’t even think y’all hire real managers because I dealt with TLs, operations managers, project managers and literally no one ever cared about improving any situation so maybe hire qualified people not just babysitters.",1.0,1.0,1.0,1.0,1.0,1.0
2019-02-01, Transaction Analyst,"San Antonio, TX",Current Employee ,Company is great for experience in a gamut of business enterprises.,More than 5 years,0,"You'll have a chance to learn different methodologies and procedures. If your observant, you will be cognizant of management techniques. You can turn your time with Accenture into a career. Beyond what I've mentioned, working with Accenture will give you the opportunity to become a better business operator.","Ambiguous promotion guidelines. It seems that even though you receive positive reviews, you're still not good enough to make it to the next level. And despite many inquires, other then the, ""well what do you do"" line, you can feel lost at some times.","Decipher between who is deserving of promotions and who just wants more money. If someone is asking you for positive feedback, and you have nothing negative to say, then reassure them you're trying to get them promoted as apposed to wasting away.",3.0,3.0,3.0,2.0,4.0,3.0
2019-02-01, Senior Analyst,"Houston, TX",Current Employee ,"Big Company- Easy to hide, lots of reasons to let you go",More than 3 years,0,"Lots of opportunity
Regular Promotion Curve
Lots of resources","Hard to change or shift job functions
Extensive rating process by people who don't work with you
Rated on things that don't affect work (after hours organizations, networking, etc.)",,3.0,2.0,3.0,3.0,3.0,3.0
2019-01-17, Management Consulting Analyst,"Charlotte, NC",Current Employee ,Amazing Company!,More than a year,0,"Gives you more of a family type of vibe.
Everyone is extremely helpful from entry level employees to Accenture Leadership","If you are not vocal about what direction you want your career to go in, they will often choose your path for you.",,5.0,5.0,5.0,5.0,5.0,5.0
2019-02-01, Medical Claims Processor,"Louisville, TN",Former Employee ,Contract Worker,Less than a year,0,"Accenture has great hours, bonuses and job description.",Being a Contract Worker there is very little room for advancement. Very clickey with employees and favourites with managers.,Pay attention to how employees are being treated from Management and fellow staff members.,3.0,5.0,2.0,2.0,3.0,3.0
2019-02-14, Content Analyst,"Austin, TX",Former Employee ,Terrible company,More than a year,0,Honestly non. Easy to get a job with them. They just want people without paying attention to quality of the people that are doing the entry level positions.,They don’t recognize hard working employees and only promote their friends. Big on favoritisms. That includes going out within their ground and exchange gifts to buy favors. Schedule change without notice in advance. Other people steal your work credit and get promoted. A lot of gossip and talk behind your back.,Pay attention to favoritisms and be more transparent.,1.0,1.0,2.0,1.0,1.0,1.0
2019-01-18, Training and Development Manager,"San Antonio, TX",Former Employee ,Very forward moving corporation,More than 8 years,0,Professional Consulting; Technological; Outsourcing; Financial Solutions offered to clients,Promotions for people of African descent at the location I was assigned to were very scarce.,Be fair.,4.0,4.0,4.0,3.0,,
2019-01-18, Senior Manager,"Minneapolis, MN",Current Employee ,Overall a good place to work.,More than 8 years,0,"Complex programs and solutions, fast paced, interesting work. Some really good project leaders.","Constant travel 4-5 days every week. 55+ males have have multiple opportunities to move up the ladder, 55+ females have limited career opportunities - unless already Directors.",,4.0,4.0,5.0,4.0,5.0,3.0
2019-01-19,,"Castle Rock, CO",Current Employee ,Senior Software Analyst,More than a year,0,"Friendly Environment, Helping Manager/Leads(Not all Projects).","Not All Projects are development one, you will see support one most of the time.",,5.0,3.0,4.0,4.0,2.0,4.0
2019-01-20,,"Norwalk, CT",Current Employee ,Good Work Experince,Less than a year,0,Working environment very good and timing work from home,relocation and modernization period,good place to improve your skill,5.0,5.0,5.0,4.0,3.0,5.0
2019-01-18, Systems Analyst,"Bloomington, IL",Former Employee ,Great place to work.,More than 5 years,0,"Great opportunities to learn new technologies.
Very supportive of continuing education initiatives.",Not much in terms of cons to say.,Need to have quarterly skip level meetings.,5.0,2.0,4.0,5.0,5.0,3.0
2019-01-27, Digital Business Consultant,"Sacramento, CA",Current Employee ,Great for starting out and growing as a first job,More than 5 years,0,"Great place to learn and grow if you don't have better options. This will lead to better opportunities down the line, especially if you're coming from out of college. Most of the talent will leave after 2-3 years for better opportunities.","Working at client sites can be morale draining. Project based so your experience may also vary. Raises are pretty low. One year, there was a 0% across the board raise unless you had a promotion. Same year our stocks jumped up...",,3.0,3.0,2.0,3.0,3.0,3.0
2019-01-21, Informatics Analyst,"Orlando, FL",Former Employee ,Much work to be done with ASIS,Less than a year,0,"Networking
Community amongst coworkers
Teaches life lessons","Poor leadership
Sketchy practices (I will explain)
Poor starting salary
“Fraternity” mentality
Poor representation of diversity and inability to try to learn and respect other cultures","Practice active leadership and lead teams through action not word, stop targeting employees to fail, don’t terminate employees on the basis of them pursuing higher education.

Much of the management at this particular Accenture office (ASIS - Orlando, FL) indulge in a fraternity mentality of leading. Honestly, it is borderline used car salesmen thinking. If you do not fit in (white male with the exception of one team leader) you will not move up to management. Please do not let others know that you plan further your education or even get certifications as that will give ASIS basis for termination. FLORIDA IS A RIGHT TO WORK STATE. Employers can fire employees AT WILL. Honestly the whole ASIS operation feels shaky. ASIS will recruit recent science major grads with little to no experience in programming and give them on the job training. This training comes with threats of paying back money (approx. $3000 worth of training) if you leave the job in under a year. There are plenty people with health issues and these people are discriminated against when taking on new projects despite a great work ethic and product track. There is a significant amount of work to be done to create a safe space for minorities. WARNING—There is a TARGET on MINORITIES at this company (especially African Americans) . I am warning those interested in this position. It is a trap to continue working in the IT field. It is very difficult to get out of this field once entered. In addition, much of the management have only certificates of completions from online universities and DO NOT understand much of the scientific reasoning and depth that true scientist possess. After being terminated from my position at Accenture ( for rumors of me applying to medical school —which where true) I found another job directly in my field as a chemist that pays $20k more than my position at Accenture. My point is there is better out there and if you do take this position try your best to find a 6 month lease and work while looking for a new job. Gratefully, I landed on my feet and am enjoying the splendors of my hard work in a new environment until I start medical school this July. I wish you all the best.",2.0,2.0,2.0,3.0,3.0,1.0
2019-01-14, Management Consultant,"Washington, DC",Current Employee ,Good Place to Start,More than 5 years,0,"Huge opportunity for growth, ability to explore a range of clients and fields to figure out what works for you, relatively good work-life balance in comparison with other government consultancies.","Progression in the company is largely dependent on your personal relationship with your manager and can be negatively impacted if they leave. Likewise, the performance review/feedback process has changed every year for the past four years and fails to provide consistent, constructive feedback.",,4.0,3.0,4.0,4.0,4.0,3.0
2018-12-29, Content Reviewer,"Austin, TX",Current Employee ,Content Reviewer,Less than a year,0,They care about the working environment.,none so far. everything is very relaxed at accenture yet professional.,none so far,5.0,4.0,4.0,5.0,4.0,3.0
2019-01-27, Technology Consultant,"Reston, VA",Current Employee ,"Good experience, stressful work",More than 3 years,0,Work with great people and get some great experience,"Hours are insane, even after you lose overtime, they expect you to work crazy extra hours.",Do a better job of balancing the work between team members and hire managers who actually care about their employees.,3.0,1.0,4.0,4.0,5.0,3.0
2019-01-14, Manager,"Hartford, CT",Current Employee ,Manager,More than 10 years,0,"Culture, Progressive, Innovative, Aggressive, Integrity, People",Personal devices configuration and process followed for hiring,,5.0,4.0,5.0,5.0,4.0,5.0
2019-02-15,,"San Antonio, TX",Former Employee ,Just an honest review based on personal experience.,More than 3 years,0,Work from Home schedule is probably the ONLY great thing about Accenture Federal Services.,"Honestly, I don't even know where to start. My experience was one that made me do a 360-degree change. I've worked in all different types of corporate environments but nothing was as horrible or low down as AFS. Don't get me wrong I had an awesome team they handled business LIKE A BOSS. This place was just a dead zone for good, loyal, hardworking, star shining people. I lost a lot of GREAT people behind this place. The
Beyond horrible senior manager, LACK OF DIVERSITY. very HIGH turnover rate (6-8 people leave within 6 months per team), No accountability or responsibility for ANYONE. AFS is NOT a place you want to waste your career away in. Don't get STUCK. Be SMART.","I would HIGHLY suggest the C-level executives in D.C to come and CLEAN house and create a training program for new hires besides some ""online"" training material that you can skip over and pass without effort.",1.0,1.0,1.0,1.0,1.0,1.0
2019-01-08,,"Rock Island, IL",Former Employee ,Director,More than a year,0,"Great firm, great training, know how to treat people well",Very large - easy to get lost in shuffle,Keep doing what you are doing,5.0,,,,,
2018-12-31, Manager,"Dallas, TX",Former Employee ,Best company I've ever worked for. It was hard leaving,More than a year,0,I was offered a very unique opportunity at another consulting firm. That's the only reason why I left,Travel. Most people leave because of the travel.,,5.0,5.0,5.0,5.0,5.0,5.0
2019-01-10,,"Santa Clara, CA",Current Employee ,It is good place to work.,More than 3 years,0,"Flexibility, good leadership, good opportunities",Cant think of any,,5.0,3.0,5.0,4.0,4.0,5.0
2019-01-02, Consulting Analyst,"Chicago, IL",Current Employee ,New Consulting Analyst,Less than a year,0,"Great people and benefits, interesting work, plenty of learning opportunities/ training, good work life balance","Huge corporation, easy to feel lost",Foster office culture by investing in office facilities / draw people into the office,5.0,5.0,5.0,5.0,4.0,4.0
2019-01-02, Consulting Analyst,"Chicago, IL",Current Employee ,New Consulting Analyst,Less than a year,0,"Great people and benefits, interesting work, plenty of learning opportunities/ training, good work life balance","Huge corporation, easy to feel lost",Foster office culture by investing in office facilities / draw people into the office,5.0,5.0,5.0,5.0,4.0,4.0
2019-01-09, Client Financial Management Specialist,"Washington, DC",Current Employee ,Clinet Financial Management Specialist,More than 3 years,0,4 months maternity leave - 2 days work from home - excellent work-life balance - excellent culture and benefits.,"In the corporate function (CFM) promotions are not based on merrit, but mostly depend on openings/availabilities; which means someone needs to leave before you can get promoted. It is really frustrating...",Promote people based on their own performance not the availablilty of the roles.,4.0,5.0,5.0,2.0,4.0,5.0
2019-01-19, Manager,"Belgium, WI",Former Employee ,Technology manager,More than 3 years,0,"1- Amazing opportunties if you are lucky with some nice projects.
2- Very competitive company that pushes you to learn and become ready for the after-accenture job.
3- Wide training and international exposure.
4- Some nice people and intelligent people too.
5- Flexible hours if you are lucky.
6- Makes you a success for the after-accenture job.
7- Nice salary as you grow.
8- International
9- If you survive accenture you can survive anything else.","1- Very competitive, if you are 3 top consultants and there is a place for promotion for 2 managers, you might watch your colleagues get a promotion while you stay in your place. The promotion budget is fixed and shared with bonuses. More bonuses to leadership mean less promotions.

2- Lead by fear culture, the person higher than you in hierarchy can think that you are his slave. Everyone is afraid of everyone.

3- Back-stabbing culture: they can promise you for a promotion or a project but once you agree, they will change their mind last minute and might give a promotion to someone stronger than you politically.

4- People are so arrogant, since they are afraid of each other, they need to talk about how successful they are and how important they are even if they are not. Culture of money, fear and power.

5- Money, M O N E Y, that's it. They do everything for money, and they tell you. Selling project without value is fine if the sales is big. 90% of Accenture culture is money driven and you see it in the first day. Believe me.

6- Dictatorship culture. As said the boss decides and he is a dictator thar can ask you to work every night.

7- There is no life, only work. If you need a promotion, forget having a hobby or anything else. I do not have children but impossible to have a child if you are at Accenture!!

8- Jealousy everywhere. Everywhere. People are looking what other people do. No time to collaborate but only to compete and one winner at the end.

9- They ask you to leave (fire you) if they find someone better than you. Not only for
Juniors but they fire Senior Managing Directors too.

10- Fake culture. Yes! You see nice parties and events at work, drinks and foods, but all fake. So people think that Accenture is cool!",I am a simple manager who left Accenture in January 2019. So I can not advice a huge machine like accenture. But I still think that i have no regret to have spent few years at Accenture!,3.0,2.0,2.0,4.0,4.0,3.0
2019-01-22, Oracle Applications Developer Associate,"San Antonio, TX",Former Employee ,"Great job stability, Bad job growth",More than a year,0,"-Good benefits
-Flexible work time (until they take it away)
-Good job security - you can often find another position within Accenture if your team lost the contract or something and needs to shut down
-Generally willing to let you have time off when you need it
-Emphasis on work culture
-May provide a training class for newcomers
-Lots of parties with free alcohol, if you are into that
-Generally friendly coworkers","-Unorganized management. Work loads are wildly erratic. You may spend 2 months or more doing nothing (often this is them having you sit on a project running tests in circles) and then have a month rush. Information gathering is a tedious chore as you will have to track down who has what information for what you need.
-Unhelpful management - Asking questions will often lead to a very unhelpful response. Often overworked (even when non-management has almost nothing to do), they will turn you away because they are busy. Or you will receive the advice of ""do whatever it takes to get it done"" from the main lead.
-Pay is time based. The longer you work there, the more you can make. But they will not consider raising your pay for performance, so coworkers are often very unmotivated.
-May remove flexible work time
-Open office, lots of foot traffic and noise, managers yelling about the latest episode of Walking Dead","Look for feedback from the developers more often. We often have advice that could help greatly streamline the development process.

Organize who has what information. Many hours are lost tracking people down for information.",3.0,3.0,4.0,2.0,4.0,1.0
2018-12-27, Operations Manager,"Atlanta, GA",Former Employee ,A good company,More than 5 years,0,Very good company to work for.,Can be moved around a lot.,,5.0,5.0,3.0,5.0,5.0,3.0
2019-01-16, Senior Manager,"Atlanta, GA",Former Employee ,Organizational Change,More than 10 years,0,Diverse opportunities to work in various industries. Lifelong learning.,Still a boys club. Difficult for women to get to highest levels.,,3.0,3.0,3.0,4.0,3.0,3.0
2018-12-21, Manager,"Minneapolis, MN",Former Employee ,Over all good company,More than 8 years,0,Lot of opportunity to learn new things technologies.,Salary for existing employees not up to market rate. Other similar companies for the similar role pay is more .need market correction.,Look around in market and see that for existing employees there is a salary market correction required.,4.0,4.0,5.0,4.0,3.0,4.0
2018-12-19, Senior Strategy Consultant,"Atlanta, GA",Current Employee ,Great post-MBA opportunity,More than a year,0,"Great network in the Accenture Strategy Consultant Development Program (ASCDP)
Driven co-workers
Large and diverse clients
Flexibility to choose your function and industry alignment after one year of being a generalist
Seen as industry leader in tech space","Lower compensation growth than top strategy firms
Paltry compensation bonuses",,4.0,5.0,5.0,5.0,4.0,5.0
2019-01-03, Senior Manager,"Chicago, IL",Current Employee ,Good Company to Work!,More than 8 years,0,Good brand; great opportunities and challenges and learning,Less compensation in terms of basic pay; more categorization resulting in salary differentiation,Great job. Continue with the goals,3.0,3.0,3.0,3.0,2.0,3.0
2018-12-17, Senior Manager,"San Francisco, CA",Former Employee ,Sr. Manager,More than 3 years,0,opportunity to feel like part of the leading edge with respect to digital transformation,very easy to feel like one more number,,4.0,3.0,4.0,4.0,4.0,
2018-12-15, Consultant,"Arlington, VA",Current Employee ,Consultant,More than 5 years,0,"The people, the innovation, the challenges and problems we solve, the flexibility and ability to reinvent yourself","Grow up or out. Lack of diversity in mid-level leadership, it exists but can be sporadic; it's often a frustrating experience climbing or watching others disappointed along the way. Very competitive.",,4.0,4.0,4.0,4.0,5.0,3.0
2018-11-29,,"Los Angeles, CA",Former Employee ,Technology Consulting Manager,More than 5 years,0,"1. The endless diverse opportunities to learn and grow
2. Great people to work with
3. Flexible work arrangements
4. Great training programs and classes
5. Clear career path
6. Great mentorship program
7. Amazing brand
8. Best place to start when fresh off college and unsure of where you see yourself in 5/10 years
9. Great culture","1. (Generally speaking for consulting firms) the work life balance is not there
2. Salary is not great unless you are an expired hire
3. Very high expectations
4. Disadvantages of a large organization",,5.0,3.0,5.0,5.0,4.0,4.0
2018-12-11, Associate Manager,"Seattle, WA",Current Employee ,"Great support in career yet it's a fairly traditional, conservative environment",More than a year,0,Good benefits and compensation. Strong management and mentorship support. Family like atmosphere.,VERY hierarchical and traditional work environment. Huge company so lots of red tape and politics. Difficult to switch DTEs or focus areas due to managers wanting to keep good people.,,5.0,5.0,5.0,5.0,5.0,5.0
2018-12-11, Senior Manager,"Washington, DC",Current Employee ,Great mentor,More than 8 years,0,"Working with the best people (with the exception of experienced hires in leadership roles), opportunities for growth, generous vacation days, perks gained from travel (miles, AMEX, hotel points, etc)",Experienced hires in leadership roles who don't understand Accenture culture,Take care of your homegrown talents.,5.0,4.0,5.0,5.0,5.0,3.0
2018-12-04, Senior Manager,"Washington, DC",Current Employee ,I've spent my entire career here and don't plan to leave,More than 8 years,0,"The people I work with are highly collaborative and not worried about competing with each other.
I get to work with some of the best technology minds in the industry and implement complex solutions.",I could get a higher salary elsewhere.,,5.0,5.0,5.0,5.0,4.0,5.0
2018-12-16, Applications Development Specialist,"Seattle, WA",Current Employee ,At the beginning it was good,More than 3 years,0,You can be with the client onsite and learn and get involved in many new technologies and know a lot of talented people.,The project can be unstable so is your assignment. You could be rolled off at any moment and you would need to relocate suddenly.,"Pay is very low, at least in Seattle location, compared with other employers. The index for the cost of living is outdated and hence the scale is still down compared to the spike on the cost of rents.",3.0,2.0,3.0,3.0,2.0,1.0
2018-12-04, Business Analyst,"Baltimore, MD",Current Employee ,great place to work,Less than a year,0,"1) Work Friendly environment
2) Provide ample training
3) Reward employee for good work
4) Many opportunities to switch projects","Lots of subcontractors
Mostly accept resources from IT and comp sci backgrounds",,5.0,5.0,5.0,5.0,5.0,5.0
2018-12-05, Management Consultant,"San Francisco, CA",Current Employee ,Management Consultant,Less than a year,0,"Great people, resources, culture, type of work","Difficult to navigate when new, some leaders are better than others—overall experience has a large dependency on the project team","Ensure you are growing your junior people, identify the ones that aren’t high performers and need to be on a performance improvement plan",5.0,4.0,5.0,5.0,4.0,4.0
2018-12-05, Analyst,"Pittsburgh, PA",Current Employee ,Analyst,Less than a year,0,great company to work at,sometimes you may have a lot of work,,4.0,3.0,4.0,4.0,4.0,4.0
2018-12-05, Senior Manager,"San Francisco, CA",Current Employee ,"Huge Company, Good Culture",More than 8 years,0,"Generally, very helpful/friendly people, good culture","Difficult for new joiners due to the size of the company and need to establish a network. Given the nature of the work, you might find it difficult to focus and deepen a specialty area (within management consulting)",Figure out better ways to help people develop a career,4.0,3.0,5.0,3.0,4.0,4.0
2018-12-04, Digital Business Integration Consultant,"Seattle, WA",Current Employee ,3 Years at Accenture out of Undergrad,More than 3 years,0,"Learned a lot during my time at Accenture. Good pay, good benefits.",Experience highly dependent on the project you get staffed on.,,5.0,4.0,4.0,5.0,5.0,4.0
2018-11-27, Buyer,"Santa Isabel, PR",Former Employee ,Buyer,Less than a year,0,"benefits, 401k, great cultural environment",no cons from me,great help to peers,5.0,5.0,5.0,5.0,5.0,5.0
2018-12-16, Associate Manager,"Rocky Hill, CT",Current Employee ,Process Oriented Organization,More than 8 years,0,"- Every one follows the Accenture defined processes word by word
- Thousands of clients, ample opportunities
- Omnipresent, flexible",- Bar of Salaries should be increased to meet the market demands,,3.0,4.0,4.0,4.0,3.0,3.0
2018-11-27, Project Manager,"Atlanta, GA",Current Employee ,"Good opportunities, Great benefits and moderate compensation",More than 10 years,0,Health care insurance is one of the best in class with low premiums and low deductibles. You get to work on great assignments for reputed clients. Work life balance is good in general but depends on the project in some cases. Company culture is good. 401 K is matched up to 6% but 66 cents per dollar.,Slow growth and moderate compensation,,4.0,4.0,5.0,4.0,3.0,4.0
