date,employee_title,location,employee_status,review_title,years_at_company,helpful,pros,cons,advice_to_mgmt,rating_overall,rating_balance,rating_culture,rating_career,rating_comp,rating_mgmt
2019-03-13, Software Engineer,"San Francisco, CA",Current Employee ,"Great perks, pay, and people",More than a year,0,"Most people are extremely nice and driven at Airbnb.

You can really find whatever you are looking for in a team.

The tech stack is a priority for the company, which makes the company a great place to work as an engineer. We have tech talks at the office, open source projects, stipends to attend conferences, etc. We encourage novel/optimal technical solutions even when the project may take more time, and we (at least recently) are trying to build with the long term in mind.","Office politics can be frustrating
Designers have too much power and many don't know how to build UX or be on top of projects
The quality of engineers is highly variable","1. Let go of more engineers who aren't meeting expectations - they are difficult to work with and continuing to play nice is a lose-lose situation for both parties involved. It hurts our brand, wastes money, and lowers the quality of our product. I think we also need to revisit our interview process to make it more fair and filter out more low quality engineers.
2. Being kind (""Be a host"", etc.) does not need to translate into padding every piece of feedback with niceties. I would prefer if the office culture tended more towards radical candor and less towards ""fake nice""",5.0,4.0,3.0,5.0,5.0,3.0
2019-02-26, Trainer,"San Francisco, CA",Current Employee ,Amazing,More than 3 years,0,Work enviroment Money Job duties Facilities,Nothing bad to say about the company,none,5.0,5.0,5.0,5.0,5.0,5.0
2019-02-23, Operations,"Portland, OR",Current Employee ,Middle management is destroying a good thing,More than 3 years,0,"Coworkers are great.
Good food program.
Nice offices.","Middle management is largely promoted from ops with little to no training.
Poorly equipped and regular blockers.
Poor organization management.
Lots of blocks for growth.
Regular reorganization that accomplishes little and the lower level employees have to deal with ever changing landscape.
Headquarters engineers make a lot of money but operational people are often paid under market rates.
No pay transparency and poor management creates confusion.","Stop reorganizing.
Really train management.
A",2.0,3.0,2.0,1.0,2.0,2.0
2018-11-18,,"San Francisco, CA",Current Employee ,Working here over a year...,More than a year,0,"- Compensation: pays more than any other tech company (Google, FB, etc) PLUS new cash bonus PLUS can choose to take your equity refreshers (no cliff) in cash. They also bump everyone to above midpoint of the range, which is really kind and close any gaps for pay equity.

- Business is doing really well: we're profitable, have money to invest in employees + new ventures, never worried about money. Not even having a round of funding for this far out is amazing.

- Great benefits. Free airbnb credits (never expire), lots of PTO and time off, easy parking lot next to the building (they reimburse the price), free lyft credits, top notch food program, etc.

- Management is honest about their pitfalls and is honest about fixing it. I appreciate this because they could sweep it under the rug.

- We're heavily invested in our infrastructure as a 2019 focus. Even hired a CTO who has decades of infrastructure heavy lifting under his belt. Sweet!

- People are really kind and helpful. Fairly rare. There are always going to be politics because people befriend eachother, but honestly you can set up a meeting with a director and they will help you resolve easily. As long as you speak out, people will listen.","Typical growing pains for our size, honestly. For a long time, Airbnb was flat and you could grow your career quickly since the company was small. Now they're trying to add ways to grow your career and make it defined and achievable since there's not low hanging fruit from a flat org, which is good. There's also increased attrition for people who have been here 5-7+ years, but honestly I think fresh people who are excited and new have been better for my team personally. Many managers are also junior, but we've started to hire senior managers - my manager's manager has been doing a great job shaping and changing, which I appreciate.","Get more senior managers rather than junior, it's been helping out. Check their participation rates and hapiness of their reports before hiring them though. Be more stringent on 1st time managers because it's dangerous. Can we have more conference rooms? :)",5.0,5.0,5.0,3.0,5.0,5.0
2019-01-09, Premium Support Team Customer Experience Agent,"Portland, OR",Former Employee ,"Great company, Customer Support role has changed over the years.",More than 3 years,0,"-One of the best companies that I have ever worked for regarding their mission and desire to provide the best customer support while embracing ingenuity
-You will work with some of the nicest people in the industry who are truly exceptional
-Great benefits including free lunch and snacks, quarterly travel coupons
-The CEO truly cares about what the company is doing and it's mission; he holds regular Q+As with employees and makes a visible effort to connect.","-Pay is not that great, I started out at $18/hour and after 3 years at the company, I was only making $20.65 after being promoted
- Little room for growth in role and lack of transparency with how employees receive raises. My lead could not or would not provide me with a direct answer or explanation as to why I was making significantly less than other employees at same SL.
- Metrics can be unreasonable at times due to the nature of the work. You are expected to close X cases a day and maintain a certain NPS, along with other metrics, although you are usually handling mishandled, escalated cases from external support teams that can take days to close. You never know what kind of call/ticket you will get, if it will be a case that takes days to resolve, or if it will be a simple account questions. You are also expected to answer questions with little resources for you and silo-ed departments, with the company motto being 'build the plane as it takes off'.
-Along with having to be compliant with 'call controls' just trying to stay afloat making your 14 cases, you will get pinged throughout the day asking if you can take over other mis-escalated cases. Even if you are overwhelmed with casework and know you don't have the bandwith to take these on, you will quickly lose favor with upper management if you don't.
-Casework can be very stressful, and while the company does it's best with trying to offset this with a fantastic food program and seminars, it emotionally drains you. CX work is more of a mediation role.
-Within the 3 years that I was there, it increasingly became more like a call center, with more micromanaging of your time within the call controls, breaks, etc. Ultimately, this work environment along with poor compensation and lack of upward mobility left me no choice but to accept another offer at a different company, which was one of the hardest and most bittersweet decisions that I ever have made career wise.","Be more transparent with pay structures, realize that the nature of the casework is ambiguous and micromanage less. The company is growing exponentially but that doesn't mean that customer support has to turn in to just another call center.",3.0,3.0,5.0,2.0,3.0,2.0
2018-11-20, Administrative Assistant,"Los Angeles, CA",Former Employee ,A good place to start,Less than a year,0,"good salary, good communication,friendly management,good oportunity, great value proposition","sometimes can be stressful,time differences with other offices, most are young colleagues,",,5.0,5.0,5.0,5.0,5.0,5.0
2018-10-30,,"San Francisco, CA",Current Employee ,Account Representative,More than a year,0,"Food, Insurance, relaxing atmosphere, people",Pay is much lower than the average,Start thinking about your employees more- direct management,4.0,5.0,5.0,4.0,3.0,3.0
2018-10-28, Security Program Manager,"San Francisco, CA",Current Employee ,Phone Interview,Less than a year,0,"Good Business Model, Attractive business outcomes",Business Model needs to be extended,,4.0,4.0,4.0,4.0,4.0,4.0
2018-10-02, Software Engineer,"San Francisco, CA",Current Employee ,Software Engineer,More than 3 years,0,"beautiful office, good pay, technical projects","engineering culture gotten worse, inexperienced and bad managers, lots of politics",,4.0,4.0,3.0,4.0,4.0,3.0
2018-10-25, Security Analyst,"San Francisco, CA",Current Employee ,Security Analyst,Less than a year,0,Fulfilling work. Consistent hours. Decent starting pay for San Francisco. Free food. Good referance on the resume for later work.,"Commuting can be terrible. Parking is a problem for a company that owns so many buildings, it seems like they could aquire the local lots. Hopefully aquisition of the latest building will reduce the problem with the lot on the roof.",Keep up the good work. Listen to your mid level managers.,4.0,3.0,4.0,4.0,4.0,4.0
2018-08-06,,"San Francisco, CA",Current Employee ,Explosive growth with an excellent culture and mission!,More than a year,0,"Summary: I'm really happy here and it's the best job I've ever had. That said, details:

1. People: The people here are really smart, really nice, and really accommodating of healthy work/life balance which is CRAZY important for longevity and long-term happiness. The people are a pleasure to work with, they're helpful, knowledgeable, and REALLY passionate about the company. I have an amazing Manager who advocates for me and it's been such a great experience.

2. Projects: The projects here are those you can't find elsewhere simply because Airbnb is a one-of-a-kind company. A lot of the operational problems we're building and fixing haven't been navigated before. You have a chance to create new processes, projects, and impact in this industry.

3. Culture: This place is serious about its culture or ""Core Values"": do the right thing, advance the mission, don't backstab, don't throw people under the bus, and stand up for the underdog. To give you an idea of the kind of people we want: one of our people raised $20 million for immigrant kids separated from their parents on Facebook-- the largest fundraiser in Facebook's history.

4. Benefits + Compensation: They'll comp you properly, trust me. Airbnb gives a generous total compensation package with lots of stock, fully covered health care/dental/vision for you, $500 in Airbnb credits per quarter, free food (breakfast/lunch/dinner), and all the cool Silicon Valley perks.

5. Flexibility: Work from home, work remotely, take PTO-- just make sure your projects get done. A+++ on this.","1. Disorganization: Hyper growth mode has created some disorganization and issues with accountability. It can be difficult to get things done with random PTOs and a softer culture when it comes to communication.

2. Career advancement: Upward mobility/ career advancement expectations can be slow or unclear because of the disorganization. You have to advocate for yourself and develop a great relationship with your manager.

3. Liquidity: Airbnb isn't a public company so those looking to sell their stocks need to wait for a liquidity event or for the company to IPO. As much as stocks are great, they can't pay the bills so giving employees more opportunity to cash out is important for those of us who aren't billionaires. FYI leadership listened to this complaint and they recently gave us a new way to cash out some of our stock + comp which is a great start.","1. Create and communicate clear paths for career growth and advancement. This is the best way to retain your highest performers who are hungry for more responsibility and impact.

2. Preserve the culture here. It's an amazing and unique strength of the company. You became successful with the current culture; protect it whether or not you decide to go public.",5.0,5.0,5.0,4.0,5.0,5.0
2018-10-05, Program Manager,"Portland, OR",Current Employee ,Program Manager,More than 5 years,0,"Culture, benefits, Work life balance, wonderful people, and a mission that lines up well with my personal values.","Our CEO has amazing ideas and moves very quickly, however our technical infrastructure, and the rest of the company seems to move like dinosaurs","Fill out the executive staff which is missing so many people, And please follow through on rebuilding the site infrastructure to give us the agility we need to be successful",5.0,5.0,5.0,5.0,5.0,4.0
2018-10-15,,"San Francisco, CA",Current Employee ,"Amazing company, full of learning",,0,"-Genuinely nice and smart people
-Thoughtful growth strategy
-Fulfilling job: people take all roles seriously",Really can't think of anything,,5.0,5.0,5.0,5.0,5.0,5.0
2018-09-27, ITX IT Resource,"San Francisco, CA",Former Employee ,Lots of perks but management and culture are an issue,More than 3 years,0,"Good Benefits, $500 Quarterly Airbnb voucher, Bonus program","Management Changes and Politics, Poor Direction and Strategy, Financial Pressures Pre-IPO, Design Methodology is not working with Engineering code","Cutout the managers who are playing political games, focus on teams and survey results to indicate poor management, address issues with attrition",2.0,2.0,3.0,3.0,4.0,1.0
2018-09-01, Senior Software Engineer,"San Francisco, CA",Former Employee ,"Good in general, serious issue in data tech stack",More than 3 years,0,The business has good potential. Culture is great. Most people are very nice. Benefits are above average. Office very beautiful. Great IT equipments.,"The management is mediocre. I heard there are people got promoted to very high level of for trash product. I never seen the cases though. Tech vision and leadership is weak. The data tech stack is absurd, I can't get my work done under such Dev environment.",,4.0,5.0,5.0,3.0,5.0,3.0
2018-09-03, Software Engineer,"San Francisco, CA",Former Employee ,"Good business, toxic culture, lame technology",More than a year,0,Good business. Beautiful office. Good work-life balance. Competitive compensation. Some 401k match. Overall nice people.,"Rather political environment - it seems to me that making ""friends"" and pleasing your manager is more important than doing solid work. Fake and hypocritical. I feel they don't practice what they preach.

Another complaint I have is on the engineering side. There are many talented engineers hired from top schools and FB/GOOG/AMZN/LNKD/MSFT, but miraculously the quality of Airbnb's engineering is not that good, as you can tell from how slow the website and the app are even today. Again, this probably is related to the culture of the company.","Get rid of those senior managers who only care about their own ""career"" and how to make their managers happy. Foster more transparent, real merit-based incentives and culture.",2.0,4.0,1.0,2.0,3.0,1.0
2018-08-18, Data Scientist,"San Francisco, CA",Current Employee ,A great place for data scientists,More than a year,0,"- Lots of great people (smart, skilled, empathetic & kind) both on the DS team and across the company.
- Tons of opportunities to learn and grows as a DS through great lunch & learns (with great external speakers as well), internal workshops and mini-conference like data days. Amazing for data nerds. Lots of opportunities for DS mentorship from experienced folks if you seek it out. $1000 Education stipend.
- Competitive compensation for DS and other positions. Company is profitable and usually generous to its employees.
- All the usual great perks of a Sillicon Valley company like food, great snacks, flexible working hours, lots of benefits etc + $2000 in Airbnb credits/year
- Great tooling and always improving on this (Knowledge Repo, data portal, R, Python servers, modeling platform etc)
- Decent company growth and diversification
- Not everything is perfect, but DS leadership listens, is open to feedback and acts on the feedback
- Great company and DS brand
- Strong data culture: data has a strong voice and DS are respected. People are eager to learn more about data through Data U. Focus on data self sufficiency etc.
- Absolutely stunning office. Visitors are always amazed.
- Inclusive, diverse and welcoming culture","- Waiting for IPO. Company took action to increase cash comp in the meantime (which was highly appreciated!), but still would be great to IPO soon
- Still lots of improvement for data tooling (Superset, pipelining etc) and data quality
- Often stretched thin, which can be stressful. Need to hire more DS faster
- Food is sometimes great, sometimes just ok
- Wish the office was closer to public transportation. Lyft credits mostly solve this, though.
- Sometimes I feel like there can be too much of a SJW vibe, but I suppose this is a byproduct of having lots of highly empathetic and kind people.",,5.0,5.0,5.0,5.0,5.0,5.0
2018-08-26, Service Manager,"San Francisco, CA",Former Employee ,Service Manager,More than 3 years,0,"great perks, friendly people, cool company","large company, working long hours",,4.0,3.0,5.0,5.0,5.0,4.0
2018-08-28,,"San Francisco, CA",Former Employee ,Welp,More than a year,0,They were a very lax company.,"Company had no structure, overall ok.",,1.0,,,,,
2018-06-20, Recruiter,"San Francisco, CA",Current Employee ,Love working here!,More than a year,0,"I absolutely love working here. The culture is amazing, the pay is great, and I couldn't ask for a better team. As a recruiter I get treated as a partner rather than a subordinate, which is empowering and helps me to get things done.","Things change quickly, and leadership isn't always transparent. That could be frustrating for some who want to be in the know and crave a steady work environment, but the company is still small and growing quickly so this certainly meets my own expectations.","Please be more transparent, when possible. Senior leadership in my org in particular has shown a lack of attention/communication.",5.0,4.0,5.0,5.0,4.0,3.0
2018-07-11,,"San Francisco, CA",Current Employee ,Employee Review,More than 3 years,0,"Strong culture, great people, great space and physical environment, global, entrepreneurial, creative, mission driven","Disorganized, complicated matrix, young and inexperienced leadership","Invest more in experienced and mature leaders, brand health and minority staff.",4.0,4.0,5.0,3.0,3.0,3.0
2018-07-12,,"San Francisco, CA",Current Employee ,Non-technical role: lots to be desired,More than 3 years,0,"- Fast-paced
- Decent comp
- Good food
- Beautiful offices","- Decision-makers unclear and unaccountable
- No clear advancement opportunities
- #toomanytolist","This used to be a fun place to work, but we are long past the time when decision-making and authority can rest with a disorganized group of folks at all levels. Tough decisions need to be made and carried out, rather than letting a clique of favored insiders continue to call the shots. Poisonous managers need to be purged, communication about priorities and org structure need to be more widely and more regularly shared, and people who are good collaborators need to be rewarded.",2.0,1.0,3.0,2.0,4.0,1.0
2018-07-05, Management,"San Francisco, CA",Former Employee ,Great Company. Culture at Risk.,More than 3 years,0,"Smart, mission-driven, committed employees. Beautiful physical work environment. Amazing food. Interesting, challenging work.","Chaotic, undisciplined decision-making. Grueling pace. Too little emphasis on hiring and developing great leaders. The executive team lacks cohesiveness. Managers are not held accountable for poor leadership behaviors.","Airbnb is able to attract exceptional 21st-century leaders but is not consistently hiring for those attributes. Too many managers drive their people, rather than inspire them. It only takes a few weak managers to demotivate large numbers of people.",3.0,2.0,4.0,4.0,5.0,2.0
2018-06-15, Business Development Analyst,"New York, NY",Current Employee ,Good pay,More than a year,0,Above market pay compared to other tech firms,Lack of perks compare to peers,,5.0,,,,,
2018-07-10,,"San Francisco, CA",Current Employee ,Looks good outside but bad inside,More than 5 years,0,"Amazing mission & physical work environment.
Amazing food.
Amazing public image.","Poor decision making - either too many parties involved in making decision or everybody waits for everybody to make decision.
Poor middle management and taking advantage by traveling extensively for ""business purposes"" by writing up sexy proposals but in actual fact, they travel for fun (so called team building/offsite/summit) and then follow by their personal travels. This applies to managers and even non managers in North America, EMEA & APAC.","Enough of advices from other reviewers.
Look at the awards: Best Places to Work: 2017 (#35), 2016 (#1), 2018 is nowhere to be found.",1.0,,,,,
2018-05-07, Data Scientist,"San Francisco, CA",Current Employee ,Awesome place to work as a Data Scientist,More than a year,0,"1) Data Scientists are valued partners and have a seat at the table when key decisions are made. PMs seek out my input to opportunity size projects, and when I have an idea that I want to drive, they listen. My eng leader is keen to invest in data in order to support my and my team's work.
2) The team has a wealth of expertise in many fields of data science, ML, forecasting, Analytics, etc. Whenever I have a question, there is always someone on the team who is an expert that I can learn from.
3) I really like our internal tools - both Airflow and Superset are two of my favorite new tools since joining Airbnb. Also our internal experimentation platform.
4) I'm excited to work for a company that I think is genuinely making the world a better place by helping people connect and belong. I came to the US as a refugee, and Airbnb's stand for refugees made me proud to work here.
5) Internal mobility on the data science team is strongly encouraged and supported. Once you've been in your role for a year or two, you can start looking at other roles if you're interested. So there are always more problems to solve!","1) Airbnb moves really fast - roadmaps change frequently and it's sometimes hard to keep up.
2) While we're getting better at it, we still don't always think very long term.","Really internalize ""infinite horizon"". Amazon spent a long time not making any money and building for the long term, while being a public company. We're a private company and should have even more flexibility to do just that.",5.0,5.0,5.0,5.0,5.0,5.0
2018-06-07,,"New York, NY",Former Employee ,Managing Director LATAM,More than a year,0,Great Company and tons of potential.,"Due to the companies growth, sometimes there is no clear organization",,5.0,,,,,
2018-05-23,,"San Francisco, CA",Current Employee ,"Amazing culture, mission, colleagues",Less than a year,0,"Company lives and breathes its culture, they hire people that are committed to teamwork and the mission. A lot of flexibility with work hours, leadership is very understanding of career growth requests, and they're open to input","Startup culture moves in a messy pace, there can be lack of coordination and accountability at certain levels due to the hyper growth",Keep doing what you're doing,5.0,5.0,5.0,5.0,5.0,5.0
2018-05-06, Data Scientist,"San Francisco, CA",Current Employee ,Amazing culture and impactful work!,,0,"I am very proud of the culture and impact of our data science team. We have one of the most diverse teams in industry, with more than 120 Data Scientists working on all aspects of the business. I could not be happier to come to work every day, and see the value that we are adding to the company, and to the data science community more broadly through open-source projects and participation at top conferences.",All the challenges expected from a fast-growing team and company.,,5.0,5.0,5.0,5.0,5.0,5.0
2018-05-09, Recruiter,"San Francisco, CA",Current Employee ,Recruiter,More than a year,0,"- There is a mature acceptance that recruiting can be seasonal, and I've never felt that one bad quarter would tank my career. Having worked at other tech companies I feel this is particularly special
- People aren't possessive over leads and there is a culture of sharing
- A great team, and amazing company culture
- Support in career growth, in and out of recruiting",- Lack of transparency from leadership,,5.0,4.0,5.0,4.0,4.0,4.0
2018-05-07,,"San Francisco, CA",Current Employee ,Great company and top-notch data science,,0,"The data scientists at Airbnb are the best out there. Incredibly smart, from all over the world, and also good and kind people (the best combination). The work is high impact and there is a lot of momentum for evolving the work and function. The demand for data science is high and business partners are hungry for data science expertise. Data university is an incredible program to empower the company with data, and it's a reflection of how awesome the data scientists are that they drive and support this program. It's also neat that unlike at other companies data science experts are in every part of the business and yet keep in touch with each other and have forums to share work (like a weekly learning lunch).

The company itself is fantastic as well. Founder led after 10 years and Brian and leadership have made some great hires recently, driving an inspiring vision for Airbnb.

The company just makes good decisions. I have total faith that we will continue to improve and do amazing work.","Sometimes things don't move as fast as I'd like, but it's definitely improving and an area of focus",Keep focusing on how to get work done and take the big ideas to concrete plans,5.0,4.0,5.0,5.0,5.0,4.0
