date,employee_title,location,employee_status,review_title,years_at_company,helpful,pros,cons,advice_to_mgmt,rating_overall,rating_balance,rating_culture,rating_career,rating_comp,rating_mgmt
2018-03-18,,"San Francisco, CA",Current Employee ,Style over substance,More than a year,0,"- More diverse workforce than other tech companies I've been at, which is heartening","- Work/Life balance is non-existent. Good luck trying to have a personal life after you start working here.
- The pay is pretty paltry, no bonus structure, equity package is nothing to write home about.
- Decisions are frequently based on ""feelings"" rather than data, which can be infuriating. Data-driven decision making and overall rigor is not something that's naturally part of the culture. It varies team to team based on whether someone came from a company that was better at utilizing data in everyday work.
- Airbnb likes to do everything their own way even if there are existing solutions in the market. Not very smart if they think reinventing the wheel is always the right decision.
- The caliber of employees at Airbnb is not nearly as good as ones I've worked with at ""Big 4"" tech companies, but they sure think they are hot shots. A lot of arrogance fuels the company at every level. There's a lot of style over substance here.
- The SF office looks great out in the atrium, but the desk areas tend to be dark, cramped and loud. Not the best environment for concentrating and getting things done.
- Employees get their personal items stolen off their desks on a regular basis with little assistance from Security team.
- This is very much a hospitality company first and foremost, and a tech company second. Quite a culture shock if you're coming from a die hard tech company (consumer/enterprise software, AR, VR, robotics, gaming, etc). I've experienced this numerous times: mentioning something marginally technical and being faced with blank stares.
- The company is a hot mess internally. No standardization in software, minimal cross-team collaboration, no version history in the codebase (well there might be some but not for everything that gets committed), lots of politics and jockeying for position/visibility, teams are very protective rather than collaborative seemingly forgetting we all work at the same place for the same goals.","- Brian is not a leader who inspires confidence. None of the founders actually do. They don't hold a candle to the likes of Steve Jobs, Bill Gates, Larry & Sergey, Elon Musk, etc.
- Disappointing LT left since he was getting us on track to growing up and doing things smartly.
- Focus on doing a few things really well, not a million things at below average. We're currently doing the latter.
- The culture enables arrogance and people being jerks to each other. The Core Values interviews are a failure since they don't seem to be able to sniff this out.",2.0,1.0,4.0,2.0,1.0,2.0
2018-04-12, Engineer,"San Francisco, CA",Current Employee ,Great Place to Work,More than 5 years,0,Great opportunities to learn and grow career,None that I can think of,,5.0,5.0,5.0,5.0,5.0,5.0
2018-03-11, Software Engineer,"San Francisco, CA",Former Employee ,"Decent company, poorly run engineering org",More than a year,0,"- Visually appealing office
- Good salary and benefits
- Free food
- Company has a good external reputation, solid growth potential","- More of a hospitality company than a tech company. Engineering isn't a core part of the culture, and it shows in the quality and visibility of the team's work.
- Systems receive low traffic levels (compared to those in search, ads, social networking, etc.), so little need to improve efficiency or innovate in the backend space
- Weak engineering leadership that won't make hard technical decisions, push through cross-team initiatives like SOA
- Senior IC promotions and external hires based more on visibility than technical skill and impact
- Steady stream of departures by strong engineers and managers
- Culture of niceness and praise to the extreme. Hard to provide constructive feedback, push back against bad projects.
- Cramped, noisy desk areas with low-quality monitors and office furniture
- Below average meals and snacks",,2.0,4.0,3.0,3.0,3.0,2.0
2018-03-30,,"San Francisco, CA",Former Employee ,Timing is everything,Less than a year,0,"Great people to work with, very engaging company culture. We are spoiled. Lots of personal development opportunities. It's like being in a university where there are many extra curricular activities to be involved with. You're allowed to voice your opinion without reprimand. Employees stand in solidarity with one another.
Data University is great!
Ergonomic office
Beautiful campus globally","Processes have become more bureaucratic. Projects get scraped if it's not sexy enough.
 My department was prideful about working in the realms of ambiguity. I personally think this is an unhealthy habit to work under.
There is movement, but you have to be smart and act on it. However, even if you move into a new role, it's not always guaranteed secure or of any value towards your career development.
Lots of unnecessary spending to keep us ""happy"", it ends up cutting opportunities for other important things.","Go back to the old core value of ""Simplify"". Things seem to have gotten very messy in terms of leadership and management.",4.0,5.0,5.0,3.0,5.0,4.0
2018-03-20, Software Engineer,"San Francisco, CA",Current Employee ,Software Engineer,More than 3 years,0,"- Great Product
- Very friendly people
- In hypergrowth mode, lot of learning opportunities.","Pain of hypergrowth, processes being put in, can slow work down.",,5.0,4.0,5.0,5.0,4.0,3.0
2018-03-09, Software Engineer,"San Francisco, CA",Former Employee ,Great Place to Work But Company Culture Feels Like a Cult,More than a year,0,"- great benefits and work life balance
- good hiring bar
- friendly co-workers
- relatively little office politics","They love promoting their work culture and thinks it's absolutely amazing. It's great if you fall very much to the left of the political spectrum like the rest of the company (and SF). But if you happen to have a couple right-wing sympathies like me such as expressing your admiration for Ben Carson in a team lunch, you will be met with frowns and disdain. I overheard an argument where a co-worker said he opposed universal income and everyone around him started to argue with him. I'm pretty sure if you said you liked Trump in any way, you'd be out of the building with all your possessions in a box.

Also the co-founders are infallible and worshipped by everyone on the team. Their ""Is Mankind"" campaign was a terrible ""Emperor's New Clothes""-esque flop but no one dared to correct them.","Please include ""free speech"" as a company value",3.0,5.0,2.0,3.0,5.0,4.0
2018-03-12,,"Portland, OR",Former Employee ,Customer Experience,More than 3 years,0,"Awesome benefits, lovely office, amazing co-workers, food!","No real way to advance in this office - you either have to move to SF, or compete with a bajillion other super talented and motivated co-workers. Not flexible about schedules or working from home. Less and less focus on employee happiness, more and more focus on the bottom line.",Bring back the culture. It's gone.,3.0,2.0,2.0,2.0,4.0,2.0
2018-03-07, Software Engineer,"San Francisco, CA",Current Employee ,Amazing place to work,Less than a year,0,"Fast paced, mission-driven, technically challenging, amazing growth and trajectory",Engineering is still concentrated in only a handful of offices,Keep it up!,5.0,5.0,5.0,5.0,5.0,5.0
2018-02-14, Engineer,"San Francisco, CA",Current Employee ,Culture can be too much,More than a year,0,"Culture, you might never feel mistreated.","Culture, when it is too much, it is a burden. When someone did something wrong, no one will point it out or blame the person, instead, the people who take it too serious might be blamed and in trouble. This makes decision making and pushing project super hard some times.","Value people's contribution, while value the culture.",4.0,5.0,4.0,4.0,4.0,3.0
2018-02-26, Business Development Manager,"San Francisco, CA",Current Employee ,An amazing brand with huge global impact,More than 3 years,0,"The best company to work at in the travel, hospitality, and accommodations space. We are truly making a global impact and bringing people together",We're still getting our sea legs together in terms of how to best work together cross-functionally.,"Promote more from within. Truly build out learning & development so that it's not just tools, but programs for advancement",5.0,5.0,5.0,5.0,5.0,5.0
2018-01-24,,"Portland, OR",Current Employee ,Peers and great. Management is not.,More than a year,0,Best peer support of any company I have ever worked for. Best offices. Design is key but can sometimes be form over function.,Management is not empowered and makes the job worse and slow. Middle management unnecessarily slows work and is bloated. Management is not trained and is biggest issue.,"Take HR SERIOUSLY, not just lip service. Treat your employees like the geniuses they are. Get out of the way. LEAD don’t manage. Don’t shuffle and play name games, drive real change that may take time and resources.",3.0,4.0,2.0,2.0,3.0,1.0
2018-01-16, Customer Experience Specialist,"Portland, OR",Former Employee ,Increasingly Corporate with wisps of startup culture,More than a year,0,"-Great benefits
-Wonderful Coworkers
-Excellent office environment","-Few opportunities for meaningful advancement
-Increasingly corporate despite company public image","Embody the core values, don't just repeat them over and over.",3.0,3.0,5.0,1.0,5.0,2.0
2018-01-08,,"San Francisco, CA",Current Employee ,Great mission but not for people interested in career growth,More than 3 years,0,"Great mission (positive human connection) and perks. People are generally friendly, interesting, and smart. Brian is a great role model for the company","Career progression is not on-pace with the market and titles are deflated. Management stated that the average promotion would take 3-5 years for the team. Tends to not promote from within and hire outside for the same skillset. Tons of talent have been lost because of this. If you are driven by doing good impactful work just for the sake of doing good work, this place may be for you.","From a business strategy perspective, resources for growth opportunities are also spread too thin.",3.0,5.0,4.0,1.0,3.0,3.0
2018-01-01, Social Media Specialist,"Portland, OR",Current Employee ,Airbnb - Social Media Specialist,More than a year,0,Incredible benefits package and creative workspace. Offers great experience in booming tech industry.,"Very little chance for growth, both career and financial.",Offer compensation based on performance to keep employee morale from exponentially decreasing,4.0,3.0,5.0,2.0,3.0,2.0
2017-12-06, Cloud Engineer,"San Francisco, CA",Current Employee ,Such an Amazing Loving Culture,More than a year,0,"Love love love. There is so much love amongst people here.
Culture fit interviews to weed about people who can't get along with others and does not have team belongingness.
Food is not great but good, love micro kitchens.
Good work life balance.
People are very understanding. Say if you need to work from home for month or few because of some family emergency.
Holiday shutdown. Everyone gets off from Dec 20th till Jan 1st. That's amazing.
Very competitive pay. Similar to Google, Fb, Uber, Lyft, Stripe etc.
Business outlook is very strong. Where other tech unicorns like uber are burning cash, we are profitable and increasing that yoy.
Great product with no real competitor.","Tech is not that strong. Need some good tech leadership and guidance on the path.
Food can be better.","Keep up the good work.
Take your time to go ipo but do it correctly and only when it makes sense.
No firing to clean books for ipo.
Bring some tech leadership.",5.0,5.0,5.0,5.0,5.0,4.0
2017-12-18, Software,"San Francisco, CA",Former Employee ,"Great company-benefits/pay/perks-must agree with their liberal mindset, though, otherwise this is not the place for you",,0,"Great benefits, breakfast/lunch/dinner provided, culture, perks of being in SF (SF employees are paid more than other offices due to high housing costs)","A-typical millennial/startup/liberal culture. Good luck fitting in if you don't agree with their political, progressive opinions. Unattainable goals from upper management and the goals are constantly changing. The plan handed to you on Monday from the manager is then changed by Wednesday, but the results are still expected minus two days-be ready to work long hours","Be open to other ideologies, opinions, etc. For a company that provides themselves on ""diversity""- the diversity only exists on a race/color level-not based on personal beliefs",3.0,3.0,2.0,2.0,5.0,3.0
2018-01-11,,"San Francisco, CA",Former Employee ,Hypocritical culture/broken middle management/no work life blanace,More than a year,0,"Smart and talented colleagues
Good mission
Interesting product and problem to work on","Culture is hypocritical- the founders might not mean to have the culture become what it is today but reality is that people only being a host to manage up. The outside image and recruiting brand definitely looks much better than the reality inside. They recently cut the food team while taking about the brand of AIRFAM when recruiting - no family is disposable for financial reasons, if you cannot stand for your culture then do not say or brand it.

Broken operation - I have been working for several tech companies big and small, the management at Airbnb is definitely on the chaotic side. Teams step on each others’ toes, nonsense frequent reorganization, people get promoted by taking others’ credit. Mid management focus on growing their own career here rather than helping team or their reports be successful. Setting up your authority in the organization or being an early employee is more important than doing actual impactful work. Many managers promoted within the company from early days do not know how to manage and often meddle with employee’s work.

Lack of innovation - most of middle management here, as a result of trying to promote their own career, do not take bold innovative approach to the business. The result is a lack of innovation to make impact but rather fine tuning to make their performance review looks good or please their upper management.

No work life balance - you are expected to work A LOT sometimes 70-80 hours when you are on certain teams.","Fix your middle management, find out those who are setting up authority and prevent innovation. Stand up for what you are saying about the culture or not saying it.",1.0,1.0,1.0,1.0,3.0,1.0
2017-11-11,,"San Francisco, CA",Current Employee ,At a critical juncture,More than 3 years,0,"-Sexy product and brand
-Inspiring founders
-Brilliant and creative coworkers
-Solid pay (high base/equity and great perks)","-Embarrassingly non-diverse, especially at the top (the company talks a lot about diversity but everyone making the decisions is white and mostly male)
-Beyond the founders and CFO, the leadership team has very little operational experience. We need to do a better job hiring seasoned leaders to run the business.
-Starting to f* up the culture. Recently laid off the entire food team, the most diverse team at the company and incredible cultural ambassadors.
-Growth is slowing, people are getting worried about the value of their equity",Don't make this an Uber moment. Reconnect with your employees. The culture is starting to fall apart and you guys are more out of touch than ever.,3.0,4.0,2.0,4.0,5.0,3.0
2017-11-27,,"San Francisco, CA",Current Employee ,Amazing Company Undergoing Some Changes (But Still Great!),More than 3 years,0,"Mission driven company
Strong culture
Global reach / impact
Relaxed and flexible work environment","Can be very political
Unclear career pathing",,5.0,4.0,5.0,3.0,3.0,4.0
2017-11-20, Talent Analyst,"San Francisco, CA",Current Employee ,"Good people, great culture!",More than 3 years,0,Lots of transparency from Executive-level Leadership and the overwhelming majority of employees are good people with open mindsets and generous hearts. The company is good at owning mistakes that have company wide impact and try their best at taking action.,Intentional career advancement structure and offerings still need improvement,,4.0,4.0,5.0,3.0,5.0,4.0
2017-11-15, Customer Experience Specialist,"Portland, OR",Current Employee ,Very Generous Benefits,More than 3 years,0,Benefits are top notch. Perks go above and beyond any previous employer.,Not a ton of job growth opportunities outside of SF office.,,5.0,4.0,5.0,3.0,4.0,4.0
2017-11-14, Account Manager,"Portland, OR",Current Employee ,Account Manager,More than 3 years,0,"Leading company in the industry with latest technology, innovative processes, top-notch talent and generous benefits.","The company can be politically alienating. Employees can be too ""millennial"" (lacking understanding of profit and growth).","Keep caring about the culture, but not too much, not at the expense of profitability and growth.",5.0,4.0,4.0,5.0,5.0,5.0
2017-11-14, Staff Software Engineer,"San Francisco, CA",Current Employee ,Great company culture and talented co-workers!,More than a year,0,"Positive company culture.
Talented co-workers.
Management owns mistakes and listens to feedback.",Some growing pains around organizational grown.,Be deliberate about scaling the company.,5.0,5.0,5.0,5.0,4.0,4.0
2017-11-06, Software Engineer,"San Francisco, CA",Former Employee ,It has changed...,More than a year,0,"- Pre IPO, great pay
- Nice people
- Relaxed environment","- No upward mobility
- Chaotic management
- Boring work",Learn to prioritize and listen.,2.0,3.0,3.0,2.0,4.0,1.0
2017-12-02, Team Lead,"Not, MO",Former Employee ,OUTSOURCED POSITION,Less than a year,0,potential for a very cool work place. BUT NOT!!!,absolutely/positively the worst managed program I have EVER worked for,CHANGE the entire Management Team and start over. It's not run by the BPO the way that AIRBNB has it's internal modo or goals. AWFUL!,1.0,1.0,2.0,3.0,1.0,1.0
2017-10-16, AirSupport Technician,"Portland, OR",Current Employee ,Genuinely great company,More than a year,0,"Focused on customers
Amazing office environment
Care about employee success
Rapid growth",Still ironing out some kinks as a young company,Continue to do a great job!,5.0,5.0,5.0,5.0,5.0,5.0
2017-08-31, CX Specialist,"Portland, OR",Current Employee ,BEST PLACE EVER,Less than a year,0,"It would literally take me days, weeks, maybe months to write all of the pros of working for such a phenomenal company. I don't think there are words to describe how much Airbnb values it's employees. I worked for a pair of Fortune 100 companies directly prior to my role with Airbnb and I have never experienced such amazing treatment, or appreciation.","I sincerely do not believe there are cons to working for this company. Perhaps the worst thing about working here is that it's such a paradise that I never want to go home, and I prefer to interact with all of my amazing co-workers vs my friends outside of the workplace.","Keep doing exactly what you're doing. And, thank you so much for everything that you do.",5.0,5.0,5.0,5.0,5.0,5.0
2017-09-13,,"San Francisco, CA",Current Employee ,Nearly 3 years later and still excited to go to work!,Less than a year,0,"My team is like my family. The company is generous, mission driven, and works hard to make employees heard. Great location, motivated and sincere people. Each time I strike up a conversation with someone new, I feel like I've made a friend. I can be my self, quirks and all, and am embraced.","It's ambiguous. We're growing quickly and noticing where the cracks are. If you can keep a positive attitude and forge ahead, even if what you're working on shifts, you'll be fine here.","Keep up the career development work. Promote more mini-office events to build camaraderie amongst new people. We all know we should take culture into our own hands, but sometimes people are shy - set the stage!",5.0,5.0,5.0,4.0,5.0,4.0
2017-08-25, Account Manager,"San Francisco, CA",Current Employee ,Run away while you still can!,Less than a year,0,"- Great food (breakfast, lunch, dinner, and amazing snacks)
-A plethora of opportunities to travel the world
- Impressive name on your resume","Promises are made again and again and there is no follow-up. You can't trust your manager, and to make it worse, you have an abundance of inexperienced managers that unfortunately are not given the tools they need to succeed.

Airbnb is bleeding money and talent, and it doesn't know how to fix it. The level of bureaucracy is unacceptable for a company its age and size. It behaves like a company of 100,000 employees, when it only has 3,000. The growing pains are being felt all over the company, and people are discouraged.

I wish I had a real perspective of what was happening on the inside before accepting my offer. The culture is (or was) amazing, but it won't be enough to make you happy amidst this mess.","Listen to your employees and provide clarity and visibility! You've created an amazing brand externally, but the house in crumbling from within.",2.0,2.0,2.0,3.0,4.0,2.0
2017-09-09, Trust Operations Specialist,"Portland, OR",Current Employee ,Great but...,More than a year,0,"Peers are the most passionate, supportive, and skilled I have ever worked with.
Food and perks.
Office space is amazingly designed.","Nepotism runs rampant and middle management exists without accountability.
Feedback from employees is not respected and double speak puts bandages on issues.
No HR support for employees means many regular issues that verge on highly problematic.","Create objective feedback systems and respect your people. You have some of the most skilled and most passionate people in your midst but are under utilizing them.
Transparency and accountability need to be real, not performative.",3.0,4.0,3.0,2.0,3.0,3.0
2017-08-17, ITX,"San Francisco, CA",Current Employee ,Great place to work!,Less than a year,0,"Awesome people, interesting and challenging problems!","Priority shuffle, projects are often competing for resources.",Maintain priorities!,5.0,5.0,5.0,5.0,5.0,5.0
2017-07-26," Program Manager, Employee Experience","San Francisco, CA",Current Employee ,"Program Manager, Employee Experience",More than 5 years,0,Inclusive and progressive environment. Plenty of opportunties to gain experience in difference areas.,Flexibility is needed as the environment is changing extremely fast.,Nothing in particular to add on this subject.,4.0,3.0,5.0,4.0,4.0,3.0
2017-06-11, Software Engineer,"San Francisco, CA",Current Employee ,"Great Engineering Culture, Great Talent, Tons of Potential",Less than a year,0,"- They're doing a great job at bringing in engineering talent to shore up their infrastructure. Over the last 6 months, they've brought in top talent from companies like Facebook, LinkedIn, Twitter, and Google. It really shows when you see what's planned for the next year.

- Some great tooling. The development environments leave something to be desired, but their core infrastructure (esp. some of the backend services) is really impressive. Tons of companies in SV are using many of the tools Airbnb has open sourced and this is only a fraction of what's been built.

- They're aware of technical debt. Current stack is very ruby heavy and monolithic and they're migrating to well-defined java/scala microservices which is great.
- Very little red tape to actually deploying code.
- The culture is a thing. If you're a ""gilfoyle"" you'll probably hate it here. Thankfully, they do a good job at bringing in people that actually want to be there and care about the product.
- Food is amazing. Better than Facebook. Also great benefits and fantastic compensation if you're on the more experienced side.
- Massive potential. The exec team is focusing on the right projects to get to a point where we can IPO. We're not quite there yet, but it's an exciting time to be here.
- They actually care about their customers.
- Brand new hardware
- Epic office. This place is an interior design marvel.
- Health insurance, etc. are excellent.
- You can pick your team as an engineer! This leads to better chemistry and keeps all teams focused on making themselves appealing.","- Last year or so they promoted some people to management that really need more training. So on some teams, you're not going to have a great time.
- If you're not an engineer, YMMV. I've heard the food team, facilities, etc. is largely being phased out for contractors.
- Tiny 401k match. But this should probably change when they IPO.
- You really have to carve out your own path here. If you want a clear progression this is not the place for you.",Don't screw over food staff and CX just to bring costs down. These people are integral to the culture of the company and indirectly shape the community here and the product as a result.,5.0,5.0,5.0,4.0,4.0,5.0
2017-06-14, Software Engineer,"San Francisco, CA",Current Employee ,4-star place to work at,More than 3 years,0,"Still experiencing good growth in terms of everything.
Extremely liberal culture.
Much faster getting things done comparing to some big corporations.
IPO prospect looks good.","Growth not as great as a few years back.
Bureaucracy is starting to build up.
A- people hiring B people and B people hiring B- people.
IPO is always ""2 years down the road"".",,4.0,3.0,4.0,4.0,3.0,2.0
