date,employee_title,location,employee_status,review_title,years_at_company,helpful,pros,cons,advice_to_mgmt,rating_overall,rating_balance,rating_culture,rating_career,rating_comp,rating_mgmt
2011-10-06,,"Santa Clara, CA",Current Employee ,Chegg has assembled amazing executive talent,,0,"Whether it's to push for an IPO, or just to make the business grow as much as possible, the company has assembled an amazing executive team in recent months. The company is growing quickly, having completed four acquisitions in the past year, so there is always plenty of work to do, and marketshare to obtain. It is a very collaborative workplace, and the future of the company is based on how the entire company grows, not just isolated groups. The company has regular awards to celebrate employees who embody Chegg's core values, and offers free lunches, snacks and drinks every day. It is a great place to work and I enjoy going to work every day. Plus, I feel positive that we're helping college students save time, save money and get smarter.",Chegg is growing too big for its present space. This is probably just a side-effect of its impressive recent growth.,"Keep pushing to change the world. Chegg has an amazing product offering and very talented employees. Combined with the management team in place, it seems destined to disrupt the education system in a very positive way.",5.0,5.0,5.0,5.0,5.0,
2011-09-20, Seasonal Picker,"Louisville, KY",Former Employee ,"I very surprsed how hard they work while still having a good time. Taking a line from the manager..""We get the job done",,0,"From the start you are greeted with a smile and the knowledge of their apprecation you are there. They keep you will informed of the policy & procedures and how to meet your numbers. The teamleads are always willing to help and encourage you along the way. The manager, always smiling and willing to work with you is very surprising since you can catch her picking , shipping right beside you at times. That really makes a person want to stay and be apart of the Chegg team. I really enjoyed my last rush with some of the new supervisors and teamleads, change is good. I have been apart of the Chegg rush team 3 times and everytime cant wait to go back.",Worked this last rush and it was very hot at times. Sometimes I really didnt think I was gonna make it. Start times tend to change often which for some of us with kids can be a little hard to manage. The chances of being hired on fulltime are not good as you are told from the beginning can be hard to deal with. The breakroom tends to be far away from the actual working area and can be a long walk. However they do give you a 15 minute break.,Find a way to employ more individuals like myself who would be honored to work with you. Air conditioning and heat would make life a little easier and would keep people around longer.,5.0,4.0,3.0,3.5,5.0,
2011-08-25, Product Manager,"Santa Clara, CA",Current Employee ,"Working on important problem with good people in stimulating, sometimes ambiguous environment",,0,"* Doing well by doing good - improving educational access is highly motivating
* Unpolitical do-what's-right-for the customer environment. Surprisingly good here.
* Broad independence on lifestyle, in office time, vacation
* Everyone gets to contribute to workplan
* Energetic work environment
* No @ssholes - friendly culture","* Can be ambiguous what's important to leadership - not a clear process or communication plan
* Career development / promotion plan is not well defined",,5.0,5.0,4.5,4.0,4.5,
2011-07-14,,"Shepherdsville, KY",Former Employee ,Disorganized and Unprofessional,,0,"Flexible work schedule, As long as you were half way competent with a computer you could do more than the management could. Spacious Break area","Management is completely incompetent, and do not know how to manage people or processes. One of the most unprofessional environments in existence. HR team who really doesn't care about the well being of employees, just about their advancement within the company. An inefficient warehouse and a workplace that doesn't care about their employees safety at all.","Get rid of anyone with a Manager or above title in Kentucky and bring in people with experience and knowledge of logistics. Clean house and start fresh is the only way the company will be successful. Also there are a lot of people there who do a whole lot of nothing, trim the fat and streamline to the necessary employees in order to increase profit margins.",1.0,1.0,1.0,2.0,1.0,
2011-06-24,,"Santa Clara, CA",Former Employee ,"unprofessional and incompetent management, no knowledge sharing between colleagues, very unhealthy company",,0,"just for an IPO. But people already started leaving without any options vested. So it's that bad; don't even think about working here.

and a small group of good people.","if you take the IPO out, 1/3 of employees leave. Why 2/3 are staying? it's because 1/3 are does not know any better; 1/3 is very incompetent.
why people leave?
1. company this size (>100) but very detached between employees and managers. Managers do not know what you are working on. There is no appreciation. Managers and you probably talk once a month
2. incompetent people do finger-pointing to cover their azzes so often that nobody trust anybody.
3. IT manager is so incompetent and a good azz-kisser
4. Management accused employees for what they never did wrong. Then fire them quietly. Nobody knows why people are missing. Nobody knows except management.
5. Management speak evil of employees too
6. Management curse employees; everyday there must be a few speaking profanity. HR watches and keeps their mouth shut. What a typical HR.

After a re-org recently, all veterans starting leaving. A start-up and veterans are leaving. You know that you don't want to get in. It smells that bad. Stay away. You have been warned.","- please resign and learn not to speak profanity. If you care about employees, don't say that you don't care. It's better to shut your mouth in that case.
- take responsibility
- hire better directors/VP. They are so incompetent that every meeting they have to finger-pointing someone else and act like they know better by criticizing other people work. In fact, they don't know anything
- Platform, technology and data are messed up. Where is the leadership to take it to the right place? All you do is delaying and months went by and not a single thing completed.",1.0,3.0,1.0,2.5,1.5,
2011-04-01,,"Louisville, KY",Current Employee ,Great Place,,0,"Great Pay, great work environment. Good people to work for and work with. If you are a hard worker chegg is a great place to grow.",High stress during rush seasons. Corporate bureaucracy at times makes changes slow. There is a lot of great people but a few bad apples that are still looming. They are pretty easy to spot however.,,5.0,4.0,5.0,5.0,4.5,
2011-03-27,,"Santa Clara, CA",Former Employee ,Chaotic,,0,"The upside, when I was there, was the free food and the open working environment considering we were all together in one room.","Downsides? Well, it was chaotic and there seemed to be no consideration if you had a personal life outside the office at the time.",Anything that I had to contribute at the time fell on deaf ears and nothing I would have to say now would likely be applicable considering the change in management that occurred since I left.,3.0,2.0,2.0,3.5,3.0,
2010-10-25, Customer Service Representative,"Santa Clara, CA",Former Employee ,Customer Service Department is not a good place to work.,,0,"As a temporary employee, you can get time off whenever you so choose and they are very lenient and understanding if you cannot come into work or are sick. Everyone is really friendly and it is generally a very upbeat and fun place to work. The dress is casual and you can be comfortable in your clothes everyday at work.",The management is completely unprofessional and they do not have any good communication plans as far as letting employees know about new promotions or changes to the website that is necessary. Many temporary employees were promised that they would be offered permanent positions for many different months and the wrong information was consistently given to them. Many people were promoted that did not deserve it and the promotion procedure was very unfair and unjust. Many people were extremely dissatisfied with the job and many other quit before the rest were laid off.,Better communication is a must and the management team needs to come up with better solutions in order to keep everyone informed.,2.0,5.0,1.0,2.0,2.0,
2010-09-09, Picker,"Shepherdsville, KY",Former Employee ,"Seasonal employee review for Chegg warehouse in Shepherdsville, KY.",,0,"Competitive wages: $11.00 per hour for seasonal employees.

Decent hours: Average 35+ hours a week with occasional overtime.

Weekly pay (if employed through a staffing agency, bimonthly pay if employed directly through Chegg).

Nice facility: Very clean temperature controlled break-room/restrooms, with plenty of seating, vending machines, refrigerators, and microwaves. Partially covered smoking area outside of break-room. Lockers for personal belongings. Ample parking.

Two 15 minute breaks and one 30 minute lunch for an 8 hour shift, additional 15 break after 8 hours (subtract 5+ minutes for the time it takes to walk to and from work area to break room)

Free lunch on Fridays with a 45 minute lunch break.","POOR MANAGEMENT STYLE: Apparently it is company policy at Chegg to treat their seasonal employees as though they are sub-human, not needed, and not wanted, with their goal being fear instead of motivation. I always felt as though at any moment I could lose my job, even though I was ranked among the top 5 out of 100+ pickers. I never got any compliments for my effort, but instead received negativity, or was ignored completely. I do not need to be coddled, but an occasional nice word goes a long way. ""We do not need you here, and you can easily be replaced"" that is a direct quote from the head warehouse manager at one of our group's many ""motivational"" meetings. Many times I would see what I can only call call temper tantrums by the leads and management alike. People getting screamed at and belittled in front of other employees as if though they were children, Chegg's turnover rate is astronomical, I saw groups of 25+ employees come and go several times, and I was only employed by them for about 6 weeks.

UNREACHABLE UNIT PER HOUR GOAL: If you are a picker at Chegg you are demanded to reach 100+ books picked per hour, or 700+ books picked in an 8 hour shift, the penalty for not reaching that goal is loss of employment. Unfortunately the system that prints the pick orders causes you to have to go into a flat out run from one end to the other of this extraordinarily large, non-temperature controlled warehouse to reach that goal. The average person could only reach 75 picked books per hour if they were really hustling, and lost there jobs even though they were hard workers. I managed to get into the top 5 pickers by figuring out how to print orders that were easy, and even then I had to really move quickly to keep up the pace. If something happens and the system isn't working correctly, you are still expected to meet and exceed your goal. The staffing agency even had a person from there office come in and work in the warehouse to see if he could meet Chegg's goal, and he failed.

POOR TRAINING: Even though picking is not a difficult job, being told to ""figure it out"" is probably not the best way to train people. I asked each picking lead to show me the best way to do the job and each one of them told me ""you have have to figure out your own way"". I made many mistakes my first week and was told I would be let go if I didn't figure it out.

LACK OF COMMUNICATION: I never knew where I stood as far as meeting my goal for the day, if I asked a question, I was answered with a half answer, or ignored completely by my lead. What to do, or what not to do was never very clear, if you make a mistake that's when you found out what not to do, then you would be threatened to get ""wrote up"" or ""fired"". I never knew when my shift was going to end, or if I had to work the weekend until the very last possible second. If you had plans, or something important to do on the weekend, you had better be able to drop them, because if you don't drop everything for Chegg, you guessed it, termination. I found that avoiding leads and management was best. All in all, it is not a very proactive system.","There are stress management programs, along with programs that will teach management/leads how to properly and professionally deal with and motivate employees. I strongly advise enrolling the entire management team ASAP.

Redesigning the warehouse to be more efficient is a must! Take a page from UPS or one of the other large companies around town.

Setting and completing goals should be based on the individual persons abilities, instead of some random unobtainable number.

Treat people with respect and they will respect you in return. People that are treated poorly will not care about their job, or their job performance. Good communication is the key to success for any company. If management doesn't let people know what to do or how to do it, then the company and employees will always fail.",1.0,1.0,1.0,2.5,1.0,
2010-04-03, Software Engineer,"Santa Clara, CA",Former Employee ,Startup with a ton of potential.,,0,"Ability to communicate with management, the organization is flat in many of the right ways. Chegg recently has brought on name brand executives (a plus) yet you can still have your voice heard by anyone, which helps employees get the resources they need.
Excellent use of a wide range of technologies within engineering.
Inter-department collaboration is increasing.
The food.
New office location is far better than the old office.","Interviewing procedures have improved but still rough around the edges.
Innovation is great for growing companies, but if too many ideas get the green light, you end up redoing/scrapping things later on. You can still move forward as a company while putting the brakes on a few more things.
Churn tends to happen post rush. Find ways to reinvigorate the staff.","QA performs wonderfully, but is under resourced.
Release schedules are overly ambitious, scale things back.",4.0,4.0,4.5,4.0,4.0,
2019-03-30,,,Current Employee ,SME,,0,"Best culture
Work life balance
Less stress","No growth for SMEs
Career opportunities are less",,4.0,5.0,5.0,2.0,3.0,5.0
2019-03-22, Network Expert,Mumbai (India),Current Employee ,Network Expert,More than 3 years,0,Flexible time of working at Chegg,Management takes a while to correspond,Please listen to employee queries without delays,4.0,5.0,3.0,3.0,3.0,3.0
2019-02-28,,,Current Employee ,Advance mathematics expert,,0,"Work and life balance, you can work by your comfort","Career opportunities , you don't get any certification",All good,5.0,5.0,2.0,5.0,2.0,2.0
2019-03-13, Managed Network Expert,Homé (Benin),Former Employee ,Good oppurtunity for students,Less than a year,0,It gives a platform for the students to help their fellow ones and earn for their knowledge.,The assignments provide are tougher than you think.,,3.0,4.0,4.0,4.0,5.0,5.0
2019-03-09,,,Former Employee ,Good place to improve knowledge,,0,"flexible working hours, timely pay",nothing to specify about this company,,4.0,4.0,4.0,4.0,5.0,4.0
2019-03-04, Subject Matter Expert,New Delhi (India),Current Employee ,Subject Matter Expert,More than a year,0,"Comfortable work environment.
Good for people who want to go into Academics.","The salary to the content team (Subject Matter Expert) is very less.
There is no benchmarking/stepping into salary as compared to the industry.
The growth opportunity is nill. The employee who has been working since 6 to 7 years is doing the same work as a fresher. There is no vertical/horizontal growth as well.","Every issue of the employees should not be answered as ""This is a company policy"".
Pay should be based on Skills, Knowledge, and Experience.",3.0,4.0,4.0,3.0,2.0,2.0
2019-02-08, Product Management,Rehovot (Israel),Current Employee ,Shape the future of education with an amazing group of people,More than a year,0,"Culture, mission, values, impact on millions of students worldwide
Use cutting edge technologies, work with passionate and smart people towards one mission to help students succeed.","None, seriously. Can't imagine myself somewhere else.",,5.0,5.0,5.0,4.0,5.0,5.0
2019-02-19,,,Former Employee ,subject matter expert,,0,"work from home
decent pay.
flexible hours",no cons if you are following the guidelines.,,4.0,4.0,4.0,3.0,3.0,3.0
2019-02-24, Subject Matter Expert,,Current Employee ,Earn while learning,Less than a year,0,Can answer question at any time.,Strict rules for not following guidelines.,,4.0,5.0,4.0,,,
2019-01-25, Subject Matter Expert,New Delhi (India),Current Employee ,Great Website for earning with learning.,More than a year,0,"1. It gives the opportunity to be self-dependent as a student.
2.Bonus when the question frequency is very high.
3. Support from the Chegg family in WhatsApp or email
4. Great website for timely payment.","1. As a subject matter expert most of the time you have to work at night in INDIA.
2. Questions volume is not high in all months.",,5.0,4.0,5.0,5.0,4.0,5.0
2019-02-01, Subject Matter Expert,Thodupuzha (India),Current Employee ,MY POCKET MONEY GIVING COMPANY,Less than a year,0,"- Correct payment in time
-Which company give 150 rs fro just a single answer .?
-Good staff and support
-they add to their whatsapp group and solve every queries","-Once revoked the account , foreever revoked
- Strict rules
-Very hard to answer questions
- Sometimes students rate low answers
- Quality should be good , else remove without further notification","Do not revoke Subject Matter Experts suddenly, due to low quality .Give them an another chance also. Not to revoke forever.",4.0,3.0,3.0,3.0,5.0,4.0
2019-01-25,,New Delhi (India),Current Employee ,Good company to work for,More than a year,0,Good work life balance with good package.,i dont find any negatives as of now,,4.0,5.0,4.0,3.0,4.0,4.0
2019-01-07, Senior Subject Matter Expert,New Delhi (India),Former Employee ,"The working environment at Chegg is very healthy, without any politics you can grow easily if you give your best.",More than a year,0,"Bonus, healthy work environment, free food fruits and snacks, good management",Vertical levels are very less,,5.0,5.0,5.0,4.0,5.0,4.0
2019-01-02,,,Current Employee ,Good to increase knowledge,,0,"Will gain lot of subject knowledge.

Great snacks",Less scope to jump in this industry,,4.0,,,,,
2018-12-29,,,Former Employee ,Subject Expert,Less than a year,0,"Good setup
Easy to use
Payment on time
Good for part timers as well","Night shifts are not so easy to maintain for long time period.
Sometimes lack of upvotes on good answers may make you feel demotivated.",,4.0,,,,,
2018-12-08,,,Former Employee ,Worked as a part-time subject matter expert: Nice work culture,,0,Flexible timings and on-time payment,Questions volume vary and payment for a single question is not satifactory,,4.0,4.0,2.0,2.0,,
2018-11-20,,,Current Employee ,Tutor,,0,Good Money in small time,Sometimes difficult to find work,Good work,5.0,5.0,5.0,4.0,3.0,3.0
2018-11-18,,,Former Employee ,Worked as Subject Matter Expert in Advanced Physics,More than a year,0,It was great to havve worked with them. A brilliant online networking of teacher student equation.,Mostly problems are available at midnight IST. It takes longer for some subjects to solve questions which might reduce monthly earning.,,5.0,,,,,
2018-12-02, Subject Matter Expert,Visakhapatnam (India),Current Employee ,Mr,More than 3 years,0,No work pressure,Growing company and need to focus on corporate culture.,,3.0,4.0,5.0,2.0,5.0,3.0
2018-12-02,,New Delhi (India),Former Employee ,Not good,Less than a year,0,"Nothing but
Income is good","All
Can remove you any time",Atleasttell him the reason to remove,2.0,2.0,3.0,3.0,3.0,2.0
2018-11-28, Online Tutor,Visakhapatnam (India),Former Employee ,Good to be a tutor if you want pocket money as a student.,More than 3 years,0,Flexibility of work. Payment on time. Happy to help.,Sometimes you won't get anyone to tutor or answer. It is seasonal.,Reach out to part time workers for a permanent post.,4.0,5.0,3.0,4.0,4.0,5.0
2018-10-20, Senior Software Engineer,New Delhi (India),Former Employee ,Awesome company with great work culture and learning opportunities,More than a year,0,"Working with Chegg was one of the best opportunity of my career. The best thing being there was to work with such a knowledgeable and cooperative team. Management is easily approachable and will treat you with respect.

I was one of the first members of Chegg Tutors Engineering team in New Delhi. Being with the team, I got the opportunity to enhance both my technical and soft skills. Our manager had always listened to us and motivated the team and had given us the chances to work with new stack which ultimately upgraded individual's morale.

It was a tough decision to leave such an enthusiastic team and a great company with values. But as I had planned to settle in Australia, so I expressed my decision to my manager. Respecting my decision he had offered me a contract role to work remotely for the company. Even the interviewers in Australia were really impressed with Chegg for valuing an employee and offering the remote work opportunity. I had worked with them remotely for around two months before moving to a new venture.

It was a wonderful time full of enthusiasm and learning. I wish all the best to Chegg to achieve a great success all around the world.",I couldn't find any cons.,Thank you for making Chegg a great workplace.,5.0,5.0,5.0,5.0,5.0,5.0
2018-09-26, Managed Network Expert,Indore (India),Current Employee ,Best place to work for students.,More than 10 years,0,"Learning with earnings,it's great indeed by solving the query of students and teaching online all these stuff makes both beneficial.
Paid for your quality work is the culture here.
Full freedom to work on our own time and place.",I don't find any issues till now,,5.0,4.0,5.0,4.0,4.0,5.0
2018-10-01,,New Delhi (India),Former Employee ,Good Environment,More than a year,0,"Salary, increment and bonus is good",Everything is good. No cons.,Keep up the good work,5.0,5.0,5.0,5.0,5.0,5.0
2018-09-29,,,Current Employee ,Good for Part-Time,,0,"Pay is good
Flexible working hours
Good customer support",Flow of questions is low during half of the year,,5.0,5.0,4.0,3.0,4.0,4.0
2018-09-28,,,Former Employee ,It was cool working there,,0,"handsome pay, nice place to work",I didn't find any cons,,4.0,,,,,
2018-09-14,,,Former Employee ,Subject Matter Expert,,0,Great work culture and learning.,There is nothing to add here,,4.0,4.0,4.0,4.0,4.0,4.0
2018-08-30,,,Current Employee ,subject matter expert,,0,it is easy to earn money if we concentrate,too many notifications regarding question count,,5.0,,,,,
2018-09-27, Professor,Maracaibo (Venezuela),Current Employee ,Inhuman and Mercantile,More than a year,0,Excellent technological platform and students in the different branches of knowledge,"I worked as a CHEGG tutor for approximately 2 years. In that period I got 251 positive reviews. I was able to share my experience of 25 years as a university professor. At the same time I made an effort to comply with the code of honor of the company. I also reported numerous times to some dishonest students who pretended to cheat with their fraudulent lessons. Suddenly and without further explanations CHEGG has suspended my account. I have asked them to reconsider my case since I really need that extra income to be able to feed my family since in my country Venezuela there is an economic and social crisis. The answer has always been the same. I get the impression that which robots already have a script prepared for each case. I regret that they did not analyze my case in depth and that they evidently heeded a ""student"" who fabricated false evidence against me and that I had previously warned about his threats. That is why I consider that the company is acting in an inhuman way without social sensitivity towards the tutors. It seems that students are always right because they are the ones who pay. I have asked them to take my case to the executive levels that can reverse this decision, but they respond very quickly saying that the decision is final and with the same text copied from the initial decision. This shows that they do not have the minimum interest to analyze my case in depth. I hope this can reach the ears of sensitive people who can reconsider my case.",Listen to the tutors please!,1.0,,,,,
2018-08-16, Subject Matter Expert,Mumbai (India),Former Employee ,I was subject matter expert in Chegg India with Chemistry as my subject,Less than a year,0,Nice place to work from home by earning in free time,"Not good for freshers, fresher are new to work but they revoke account in one mistake. Freshers may take time to learn about rules of the new working firm.",,4.0,2.0,4.0,2.0,3.0,2.0
2018-08-31,,,Current Employee ,Working Part-time at Chegg.com,,0,One can earn nice money,One has to sit at the computer,,4.0,,,,,
2018-08-27,,,Current Employee ,Subject matter experts,,0,"No pressure
Good pay",Bad time of work mostly at night,,4.0,4.0,4.0,4.0,3.0,3.0
2018-08-27,,,Former Employee ,Loved working here,,0,"awesome work culture, lovely teammates.",I can't think of any con!,,4.0,4.0,4.0,4.0,4.0,4.0
2018-08-11,,,Current Employee ,Subject Matter Expert,,0,"Flexible work hours, and questions are challenging.","Pays okay, but the questions can be a bit tough sometimes.",,5.0,5.0,5.0,5.0,4.0,5.0
