date,employee_title,location,employee_status,review_title,years_at_company,helpful,pros,cons,advice_to_mgmt,rating_overall,rating_balance,rating_culture,rating_career,rating_comp,rating_mgmt
2018-04-13, Account Executive,"San Francisco, CA",Former Employee ,Great Product and Company Culture,More than 3 years,0,Great product in a great space and the company is on a great trajectory. It's a fun place to work with great people.,Career Development and clearly defined path to grow within the company. They preach about leaders coming from within and how existing employees are leaders of the future but that isn't the reality.,,5.0,5.0,5.0,5.0,4.0,4.0
2018-04-13, Senior Account Executive,"San Francisco, CA",Current Employee ,Best and Most Exciting Job I've Ever Had,More than 3 years,0,"I'm serious about the title. First thing I like about Cloudflare is the people. The founders have done a great job about creating a good, fun and diverse culture from the beginning. The three core values we look for in employees are: Smart, Empathy, and Technical Curiosity. From a product standpoint we are rocking it and our network scale and growth is awesome. We our out-innovating all of our competitors and taking market share away from them as well as growing the market with new capabilities. The sales team is fun, we're hitting our numbers, and growing.","No company is perfect, and we could always do better as well. Management could do a better job of proactively working with its team members to discuss and support individual career growth plans. We're trying to do so much so fast, that sometime we bight off more than we can chew each qtr. More stock and more often would be better.",Communicate upcoming changes better with first line managers before announcing changes to staff. Celebrate our successes more each quarter. Add more professional/experienced managers.,5.0,5.0,5.0,5.0,3.0,3.0
2018-04-09,,,Former Employee ,Great mission and potential if managed well,,0,"- You get a lot of responsibility and autonomy
- Great mission and high impact for a smallish company
- Good place to establish yourself as an an expert (for some roles)
- Great office in SOMA","- Lack of effort in cultivating a company culture which means people often bring their bad side to work, especially the coasters (those waiting around to cash out equity)
- Company gives out very little equity, no system in place to reward high performing employees to keep them around","- Make an effort to enforce a more positive culture
- Put a compensation and performance management system in place, reward employees that do well
- Invest in good HR leaders and empower them to make changes",3.0,3.0,2.0,4.0,3.0,2.0
2018-03-15, Customer Success,"San Francisco, CA",Current Employee ,Incredible opportunity + great culture,More than a year,0,"- The future looks very bright - phenomenal growth and pace of innovation
- Truly market-leading technology that customers love
- Smartest group of people you will ever work with
- ""Don't hire a**holes"" is the #1 guideline in recruiting here, and it shows
- Strong feeling of teamwork and collaboration across departments in working towards our mission of building a better internet
- Solid pay and benefits, plenty of opportunity to grow and move within the company","- All companies can be doing a better job with diversity in hiring and promotions. Cloudflare is certainly ahead of the pack but can always do better.
- Internal documentation + processes are a bit of a mess and need to grow up in alignment with the company's growth","- Continue to put your employees first and open up paths for opportunity and growth internally. Let people experiment and figure out how they can contribute best.
- As we grow into this major ""real company"" stage, make the extra effort to maintain the culture and values that brought us this far",5.0,5.0,5.0,5.0,4.0,5.0
2018-02-22, Product Manager,"San Francisco, CA",Current Employee ,Recent Product Manager Joiner,Less than a year,0,"- Genuine partnership between engineering and product
- Working on important stuff - the INTERNET! No uber for cats here...
- Super technical. Ex-engineers will do well.
- No jerks
- Rocketship
- Visa sponsorship.
- Teams small enough to be start-uppy, but big enough to get stuff done.","- Rocketship... great opportunity, but also complexity and growth can be hard.
- No referral bonus","I'm only 7 weeks in, but I'm very happy with management so far. They communicate where they want to go and give us the resources to get there. They're realistic that growing at the pace we are is challenging, but that it also provides opportunity.

The founders were a key part of onboarding and continue to communicate their vision regularly and at quarterly planning.

So far so good. You've built an amazing company.",5.0,5.0,5.0,5.0,5.0,5.0
2018-02-08, Systems Engineer,"Austin, TX",Current Employee ,The best company I've ever worked for,More than a year,0,"* Very technical co-workers
* Fantastic healthcare benefits
* Interesting internal presentations
* There are a lot of opportunities to be challenged (not just work projects, but technical reading groups, technical presentations, etc.)
* There's a lot of work to be done
* I'm never the smartest person in the room
* I have a lot of autonomy in how I work and what I work on",There are a few growing pains as Cloudflare figures out how to be a bigger company. There's a lack of cohesion in product design and development (but this is being addressed).,"It's fun to ship products and features. However, we need to take a step back sometimes and think about the broader implications of shipping before prime-time. It affects the Cloudflare brand when a product isn't polished. We need more designers that truly and holistically understand our product.",5.0,5.0,4.0,5.0,5.0,5.0
2018-02-08, Account Executive,"San Francisco, CA",Current Employee ,Account Executive,More than a year,0,Incredible place to work. My management is very supportive and has helped me grow. The company culture is excellent. I feel surrounded by impressive intelligent people.,I have a long commute,,5.0,4.0,5.0,5.0,5.0,5.0
2018-01-26,,,Current Employee ,A company on the move!,Less than a year,0,Mission-driven: making the internet better. Focused on diversity; inclusive culture. Respected for its unique and democratic approach.,"If you're not highly technical, need to come up to speed quickly",,5.0,5.0,5.0,5.0,4.0,5.0
2018-01-12,,,Current Employee ,Business Development,,0,"- Relatively fast hiring process
- Extremely friendly interviewing process
- Exposure to a variety of individuals during the process
- Fun and hard working-work environment","- Response time after interviews (however, CF is a fast growing company)",Keep doing what you are doing!,5.0,5.0,5.0,5.0,5.0,5.0
2018-01-12, Business Development Representative,"San Francisco, CA",Current Employee ,Business Development Representative,Less than a year,0,- The people are amazing and the training is very good. Is a company that it's growing and I've joined the company because I believe that they trust the potential of their employees and they want to invest in them.,- Long recruitment process and sometimes they don't email you or call you.,,5.0,4.0,5.0,4.0,5.0,5.0
2018-01-12,,,Current Employee ,Recruitment Process,,0,"During the interview process I was able to meet with team members from all departments within Cloudflare. This was the most positive experience in the recruitment process.

This method allowed me to gain a deep understanding of my responsibilities, insights into how I would be supported and teams work together, more importantly, see the true passion shared for Cloudflare's mission by all individuals.

At the end, the recruitment method at Cloudflare, although a bit longer than past experiences, allowed me to start with knowing a lot of my new colleagues and enhanced my enthusiasm to join the journey.",Candidates should be ready for a thorough process that takes time. The reward is great but they are looking for specific individuals to join the team.,I would highly recommend keeping the process thorough. The talent in my new hire orientation was incredible. Cloudflare has a bright future and I am excited to be a part of the journey!,5.0,5.0,5.0,5.0,5.0,5.0
2018-01-12, Senior Recruiter,"San Francisco, CA",Current Employee ,"Great process, great people",Less than a year,0,"The interview process was great, and all of the meetings felt more like conversations, not interviews. Meeting a broad range of people who were transparent, open, honest, and excited.",Office is located far from BART.,Keep doing what you're doing.,5.0,4.0,4.0,5.0,4.0,4.0
2018-01-02,,,Current Employee ,"Sales can be rough if you are just starting out or need guidance, but awesome if you have passion for the product.",,0,Laid-back atmosphere with a sense of all employees working for a common goal. If you show up and work hard it will be recognized and the work is rewarding.,No territories or data from sales ops regarding who should be reached out to and when. This creates a very competitive and secretive feeling in the sales team.,Appreciate what the sales team does for Cloudflare! Cant reach the proposed revenue goals without them.,3.0,2.0,3.0,2.0,3.0,1.0
2017-12-07,,,Former Employee ,Systems Engineer,More than 3 years,0,Great things to work on. Excellent engineers and fun people to work with.,Senior management does not get rid of people who are problems. They are beginning to sort things out but there are a few teams that are legitimately a joke.,,3.0,2.0,2.0,3.0,3.0,2.0
2017-12-14,,,Former Employee ,Growing pains and hiring bad fits,,0,"really talented colleagues
lots to do","management is often in over their heads
resource starvation leads to burn out
hires people who do not fit sometimes","Be serious about recruiting and hire enough recruiters to hit your goals
Listen to the team
reward those that are carrying the load and measure them on their measurables",2.0,1.0,1.0,3.0,3.0,2.0
2017-11-14,,"San Francisco, CA",Current Employee ,People Team,Less than a year,0,"Cloudflare has been hands-down one the best companies for my career thus far. The company's culture is strong and understands what work needs to be done and how it should be done. There's no subterfuge! I really enjoyed the extensive and deliberate interview process that I went through. It clearly showcases Cloudflare's commitment to quality and excellence.

The management team is always accessible and thoughtful about the company's growth and people strategy, which really sets us apart.",Nothing at the moment- Love this place!,,5.0,4.0,5.0,5.0,4.0,5.0
2017-08-02,,"San Francisco, CA",Current Employee ,I am thrilled to be part of this company,Less than a year,0,"The people are amazing and the work/life culture is great. I came from a very hectic, cut throat culture. So it was nice to see not all tech companies existed like that.",Lots to still be built out and because of which sometimes it's a bit unorganized.,,5.0,5.0,5.0,5.0,4.0,5.0
2017-07-20,,,Former Employee ,Great company overall if you're on the right team,,0,"Good culture, great co-workers, certain teams have great chemistry.",Lots of growing pains. Employee professional growth lacking.,Give engineers the tools they need to grow their career.,4.0,2.0,4.0,2.0,4.0,3.0
2017-06-22,,,Current Employee ,Engineering,More than 3 years,0,"Genius product, market leadership, bright financial future.",Compensation structure makes no sense.,"More engineers, less bureaucracy, breakfast/lunch every day.",5.0,3.0,5.0,5.0,3.0,3.0
2017-06-13,,,Current Employee ,Best group of people I have ever worked with,,0,"Great management team. Very engineering driven, so prevents sales from over-selling unfinished product.",None that I could name.,,5.0,5.0,4.0,5.0,4.0,5.0
2017-02-16,,"San Francisco, CA",Current Employee ,"A perfect mix of Product, Market and People",More than 3 years,0,"Mission driven company with huge market potential and an excellent product.
Visionary leadership who is great at finding large untapped market opportunities.
Nicest group of people.
Fast paced and a fun place to work",Under investment in certain departments such as HR have lead to less structure when it comes to performance management and career progression. Company recently hired Head of People so company is taking the right steps to overcome these challenges.,,5.0,5.0,5.0,5.0,4.0,5.0
2017-02-07,,,Former Employee ,"Good market opportunity, subpar culture",,0,"Nice office, good benefits, pursuing a worthy cause","People here are smart, but there's a clear divide between the old guard and the new employees. For some reason, people do not feel compelled to share Information or help onboard other employees. Everyone is focussed on what they're doing and not so much on what helps the team / bigger cause.","Wish them luck, but the management has to do some serious introspection if they want to outlast the competition.",2.0,3.0,1.0,2.0,4.0,1.0
2017-01-12, Account Executive,"San Francisco, CA",Former Employee ,Poor Leadership Overshadows Strong Product,More than a year,0,"Lots of really smart people that are fun to work with.
Cool office in SOMA near ballpark.
Good work/life balance.
Strong product, especially in the mid-market vertical.","Past reviews are spot on: CEO is arrogant.
Sales Leadership is disconnected from the front lines + added an unnecessary layer of management that further removes senior leadership.
Tension between sales and marketing.
Compensation and equity are well below market.","Take better care of your employees - way too much turnover the past 12 months.
Improve the work environment/culture to better support professional development and career advancement. Be more transparent around business decisions; people appreciate candor and accountability. Sales Leadership should spend more time in the trenches to better understand what is actually going on in the business.",2.0,5.0,1.0,2.0,3.0,1.0
2017-01-06,,"San Francisco, CA",Current Employee ,Great place with great people,Less than a year,0,People really care about the mission. Feels like we're all pulling on the same rope. Still a relatively flat structure with a lot of visibility. Beautiful office in a convenient location.,Perks are good but don't blow you away. If you need all your meals provided at work this isn't the place for you. Also no 401K match.,"Don't compromise on the values. We are likely to encounter more scrutiny and pressure regarding content that flows through the network, and making judgments on free speech starts down a very slippery slope.",5.0,4.0,5.0,4.0,4.0,5.0
2017-01-05,,"San Francisco, CA",Current Employee ,People. Mission. Product.,More than a year,0,"Smart teams, great mission, great products. I genuinely like and admire my colleagues. They are interesting, kind, funny people who also happen to be highly technical. Project Galileo, Universal SSL, Free plans for anyone all make me proud to work here.","Cloudflare isn't for everyone. If you need a defined career path and are looking for robust management programs, you'll be disappointed. Lots to do, not a ton of scaffolding. Some people will love this and thrive. Others won't.","We have something very special. Keep focused on maintaining that. We're at our best when engineering and product take the lead. Enterprise sales matter, but building for our self-service and free customers are what get most of us excited to come to work every day.",5.0,3.0,5.0,5.0,4.0,4.0
2016-10-27,,"San Francisco, CA",Former Employee ,Declining rapidly,More than 3 years,0,"From a purely technical point of view, the work is interesting and engaging. Once upon a time it was evening meaningful. Now, most of the big problems have been solved and it's more about sustaining what has been built.","As previous reviews have stated, basically ""senior"" management. I use that with quotes because it should imply people with experience, but this group is completely juvenile. Again, agree with a previous poster, the legal team is just odd and they take to Twitter and Facebook constantly in a way that makes you think their bonus is tied to how cool they can make them appear to the CEO. It's particularly bad lately with the election coming up as some of the in-house team are posting obviously partisan articles in ways that give the impression that it's also the company's position. If anyone should understand the rules of social media you'd think it's the attorneys...but, definitely not in this case.","Honestly, not sure what you can do. The IPO window is closed as all the metrics are on the decline. There is no way the public markets can get excited over this company anymore. I suppose an acquisition is the likely route, and probably will only enrich the founders at this point as the valuation is tanking. Good while it lasted!",1.0,1.0,3.0,2.0,2.0,1.0
2016-06-07,,"San Francisco, CA",Former Employee ,Less than stellar,More than a year,0,"Many smart engineers
Nice office (compared to previous office)
Decent healthcare","CEO is not a great person and is quite vocal in his lack of respect for engineers and how hard they work. He doesn't think employees need great benefits. I overhead him saying 401k was a waste of money. He uses the technical achievements of CloudFlare to draw attention away from the company's lack of any major growth and devaluation.
Promotions are non-existant.
Other cofounders really have no idea what is really going on in the company.
If you are not a few of the in crowd then you will never get anywhere in the company no mattter how smart you are.
Sales team is washed out
Pay is not great compared to other startups in SF.
Churn is much higher than reported.",The world of Matthew is not the real world. Drop the condescending attitude.,2.0,4.0,2.0,1.0,3.0,1.0
2016-04-21, Engineering,"San Francisco, CA",Current Employee ,"Great market, good product (always improving)",More than a year,0,"CloudFlare is a small company (100 engineers, another 150 in other roles) which has a big and growing impact on the Internet -- for the good. Rather than locking website operators into a single ""stack"" from Amazon, Microsoft, Google, or other hosting providers, CloudFlare lets websites choose how to host their site and then get top-quality network edge performance and security between their users and server infrastructure, for a price ranging from free (for millions of sites with less-demanding requirements) to about 10% of what incumbents charge for Enterprise customers.

The biggest reason to work at CloudFlare is to be a part of making the Internet a better place. In contrast to a lot of other companies, CloudFlare has an extremely permissive terms of service, valuing free speech over everything else. While there are a lot of sites on CloudFlare which people find objectionable (for varying reasons), on balance, having open access at the network layer makes the Internet a better place.

There are some big engineering problems to solve -- handling a huge volume of web requests means every other support system is also huge -- so it's a great place to get to work on hard challenges, the latest technology, and with some really smart people.

CloudFlare has both a high media profile and a large userbase, so if you tell someone you work at CloudFlare, you're likely to get a positive response.","The biggest problem with CloudFlare is a legacy of flat organizational structure. For a long time, CloudFlare clung to a ""flat"" organization. This was great back when the company had 25 or 50 employees, but broke down at 100-150. CloudFlare now has a top-tier VP Engineering and some solid engineering managers, but is still implementing the kind of structure a company doing as much as CloudFlare does needs to have.

For a long time, CloudFlare had below-market office environment (a cramped, poorly maintained space), but after 18 months of delays, we finally moved into an amazing dedicated building a block away. People visit and compare it favorably to any company in tech. If you want to be in San Francisco, the location is hard to beat -- a block from Giants Stadium and 2 blocks from Caltrain.

CloudFlare cash compensation is essentially at-market. Equity compensation is less than market, but the company is also on a solid financial footing and good growth trajectory (because people actually need, value, and pay for the product), so it's hard to directly compare to more ""bubble-based"" valuations at other companies. Benefits are decent (free snacks, but only one free meal/week). Good health insurance, no other perks.","Continue adding the kind of structure a great company needs. You're right to eschew process for its own sake, but chaos isn't good, either. Keep true to the values of openness and making the Internet better, and do things to bring the benefits of the product to a greater number and more varied types of customers.",4.0,4.0,4.0,4.0,3.0,3.0
2016-03-16, Infrastructure,"San Francisco, CA",Current Employee ,Looks better from the outside,More than a year,0,"Company is highly visible, in large part because senior leadership goes out of their way to promote themselves personally. The overall vision and market opportunity is there, so for sure there is a possibility of a good outcome with respect to exit opportunities.","Management is really self centered. Perfect example, a lot of the ""awards"" they're constant going to fancy dinners to receive were actually bought and paid for via marketing dollars. They used to be really focused on a good ""exit"" but now I wonder with our valuation being the obvious result of a bubble if a lot of management is now on a promotion tour for their next gig.

CEO is a lawyer and sometimes I wonder if that's why we have the weirdest legal team I've ever seen. Since the CEO is obsessive about twitter everyone on that team who wants to ingratiate themselves with him uses it obsessively. Specific example they literally tweeted about a C&D we received from some rapper and the follow calls they had with their counsel. Just embarrassing to have people in those positions so giddy about getting the attention of a hip hop star that they had to rattle off a dozen tweets and facebook posts to brag about it.","Hire a COO who can start to run this like a real company. The opportunity is too big to let slip away, but narcissism and hubris are two things that can mess it all up for us. Also, stop hoarding equity, what we give out now is so far under market.",4.0,5.0,3.0,3.0,1.0,1.0
2016-04-15, Technical Support Engineer,"San Francisco, CA",Former Employee ,Customer Support Engineer,More than 3 years,0,Innovative technology which is important for a large internet group in terms of DDOS.,Tough to keep in touch with the core principles which got the company started. Uncomfortable churn rate at a high engineering level.,listen to the people hired to do the job and consider/try constructive suggestions.,1.0,1.0,1.0,1.0,2.0,1.0
2016-02-12,,"San Francisco, CA",Current Employee ,Great place to work,More than a year,0,"super smart, highly motivated team, serious upside potential",San Francisco is a very competitive marketplace for Tech companies,keep doing what you're doing,5.0,5.0,5.0,5.0,4.0,5.0
2015-12-17, Engineer,"San Francisco, CA",Current Employee ,Awesome work environment,Less than a year,0,"You get to work with highly intelligent people to solve the latest problems that face the Internet. Massive amounts of data passes through the network, hackers launch complex attacks, and global politics actually effect you. It's a truly impressive place to work. And you're ultimate goal is to make the Internet a better place. That's just awesome. The office is gorgeous and loaded with great amenities to make your work experience comfortable. There's a great work/life balance, but it is still a start up.","You could stand to make more money. With massive growth, it's hard to find who has the information you need, which means it can sometimes be a real challenge to complete a task. But everyone is nice enough that it's not a terribly dreadful journey.","Make management decisions wisely, then let them do their job. Trust the people you have, and foster more independence.",5.0,5.0,5.0,5.0,3.0,4.0
2015-10-30,,"San Francisco, CA",Current Employee ,Great ideas; let management team do what they're hired to do,More than a year,0,"Cutting edge of internet--getting to be part of policy as it's made
Opportunity to work with ridiculously smart people
This company is going places",Founders don't let management lead. Can tend to micromanage and leave people frustrated and powerless. Almost impossible to voice different opinions.,You hired talented people. Let them do their jobs--micromanaging won't scale. Be open to ideas other than your own and be willing to step back and listen. Be willing to hire people who aren't yes men or women. Acknowledge that some of the attrition happening is due to frustration about not being heard.,4.0,4.0,4.0,4.0,4.0,3.0
