date,employee_title,location,employee_status,review_title,years_at_company,helpful,pros,cons,advice_to_mgmt,rating_overall,rating_balance,rating_culture,rating_career,rating_comp,rating_mgmt
2019-04-09, Security Manager,"San Francisco, CA",Current Employee ,Awesome place to work and great company culture,Less than a year,0,Cloudflare hires intelligent employees who are nice and enjoy their work. It's a great place to work because everyone is invested in the mission to help create a better internet and is willing to help out with problems across the company.,Would be nice to have a 401k match.,"You can tell Cloudflare management takes pride in building out and hiring great teams which is something I value. Overall, they are very receptive to feedback.",5.0,4.0,5.0,5.0,4.0,5.0
2019-04-02, Solutions Engineer,"San Francisco, CA",Current Employee ,"Fast paced, challenging and exciting",More than 3 years,0,Lots of opportunities to make your own journey and a lot to learn. The company is very fast paced and I haven't been bored once since I joined. All colleagues are very smart and driven. Internet security & performance is also a very important and interesting topic.,The company is growing fast and not everything is perfect.,Keep the culture the same for as long as possible.,5.0,3.0,5.0,5.0,3.0,4.0
2019-03-27,,"San Francisco, CA",Current Employee ,Great Time to Join,,0,"If you like being part of building things from scratch, taking ownership of projects yourself, helping build structure and sustainability for the long-term, this is a great place to work.
If you want to be challenged to learn about how the Internet really works, at one of the few places where everyone really needs to learn how the internet works, this is the place to be.
If you like working with people who really care, and are building an enduring company, but are not ruthless or arrogant, you will fit in here.","If you like a lot of structure and a defined focus, you will be made to feel uncomfortable. We are building out structure and accountability, policies and processes, etc., but we are not entirely there yet. We need people who want to help build those controls but don't need them.",Keep pushing responsibility down to teams and trusting the people you hire!,5.0,5.0,5.0,5.0,4.0,5.0
2019-03-20,,"San Francisco, CA",Current Employee ,Delighted to be Here,Less than a year,0,"While going through the recruitment process, I was concerned by a few of the postings I read on Glassdoor, specifically about the CEO, and how he engages with employees. I reached out to a good friend who works at Cloudflare, and they took the time to go through the negative reviews and share their perspective with me. That conversation helped alleviate some concerns, still, I feared that after joining things might take a turn for the worse.

My concerns went away my first week during orientation. Upon hearing the CEO speak to our onboarding cohort it became evident he's a passionate, intelligent, caring, and thoughtful leader. Throughout the week it also became clear that Cloudflare is full of equally passionate, intelligent, caring, and thoughtful individuals.

Every day I come into the office, excited for the work I'm doing, and for the people I have the privilege of doing it with. I have regular experiences (daily) which validate my decision to work here. Cloudflare is AMAZING and the people who work here are genuinely good human beings — intelligent, capable, and inspiring — and a delight to work with. I couldn't be happier!","Like many fast growing companies we have our growing pains. I don't know that I've got enough information to diagnose what the biggest challenges are. Still, in the conversations I've had it's clear that people are engaged, interested in understanding where we can improve, and will to expend the energy to make things even better (and they're already pretty awesome).",Keep up the great work. I'm excited to be on this journey with you!,5.0,5.0,5.0,5.0,5.0,5.0
2019-03-05, Sales,"San Francisco, CA",Current Employee ,Love it,Less than a year,0,"Great Company culture, nice office, great people to work with, very good product.","Can't think about one right now. There is definitely a lot to learn once you are in, but I would put this as a positive aspect.",,5.0,5.0,5.0,5.0,5.0,5.0
2019-03-01,,,Current Employee ,Incredible Gem of a Company,More than a year,0,"- Insanely talented team members in all departments
- Hyper focus on maintaining strong culture and work life balance
- Fascinating and challenging technical problems
- Building a better Internet is not just a slogan it’s in the company’s DNA. You can see it happening everyday with all the features / products being worked on.",None I can think of,Keep up the great work,5.0,5.0,5.0,5.0,5.0,5.0
2019-03-09, Engineer,"San Francisco, CA",Current Employee ,Good place to start a career,More than a year,0,"- Company does well
- Good place to start your engineering career (but not in other roles)
- Women rule, but bias for others
- Good technology","- Political, toxic culture
- CEO rules by intimidation and COO is weak
- Low pay, weak benefits, meaningless equity",Change them,2.0,2.0,1.0,3.0,1.0,1.0
2019-02-12,,"San Francisco, CA",Current Employee ,Wonderful People with an Extraordinary product,More than 3 years,0,"The people are truly amazing and inte.lligent. Everyone works extremely hard on the daily basis, If you like hard work you will love being on the team",Lunch is only one day a week,Continue to hire smart hardworking people,4.0,4.0,4.0,3.0,5.0,4.0
2019-01-31, Solutions Engineer,,Current Employee ,Rocket Ship,Less than a year,0,"-Autonomy is encouraged.
-Team is some of the most friendly technical people I've ever met.
-The product is good; it's easy to implement and practically a requirement for the modern web.
-New feature adds are rolling out to cover complaints.
-Culture is about improving as individuals and as a company; good team structure without any corporate kool-aid or forced ideals.
-Unlimited PTO with management who actively tries to avoid burning people out.","Employees are chained to a metaphorical rocket ship. Profit growth is happening fast, new features and stats are rolled out practically by the day, and it can be difficult to keep a handle on everything that's happening. New hires on customer-facing teams are often thrown into the fray and have to learn by doing, which can lead to some bad experiences.

QA also needs some work. Engineering change pushes and mistakes create some serious pain for customers, which roll down to the teams supporting them.","-Make sure all teams have access to abundant training.
-Keep updating the documentation every time something new happens and ensure it's widely shared.
-Remember to recognize when employees are working hard for a customer.",4.0,5.0,5.0,5.0,5.0,5.0
2018-12-15,,,Current Employee ,"A challenging job, but an extraordinary place to work",More than a year,0,"Colleagues are incredibly generous with their time and the product itself is a thing of beauty. Truly mission-oriented. While you'll never hear it described as a ""social enterprise"", CF dedicates a ton of pro-bono resources to protecting democratic elections, user privacy and free speech around the world.",Management operations could be improved. But Managers themselves are universally-liked. No clear path for career advancement,Customer-facing and product need better alignment. Promotions and/or job title changes need improvement to prevent attrition,5.0,5.0,5.0,4.0,4.0,5.0
2018-12-15,,"San Francisco, CA",Former Employee ,"Good Product, Weak Leadership and Culture",More than a year,0,Product is something most companies need and fairly easy to use. Definitely appeals to mid-sized companies. Mission of creating a better internet resonates with techies. Office is located by ballpark close to several other well known startups and tech companies.,"Senior management (and most levels of management for that matter) often makes decisions without being transparent with other managers or employees. Very politically charged environment where you have to constantly watch your back and navigate the political landscape daily. Tension between departments and within departments regularly which can be exhausting.

I would not trust my career and development here. Anyone joining should take it for what it is worth...a unicorn name on the resume, with little long term attraction...most good talent leaves the company within 2 years because of the very cheap compensation and horrible culture.

HR team is powerless and focuses on how to get PR for the company rather than solving the real day to day problems. Company likes to hire ""yes"" people and this includes HR.","Bring in new people outside the company who know what it takes to scale a company successfully from both a business and cultural standpoint. Remove any old timers that contribute more problems than value and are in over their head. Don't be penny wise, pound foolish.",2.0,3.0,2.0,2.0,1.0,1.0
2018-12-06,,,Current Employee ,"Big mission, little trust",More than 3 years,0,"Standard issue startup perks (snacks, unlimited PTO, etc.)
Unique mission
Still a lot of smart people
Amazing core product","You're a second-class citizen whose day-to-day experience will mostly depend on the maturity of your team and the capability of your manager - both vary wildly between micro- and absentee management. Even with a great team, the best employees tend to put in 2 years and leave, and only a handful stay past the 4 year mark. People are never prioritized over the increasingly unfocused mission of re-inventing the Internet.

The management layer is a dangerous mix of inexperienced and underpowered. Many are overly concerned with how they are perceived by their bosses due to the cult of personality at the very top. Many are powerless as a lot of key day-to-day decisions are still filtered through the executive team. Headcount, compensation, and even final interviews still flow through the top. So, even a solid manager requires final approval from above them for any decision that really matters.

This means many teams are understaffed and employees find themselves overworked and underpaid. Problems tend to get hidden instead of surfaced, become technical debt and just pile up until things start breaking. The company very accurately ""lurches from one incident to another"" as one reviewer put it, and the employees are the ones that have to clean up each and every mess.","Do right by your employees today so it'll be easier to do right by your shareholders in the future.
Stop being so cheap. You aren't a startup anymore.
Empower your people. Follow your own advice and give away your legos. Question every remaining sacred cow.",2.0,1.0,2.0,2.0,2.0,1.0
2018-11-17,,,Current Employee ,BDR at Cloudflare,,0,"Great team, exciting growing company, lot of opportunity to learn and grow and move to other teams","low level role, tough grind, all about your quota atainment",,4.0,4.0,5.0,4.0,3.0,5.0
2018-10-15, Full Stack Engineer,"Austin, TX",Current Employee ,Engineer,More than a year,0,"Engineering is world class. I don't know how Cloudflare manages at under a 1k of employees to bring together so many brilliant, creative minds.

There are a variety of teams that all have different pros and cons. You can be fluid in your role if you are a go-getter that likes making an impact. In every team, your job is what you make it and there is a ton of room to grow and reach out beyond the scope of your role or even your team.

Austin office is isolated in terms of freedom of creativity and informed risk-taking, yet integrated with the rest of the company in terms of engineering practices and company goals.","The company is at a stage where certain teams are being corporatized. Process in some teams takes up more effort than deliver value, which I believe is typical at this stage in a company. Good news is, Austin office and product strategy particularly are protected from this trend.",Keep the bar high in terms of hiring. Don't settle just to keep the numbers up. Every mediocre hire hurts the rest of us.,5.0,5.0,4.0,4.0,5.0,3.0
2018-09-26,,,Former Employee ,SRE robots,,0,None that I can think of.,"It was a very disappointing experience that I hope it will never be repeated ever again in my career. I have been promised a senior SRE job to find out that SRE at Cloudflare actually means watching some screens and when it blinks, click a button to open a page, from where you copy a set of instructions to paste them into your terminal.
Not only that the job descriptions are highly misleading, but it's certainly not a good place if you want to grow. Other than a theoretical description thrown on a piece of paper, there are very, very few genuine senior positions.

The culture is equally bad, everyone is afraid of the CEO, which, also shows it frequently in public, is a very narcissist person. He's also the one that decides your salary, and usually the offer he makes you is non-negociable. Get used to this, as after you join, this is going to be the pattern: whatever he says, you only have to say ""yes"", or you can be fired if you disagree!
Generally speaking, the higher ups have an obvious lack of previous experience in terms of management, and they understand management as a form of kingdom, they being the ones giving orders and the rest have to execute. After arguing a few times with a manager, when they run out of arguments for his terrible idea (which everyone disagreed with), he shouted: ""just do it as I said"".
Not to mention that there's no such thing as equality, definitely not an equal chance employer: if you kiss the right place you're privileged (and the whitelist is pretty short), otherwise they know how to make it a cold place for you.

You cannot attend a conference or a training to help you develop your skills, unless you speak. This is understandable up to an extent, but engineers typically have a strong desire to learn and expand their skill set. They don't offer anything in this direction.
The list of benefits is incredibly short and poor, rather offensive.

Leaving, was the best decisions in my career. I left shortly after I joined, being unhappy that there was a huge mismatch between what I've been promised and what I've actually been offered. At the interviews they make it looks like ""hey we're all friends here"" to find out how much decoupled are the teams, in reality.

The bottom line is: they don't need creative engineers, but robots that only execute orders and don't argue or have opinions / ideas.","Bring and keep more people with experience. Having the large amount of tech debt you have and understaffed teams, it's can't lead anywhere good.",2.0,3.0,1.0,1.0,2.0,1.0
2018-09-08,,,Former Employee ,Mismanaged Potential,More than a year,0,Solid product traction with mid-sized and small companies. Company has a good office location by ballpark and generally nice office space. Developers generally like Cloudflare's brand.,"No real culture and top leaders at company often lead by fear and public shaming of employees. Previous reviews of CEO are spot on. Engineers and sales are constantly overlooked and not appreciated. Compensation is below market, especially equity. Employee churn is a real issue here. A lot of top talent has left over the years and the trend is continuing even after hiring some HR folks.",Invest in and recognize people. Build a culture in the company so that employees are more engaged. Replace a lot of the old guard in management positions so that the company can get out of its own way and move on to the next phase.,2.0,4.0,1.0,2.0,2.0,1.0
2018-09-06,,"South San Francisco, CA",Current Employee ,A great place to do your best work!,More than a year,0,"- Working with the best, brightest, and humble people.
- Open culture and high-growth mean tons of opportunities for everyone.
- Doing a ton of good in the world by making the Internet safe.
- Unbelievably supportive leadership team.",Tons to do but even more important to manage your work and life.,Thank you for staying focused in building a great company and culture.,5.0,4.0,5.0,5.0,5.0,5.0
2018-08-29,,"San Francisco, CA",Current Employee ,Love Cloudflare!,More than a year,0,"I love working at Cloudflare. A tech company with a soul and employees who are super committed to the mission. The work is great and interesting. Such smart people. The leadership really puts their values in to action. Social good projects like Project Galileo and Athenian Project make me feel super proud to work here.

We are growing and leadership always works to make sure folks have career opportunities and pathways.",As the company grows things change and change can be hard. I think they are approaching this growth in a super thoughtful and strategic way but there are always growing pains.,,5.0,4.0,5.0,5.0,4.0,4.0
2018-09-20, Systems Engineer,"San Francisco, CA",Current Employee ,Zero Trust Workplace,More than 3 years,0,"Unlimited PTO

Decent health benefits

Free snacks

Catered lunch on Wednesdays

Fantastic Marketing & Sales departments

Close to Caltrain and close to the London eye ( this is probably a con for those who actually live in London)","Narcissism in all levels of the company.

People intentionally sabotage and distract meetings to get things done their way.

Little empathy and team spirit.

Not a diverse workforce.

Internal communication frequently contains aggressive language and profanities.

Blog post driven development.

Technical debt is thrown over the fence to SRE without any consideration given to it’s reliability.

Little is transparent about the company. Engineering initiatives, financials, stock, business direction, technical decisions, etc, they’re all guarded.

No career progression for individual contributors.

Decisions are made near the top of the stack.

The only way to get something done is to not follow the processes. If a decision is made at Individual Contributor level it is hidden from the rest of the company until it's too late to discuss it.

Micromanagement is common.

Standard for hiring is really low because of the talent retention issues.

Compensation is low.

Engineering in London and Engineering in San Francisco feel like different companies.

Technical discussions are ""wars of attrition"" where the author and reviewer wear down each others motivation to keep making comments or replying to emails.

Very little collaboration between engineering teams. Most meetings are adversarial, shouting isn't uncommon.

Despite what a recruiter might tell you the company is not engineering driven in the slightest, the product is fairly technical but it's not driven by engineers. Everything is driven by blog.cloudflare.com

The company lurches from one incident to another, never really putting any effort into learning from past mistakes.","Don't take the bus factor too literally, your people are valuable, treat them like they mean something.

Seek out data when making decisions, put real effort into avoiding confirmation bias.

Actually spend time and efforts improving your culture, hold those responsible for the toxicity accountable.

Let all of the engineering managers you promoted to keep from quitting go. Hire some managers with real experience growing a company.

Put real effort into engineering career progression and rewarding peoples achievements.",1.0,1.0,1.0,1.0,1.0,1.0
2018-08-17,,"San Francisco, CA",Former Employee ,I wouldn't reccomend if you enjoy any type of support,,0,"Close to transit, nice offices","Incompetent middle managers, back biting co-workers, no clear direction",Not much. If they wouldn’t listen before it’s unlikely they will now.,2.0,2.0,3.0,1.0,4.0,2.0
2018-08-15, Sales,"San Francisco, CA",Current Employee ,High potential company,Less than a year,0,"Working with fun, smart and dedicated people who enjoy coming to work everyday.","Less of a household name, technical product to sell.","Continue to listen to your employees, they set the tone for current and future employees.",5.0,4.0,5.0,4.0,5.0,4.0
2018-07-20,,"San Francisco, CA",Current Employee ,Great place to start a career,,0,"Fun/casual environment, people are nice and exceptionally intelligent, exciting place to be with rapid growth, cool products, great office location, more developed than a startup but still a startup culture.","Some processes haven't quite been fleshed out yet so there can be some confusion at times, large/well-resourced competitors.",,5.0,5.0,5.0,5.0,5.0,5.0
2018-07-05,,"Austin, TX",Current Employee ,Cloudflare Austin,,0,"* Chance to work as part of a smart, motivated team without having to move out of Austin
* No jerks - team members are encouraging and happy to answer questions
* Cloudflare builds things that genuinely impact the internet at scale
* Austin office works on hard product and engineering problems; it's not just a satellite location
* Onboarding is comprehensive and done in San Francisco, which gives you an opportunity to meet teams in other offices",* The organization is moving so fast to new challenges that it can be difficult to keep up,,5.0,4.0,5.0,5.0,4.0,5.0
2018-07-18, Engineering Manager,"San Francisco, CA",Current Employee ,"Brilliant engineers, worst leadership in the Bay Area",More than a year,0,"The brightest engineers, full stop.","The CEO is a petty narcissist, that freaks out whenever there is an incident, and shows zero trust in his team. It’s been a known problem for years. No one does anything about it, because they are afraid of him, which is strange, because he’s not a particularly charismatic or intimidating person.

Leadership openly asks managers to write positive Glassdoor reviews, and responds to negative reviews by suggesting employees take it up with their manager. Unfortunately, there is a culture of managers not listening to employees, so nothing changes.

CEO is obsessed with creating an “office culture”, but can’t seem to describe to anyone what that means.

Leadership loves to toss around the “seat on the rocket ship” analogy, but blatantly ignores the fact that rocket ship level engineering requires rigor, deliberation, transparency, and often, moving slower to make sure the right engineering is being done.

The company lurches from one incident to another, never really learning from mistakes, yet is obsessed with growing quickly.

Disaster in the making, and the best employees are leaving right and left.","If you want to grow into a real company, lose all the people that have been promoted because they’ve been at the company a long time. Get senior leaders that understand people management, and put forward a real vision for the future, and talk plainly about how each team contributes to success. Stop asking employees to write positive reviews. Listen to the negative feedback and hold the people responsible, accountable.",1.0,2.0,1.0,1.0,3.0,1.0
2018-07-18, Software Engineer,"San Francisco, CA",Former Employee ,Engineer,More than a year,0,Nice facility and good location. Short walking distance from Caltrain.,Lots of incompetent people in upper management loves to belittle and overwork their employees. Lost respect for upper management. COO doesn’t do anything but complain about dirty dishes. Like seriously? Is that your only contribution? Thank god having real skills matter... just because you have an MBA doesn’t mean you know everything.,Please don’t work as a head of anything anywhere else.,1.0,1.0,1.0,1.0,5.0,1.0
2018-04-27,,,Current Employee ,It's a job,,0,"Good product, great offices in SF, unlimited PTO","No work from home, micromanagement is common, CEO is deified and narcissistic.",Replace the CEO and allow employees to work from home occasionally.,3.0,2.0,2.0,3.0,2.0,2.0
2018-05-07,,,Current Employee ,Ops,,0,Been here for less than a year and loving it. Great place for new grads and industry professionals. Working with awesome people in a work smart environment.,"Not a lot of processes. If you're interested in building from the ground up, this is the place.",,5.0,5.0,5.0,4.0,4.0,5.0
2018-05-28, Engineering,"San Francisco, CA",Current Employee ,Engineering,More than a year,0,"- Interesting product
- Unlimited PTO (whether you can take it is another matter)
- Close to Caltrain and Muni rail","Cloudflare does not have mission values or company culture that promote harmony among all employees. There is a very silo-ed and clique culture within the company and it seems that those who are early employees, hold higher level position or gained favor from the CEO, will have preferential treatments than the others.

The tone from the top seems to reflect this:
- The CEO berating engineers in the company wiki for every one to see.
- A public tweet from the management publicly making fun of a company that tried to do business with Cloudflare
- An offer was extended and rescinded without explanation (search Glassdoor for this review)

If you see search for past reviews, you will notice common theme on what many people think of the CEO (Hint: Arrogant).

People are leaving in droves and quickly replaced by other newcomers and the cycle continues, including high ranking employees.

If you go to LinkedIn, you can see how many people have left Cloudflare and begin to see the pattern.

The company may have a good product, but be aware of the ""culture"".","Start building a more respectful cultural. Implement annual performance review and anonymous 360 feedbacks across organization. Promote those who are high performers and team player. Remove those who creates a toxic culture, no matter how good they are in their job.

For the CEO: be humble.",1.0,2.0,1.0,2.0,2.0,1.0
