date,employee_title,location,employee_status,review_title,years_at_company,helpful,pros,cons,advice_to_mgmt,rating_overall,rating_balance,rating_culture,rating_career,rating_comp,rating_mgmt
2019-04-12, Software Engineer(Internship),"Menlo Park, CA",Former Employee ,Great,Less than a year,0,It's an energetic and open company.,Some of the teams are moving too fast.,,5.0,4.0,5.0,5.0,5.0,5.0
2017-02-16,,"Menlo Park, CA",Current Employee ,"Fast paced company with high expectations, but incredibly fair. You won't a place that cares more about it's people.",More than a year,0,"- Incredible benefits
- Excellent compensation that rewards strong performance
- Lots of autonomy
- Tons of room for growth
- Very transparent from the top down
- Strong leadership
- Intelligent and caring colleagues
- The most fair and well thought out review process you will find everywhere
- Exciting work","- If you don't learn to make the work life balance work for you, it can be exhausting. But you'll also be given lots of support with this if you ask for it.
- It doesn't matter how good you are at your job, chances are you're going to be surrounded by a ton of other people who are just as good if not better. Imposter syndrome is real, but if you got an offer, you probably belong here too.","Keep doing what you're doing, keep an eye on employee burnout, keep supporting your people and keep pushing them, and the rest of the world, forward.",5.0,5.0,5.0,5.0,5.0,5.0
2016-02-16, Site Selection Program Manager,"Menlo Park, CA",Current Employee ,Pleasantly Surprised,,0,"I'm a 55 year old working in a company where the average age is 28, and I've never been happier. I have always wanted to work in a company where I wasn't the proverbial square peg, and after nearly 30 years in the work force, I believe that I have found the company that complements my ideology for how a company should operate. Here are the ""Pros"" as I see them...

- Leadership: Mark Zuckerberg, Sheryl Sandberg, Chris Cox and the rest of the leadership team. Inspiring, smart and totally real.
- The Culture: The openness is a real thing, we're trusted to do the right thing, mistakes are expected, being yourself is important and encouraged, humility is encouraged and expected, building trust is paramount, the mission of making the world a more open and connected place isn't just a cool phrase because it guides everything. It's not about us, it's about everyone else.
- The People: Smart and nice is what I find. The diversity is better than any other company I've worked at and it's getting better. Those that are figuring out how to make what we do better for everyone are really good at implementing their ideas. Two years ago I didn't know what this company really was or if it had a secure future. I can clearly see now that they have what it takes to last, and it's sincere.
- Management: Managers are hired because they're good managers and not because they're good at something else. The management track is different than the contributor track and they're equal in importance.
- Benefits: Working in the Valley it's hard to differentiate all the benefits employees receive and Facebook is at least equal to all the major tech companies, but coming from Seattle the benefits are nothing short of incredible.

Granted, I haven't been with the company for very long and I'm still in the honeymoon period, but I can tell what's real and what's not; this place is for real.","Like any tech company, the work is big and complicated so work/life balance can suffer from time to time. The difference is that it's the passion within the individuals that drives them to work long hours and forego time off. Of course there can be times when schedule demands force the imbalance, but it's not such that 10-12 hours days become commonplace and expected regardless. We do what we do to get the job done; no one is killing themselves because there's an order to do so.

Being able to eat to your hearts/stomachs content can be dangerous to the waistline, but that's a self-control thing and not the company's issue.","Keep doing what you're doing and fight hard to not be complacent. I believe that humility is the key so don't ever lose that thinking. Your motives will always be suspect, but if you're able to look in the mirror everyday and know that your motives are pure, that's all that matters. Walking the talk is the best evidence there is.",5.0,4.0,5.0,4.0,5.0,5.0
2019-04-09, Head Writer,"Los Angeles, CA",Current Employee ,Great experience,More than a year,0,"Creative, enthusiastic, efficient, appreciative, inventive","Lack of support staff, too guarded of brand, lack of benefits",,5.0,3.0,3.0,4.0,4.0,4.0
2019-04-11, Facebook Software Engineer,"Canada, KY",Current Employee ,Fun,More than 10 years,0,I love meeting new people. Making new friends and I love spending time on the internet..,"My country is far from here, and would love to come stay over.",Should keep up with the good works..,5.0,,,,,
2019-04-11, Project Manager,"Washington, DC",Current Employee ,Great company! Proud to work here!,Less than a year,0,"Clear mission, challenging but important work, great culture, excellent perks, generous employer, they take care of the workers, a lot of learning and growth opportunities, skills based company, autonomy, diversity and inclusion are top notch, treated with respect, flexible when it comes to personal life, fun environment, building social value.","Open office concept can be tough to focus, lots of meetings and many tools to navigate.","Recognize performance on a personal level. Bonuses are great but just hearing ""great job"" is enough sometimes.",5.0,4.0,5.0,5.0,5.0,5.0
2019-04-05, Software Engineer,"Menlo Park, CA",Current Employee ,great place.,More than a year,0,good colleagues and good manager,peer pressures and too much work.,,5.0,2.0,4.0,5.0,5.0,5.0
2019-04-06, Program Manager,"Menlo Park, CA",Current Employee ,"Super Fast, Smart, and Fun",More than a year,0,You're working on things that impact the world with amazing people from around the world. They treat us very well too in every way imaginable. The most important is that it's a bottom up company which allows us to continue to be agile even at our size.,"It can be hard to have a work-life balance because there's so much opportunity, but if you set limits its pretty great. Also, the housing near work is really expensive.",Keep being transparent and listening to feeedback,5.0,5.0,5.0,5.0,5.0,5.0
2019-04-03, Product Manager,"Menlo Park, CA",Current Employee ,Product manager,Less than a year,0,"Facebook is full of very smart, engaged, genuinely caring people. There is a lot of autonomy and not much stands between recognition and success other than yourself and your own ambitions.

As a company, it’s a very cushy place with lots of perks and a laid back culture.","Due to the recent scandals, the company has become cautious to an extreme and every privacy decision is taken with painstakingly slow speed because it’s been vetted by layers and layers of people.
It’s also a very fast paced and competitive place, so some people find it hard to keep up.

Also, it’s a little tiring when literally everyone you meet has an opinion (both good and bad) about your company/job even when most people don’t have a clue about what you do.","I like the fairly hands-off, bottom up approach in general. It tends to work well at FB. The only exception would be for newer products, we need a culture of a bit more leadership regulated strategy for the sake of consistency.",5.0,4.0,4.0,5.0,5.0,4.0
2019-03-27, Software Engineer,"Menlo Park, CA",Current Employee ,Great company to work at!,More than 3 years,0,"Many benefits and perks;
Great problems to solve;
Very open towards being yourself at work;
Good career path.",I can't really see any cons apart from the headquarters being in Menlo Park. I wish they would open more infrastructure engineering roles on the San Francisco office as well.,,5.0,4.0,5.0,5.0,5.0,5.0
2019-03-27, Senior Product Manager,"San Francisco, CA",Current Employee ,Great place to work with terrible work-life balance,More than a year,0,"- Surprisingly solid middle managers in many orgs
- Brilliant people, in general
- Incredible food
- Decent growth potential (I was promoted in 1 year & am looking at it again)","- Underleveling rampant, especially of women
- Unprofessional hiring/interviewing experience
- Awful commute for everyone (especially SF folks)
- Tons of thrash if you're working in a highly visible role
- Organizational politics, like everywhere
- Less growth/comp upside than in the early days","Know your power - your comments can thrash considerably. Think about what you can do to scale your feedback and give your teams more space to operate independently for longer periods of time: e.g., approving of metrics and principles so that the rest can be filled out in detail.

Work to value experience and competence over relationships, so that people don't feel it's as important to bond socially with executives in order to advance.",4.0,2.0,5.0,4.0,5.0,4.0
2019-03-25, Area Manager,"Menlo Park, CA",Current Employee ,Facebook’s culture Changes with News Headlines,More than a year,0,Fanrastic culture with dynamic leadership. Perks are top notch.,Work life balance can be challengening in hyper competitive atmosphere.,Be kind to your employees. Hyper focus on always driving impactful projects quickly leads to burn out.,5.0,3.0,5.0,5.0,5.0,4.0
2019-04-05, Software Engineer,"Menlo Park, CA",Current Employee ,Opportunity to growth,More than 3 years,0,Engineers are expected to be very independent and proactive. You will growth a lot as an engineer and you will work with very smart people.,"It seems chaotic and un-structured. Your direct manager plays a big role on how your experience the company. As in any other company there are good and bad managers and Facebook as plenty of both. If you land with a bad manager, your are going to have a very bad experience.",The upper level management has a very clear idea on where to take the company. The expectation on the IC are high. The middle layer management seem to lack accountability and it's not uniform across the company.,4.0,1.0,4.0,5.0,5.0,3.0
2019-04-05, Data Scientist,"Menlo Park, CA",Former Employee ,"overall is good, but you need know what project is best for you",More than 5 years,0,"- great opportunity to work with the smartest people from the world
- most products have billions of users so your work have a big scope
- beautiful campus, good snacks, foods, and benefits","If you are a data scientist, you need to really care about two things:

- Impact. Unlike SWE, who can prove their impacts by finishing pre-planned coding projects and rolling out pre-planned features, data scientist does not automatically get credit if you only finish beautiful analyses. You have to suggest eng team to apply your suggestion from analysis, and prove how much of the product growth are from your analysis. So sometimes your impact can be subjective.

- Skillset. You may be asked to do a lot of ad-hoc analyses from eng team, which I am sure are very important and can guide engineers whether to implement certain features, but that will prevent you from doing some deep dive analyses and learning some new techniques in data analysis. Maybe after a year or two, you will find that you did not build any statistical models or haven't touched any machine learning. But that's the skillset what other companies will ask for when you apply new job. Who cares you did how many ad-hoc analyses or AB test or wrote how many data pipelines. It's the fancy machine learning model that will earn you respect.

Also, total pay is lower than SWE for the same level.",,4.0,4.0,4.0,5.0,5.0,4.0
2019-04-04, Data Analyst,"Menlo Park, CA",Current Employee ,"Talented people, Meaningful work",More than 3 years,0,"Work with some of the smartest people I've ever met.
Work on really impactful projects.
Perks and employee benefits are top of the line.","Moves extremely fast--things are always changing, and it can be hard to keep up sometimes.",,4.0,4.0,4.0,5.0,4.0,4.0
2019-04-03, Software Engineer,"Menlo Park, CA",Current Employee ,Performance Review is a single point of failure (SPOF),More than 3 years,0,"Good Salary, friendly coworkers, a lot of benefit like free food, free wash.",Work life balance is so bad. Average 50 hours+ per week.,,3.0,1.0,3.0,5.0,5.0,2.0
2019-04-02, Senior Software Engineer,"Menlo Park, CA",Current Employee ,Good company - moves fast but with a lot of churn.,More than 3 years,0,Moves fast; always innovating. Pay is great.,"Many initiatives are started and shutdown with a short period of time. You have to chose your projects, teams and skillsets wisely.",Lots of people are optimizing for their own compensation and not for the company's best interest.,4.0,2.0,3.0,4.0,5.0,4.0
2019-02-13, Growth Marketing Analyst,"Menlo Park, CA",Former Employee ,"Amazing, stressful company with the smartest folks",,0,"Smartest people, good benefits, beautiful office, great food

Great place to learn from smart folks that have solid fundamentals in whatever trade you're trying to learn

It's a fun place to work. People hang out and go to lunch, lots of smiles going around.

Awesome classes to pick up technical skills

Bike shop on campus

Very organized, great strategy and leadership and execution

Feels like with the caliber of smart folks that fb hordes it will always be dominant.","Almost everybody there is stressed. Work life balance is bad.

Competition to get a good review leads to extremely stressful environment for most folks I know.

Rewards highly intelligent people that sometimes aren't very nice.

Feels pretty cliquey and often like a popularity contest",Make work life balance a priority.,5.0,2.0,5.0,5.0,5.0,5.0
2019-03-12, Data Analyst,"Menlo Park, CA",Current Employee ,Great learning experience,More than a year,0,"The company invests in its employees, lots of classes and resources.","large org issues -- politics, redundancy, communication",,5.0,5.0,5.0,5.0,5.0,4.0
2019-03-02, Technical Recruiter,"Menlo Park, CA",Current Employee ,Great place to work,More than 5 years,0,"- Great culture
- Performance reviews are incentivized by the right things
- Comp
- Benefits + Perks",- Company size has gotten super large,,5.0,4.0,5.0,5.0,5.0,5.0
2019-03-11, Content Strategist,"Menlo Park, CA",Current Employee ,Best place to work!,More than a year,0,"Food, people, shuttle, benefits, etc.",Lots of meetings. Challenging to focus on completing tasks.,,5.0,5.0,5.0,5.0,5.0,5.0
2019-03-18, Event Coordinator,"New York, NY",Current Employee ,"Great place, but be prepared",More than a year,0,"Great perks, like really great perks
Compensation
Free food
Nice people","Little room for error
Can feel like a tiny person in a crowd of many
Finding work life balance can be hard",Increase diversity and hold managers accountable vs taking it out on their reports,4.0,3.0,3.0,3.0,5.0,3.0
2019-03-07, Executive Assistant,"Menlo Park, CA",Current Employee ,"Incredible culture,amazing people",More than 3 years,0,"Really care about their people
Everyone has a voice
Best benefits
Best perks",No work life balance,,5.0,2.0,5.0,5.0,5.0,5.0
2019-03-10,,"Menlo Park, CA",Former Employee ,Great company,More than a year,0,"Great pay, great people, great perks.",It's located in Menlo Park.....,,5.0,5.0,4.0,5.0,5.0,5.0
2019-02-24, Social Media Marketing Manager,"Menlo Park, CA",Current Employee ,"Good compensation, benefits, and work/life balance",More than 3 years,0,"I have been with Facebook for 3 years. The company works hard to look after its employees and provide them the best benefits and services. I have yet to see any layoffs. Even when jobs are eliminated Facebook provides assistance to find another position within the company. This is very different from my experience with Coca-Cola and CNN, both of which had regular large scale layoffs. Compensation is very good, especially for engineers. But It can be difficult to get an interview without an internal connection/referral.","I have had 6 managers in 3 years. Facebook has a lot of reorgs. And I am certain all of this change has hindered my career growth. Even though I have received top reviews I have not been able to achieve a promotion.

Regarding the culture -- Generally everyone is great to work with and good at their job. However, there are a some people who seem unfamiliar with a professional work environment. These people can cause lots of drama and generally seem ungrateful for the tremendous opportunity we have at Facebook.

It can be difficult to deal with all the attacks on the company from the press. When you see so many amazing people working hard to get things right, and the press only focuses on (predominately false) negative articles, it is hard not to get discouraged.","Be better advocates for your top performing employees. The awards, bonuses, and cross-functional recognition is great. But I need to see my level progressing as well.",5.0,5.0,4.0,4.0,5.0,5.0
2019-03-06, Recruiter,"Menlo Park, CA",Current Employee ,Great place to work,More than 5 years,0,"awesome culture
great benefits/perks
really smart people
challenging and hard problems to solve",company is getting super large,don't like the size change the culture,5.0,5.0,5.0,5.0,5.0,5.0
2019-04-04, Software Engineer,"Menlo Park, CA",Former Employee ,Worst company to work with if you want only work but not work life balance,Less than a year,0,Good food and team with different dimensions,"manager , ethics, no balance between work and personal life",improve managerial hiring,1.0,1.0,1.0,1.0,1.0,
2019-03-02, Data Scientist,"Menlo Park, CA",Current Employee ,Data Scientist,More than a year,0,"Good perks and comp, coworkers are nice and fun",Very competitive environment. No possible to succeed if you don’t work 60+ hours. Focus on short term impact due to performance cycle every 6 months. No clarity on expectations of roles. Mix signals from leadership about culture,,2.0,1.0,3.0,1.0,4.0,2.0
2019-02-25, Postdoctoral Research Scientist,"Redmond, WA",Current Employee ,Good place to work,More than a year,0,"cool projects, cool people, amazing pay and benefits",you have to be able to deal with uncertainty typical of ever-changing research environment,,5.0,3.0,4.0,4.0,5.0,4.0
2019-03-01, PSO Manager,"Mountain View, CA",Current Employee ,Chaos,More than a year,0,"- Everyone is smart and very hardworking
- Facebook is a great company to work","- The PSO organization excluding ProdOps is a complete mess with no structure .
- limited career growth
- HR is not helpful and will always side with your manager
- There is no work life balance, and you will always be stressed
- Your performance is solely based on you managers opinions of you","- Learn to be better people managers
- understand the work that your subordinates do and don’t rely on other managers feelings",3.0,2.0,5.0,2.0,5.0,2.0
2019-02-24, Software Engineering Manager,"Menlo Park, CA",Current Employee ,"Great culture, big startup company",More than 5 years,0,"The best company culture. Open, focused, friendly and people first.
Here, your voice matters, you get to work on things that matter to you and the company. The company invest in you through many ways (many perks, training materials, PTOs, 4 months parental leave, etc.)
During calibration you can see how everyone puts people to the top of their consideration.","The company is focused on connecting people, and is very very focused on this. So if you wanted to work on versatile of things like cloud system, self driving car, etc., it's unlikely you can find such work near term.
You might need to adapt to the work life integration style here. Some teams are pretty busy, but not all teams are like that.",Keep up the open culture while making sure leaks don't happen too frequently. Let leaderships hear more from what frontline ICs and managers to understand what the company can do better. Many issues don't surface in weekly Mark Q&A because it's scary to ask some questions publicly.,5.0,3.0,5.0,5.0,4.0,5.0
2019-02-18, Product Experience Analyst,"Menlo Park, CA",Former Employee ,"Great Company, Great People, Find the Right Team",More than 3 years,0,"Flexibility of work
Best in Class Benefits
Big Interesting Problems to Solve at Scale
Flexibility to change teams if you get bored, don't fit well with a given team
Performance is rewarded well","As more people get hired scope of role and work may decrease due to too many cooks in the kitchen.

I've noticed a creep in territoriality and focus on getting a good review rather than impact.",,5.0,2.0,5.0,5.0,5.0,5.0
2019-02-12, Product Designer,"New York, NY",Former Employee ,"A great place to learn and grow, if you're lucky and find the right team",More than 3 years,0,"- If you find the right team, and you have the autonomy to self-improve and grow, Facebook is a great place for you to flex your wings, experiment, and improve.
- By default, almost everything you ship is used by a lot of people
- Benefits are really good","- You work all the time. It's impossible to truly step away from work. I had dreams about FB projects until about 3 months after I left.
- If you don't end up on a good team, or with a good manager, you're out of luck in terms of ""upwards"" movement and ""impact"". It's really a dice roll unless you're privileged enough to select a specific team.
- Facebook itself is a well greased machine. It self-enforces a lot of its own problems we're seeing the outcomes of today due to how it works. It's unlikely to change that anytime soon, so if you don't like how FB is unable to predict externalities in its work at its scale, you'll be upset working there
- Working at FB is a bit like having blinders on. You're so dang busy and shipping things all the time, it is not conducive for you to think about the big picture and (related to above) the potential butterfly effects/externalities of your work. Many well-intentioned projects end up having disasterous consequences, but I'm confident that 99% of people out there, if they worked on the project, would've also been unable to predict the fallout. The prime example here is Instant Articles, which was a design-lead initiative to give select news partners the ability to make their articles load fast and render ""natively"" in the mobile apps (spun out of Paper after that got shut down). I can assure you that all the team wanted to make was a beautiful interface — it was lead by a product designer — and none of them would've wished to kill ad revenue/contribute to ruining journalism. You can argue that Instant Articles was one in many many steps FB took that ultimately shifted the ability to make money off of news ads from newspapers to FB itself, and lead to today's massive journalism layoffs and click-bait culture (if ya can't get clicks, ya can't get ad views, and ya can't make money). If you ever met the Instant Articles design lead, you'd know all they care about is a good design and polished interactions. But it turns out, just caring about that means you aren't thinking about the potential damage your product can do 4 years down the line.","Facebook's culture will never change. The recent Q4 earnings are a testament to how good the ""ship fast"" machine is printing money. Even a disastrous 3 year long anti-FB PR cycle didn't keep the stock down for long, which means the company won't make major changes to the way they work.

Here are the more radical ideas that will never be implemented:
- Zuck needs to go, or step back into a different role to just focus on his pet projects (which he has many). His low EQ trickles down through the company because all important projects live or die by the ""Zuck Review"", which he offers his gut views on the product. The man is not infallible, and cannot predict bad human behavior because he himself (and those around him) are only human, and have many flaws and oversights due to their background, location, wealth, etc.
- Build more ""local"" product teams. FB to this day insists on running product from HQ, whereas Lays and Doritos know that their American flavors will never work in Southeast Asia and create local flavors with a local team and local testing. Line is a Korean company that has a Thailand specific team to work on Thailand specific features. Facebook has never done this except for a ""project Japan"" to make FB more appealing to Japanese people in the late 2000s/early 2010s.
- Fire a ton of people. There is a lot of incompetence, especially at the management level

None of that will happen.",3.0,2.0,2.0,4.0,5.0,1.0
2019-02-19, Data Scientist,"New York, NY",Current Employee ,Still a Rocketship,More than 3 years,0,Hard to find another company that moves fast at this scale,You have to be able to manage upwards and downwards,Evaluate the big bets and ensure resource alignment,5.0,5.0,5.0,5.0,5.0,5.0
2019-02-19, Product Specialist,"Menlo Park, CA",Current Employee ,Awesome workplace,More than 3 years,0,"Food, work life balance","Growth and Opportunities, Stressfull sometimes",,5.0,5.0,5.0,5.0,5.0,5.0
2019-02-20, Full Stack Developer,"Los Angeles, CA",Former Employee ,I was working at Facebook full-time,More than a year,0,A good place to be in. Enjoyed my full potential. work and life are balanced.,You have to be able to manage upwards and downwards and stressful sometimes.,More transparency and conversation around career advancement and compensation would be nice,5.0,5.0,5.0,5.0,5.0,5.0
