date,employee_title,location,employee_status,review_title,years_at_company,helpful,pros,cons,advice_to_mgmt,rating_overall,rating_balance,rating_culture,rating_career,rating_comp,rating_mgmt
2017-12-13, Software Engineer,"Menlo Park, CA",Current Employee ,"Warm supportive culture, embraces autonomy and diversity, full of elite talent",Less than a year,0,"I've been at Facebook for 6 months. I've never been one for loyalty to my job or my company, but at least in Social VR, my team are some of the most genuinely supportive and caring people I've ever met in my life and I really feel like they accept me and will be there for me both when I need things at work and when I'm having personal difficulties. I'm given full autonomy to pursue the things that I think are most important. My team is incredibly diverse (including transgender, black, Asian, Pacific Islander, Latino, and an unusually high percentage of women) which shows both an extraordinary commitment to diversity and gives me faith that the product will be built to serve diverse customers. And the backgrounds of the people on my team are shockingly elite, with many projects on their resumes that are immediately familiar to and admired by me. I'm also proud that Facebook has so many people at the very top who are strongly committed to VR - like Zuckerberg's ambitious announcement at OC4 that his goal is to have a billion people in VR.","Facebook is hugely committed to transparency and authentic identity. So if you value separating your personal life and work life, don't want to share your personal feelings with coworkers or hear about theirs (or offer emotional support), or don't like to share with other people in the broader company what you're working on, it may be a bad fit for you. Likewise, if you prefer to be directed by leadership rather than establishing your own direction autonomously, Facebook might be a bad fit for you. Finally, Facebook's primary Menlo Park campus is located in the middle of nowhere with very little else around - you eat and get all your services on campus, with the nearest downtown a 15 min drive away. If you prefer to be in an urban center, you should either consider a different location, or a different company.",Honestly just keep doing what you're doing. You're making a lot of great decisions and supporting me in the best way I can imagine.,5.0,5.0,5.0,5.0,5.0,5.0
2017-12-05, Software Engineer,"Menlo Park, CA",Current Employee ,Best Large Tech Company Culture,Less than a year,0,"From the start, Facebook has been amazing.

Bootcamp was a great experience; not too many companies let a new grad spend 6-8 weeks searching for a good team fit. They let you pick a team, which essentially means you get to pick your tech stack (Backend; Front-end; Mobile; Infrastructure), the org you work for (Messenger, Facebook, Oculus, Instagram, etc.). More importantly, you get to pick your manager + team mates, where as in other large companies, it's the other way around; you are assigned to a product & org & manager whether you like it or not. This is way different compared to Google's opaque 'host matching' process and Microsoft where they just randomly place you in a division like Azure or Office.

The company values really shine through every day. Before Facebook I thought the concept of company values was kind of corny and B.S. Now that I'm at FB I can at least say that here the company values are actually values held by top management + majority of the workforce and not just marketing / HR speak.

Everyday I really feel like we are moving fast and shipping a lot of product very quickly. We A/B test lots of features, analyze the data, and swiftly decide what to ship to the public. I never feel stuck; I always feel like I'm either implementing an A/B test or analyzing data so we can ship more features. There are not long product cycles with lots of prognostication from product leadership; we build, measure, then learn. Thats it.

I feel everyday that we have an open culture. At Facebook, we use Workplace, a tool thats kind of like Facebook but for corporations, made by you guessed it... Facebook. Within Workplace, just like normal FB, there are a ton of groups. I'm in a bunch of groups and basically get visibility on decision making + product updates + news from every part of our org. I feel like I'm in the loop and just learn so much about FB / product by reading my Workplace newsfeed. For example, today I read a research report about internet users in India, learned some stuff about dynamic ads, and saw one of the senior leaders announce a new partnership deal. All of that info isn't directly relevant to my day-to-day job, but because its all there and open to anyone, I learn so much and have so much clarity into FB's product vision & company objectives. Mark or Shreyl do Q & A's every Friday. Between hearing top leadership speak, and reading updates from every part of the company on Workplace, I feel that FB is a very open and transparent place to work.

There are many other pros and cultural values that I like but let me get to a major pro to end this review. Food!
Here's just a sample from today! I ate these 3 meals today at the company cafe 2 mins walk away from my desk.

Breakfast:
Soft Boiled Egg + Been + Cheese + Salsa Tostada. Organic Blueberries & Blackberries. Hemp & Pumpkin seeds.

Lunch:
Vegetarian Pho with Sous Vide Eggs, Tofu, Steamed Cabbage, Green Onions, Cilantro, & Bean Sprouts in it. Added Sriracha and Chili Oil to spicen it up.
Thai Iced Tea Bobba (Bubble) Tea.

Dinner (today was Jamaican themed):
Sweet Potato & Corn Casserole, Collared Greens, Fried Plantains, & Quinoa.
I also got a slice of cheese pizza :)

Dessert: Mango Cheesecake made with Graham Cracker Crust.

By the way, the menu rotates, and at the HQ, there are a ton of cafes to choose from so way more options for food are there.","Work life balance is tough. Can have some busy weeks due to the ""move fast"" culture. Plus you have a lot of ownership which brings with it some stress.

The offices are crowded due to how fast we are growing. They are building a few new huge buildings but until those finish things are quite cramped, and the work place can get loud.

Also not enough space in the gyms because of the general overcrowding on campus.","As we grow bigger, invest in making sure execution pace is still fast and we don't get bogged down in bureaucracy like other tech giants. Put extra effort to make sure our current culture stays the way it is even as things scale.",5.0,3.0,5.0,5.0,5.0,5.0
2017-12-19, Software Engineer,"New York, NY",Current Employee ,Amazing place to work,More than 3 years,0,"Engineers gets to choose what to work on
Work and learn from the best people in the field
Fair rating and bonus procees",Remote offices need constant connection with Headquarters in California,,5.0,4.0,5.0,5.0,5.0,5.0
2018-01-03, Software Engineer,"Menlo Park, CA",Current Employee ,Software Engineer,More than 3 years,0,"Independendence -> reducing though
Scale
Impact of work
Move really fast
Switch teams","No process
Different teams follow different development patterns",Need a balance between top down and bottom up approaches for engineering.,4.0,2.0,5.0,5.0,5.0,3.0
2017-12-18, Software Engineer,"Boston, MA",Former Employee ,Software Engineer,Less than a year,0,Good people and nice area,nothing is wrong here it is good,keep it up,5.0,5.0,5.0,5.0,5.0,5.0
2017-12-07, Technical Sourcer,"Seattle, WA",Current Employee ,Technical Sourcer,Less than a year,0,"free food, almost unlimited flexibility, fully stocked snacks, every kind of coffee you can think of, amazing benefits, top 90% for pay. The list goes on and on",I have yet to find any cons.,,5.0,5.0,5.0,5.0,5.0,5.0
2017-12-06, Software Engineer,"Menlo Park, CA",Current Employee ,Excellent place to start. Meh place to stay.,More than 3 years,0,"Lots of freedom - you are the master of your own career. You get full credit for your achievements (with a cost of taking full responsibility).

Retains its ""move fast"" culture - you can get a lot of meaningful work done.

Smart and proficient colleagues - you can learn a lot regardless of your level!

Compensation is fair and sweet.","Forget about work/life balance. In fact, forget about work/sleep balance. Management does nothing to deal with the problem.

Horrible working conditions. Wide and extremally noisy open spaces (impossible to concentrate), tiny desks, lines in restrooms, unavailable meeting rooms. I do most of my meaningful work from home. Management refuses to acknowledge the problem and praises facilities, so no chance of this being fixed.

A strong political bias coming all the way from the top that pollutes working climate.",,3.0,1.0,5.0,4.0,4.0,3.0
2017-12-06, Business Analyst,"Menlo Park, CA",Current Employee ,Impact-Oriented Company,Less than a year,0,"Ability to drive impact from day one. Incredibly lean teams, great management exposure, people bring their authentic selves. Fantastic wellness benefits, amazing restaurants on campus, great shuttle service throughout the Bay.","Limited conference/meeting rooms, number of reorgs/changes to business operations, large number of visitors/guests on campus","Maintain the culture, more specific on-boarding training per department, expand office presence in downtown SF",5.0,4.0,5.0,5.0,5.0,5.0
2017-12-05, IOS Recruiter,"Seattle, WA",Current Employee ,Facebook,More than a year,0,"I've been at Facebook for about a year and a half and it is the first company i've worked for that's truly walked the walk in terms of standing by it's mission and values. The people that I work with care deeply about their users and about the company as a whole and Facebook cares deeply and invests in those employees as well. The problems are large scale and complex, but the people working to solve them are the best of the best. I come to work everyday and enjoy my job, I feel appreciated, secure in my role, and that I personally make an impact every day. It's a rare feeling.

Perks are insane, benefits are humbling and the people I work with are smart, funny and dynamic. Can't recommend the company enough.",No large cons that come to mind.,Keep doing what you're doing. The transparency and realness provided from the top down is phenomenal.,5.0,5.0,5.0,5.0,5.0,5.0
2017-12-09, Project Manager,"San Francisco, CA",Current Employee ,Project Manager,More than 3 years,0,Great opportunity to deliver strongly customer oriented service to market. huge number of talented and creative colleges to build an innovative solution,need to take an initiative activity and mindset to drive other people and motivate subordinate staffs. self starter highly needed,Nothing,5.0,5.0,3.0,5.0,4.0,5.0
2017-12-09, Software Engineer,"New York, NY",Current Employee ,Better than expected,More than a year,0,"• Great culture
• Very smart people around
• Amazing teammates
• Flexibility to choose teams/projects at the beginning and later very easy to switch if you like.
• Great resources within the company to keep learning
• Great perks (specially the food, it’s awesome and free)","Most offices are cold, don’t know why but it’s annoying to have to wear a jacket in the middle of the summer",,5.0,5.0,5.0,5.0,5.0,5.0
2017-12-05, Product Manager,"Menlo Park, CA",Current Employee ,"Challenging, interesting, and delicious free food",Less than a year,0,"Every day involves solving difficult problems with a bunch of very bright people. We're rewarded well for this, and everyone treats each other with mutual respect.",People do work harder than at some other tech companies. Commuting in the Bay isn't overly fun.,Strive to keep autonomy as the company grows rapidly. Trust and independence are key to the company remaining successful.,5.0,5.0,5.0,5.0,5.0,5.0
2017-12-06, Manager,"Menlo Park, CA",Current Employee ,Wonderful Company,More than 3 years,0,"- Incredible benefits
- Excellent compensation that rewards strong performance
- Lots of autonomy
- Tons of room for growth
- Very transparent from the top down
- Strong leadership
- Intelligent and caring colleagues
- The most fair and well thought out review process you will find everywhere
- Exciting work","Imposter syndrome is real, but if you got an offer, you probably belong here too.","Keep doing what you're doing, keep an eye on employee burnout, keep supporting your people and keep pushing them, and the rest of the world, forward.",5.0,5.0,5.0,5.0,5.0,5.0
2017-11-22, Marketing Science Partner,"New York, NY",Current Employee ,"Great challenges, great culture",More than a year,0,"Given the number of employees relative to the size of the company, you always get to work on something meaningful, interesting, and challenging. Compensation is good, hours are great, travel is extremely manageable for most roles, and managers do a great job of balancing between using current strengths and developing new skills in preparation for future roles. The food is also great.","Wish the office were dog-friendly, but that's about it.",,5.0,5.0,5.0,4.0,5.0,4.0
2017-11-26, Freelancer,"Washington, DC",Current Employee ,.,Less than a year,0,Strong leadership. Lots of autonomy. Intelligent and caring colleagues.,It doesn't matter how hard working you're you are going to be surrounded with a lot of other people who are just as good as you're,Keep supporting your people and the rest of the world,5.0,4.0,4.0,4.0,4.0,5.0
2017-11-28, Software Engineer(Internship),"Menlo Park, CA",Former Employee ,Internship,More than a year,0,One of the best internships out there. Had a great summer internship with them for two years in a row now. Interned at HQ and the Seattle office and all the offices have their own little perks. Interns get all the same perks as full-time and more including housing and intern events.,Work-life balance is a bit tricky as they make it convincing to stay at on campus with all the free food.,,5.0,4.0,5.0,5.0,5.0,5.0
2017-11-27, Content Marketing Manager,"Menlo Park, CA",Current Employee ,Content Marketing Manager,Less than a year,0,"Smart, driven employees empowered to be impactful and efficient.","Facebook mission clear, execution direction from Leadership down is a miss. Too vacuumed and work on 6-month review beats, so a lot of man/woman for themselves.",Better follow through of Facebook mission -> strategy to get there -> how and follow-through of delivery.,5.0,4.0,3.0,5.0,3.0,4.0
2017-12-05, Director of Engineering,"Menlo Park, CA",Current Employee ,Working at Facebook as a senior engineering leader,More than 3 years,0,"Empowerment, culture, infrastructure, autonomy, impact, comp","Much of the internal mythology about the company's culture isn't really true anymore, now that the company has grown to more than 20K employees. It's still a great place to work, but because the reality doesn't match the speeches it often leaves people feeling betrayed and disillusioned when FB turns out to just be a large tech company.",,4.0,3.0,4.0,5.0,5.0,3.0
2017-11-20, Specialist,"Menlo Park, CA",Former Employee ,Community Operations,More than 3 years,0,Working on great projects. Continuous innovation and learning. Transparency. Strong leadership. Good culture.,You need to be careful about work-life balance.,,5.0,4.0,5.0,5.0,5.0,5.0
2017-11-14, Product Quality Analyst,"Menlo Park, CA",Current Employee ,Great Place to Work Learn and Grow,More than a year,0,"Amazing Benefits
Competitive Salary
Promotions come quick and fast if you work smart and hard
Culture of sharing and cooperation
Lots of growth oppurtunity and ability to level up your technical skills including formal classes","Middle Management in my role doesn't really get it sometimes. They aren't technical enough to be managing technical analysts.

Work-Life Balance can be a struggle and isn't as good at other companies like LinkedIn/Microsoft/Google.",,5.0,2.0,5.0,5.0,5.0,5.0
2017-11-17, Software Engineer,"Menlo Park, CA",Current Employee ,The best tech company to work for,Less than a year,0,"Many interesting engineering problems to work on.
Many smart coworkers.
Ideas come from engineers bottom up.
Open culture.
Awesome perks.","WLB may not be the best depending on what team to are on.
Rapid hiring creates office space problem in MPK. New building opening up next year will reduce the problem.",Keep doing what you are doing.,5.0,4.0,5.0,5.0,5.0,5.0
2017-10-27,,"Menlo Park, CA",Former Employee ,Most challenging place I've ever worked at,More than a year,0,"If you want to work with the brightest and best, this is the place to be at. People here are really on top of their game.",They have very high requirements here. Impostor syndrome can be definitely an issue if you don't get with the program quickly.,"I would like management to realize employees are people. Hearing stories about how people were forced out, it seems management can be very cold about the process.",5.0,1.0,4.0,5.0,5.0,3.0
2017-11-11, Software Engineer V,"New York, NY",Former Employee ,Great workplace,More than a year,0,"Autonomy and freedom to work on projects you're interested in
Great bootcamp training
Everyone is incredibly intelligent and executes well","Starting to get fairly bureaucratic, even in 2015. Can't imagine now but I've heard it has only gotten worse.",,5.0,4.0,5.0,5.0,5.0,4.0
2017-11-09, Product Manager,"Menlo Park, CA",Former Employee ,"great benefits, youth culture",More than a year,0,"outstanding benefits, good people overall","One thing I noticed was the first person to 'post' an idea ultimately gets credit for the idea, even if they didn't originate it. Makes it hard to discuss ideas or work collaboratively without fear that your ideas will get stolen. I guess it's part of moving fast and breaking things. Also, propaganda posters decorate all the buildings. They're there for inspiration but it felt more like cultish brainwashing. My opinions could be because I was older than about 92% or the population at Menlo Park which skews toward college grads and under 30s. For a veteran of the industry, some of the soft and sentimental ""stories"" sometimes ring false. Some people simply want to go to work and do a job without having to make it a life changing experience.",It's great to have a place with free food and couches and old timey arcade games but actual recognition for work performed would be cool too.,4.0,3.0,3.0,3.0,5.0,3.0
2017-10-21, Engineering Manager,"Seattle, WA",Current Employee ,Fun work. Tons of independence. Great pay,More than 10 years,0,"Pay/compensation is top notch.
Independence.
Dev environment is a dream for php devs.
Variety of tech/products.
Great benefits (food, gym).
Same salary in seattle as California.","Very high expectations.
You need to be a bit of a 3-in-1 printer to do good (not just a dev but also a tester and pm and designer and data eng and data scientist).
A bit of politics to define goals.
Growing bigger is tough on culture.",,5.0,4.0,5.0,4.0,5.0,5.0
2017-11-19, Software Engineer,"Menlo Park, CA",Current Employee ,Software engineer,Less than a year,0,great benefit and self time pacing,low raise rate after yearly performance review,should know how to do the job of employees before stepping into management,3.0,3.0,4.0,4.0,4.0,2.0
2017-11-06, Software Engineer,"New York, NY",Current Employee ,Fast-paced with lots of freedom,More than a year,0,"Independence, fast pace, high impact","Highly performance-focused, which can lead to burnout if you aren't careful",,5.0,4.0,5.0,5.0,5.0,5.0
2017-11-03, Software Engineer,"Seattle, WA",Current Employee ,Great company for college grads,Less than a year,0,"The company culture is really great, which is like night and day for productivity.","Employees are younger, generally speaking, than Google, so there's fewer super well-known people.",,5.0,5.0,5.0,5.0,5.0,5.0
2017-11-15, Technical Employee,"San Francisco, CA",Current Employee ,Good,Less than a year,0,very good place to work at so nice,not that i can think of realy so not.,none.,3.0,2.0,4.0,3.0,3.0,3.0
2017-10-24, Product Manager,"Menlo Park, CA",Current Employee ,A corporation for entrepreneurs,Less than a year,0,"I've been at Facebook for 7 months now as a Product Manager after 3 years as an entrepreneur and a freelance product and growth consultant. I've noticed the following:

1) The company embodies ""move fast"". If you can prove you can create a vision and build momentum for a product and a team, you will be given the reins to move as fast as you can at FB. I've taken a project from 0 to 1 to launch in 4 countries in 4 months.

2) The company embodies ""be bold"". There are no ""small swings"" around here. There might be a lot of incremental work, optimization and tweaking on all fronts but when the company realizes progress needs to be done in an area, it's no holds barred. The big bet I'm currently leading has lead to 2 teams merging and org structures adapting to enable that shift.

3) The company embodies ""be open"" - There is a transparency to the decision making, be it at team level or at management and leadership level I've never encountered before. It's refreshing to be able to ask any question I want to Mark every Friday during the Q&A for instance.","One thing has underwhelmed me and that is that management isn't as available as I wish it would be. For instance, I would have loved the opportunity to meet and learn from higher-ups and more experienced people more often but am unable to find time on their calendars (Still trying though).",,5.0,5.0,5.0,5.0,5.0,4.0
2017-10-27, Product Designer,"Menlo Park, CA",Current Employee ,Facebook,Less than a year,0,I feel empowered to work on what I care about and generally enabled.,Sometimes the problem set can be a bit narrow because of the target platform.,,5.0,5.0,5.0,5.0,5.0,5.0
2017-10-17, Software Engineer,"Menlo Park, CA",Current Employee ,Impact like nowhere else,Less than a year,0,"- Opportunity to build a product that billions of people use around the world
- Great perks (health benefits, food, environment, transport, bonuses)
- Great culture focused on connecting the world.
- Good tools",Using Facebook (the app) will never be the same,,5.0,4.0,5.0,5.0,5.0,5.0
2017-10-26, Production Engineer,"New York, NY",Current Employee ,Good so far,More than a year,0,"Perks: Food, good pay, lots of events and technical challenges, smart coworkers, interesting work, lots of different types of tech, cutting edge tech","Compared to most places, there are no real cons to speak of",You're doing pretty well from what I can see!,5.0,5.0,5.0,5.0,5.0,5.0
2017-10-27, Content Specialist,"Menlo Park, CA",Current Employee ,"Smart, passionate colleagues",More than a year,0,"- extremely smart people
- remarkably transparent company across orgs and teams","- emphasis on Menlo Park office, remote and international workers are at a disadvantage",,5.0,4.0,5.0,4.0,5.0,4.0
2017-10-25, Software Engineer,"Menlo Park, CA",Former Employee ,Facebook,Less than a year,0,"Autonomy, Flexibility in Position, Modern Environment.","Sporadic Empathy (out-argued by a first-pass data analysis), Lack of Consistent Training.",,5.0,4.0,5.0,5.0,5.0,4.0
2017-10-09, Executive Assistant,"Menlo Park, CA",Current Employee ,Executive Assistant,Less than a year,0,Amazingly progressive in so many aspects. Being bold and taking risks while thinking outside of the box are truly appreciated. Feedback is openly given and requested at all levels and incorporated into changes (where warranted) quickly.,"The pace is fast and furious. Onboarding process re: tools available and how to access could be beefed up a bit, but would need to be on a department level to be of significant value.",,5.0,5.0,5.0,5.0,5.0,5.0
2017-10-15, Production Engineer,"Menlo Park, CA",Current Employee ,"Wonderful people, fun work, great culture",Less than a year,0,"Comp, benefits, and perks are incredible.

Company culture is so, so good. I've had two great managers who both have done an excellent job supporting my growth and guiding my career.

It also feels like senior and C-level management really cares about employees. It feels like Facebook the company really tries to support me as a whole person (but be sure to ask for what you need! nobody's a mind reader).

For eng, bootcamp and team selection are such a good idea. I freaking love my team, and I get to own my decision to join that team (rather than some hiring/allocation manager deciding where I get to go).

Very few operational rules/bureaucracy. I can ssh into any machine I need to. If someone's fighting a fire anywhere in the company and I am able to help, I feel like I can always jump in to help. I really like Infra, so being at a big company like FB is super fun.","Oncalls can kill your sleep during your oncall shift if things are noisy overnight

There's a little bit of an ""always on-the-grid"" culture which contributes towards the 4/5 work/life balance, but it's generally not too hard to fight it. Most people who work a lot end up doing it because they're passionate about their work, anyway.",,5.0,4.0,5.0,5.0,5.0,5.0
2017-10-21, Data Scientist,"Menlo Park, CA",Current Employee ,Great!,,0,"It's great working here, there's nowhere else I'd rather be. You are working with very smart people who are energized and believe in the work they are doing. You will be rewarded for doing well, and for the company doing well. You are empowered and encouraged to wield influence and ship products that can literally affect billions of people, no matter what level you are at. There is also a lot of food.","It's really expensive to live around here, and the traffic sucks, so if you want to work in the heart of things in Menlo Park you have to contend with that. And it can be pretty intense, but that's mostly because there really is so much to do, and you will want to go do it!",,5.0,3.0,5.0,5.0,5.0,5.0
