date,employee_title,location,employee_status,review_title,years_at_company,helpful,pros,cons,advice_to_mgmt,rating_overall,rating_balance,rating_culture,rating_career,rating_comp,rating_mgmt
2019-01-23,,,Current Employee ,HR,More than a year,0,"wonderful people, amazing product, changing lives","high turnover, always feel behind the curve",,5.0,4.0,4.0,4.0,4.0,3.0
2019-04-12,,"San Francisco, CA",Former Employee ,"Lack of leadership, vision, and commitment",More than a year,0,"- great brand and product history
- yummy snacks and cool office","- Existing executive team still around from the start up days, even after poor market performance, massive attrition, and major complaints from employees
- CEO who is still way too deep in the weeds of product instead of providing the strategic direction and leadership needed to sustain the business
- lack of commitment to a vision and direction creates major spin and time wasted on work that never makes it to market
- Disempowered product and marketing teams unable to make even the smallest decision on their own without an executive approval",The executive team absolutely needs to be refreshed at this point. The company will not sustain itself with the existing management and attrition will continue to be a pain point.,2.0,3.0,2.0,2.0,3.0,1.0
2019-02-21, Marketing Manager,"San Francisco, CA",Former Employee ,Great work-life balance; lack of innovation,More than 3 years,0,"- Great work life balance
- Opportunity to roll up your sleeves and get work done
- Opportunity to work with some really nice and talented people
- Mission-driven and people really care about it
- Flexible WFH policy","- Opportunity to roll up your sleeves... because you’re constantly fighting fires and cleaning up messes.
- No clear path for growth; results in in-fighting among middle management
- Lack of innovation/always feeling behind the curve
- Unclear strategic vision from senior leadership.
- Lack of alignment from senior leadership",Get aligned with each other. Create real goals that go beyond “deepen engagement with existing users” and “reach more users.” Set a strategy that gets us there. Then follow through with that strategy.,3.0,5.0,2.0,2.0,3.0,2.0
2019-03-01,,,Current Employee ,Good but not great anymore,,0,"good compensation
good flexibility
good movement depending on your org","losing momentum
lots of disorganization of upper management
not a clear vision anymore",,3.0,5.0,3.0,5.0,5.0,2.0
2019-02-02,,,Former Employee ,Sinking ship,,0,"Good people
Still some talent left
Good location","I’ve never been anywhere that felt more like a sinking ship. Everyone is scrambling to get off.

Continual layoffs feel like peeling off a bandaid very slowly. It is public knowledge that execs want to shed headcount. Just get it done already.",Spend that cash in reserve to do something dramatic and fast.,2.0,4.0,3.0,1.0,2.0,1.0
2019-02-06, Reliability Engineer,"San Diego, CA",Former Employee ,Decent place to work,More than a year,0,"Lots of perks, and great people",Lack of innovation and vision.,,3.0,,,,,
2019-01-22,,"San Francisco, CA",Current Employee ,Fun place to work,More than a year,0,The work is challenging and the hours are reasonable. Fun to work with other people who are wild about fitness.,Some middle and upper management are hard to work with.,,4.0,,,,,
2019-02-15, Senior Analyst,,Current Employee ,"Low morale, constantly changing priorities",More than a year,0,Recognizable brand. Your parents' friends will think it's cool you work at Fitbit. Employee discounts on products.,Leadership keeps changing priorities and can't deliver on promises. Inflated middle management. 20% of the people do all the work while the rest try desperately to make themselves helpful. No career pathing. Systems tools are barely working.,,1.0,5.0,1.0,1.0,3.0,2.0
2018-12-30, Manager,"San Francisco, CA",Current Employee ,Good Upside!,Less than a year,0,"*Strong product roadmap
*Good communication from Sr Staff
*Good benefits, started 401k company contribution
*Very metrics driven
*Put recent focus on better managing OPEX w/ good results
*Likes to celebrate
*Philanthropic
*No debt, a lot of cash in the bank","*Need stronger accountability on meeting deliverables
*Better focus on the projects w/ the bigger bang for the buck","Sr team to improve on collaboration, need to ask the tough Qs to move the company forward.",5.0,,,,,
2018-12-09,,,Current Employee ,Work balance,,0,Fitbit cares their employees a lot and provides flexible work schedule for their employees,Meeting might be too much.,,4.0,,,,,
2018-12-18,,,Current Employee ,Company with so much potential,,0,"Great mission and ability to work on projects that can really improve the world. Smart, passionate, and dedicated colleagues.",Ability to execute on strategy. Weak and uninspiring leadership.,,3.0,4.0,3.0,3.0,4.0,2.0
2018-12-03, Senior Test Engineer,"San Francisco, CA",Former Employee ,Lacks leadership,More than a year,0,"Cool technology, work from home, good work/life balance",Leadership is weak. Lack of marketing direction.,Company needs a visionary leader that has a set of stones.,3.0,5.0,3.0,4.0,3.0,1.0
2018-11-27,,,Current Employee ,Welp,,0,"WFH-Work from home
FTA-Flex Time Away",Everything else is below the standard,,3.0,2.0,2.0,2.0,2.0,2.0
2018-12-16,,,Former Employee ,Stay Away. Sinking Ship.,More than 3 years,0,"- Flexible work from home.
- 'Unlimited' time off
- Free snacks
- Good people","- Company doesn't have a solid direction to go in and is falling behind the rest of the market.
- Decision making is very slow.
- Zero opportunity for career growth. The company is in such a constant state of crisis that there is no time for career growth.
- No 401k matching.
- Underpaid compared to the rest of the market. You'll be lucky to get a decent bonus (if you get one at all) or a promotion.
- Poor, argumentative leadership.. Top level leadership is often unable to be realistic about the state of the company and is unwilling to take responsibility for failures.
- Overworked and over stressed. Working overtime is often expected for no extra compensation.
- Losing employees at an alarming rate with a lack of effort to replace them.
- Company is in constant crunch time. More work is falling on the shoulders of less people.

Look elsewhere. I promise you there are better options. This company cannot last much longer the way it is being run.","Focus on your employees. Don't work them to death. Compensate fairly, show appreciation, and give them the resources they need to get their work done. Be realistic and upfront with them.",1.0,2.0,2.0,1.0,1.0,1.0
2018-11-10,,,Former Employee ,Overall positive experience but concerns about company future,,0,Solid work life balance at Fitbit,"Poor executive leadership, unclear about company direction",,3.0,,,,,
2018-11-05, Engineer,"San Francisco, CA",Former Employee ,Like A New Company,More than 3 years,0,"1. Lots of flexibility in working environment
2. Talent colleagues","1, Slow in making decision
2. Not good at manufacture",,3.0,4.0,3.0,3.0,4.0,2.0
2018-11-15, Firmware Engineer,"San Diego, CA",Former Employee ,Hopeless company,More than a year,0,"Cool people, smart engineers. You work for a recognizable brand. Good work/life balance","The company doesn't know what it wants to be. There is no innovation whatsoever on the devices. Years of development time are spent to produce a tiny improvement.
The decision process is flawed: too many cooks in the kitchen, lack of general direction and endless back and forth. Often, projects end up in a dead end and get cancelled for the wrong reason (inability of engineering teams to agree on a path and commit to it).
Eric & James live in La La Land.",Get rid of the founders and hire a seasoned CEO.,1.0,4.0,2.0,2.0,3.0,1.0
2018-10-30,,,Current Employee ,Great place,,0,Fast pace and lots of things to do,cancelled projects and roadmap need work,,3.0,3.0,3.0,3.0,3.0,2.0
2018-10-16, Finance,"San Francisco, CA",Current Employee ,Senior management trainwreck,More than a year,0,There are some good folks doing their best and at least that takes the edge off a little bit,"Senior management can't seem to execute on a vague and overly broad vision. Very little innovation, Apple is crushing us. No corporate values, no accountability, under-performers get job offers to purely leverage promos and retention at Fitbit because we're desperate to stop the attrition. No 401k.","Listen to the workforce who is clearly full of disengaged people who have heard the same promises over and over with no action or accountability. Drain the swamp... of VPs, SVPs, EVPs",1.0,2.0,1.0,1.0,2.0,1.0
2018-09-06, Infrastructure Engineer,"San Francisco, CA",Current Employee ,"Good people, improving culture",Less than a year,0,"Flexible working environment, global teams, caring people, can be who you want to be",Some idiotic IT policies that hinder productivity and happiness,Continue discussions about culture and involving everyone.,4.0,5.0,4.0,4.0,4.0,3.0
2018-09-10, Senior Software Engineer,"San Francisco, CA",Current Employee ,"Good technology, bad management",More than a year,0,"free snacks and beverages
onsite shared gym
fitness and yoga classes
fascinating technology to work with
convenient downtown location","no 401k match

Penny wise, pound foolish management:

o They have moved numerous employees across the street twice in twelve
months. After a couple of months in the new location they abandoned
one entire floor to sublease it, causing more disruption.

o Loss of autonomy as management forces angineers to use a round peg in square hole approach in their attempts to make everything uniform.

The company uses a facade of self-empowerment in the evaluation
process. Managers write ""goals"" for employees and have them
copy-paste the text into the Workday system as their own input.

Top level management is often uncertain on the best way to implement
their plans, and this makes them prone to using charlatans and petty
tyrants in low-level management positions.","Try to achieve real transparency in communications with employees. The
current all-hands meetings are mostly dog and pony shows designed by
sales to create a PR splash.",3.0,3.0,4.0,2.0,3.0,2.0
2018-08-14,,,Former Employee ,Excellent place to work,More than 3 years,0,"The best aspect of working at Fitbit (at least for a Firmware engineer) is the people. They have a great team of smart and friendly people. In four years there I never encountered any problems of internal politics or anything else that is unpleasant.
The company is very flexible as far as working from home whenever you need. They vacation policy is FTA, and the benefits package is excellent. Work/Life balance is also excellent - the company is really encouraging it.",During the four years I worked at Fitbit it was growing at a very fast rate (the number of firmware engineer increased about x10). This caused sometimes communication failures - not hearing about things that you should know - but it was not too bad.,,5.0,5.0,5.0,5.0,5.0,5.0
2018-09-03,,,Former Employee ,Used to be amazing; now it's just okay,Less than a year,0,"-Lots of autonomy.
-Many people on engineering are kind and smart. (There are outliers though)
-Great location if you live in SF.
-Flexible work from home policy.","-High attrition on the engineering team. Rigor is lacking. Makes it hard to accomplish quality design work.
-No proactive support for talent resources, just ad-hoc reactions. You will have to advocate for yourself (E.g., some people had no managers for several months)
-Missing cohesion everywhere. Poor communication between business and engineering results in a large understanding gap.","Decision making politics slows down innovation, distracting already scarce engineering resources. Advocate for your employees, don't hinder them.",3.0,5.0,3.0,4.0,3.0,1.0
2018-07-26,,"San Francisco, CA",Current Employee ,Not the time to join,More than 3 years,0,"I love Fitbit. Our products are a great mid-level option for nearly everyone who wants to understand their health data and is not an elite athlete.
We have many amazing employees to work with who care about the customer and the product.
The company used to have a great culture and there were many opportunities to do new things in interesting ways. Some of the employees still can do innovative and interesting work, but it's now completely restrained to the research group and the new Boston team.
Pay and benefits are good and time-off is excellent. There is no 401k match but there is a 401k.
Work-life balance can be good when departments are staffed.
The culture retains a health and fitness focus that benefits everyone.","The current management team under the founders are poor leaders. From HR to Operations the leaders are out of alignment with one another, running their own fiefdoms. Leaders generally treat their employees and first and second level managers like pawns or cogs - irrelevant and unimportant. VP's, however, can do no wrong even when their departments are losing people in large numbers. Behavior is bizarrely hierarchical. You have to get VP approval to buy a pencil. You will not have much autonomy at Fitbit anymore. You won't even be able to work from home in many departments. You will not do innovative work. You will be asked to do things in outmoded ways often. You will also have much of your interesting work given to vendors or off-shored, bit-by-bit. You will still have lots of uninteresting work because your peers will continue to leave in droves (attrition is higher here than anywhere I have ever worked). You will be micromanaged in many departments. Your VP will take credit for all of your work (which is their right) and they will not share that credit or acknowledge you even in private (which is not their right). And the worst part is that you will keep hoping that things change and go back to the culture Fitbit had before January of 2017 and you will suffer for your loyalty.","My first word of advice is not to write a condescending reply to this review. It makes you look petty and proves my review correct. I would also advise that the founders look closely at the reality of what it's like to work at Fitbit - not at the VP level and not through the words of the HR department - but at the level where the work gets done. And, when you see that it isn't good, change it. Fire a senior VP every once in a while. Hold people responsible for attrition. Be open and honest about the plan to move jobs to Romania - tell us what work will go and what will stay in the US. If you want someone to stay, tell them and then don't turn around and lay them off. Produce a strategy you can articulate clearly and in less than 30 minutes. The new Boston team is great, protect them from the negativity of corporate. Do one thing every day that shows you value your employees (not your VPs) and then tell people what it was. It will work way better than doing one thing every day that shows you don't value us and then denying that it was done.",2.0,3.0,2.0,1.0,4.0,1.0
2018-08-26,,,Former Employee ,Senior firmware engineer,,0,"Talented engineers, good culture, cool location","Bad business decisions , change plans and directions frequently.",Make better business decisions,3.0,4.0,5.0,4.0,2.0,3.0
2018-08-06,,,Current Employee ,QA firmware,,0,"Great work life balance, great perks",office location in San Diego,Invest and expand your RnD,5.0,4.0,5.0,3.0,5.0,5.0
2018-07-27,,,Current Employee ,I LOVE Fitbit! Great team and Great products!,,0,"Amazing mission to make the world healthier
Best work/life balance I’ve every had
Able to work from home
Unlimited vacation time (still need approval)
Smart people
Supportive manager
Great environment
Employee discounts (50% off 10 devices per year)
Lots of company and wellness events (onsite yoga, holiday party, picnic, product launch celebrations, speakers and race sponsorships)
Pretty standard/decent benefits (medical, dental, commuter benefits, etc.)
Pay/bonus/equity seem decent based on my experience - just need to get the stock price up
Unlimited free snacks/drinks","No 401K match (need to fix this) but they do have a 401K and offer free financial advisors (new)
Attrition is high so there is a lot of churn
Inconsistent managers (some are great, some aren’t)
Long term vision is unclear. Direction is shifting and it is very unsettling. CEO needs to give more clarity on future direction.","I have a great manager and a great team. Not everyone has the same experience as me though. I suggest that there be more manager training to have better consistency. Some technical people maybe shouldn’t be managers. Keep focusing on improving engagement and communication (this has been getting better). Make sure you are hiring people who are
scrappy and can tolerate a lot of change as I have seen people get really upset and leave when they are moved to different projects. Execs need to give more confidence to us about where we are heading and reduce churn/movement of people around.",5.0,,,,,
2018-07-16,,,Current Employee ,Good team,,0,Good team to work with,upper management seems to be lacking direction,,4.0,,,,,
2018-08-14, Visual Designer,"San Francisco, CA",Former Employee ,Trying too hard to be Apple,More than a year,0,Decent location in city. Offices are ok.,"Leadership is a mess, we should have stuck with trackers and owned the market now we are trying to compete with apple when we will never win. Old components and no ownership of all technology limits us.","Refocus on devices, focus on health. Support your team and train them up.",2.0,3.0,2.0,2.0,3.0,1.0
2018-07-13,,,Current Employee ,Director,More than 3 years,0,"Great culture on the marketing team
Employees act like family and treat each other with respect
Good amount of autonomy to get the job done","There’s big company vision, but have been struggles around execution","Create more/better people managers
Pay top talent
Continue investing in culture",4.0,5.0,5.0,4.0,3.0,4.0
2018-07-11,,"San Francisco, CA",Current Employee ,"Great culture, Lots of smart people",More than a year,0,"A lot of smart people, I get to work on projects outside of my day to day job, lots of fun events, great work life balance","no free lunch, no 401k matching",,5.0,5.0,5.0,5.0,4.0,4.0
2018-06-29, Logistics Coordinator,"San Francisco, CA",Former Employee ,Limited,More than 3 years,0,Great staff and potential for growth,Poor leadership as company grows,"Communicate with the team, show that management cares about it employees and their development.",4.0,3.0,3.0,3.0,4.0,2.0
2018-07-20, Director G&A,"San Francisco, CA",Current Employee ,Tragic,More than a year,0,"Amazing product, people with their hearts in the right place, flexible work schedule/work from home, location, perks","employee benefits, incompetent management, low morale, high attrition, many inefficiencies, criteria for promotion = give notice of resignation","Listen to feedback from regrettable terminations and take action based on it. Implement 360 degree reviews to understand why confidence in management is so low. Promote based on merit not fear of loss. Make executive compensation performance based. Evaluate leadership and decisions made against company performance, not likability. On the plus side, fostering a culture of wellness, taking care of each other and being nice/respectful is great!",2.0,2.0,2.0,3.0,2.0,1.0
2018-07-04,,,Former Employee ,"Started off great, now downward spiral",More than a year,0,"Some really great people, great subject matter to work on if you’re interested in health and fitness, random fitness perks, nice work from home culture","Extremely negative attitudes, cutthroat environment at times, don’t move up unless the right person is your manager, heavy attrition, slow progress, been talking about the same initiatives for the last 2 years and probably longer. Confused leaders, lack of guidance.",Do SOMETHING to boost morale and inspire confidence in your employees. Take the resourcing problem seriously.,3.0,5.0,3.0,4.0,4.0,2.0
2018-08-08, Quality Engineer,"San Diego, CA",Former Employee ,Quality,More than a year,0,"Name recognition, must be a good place to work!","No value. Not valued by team mgnt, department mgnt, or executive management so how is an employee to feel valued?? LEAVE!",Figure out why the high turnover,1.0,2.0,1.0,1.0,2.0,1.0
2018-08-07,,"San Francisco, CA",Former Employee ,Awful place,Less than a year,0,"Some good folks here. Some people and teams seemed really great, doing amazing work. Some real workaholics too.
Great snacks, cereal, smoothies.","My manager and colleagues were terrible people to work with- toxic, hostile and duplicitous. Fitbit has a fair number of people who are either cast offs of a-list companies, or trying to get to an a-list co. Then the cast offs take it out on their charges.","Fitbit has a broken business model. So they do what companies with big egos and broken businesses do: they reward aggressive and unscrupulous behavior to “get’r done.”
Fitbit is not unique in this, its tech, it’s the Bay Area, baby!

My advice: tech is still comprised of human beings.",1.0,2.0,1.0,1.0,3.0,1.0
2018-06-09,,,Current Employee ,software engineer,,0,fun great w/l balance,growth of the company is questionalble,,4.0,,,,,
2018-06-29,,,Former Employee ,Engineer,,0,"- Good flexibility
- Good technology/tools","- Bad bad bad management
- Lack of accountability",,3.0,3.0,2.0,3.0,3.0,1.0
2018-07-26, Engineer,"San Francisco, CA",Current Employee ,Think twice before joining!,More than 3 years,0,"Amazing colleagues
Flex time
Work from home opportunities","Had a CFO that ran the stock to the ground, yet blamed Wall Street with no accountability from the board
Senior leadership that changes company strategy every quarter
High attrition with no signs of improvement
Engineers in the states laid off and replaced by cheap labor in Eastern Europe","It’s sad to see what has happened to this company over the past few years... it’s turned into a cut throat environment due to distrust and resentment towards senior leadership. Most of the employees that I speak to are actively interviewing for a new job, turning a blind eye to attrition does not instill faith in current employees",1.0,3.0,1.0,2.0,3.0,1.0
2018-07-14, Program Manager,"San Francisco, CA",Current Employee ,PMO allows co-worker yell at us,More than 8 years,0,I love the idea of helping people become more active,"Unfortunately the PMO had a problem with one of their workers who has a very short fuse and with out warning will yell, talk down, talk over to the women in the group. The issue has been raised by most of the women in the group and nothing has been done.",Please provide us a safe place to work.,1.0,1.0,1.0,1.0,1.0,1.0
2018-05-11,,,Current Employee ,Finance and G&A,,0,"- Great team and colleagues, very collaborate
- Smart people and interesting issues for a growing company
- Good work life balance and flexibility
- Great company mission and vision","- Company needs to continue to execute on its strategy and mission, but the potential is there and is achievable","Town hall meetings are good to keep employees informed, keep it up. Mission and strategy is focused, now it's just about execution",5.0,,,,,
2018-05-14,,"Boston, MA",Current Employee ,Climbing back to glory,More than a year,0,"Great missions.
Not much players left in the field.",Super low stock price compared to 2 years ago.,,5.0,4.0,5.0,4.0,4.0,4.0
2018-05-07, Senior Program Manager,"San Francisco, CA",Current Employee ,It was the best of times...,,0,Great growth experience. Some excellent leaders within the company. The company is maturing.,Turnover makes organizational efficiency an uphill battle.,,4.0,5.0,3.0,3.0,5.0,4.0
2018-05-19,,"San Francisco, CA",Current Employee ,"Once great, now troubled.",More than 3 years,0,"* A truly inspiring mission.
* Products that really help people.
* Lot's of opportunity to improve things.
* Some great people trying really hard to make things work.","* Poor leadership from the executive team.
* In-experienced/junior Directors.
* Difficulties executing.
* Poor strategic and tactical planning.","Hire some experienced directors.
Replace some of the executive team with new outsiders.
Invest better in your employees and culture.",2.0,1.0,3.0,3.0,2.0,1.0
2018-06-10,,,Former Employee ,"Mechanical engineering, just don't do it",,0,There were individual contributors that made the days easier. I was able to learn how to not do a lot of different things.,"This could be an exhausting list, so let me keep it simple.

The managers are weak. And the team suffers for it. Their bosses are even weaker. Indicision kills momentum on a daily basis. Everyone is afraid to make a decision. You're rewarded if you talk a good game, even if you've provided no tangible results.

The VP plays favorites, so... Hope you're one of the three people to have worked with him in the past. Otherwise don't waste your time.

It's not a fun work place, it's not a trendy environment, the perks are gone and the promise of a flexible start up like environment is a lie, so don't fall for it when recruiting shovels that on you.

Pay is also weak. And promotions are done apparently by throwing a dart at the wall","Leave. The company would be better for it. Really, hanging out and taking money will make you feel good now. But when you go to a real company and can't keep pace with your counterparts that actually worked their way to the top, you'll be worse off for it.",1.0,2.0,3.0,1.0,2.0,1.0
