date,employee_title,location,employee_status,review_title,years_at_company,helpful,pros,cons,advice_to_mgmt,rating_overall,rating_balance,rating_culture,rating_career,rating_comp,rating_mgmt
2018-06-06,,,Former Employee ,"Horrible leadership, company lacks direction, poor people managing",,0,"The idea of this device company is cool, but they don't executive. Potential for better utilization. Young work culture.","Management team has no clue how to run a business. They lack transparency both to their employees and to the investor community. They need an actual CEO that knows how to run a business, neither cofounders are good at business or investment community. They provide no onboarding to their employees and their people managers typically have never managed people and need severe training. This feels like the end of the company and is a crowded market with others doing way cooler things way faster.",Hire an actual CEO and have the cofounders put in different strategy positions. Provide actual onboarding for employees and set clear goals for individual performance.,1.0,1.0,1.0,1.0,3.0,1.0
2018-05-10, CS Lead ,"San Francisco, CA",Current Employee ,Creating monsters,More than 3 years,0,"- Okay pay
- Good benefits
- Good work life balance
- Great team","- Lack of career growth opportunities for internal candidates
- Other departments/teams are not reliable, could be due to horrible attrition rates
- Some employees have the same title/responsibilities on paper but in reality they have completely different responsibilities/productivity expectations and get paid the same, still hold same title
- The moral here is in the gutter. The people i lunch with are some of the only reasons im still here and I know this to be the case for many others.",Really need to identify and get rid of weak links and also need to identify and go to bat for key team members/consistent top performers who could be utilized elsewhere in the organization.,3.0,3.0,2.0,2.0,3.0,2.0
2018-04-27, Manager,"San Francisco, CA",Former Employee ,Reap What You Sow,More than 3 years,0,- Innovative company (at least it was),"- Failure to invest/groom individual contributors
- Lack of vision
- Bloated management corps","Your people were your greatest asset, not your technology. If you understood this all the people who sacrificed and were responsible for the company's early success would not have all left.",2.0,3.0,3.0,1.0,2.0,1.0
2018-04-27, Senior Software Engineer,"San Francisco, CA",Former Employee ,All the negativity is true,More than a year,0,"The people you directly work with are the only ones keeping you sane at this place. And even then, they're already dead inside. Um, what else... there's cheese in the fridge? I'm grasping for straws here.","You know how sometimes you read reviews and skim by the 1 stars because usually they're the result of an unusual situation or an employee that's upset because he/she got terminated? Well, this is neither of the above, so don't skim over this one.

Short version: if you are considering accepting an offer here -- don't. For your sake, accept the fact you got some decent interview experience here and use it to get an offer somewhere else.

Long version: Let me elaborate on a few examples of ""fun"" things that happened during my tenure at Fitbit:

- For about a month and a half I didn't receive a paycheck because they switched payroll providers and I was marked as ""terminated"" in the system.
- I watched my initial RSU grant get cut into about 1/8th of what it was after only about year of employment. You read that right folks, a consistent monthly decline for 12 straight months. The year after was just as bad.
- I was re-org'd 3 times - each time more confusing than the last.
- Lunches were taken away.
- All supplemental perks were reduced in some capacity or another.
- We were promised a company gym, and 401k match. Neither of which happened, surprise surprise.

And that's just the tip of the iceberg - here are the REAL goodies that should be showstoppers for you:

- Round of layoffs, plus a paraphrased inspirational quote for you: ""we are saving lives here, if you want to get paid fair wages, go work somewhere else"".
- Deadlines were unreasonably tight -- a consistent theme that you get numb to over time.
- Bonuses were sad at best, with veiled threats of taking them away completely if you can't work at 150% capacity.
- Resources were insanely mismanaged. Decades of backlog estimates.
- Company vision changed roughly once every 3 weeks or so. ""X"" is the future. Wait 3 weeks. ""Y"" is the future. Wait 3 weeks. ""Z"" is the future. Want to know what this means? It means the execs are throwing darts on a dartboard and hoping something sticks.
- Attrition levels are maddeningly high. I don't know the exact figures, but don't expect to work with your teammates for long here. Culture and morale is in the toilet.
- Empty promises and hazy direction on all levels of management.
- HR/Payroll made boneheaded mistakes all the time. Corrected W2's, ESPP miscalculations, etc.

Ask yourself, do you really want to work in this kind of environment given how competitive the tech industry is right now?",There is nothing I can say that will fix the clown show that management has been putting on for years. Leadership continues to stagnate.,1.0,1.0,2.0,3.0,2.0,1.0
2018-03-13,,,Current Employee ,Technical Recruiter,,0,"Active, forward thinking, fast paced, great environment, work life balance","Competitive market, sometimes slow to react to the market, stock price",Keep working hard and turn this ship around. Focus on innovation and digital health solutions,5.0,5.0,5.0,5.0,5.0,5.0
2018-03-21, Tier III Agent,"San Francisco, CA",Current Employee ,Was fun at first but morale has been downhill since,More than a year,0,"Employee discount is 50% off
Medical/dental/vision benefits
FSA + Commuter benefits
Ability to work from home
Test upcoming products and features","No opportunity for growth within customer support department
People not held to same standards
Management disorganized
Morale very low almost like no one wants to be there
No communication between the different teams within customer support",Hold people to the same standards and hold people accountable,2.0,3.0,2.0,1.0,3.0,2.0
2018-03-02,,"San Francisco, CA",Current Employee ,"Company Struggles, Still Enjoy Working Here",More than 3 years,0,"Respectable work-life balance for most. At times you can be extremely busy meeting deadlines but it's pretty good for the most part.

Coworkers are very pleasant to be around. There are always exceptions to the rules though. Extremely humble for how talented some people are.

No shortage of snacks and coffee in the building.

Treadmill desks and some minor gym equipment on various floors.

On-site yoga, mindfulness, and workout classes.

If you're ambitious and talented you can step in and make your own role a reality.","Lots of talented folks have left for better opportunities. Some people only want to work at the most successful companies or have an opportunity to get in early on

There are a ton of complainers. I think they are mostly spoiled by having a lot of opportunities for work in the Bay Area. It can be tough to block the constant downpour of complaints and whining.

Company is struggling.

Still not a very clear description as to how an employee can level-up and grow within the company. The career ladder is listed with job titles, but there is absolutely no description as to what tasks an individual needs to do in order to get to the next level.","Make the career ladder more clear. It's been years and some organizations within the company only now have a defined career ladder. However, only the job titles are listed. There isn't a clearly defined description of this individuals role. There also isn't any opportunity to learn new things. There is no system in place that actively tries to get team members (engineers in my case) to learn from someone above them.

I've been here 3-4 years and never received constructive feedback. Please fix that.",4.0,5.0,5.0,2.0,3.0,3.0
2018-03-02,,,Current Employee ,Growing Pains,More than a year,0,"- Company treats employees well
 - Great general attitude in offices
 - Effort from C-level management to stay transparent to employees
 - Comfortable workspaces","- Satellite offices feel somewhat second class; coordinating between multiple location is a hassle
 - People and projects have been forgotten and not allocated proper resources as the company has grown",,4.0,5.0,5.0,4.0,5.0,4.0
2018-03-14,,,Current Employee ,PM,More than a year,0,- Great place to get your career started,"- Too chaotic
- Cross-team communication is terrible
- Always rushing everything
- Pay is not competitive especially for the Bay Area",,3.0,4.0,3.0,2.0,2.0,2.0
2018-03-11,,"San Francisco, CA",Current Employee ,Supply Chain Manager,More than 3 years,0,"Great mission, pretty cool products, good people","New senior management has created a ""everyone-for-himself"" culture.
Company is in transition with its roadmap.
Product intros are typically brutal on work-life balance.",Take care of the people you have. Be more generous with RSU's.,3.0,3.0,3.0,3.0,3.0,3.0
2018-03-09, Content Production Manager,"San Francisco, CA",Former Employee ,"Rigid culture, poor execution of an admirable vision",More than a year,0,A lot of smart people to learn from and work with.,"Office politics get in the way of doing the best work.
Culture is not attuned to the modern workforce and setting employees up for success and productivity.",Learn to be more flexible against process/bureaucratic barriers in order to actually succeed in fulfilling the mission the company sets out to do.,2.0,3.0,2.0,3.0,3.0,1.0
2018-01-21,,,Former Employee ,Unfortunate State of Affairs,,0,"A really great mission underlies this company - ""Making the world a healthier place"". Who couldn't get aligned with that mission? In past, there has been a great external brand, image and connection to the world. Made you proud to be part of it.","This is an HBR text book case of the impact of Leadership. The company had everything going for it, and has really floundered due to inexperienced and a really out-dated approach to building a company, executing on a vision and cultivating employee engagement, connection and loyalty. The two founders are simply inexperienced and take far too long to catch on to what matters and often just don't. The CFO has a classic 1970s/80s mindset. Anything employee related is an expense that can be cut without a second thought and then wonders why there is 40% turnover. So many talented people gave it their all and then gave up. The replacements are mediocre of course, because the brand has lost it's appeal. What A players are going to leave great roles to join Fitbit now? Really sad actually. Could have been such a great story.","Start over with your philosophy. You've really lost the plot. Employees simply can't come last. The turnover you are experiencing is unfortunately so well deserved, and could have so easily been avoided. You kind of need great talent to execute on a strategy, but that seems to be a difficult concept for the Exec team to grasp.",2.0,,,,,
2018-03-04,,,Former Employee ,Growing Pains,,0,"Energetic and focused people, lack of corporate cynicism among employees at first.","Rapid expansion without proper management strategy and support. Always fires to put out, not enough long term vision.",Get back to being markey proactive instead of reactive,3.0,2.0,3.0,3.0,4.0,3.0
2018-02-12, Senior Research Scientist,"San Francisco, CA",Current Employee ,Some great things. And some drawbacks.,More than a year,0,"Great work/life balance, amazing co-workers",Lack of direction as a company (and constant pivots) causes lack of motivation in employees.,,3.0,5.0,3.0,3.0,5.0,3.0
2018-01-06, Manager,"San Francisco, CA",Current Employee ,Commodity Manager,More than 3 years,0,Great Team work environment and flexible working hours,Top management in operation never learn the lessons from the past,,4.0,4.0,4.0,4.0,4.0,3.0
2017-10-13,,"San Francisco, CA",Current Employee ,"RUN, do not walk, to the NEAREST EXIT.",More than a year,0,"- Offices in downtown SF. No south bay commute is nice.
- Cool to work on hardware products.
- Raw passion and compassion for colleagues at the lowest levels of the hierarchy.","Buckle up, buttercup.

- Lack of vision from top leadership on whether we want to be a health company or a consumer electronics company. This creates a fragmented and broken product portfolio. Latest smartwatch release is a prime example. It pales in comparison to almost any other smartwatch on the market, and though it is equipped some more advanced sensors, they are not functional on the product because the software work required wasn't completed.

- Numerous layers of completely inept middle management are given way too much power. The largest piece of this problem is the product management org, which needs to be completely gutted. The new trimester planning process is a turf war, consisting of weeks to months of bitter fighting to get features on the roadmap. We end up committing to doing too much, since NO ONE seems to do any resource planning to figure out whether we actually have the staff to build what the PM org and execs put on the roadmap. The actual dev and design teams who will be tasked with the work have little voice in this process and only find out the results at the end. Compounding all of these problems, the planning cycle takes so long and happens three times per year which means we're almost always in a planning cycle and continuously shifting around our priorities.

- Teams across the product development side of the house (sw and fw engineering, QA, design) are all understaffed. This leads to dismal team morale, constant tension between ICs in these teams, and very high attrition rates even by Silicon Valley standards. Some employees are so overworked that they come in even when sick because they have too much on their plates to take time off.

- Due to overcommitting and lack of resources, the scope and feature set of products we release are usually severely cut from the original plan for the product, to the point that the original vision for the product is barely recognizable in what is actually released.

- Major lack of diversity especially in management teams. Mostly white men. The company has no visible programs to foster diversity in hiring. There are some special interest programs once already inside, but they don't seem very active. Fitbit's answer to our diversity problem is ""we don't have one.""

- C-level leadership is not present and feels disconnected from the rank and file. Bi-weekly all hands meetings feel more like a mandatory address from a dictator than an open dialogue. I have worked at companies much larger than Fitbit, with *thousands* more employees on their HQ campuses, and still felt the executive leadership was more open and connected to staff. The CEO and CTO really should take a pause from whatever they do on a daily basis and take time to meet with a listen to all of the teams building out their products.

-- As a sub-item to this, there is a lack of transparent communication from the top down at Fitbit. Exec leaders yack all the time about how they are working to improve this, but little has changed. Prime example: earlier this summer, there were apparently some kind of violent threats made against our San Francisco HQ. The company sent out cryptic emails telling all of us to work from home and not come into the office, but leaving us otherwise in the dark. This came from HR, not even the C-level execs. This went on for several days, with nightly emails saying to ""keep working from home tomorrow."" After a week, they claimed they worked with law enforcement to confirm it was safe for us to return to the offices, but never shared exactly what the threats were or what steps were taken to keep all of us safe in the future. The entire situation was completely mishandled. Reminds me of our layoffs in Jan '17, but I'm sure there are enough Glassdoor reviews on those so I'll skip over that subject.

- There is no formal performance review process at Fitbit. There is only a self service check in web app that is fairly useless. Some departments have come up with their own performance review processes which are biased and opaque. Apparently I have had several performance reviews in my time at the company but no one has ever shared any of the results with me. When I surfaced this complaint to HR, they asked, ""have you ever had a conversation that seemed like it _could have been_ a performance review?"" *jaw drops*.

Given this lack of clear evaluation, promotions seem unfair and opaque, and many ICs and even team leads do way more than their job description but still don't get promoted. This increases our attrition problem. Some who have left have told me they were offered (long overdue) promotions on their way out, which just feels pathetic.

- Our entire marketing organization has a very poor understanding of our product portfolio and relies heavily on people in the product development side of the house to do their jobs for them. They have dozens of project managers, coordinators, and other oversight roles but not enough executors which means they outsource or try to force others to fill in on the execution.

- Archaic tools and lack of proper productivity technology and processes result in an insane amount of unruly emails, lost decisions, and lack of clarity across functions of the product development org. It is baffling to me how little this company invests in basic project management and team planning software. Our Jira structure is a giant mess with a huge part of the prod dev org sharing one single Jira project with tens of thousands of tickets (not at all how Jira is supposed to work). Different teams also use Jira in different ways which makes it even less effective. Our Wiki is a joke with thousands of unorganized, duplicate, and abandoned pages. This is such an easy problem to solve compared to all the others this company faces. Will someone WAKE UP and smell the roses already?!

- Lack of office perks including no food, poor snack choices which never change (and unhealthy ones at that).","- Stop trying to crank out hardware products without any regard for whether they have compelling market value or not. Spend more time thinking about and explaining your vision for the company to all of us, if there is one.

- Staff up teams in the prod dev org so that you have enough resources to build out your product roadmap, or cut down the roadmap. You are going to burn out your entire staff or literally drive us into the grave.

- Have lower level staff submit goals for middle tier management and work out a system for said management to be accountable to reaching those goals or at least attempting to solve problems in their org.

- Do a listening tour with all of the teams involved in the prod-dev process.

- Give us better collaboration and communication tools, and a few more heads to do knowledge management.

- Implement a better and more transparent performance review process, with safeguards to make sure staff are promoted appropriately when doing the responsibilities of higher roles, to prevent them from leaving to level up.",2.0,1.0,2.0,2.0,3.0,1.0
2018-01-04, Program Manager,"San Francisco, CA",Current Employee ,"Although I've enjoyed working here, so much about the company could/needs to be improved!",More than a year,0,"-Great, intelligent people
-Fun culture/environment (fun perks like weekly happy hours, Workout Wednesdays)
-Universal mission that everyone is passionate about -- lots of products and new opportunities to be excited about",Fitbit has grown very quickly and wasn't able to keep up in some aspects - organizational communication leaves a lot to be desired for and lots of processes/programs that should be put in place for such a large company are either underdeveloped or don't exist at all. This leads to a lot of unnecessary work/time/effort spent on things that could be better put to use. Some senior/exec management is also unaligned and disconnected.,,3.0,4.0,4.0,3.0,3.0,2.0
2017-12-20,,"San Francisco, CA",Current Employee ,A Change Would Do Them Good,,0,"Great aspirations, good intentions, some awesome folks who are a pleasure to work with.","Feels like the customers and products come first, with employee well-being trailing far behind.",It only takes one bad apple in management to ruin something good. When you see high turnover in one section of a department you might want to talk to the little guys on that team.,2.0,1.0,2.0,1.0,2.0,2.0
2017-12-06, Product,,Former Employee ,Great potential but shaky vision,,0,"Smart people, great brand, innovations reach a lot of people","Narrow vision, start and stop product roadmap, lots of employee turnover",If you're really a health & wellness company and not just a hardware company you have to invest there,3.0,4.0,2.0,2.0,3.0,2.0
2017-12-05,,"South San Francisco, CA",Former Employee ,go somewhere else if you have choices,More than 3 years,0,Free trackers and ok compensation.,"horrible middle management forces good people to leave.
managers who don't know what they are doing only cares about budget and headcount so that they can be promoted. Half-million- dollar analytical instrument was bought without proper evaluation and justification. Lying to upper management to get more budget and headcount, while people in the group have no work to do and instruments are idling. Senior people in the group bully on new comer and forced him to leave in 2 weeks. Quite unique experience!",too disappointed to say anything.....,1.0,2.0,3.0,1.0,2.0,1.0
2017-12-06, Customer Support Specialist,"San Francisco, CA",Former Employee ,Customer Support,Less than a year,0,Great sense of purpose helping people work towards fitness goals.,The supervisors treat you like children regardless of your performance.,"Treat people like adults, not children.",1.0,1.0,1.0,1.0,1.0,1.0
2017-10-18,,"San Francisco, CA",Current Employee ,Not a good place to go to,Less than a year,0,"Snacks, Great work/life balance, ""unlimited"" ptos, downtown SF","No career path. No leadership. No goals.
The company is going down. For example, It's real hard to release new products without a lot of issues - Firmware, hardware quality is really down. Everything is a mess and nothing is documented. There are not desire to optimize the work of people and there is waste everywhere. Leadership team is only focus on the hardware product side of things not on the support side (IT, Finance, CS...) or the services around the product (group health). Nothing is done to make you feel valued.
No 401k contribution","Value people who are doing good work and promote them. Clarify goals at every levels of the company.
For the CEO and CTO stop being engineers and start managing people... That means giving guidance and making decisions for the company as a whole not only for the people working on the product. Have and promote leadership values.
We are not a startup anymore!",2.0,5.0,2.0,1.0,3.0,1.0
2017-09-22,,,Current Employee ,Making the right changes,More than 3 years,0,Humbling year is starting to show signs of turnaround. Mood is becoming better as we gain confidence in our strategy. Great work/life balance.,Management is generally cheap and slow. Generally better at vision than execution. Could be better at defining career tracks.,"If you want people to stay, help them grow in their career rather than bringing in outside management",4.0,5.0,5.0,2.0,4.0,3.0
2017-09-22, Engineer,"San Francisco, CA",Current Employee ,Lots of employees but only a few matter,More than 3 years,0,No micromanaging. Flex time. Good pay. Nice location.,"Where to start. There are over 1000 employees but due to improper execution of SCRUM only a relative few are in the know and doing all the necessary work. These few are then spread thin while the rest are left in the dark wanting to help but are left only to waste time in their own vacuum. Most employees that care but are left out will spend most of their day sifting through wikis and internal chat rooms trying to gather and piece together info in order to stay relevent. Many will even create work for themselves that didnt need to be created in order to keep busy, while others will just text on their phone or watch wrestling on their laptops. Bad habits have formed, culture breakdown. Upper management is too busy to notice what 90% of their employees are doing whilst putting pressure on those 10% to keep the company making money. Many of the 90% are actively looking for work and even interviewing whilst on the clock! Meeting rooms have thin walls. It is typical to overhear someone in the next room in the middle of a phone interview with some recruiter poaching Fitbit employees. Lots of talented employees here not tapped, many are fed up and leaving everyday. Positions of those whom left are unfilled because they did not matter to the leadership in the first place. Every week they have going away parties. This company doesnt know what they need from most of their employees yet they keep them on payroll until they leave, wasting people's time and careers and putting imbalanced load on a few.","Take a step back and envision the company you want to build. Treat your company like a team, what you have now is a few superstars on the court and the rest are sitting on the bench. That isn't teamwork, and that is 100% leadership's responsibility for not getting the rest of the team to practice and on the court during games.",2.0,4.0,1.0,1.0,4.0,1.0
