date,employee_title,location,employee_status,review_title,years_at_company,helpful,pros,cons,advice_to_mgmt,rating_overall,rating_balance,rating_culture,rating_career,rating_comp,rating_mgmt
2015-11-18, Senior Firmware Engineer,"San Diego, CA",Current Employee ,"Rapid growth, dynamic environment",Less than a year,0,This company is young and still treats it's employees well. The founders are very involved. New hires are given exceptional responsibility right away with the current rapid growth. I am excited to be here.,"No matching 401(k). Minimal resources available to new hires to understand the organization of the company, and of product development.","Invest more in orientation/onboarding. A second day specific to job duties (engineering vs research vs marketing, etc) would be a big help. Just the act of putting together the syllabus and materials might expose some holes.",4.0,4.0,5.0,3.0,4.0,4.0
2015-11-30,,,Current Employee ,Quick and active company who want to get a lot of great things accomplished.,,0,"Lots of energy in and around the office.
They are hiring and filling much needed positions.
Healthy snacks and lunches",The dust hasn't settled with all the new hires and there isn't a clear org chart which makes it difficult for new hires to know who is who.,Have and communicate the top 10 goals for each quarter. This would help in keeping the company stay on point.,4.0,3.0,4.0,4.0,4.0,4.0
2015-11-24, California,"San Francisco, CA",Current Employee ,Love working here.,,0,"Flexible working scheduled, friendly employees, amazing company.",Needs a bit more organization.,,4.0,,,,,
2015-08-28,,"San Francisco, CA",Current Employee ,Tech company that lacks arrogance!!!!,More than a year,0,"- lacks arrogance
- tons of passion for the mission of the company and its products
- easy to move around the company (great place for new grads or career changing)
- interesting projects/products with hard problems to solve
- flexible work hours
- Fun people to work with even though it's growing faster than we can handle at this point, some how we have continued to hire great people.
- The ability to reach out to James or Eric, they are such humble executives.","- HR Benefits are bad! (If you are a man with a pregnant wife, I'd suggest a google or facebook)
- No annual reviews (which is ok, I guess) But that means no bonuses or any sort of promotions.
- legacy employees in management positions that they should not be in
- The office is a mess! Limited space","I think the executive team is doing great! Awesome job on the IPO and continue doing what you are doing. HR needs some help. The new 10% bonus plan is kind of a joke for the bay area, especially since taxes will take half. Most of our competitors offer at least a 20% bonus. Salaries need to be reviewed and so do our managers, they need to held accountable.",4.0,5.0,5.0,5.0,3.0,5.0
2015-10-04, California,"San Diego, CA",Current Employee ,Firmware Engineer,Less than a year,0,"CEO and CTO are still very much connected to engineering. It's not uncommon to have James or Eric sitting in and contributing to an engineering discussion. It's clear from all my interactions with them that they care about the health of the organization, not just the bottom line.

Fitbit has a great product and the leadership knows that they must continue to improve in order to stay on top of the market. The investment in engineering is impressive.

Fitbit brings San Francisco engineering culture to San Diego and that's refreshing.

Engineering managers all remain very technical and they continue to contribute to projects.

The engineering team is extremely supportive, trusting and demanding all at the same time.

Very flexible work hours to accommodate a healthy work/life balance. Afternoon walks/runs/workouts are extremely common.

Fitbit is setup for remote workers. Working from home can sometimes be even more productive than working in the office.

Modern workplace perks like 6 catered lunches a month, snacks, drinks, happy hour Fridays

For now, they still pay for traditional (low-deductible) medical benefit plans

Generous Employee Stock Purchase and Bonus Program","Fast growth is stretching the management team thin.

Very ambitious schedules for future products are on the edge of demoralizing for the more seasoned Fitbiters. It will take time for the hiring boom to kick in and allow us to crank out new devices quicker and quicker.","Create a policy for allowing failed candidates to try again.

Get outside help with the teleconferencing equipment.

401K matching would be nice",5.0,4.0,4.0,4.0,5.0,4.0
2015-10-05, Software Engineer,"San Francisco, CA",Current Employee ,"Pros are great, Cons are painful",More than a year,0,"-Work/Life balance is great
-Lots of exercise if you want (team walks, yoga, martial arts etc)
-Very fun environment
-Some departments are great and make day to day enjoyable
-Executives are approachable and down to earth.","-Hiring process through the Recruiters is painful if you aren't ""talent."" Better off going through a job agency like Aerotek.
-Very little checks and balances between different departments that affect each other. Changes that one department makes internally will negatively affect another department, causing a waste of time
-Documentation is poor and unorganized. To get caught up, generally have to hunt people down and have them verbally explain things to you. Slowly getting better
-Deadlines are unrealistic
-You aren't here for the pay","-Better Benefits
-Deadlines shouldn't be driven by outside departments that don't understand how long a task would take or how difficult
-Better follow up with candidates that don't get a position",3.0,5.0,4.0,4.0,3.0,3.0
2015-10-02,,,Current Employee ,Copywriter,,0,"Flexible, nice people, good products",The energy can be a bit boring,,4.0,5.0,3.0,4.0,4.0,4.0
2015-10-01, Hardware Design Engineer,"San Francisco, CA",Current Employee ,"So far so good, really excited about this job!",Less than a year,0,"Fitbit is a great place to work: coworkers are great, salary is very good and benefits and perks are exhaustive. The thing I love the most is how they try to schedule activities so that employees can get to know each other a little bit better.","I haven't really found any downside so far, but it's also true that I've been working here for a very short time so eventually I'll come back in the future to update this review if I notice that something is not working well.",Managers are really doing their best to eliminate road blocks and I think they are doing a great job about that.,5.0,5.0,5.0,4.0,5.0,5.0
2015-09-12, Research Scientist,"San Francisco, CA",Current Employee ,Research Scientist-Fitbit,Less than a year,0,"Great team environment
Great perks
Great resources
Upbeat atmosphere
Great mission
Some flexibility in choosing research projects","Growing very fast, some bureaucracy",,4.0,4.0,4.0,4.0,5.0,4.0
2015-09-15,,,Current Employee ,Lack of structure and micro-management,Less than a year,0,"Decent pay
Good perks
Some autonomy, but not where it matters
Fun
Good energy","Layers of middle management that can be out of touch with daily priorities and life on the front line.

Lack of trust in the experts Fitbit hires, leading to micro-management that then leads to waste and inefficiency.

Lack of planning and structure, and somewhat dismal distribution of responsibility. Instead of really evaluating what each team member's strengths are, and working to cater and distribute work to those strengths, work is assigned in a somewhat haphazard, fire-fighting style. Manager claims to be open to feedback, but that is not the reality. For a young company, there seems to be a lot of waste, and that is possibly only exacerbated by the lack of processes and somewhat unbridled hiring and growth.","Trust your employees and experts to do their jobs.
Don't micro-manage at every step of a process.
Develop a plan of attack when it comes to projects that caters to the project as a whole and each team member's strengths.",2.0,4.0,4.0,3.0,4.0,2.0
2015-08-14, Engineering Manager,"San Francisco, CA",Current Employee ,Executive level focus amidst day-to-day ambiguity and change,More than a year,0,"James and Eric have excellent vision and focus- I don't see myself working on projects that get canceled partway through development.
Great people in most organizations.
Strong desire to develop high quality products that can make an impact on people's lives.
Good opportunities to make an impact on the company, if you are pro-active.
Open purse strings to support product development.","You have to prove yourself to get a promotion.
Problematic groups (too boys club, not adequately staffed, etc) and more disturbing, no push to make them better. People say ""oh yea, that group would be terrible to work in"", but nothing is done about it!
Hesitation to define any policy has resulted in us losing a lot of original Fitbit culture.
No strong HR organization until very recently- so no training, coaching, education. But it's coming.
Desks are terrible- engineers need large desks with shelving/storage.","Invest in your managers because they want to become better at their jobs.
Provide an opportunity for each group in the company to share, on a regular basis, what they do and what they are working on. HW doesn't know what SW is working on. SW doesn't know what HW is working on.",4.0,5.0,4.0,4.0,3.0,5.0
2015-08-17,,"San Francisco, CA",Current Employee ,The best professional experience in my career,,0,"Fitbit makes culture a high priority so I think there are several things that stand out to me:
-This is the friendliest office I’ve ever worked in. Everyone smiles and says hello. Everyone will stop what they are doing to ask you how your weekend was (and actually listen).
All of the VPs and Execs sit with the other employees. No one is removed or has their own office or a “better space"". You wouldn’t even know someone was a VP until you look at their calendar.
-There is a lot of lateral and upward mobility. Fitbit really invests in all of its employees. It’s the type of place where you’re hired for you and all of your skills and personality. If a role opens that is a better fit for you, Fitbit wants you to be able to move around. If you’re not fitting with the role you currently have, it’s the type of place where managers will work with you to see where else you can focus to do your best work.
-There is an awesome work / life balance. People work really hard and they are excited about what they do, but no one gives you a hard time if you tell them you’re leaving at 4pm one day because you really want to spend time with your friend from out of town, or when you tell them you need an extra day because it’s been a long week and you need some time to relax. Everyone is excited to hear about what people are doing outside of work and understands that investing in that is important.
-Everyone loves the product – it’s really cool to be in a place where people actually use product that we are all working on every day. When the latest software or hardware or even color comes out, the office is buzzing with people who get the first edition to test out! it’s really exciting.","If you aren't a proactive person, it's possible to slip between the cracks here. There is so much developing and going on at once, and that comes with a lot of opportunity. The most successful employees can capitalize on that opportunity without waiting for it to be given to them. Everyone here is juggling so many things that there isn't a lot of support for someone who can't forge their own way once in a while.",Keep it up!,5.0,5.0,5.0,5.0,5.0,5.0
2015-08-28, Customer Service,"San Francisco, CA",Current Employee ,customer s,,0,great atmosphere friendly people great food,you work your butt off,,4.0,3.0,4.0,4.0,3.0,4.0
2015-08-26, Research Software Engineer,"San Francisco, CA",Current Employee ,Research Software Engineer,Less than a year,0,"The research team has an incredible culture--people here are very fun and goofy and very very intelligent. There is essentially no hierarchy here, and everyone has the opportunity to be heard equally and to contribute. I feel very comfortable with asking anyone at all on the team for help, including the director of R&D. I'm also very supported in my efforts to learn/expand into new areas of expertise. Benefits are incredible.","There is very flat hierarchy on the research team--perhaps too flat. I feel that I personally could use a little more guidance/oversight, an issue that would be helped by hiring more manager positions for the research team.",Continue protecting the research team culture; continue hiring really smart but nice people; maybe hire someone to be a more direct boss to me :),5.0,5.0,5.0,5.0,5.0,5.0
2015-08-11, Mechanical Engineer,"San Francisco, CA",Current Employee ,Great place to work for a young Mechanical Engineer,,0,Easy to see your impact on the products you are making. Lots or resources and tools at your disposal. The only limit to your resources is your own time. Great place to grow in skills as an engineer.,"Company is growing so quickly that it always feels understaffed, even after doubling in employees every year. This is good for young engineers(<5 years experience) because the opportunity exists to really shine and prove yourself and learn a lot.","The company needs to have more unified culture and values across departments. It is obvious that while some departments are awesome, others are not so great.",5.0,4.0,5.0,5.0,4.0,4.0
2015-08-17,,,Current Employee ,"Happy, Fun & Exciting Work Environment",,0,"Inclusion, opportunity, friendliness, self-growth, challenging",Sometimes can have long hours.,,5.0,4.0,5.0,5.0,5.0,5.0
2015-08-09, Research Scientist,"San Francisco, CA",Current Employee ,Excellent opportunities for growth in a positive environment,Less than a year,0,"Really talented group of people on research team - great expertise in diverse areas
Very collaborative culture - low-ego, just try and get the job done
Good work-life balance; work hard during the day, but not expected to work excess hours outside that - definitely trying to live to a vision of helping people live healthier lives.
Lots of opportunity to contribute new ideas and thinking - the company is very open to new influences and ideas.","No real cons to mention.
Like all SFO jobs, commute can be a hassle if BART or Caltrain have delays, it can mess up your day.","Keep the collaborative ""sleeves rolled up"" work attitude - the founders have created a great culture of low-key, but highly effective, work practices.",5.0,5.0,5.0,5.0,5.0,5.0
2015-07-31,,,Current Employee ,Best place to work!,,0,"Working here doesn't feel like work at all, great culture, great people!","None... honestly, none. You'll love it here",,5.0,5.0,5.0,5.0,5.0,5.0
2015-08-13,,,Current Employee ,Company Review,,0,"Great company culture, snacks, still has start-up feeling despite IPO","Things are constantly changing, which could be a con. I think its a good thing though.",,5.0,5.0,5.0,4.0,4.0,5.0
2015-08-12, CAD Drafter,"San Francisco, CA",Current Employee ,CAD Drafter,,0,"Very quick process (2-3 weeks from initial screening call to finishing my on-site)
Helpful and patient people
Friendly
Informative
Overall a wonderful experience and great recruitment/interview process!!",No cons I can think of,,5.0,5.0,5.0,5.0,5.0,5.0
2015-08-16,,"Gilroy, CA",Current Employee ,HR and Org Development Needed,More than a year,0,"Great product, smart people, passionate employees.","No accountability of poor leadership within Operations. Lack of resources and time to hire is inexcusable. Culture and back stabbing within Ops team, too much finger pointing. Compensation is way to low for the amount of hours employees are expected to work.",HR invest in development of Operations Leadership. Feedback has been given and swept under the carpet. We have already had a few excellent employees leave due to lack of support & poor leadership. Address the situation or prepare for a mass exodus once folks can cash in vested stock options.,2.0,1.0,2.0,1.0,1.0,1.0
2015-07-22,,"San Francisco, CA",Current Employee ,"Fast and fun company, needs to grow up in some areas",Less than a year,0,"Things happen fast, and growth is astounding. This results in an environment where an individual can have a lot of impact, but they need to be able to deal with uncertainties and sometimes chaos.
Most people seem to be working hard and are productive, and are fun to be around. I've not really met any jerks yet.
Decent work-life balance as in folks leave the office mostly on time to get home (could use more relaxed PTO policies though).","There's severe lack in ""people processes"" - I haven't yet found out if there's any kind of performance review process or how feedback gets back to employees.

The office's desk areas are very cramped, incredibly noisy, and clutter everywhere (the meeting rooms/lobby/break areas are nice though), worse than any other SF office I've seen. No personal space at all. I hope that gets better with the new office.","- Get people processes into place
- Improve the work areas",4.0,4.0,3.0,3.0,3.0,4.0
2015-08-21,,,Current Employee ,*Experience may vary,More than a year,0,"Overall the people are very nice. If you are an engineer you are the top of the heap and get to enjoy a lot of the perks offered. The company seems to be trying hard to maintain its culture, even as it continues to grow as quick as it does.",Long hours and minimal support from leadership. Very few are willing to stand up and own decisions. No one repeatedly wants to be the bad guy but some support and back up for those that have to make tough calls would go far. There are a lot of layers to go through. The previous reviews are interesting; the high level of praise for the company on all ends is not something seen often in daily fb life and the fact they are coming in grouped together is interesting. Perhaps it's very subjective to the organization you report into.,Make the Fitbit experience balanced across the board. Leadership should communicate to the employees more. It is limited to once a month all hands meetings.,1.0,1.0,1.0,1.0,2.0,2.0
2015-07-09, Hardware Design Engineer,"San Francisco, CA",Current Employee ,Love it here.,More than a year,0,"Transparent Leadership
Challenging fast-paced work
Talented and driven co-workers
No big egos, people are nice, even when things don't go as planned
Work/life balance - everyone works really HARD, so we can all go home on time.
Fun/not-cheesy company and team outings.

In my 15 years as a hardware engineer, this is hands-down the absolute best job I've ever had.","Company is growing really fast, so meeting load load is increasing as more management layers are added.

Culture is in flux as we add more people. This is not necessarily a bad thing, but just want to avoid the corporate culture pitfalls of larger companies.

Work moves fast here, things can get a bit chaotic. I personally like that type of environment.","As we grow, work to keep fitbit leadership transparent and open to change. Continue to listen to your employees and engage with them personally.",5.0,5.0,5.0,5.0,4.0,5.0
2015-07-09,,,Current Employee ,Product Programing Manager,Less than a year,0,Fitbit is a great place to work. People work hard and leadership pushes us to do our best. Working on really exciting products with smart coworkers. People are in general collaborative and fun to be around.,"Fitbit is in the process of growing very rapidly. Meaning that we don't have enough conference rooms and it's a bit crowded. Other than that, it's a great place to work",Let's focus in on great products and continue to work together to launch them. Let's dream even bigger to bring future products that really live up to our mission statement of helping people live healthier lives.,5.0,4.0,5.0,5.0,4.0,5.0
2015-05-24,,,Former Employee ,Could have been great if not for two unprofessional middle managers,More than a year,0,"In addition to the free catered lunch on Fridays, this is a great place to grow your career. I learned new things and met great people. Employees can learn not only how certain things are to be done but also why, which is the most important. Furthermore, the top executives are great people to work with as they are knowledgeable, professional, and not arrogant.","As much as I respect the top executives, I wish they deal with problem middle managers rather than doing nothing about it.

I reported to two unprofessional middle managers who took credit for other people's work, played the blame game, cursed loudly at meetings, badmouthed people behind their backs, complained all day, and were more concerned about office politics than with getting work done. Furthermore, not only were they arrogant, but they were also incompetent. Numerous complaints were lodged to HR and to top executives against these two middle managers by several people they interacted with, but nothing was done.

Therefore, if you report to an unprofessional middle manager, start looking elsewhere because nothing will be done to correct the situation.","Listen to your employees and take action if there is a known problem with a middle manager. Kicking the can down the road will only make the problem worse.

It's a shame. The top executives wanted me to stay. My colleagues wanted me to stay. I wanted to stay. But I couldn't stomach those two unprofessional middle managers any longer.",2.0,2.0,2.0,3.0,3.0,4.0
2015-07-02, Chief Executive Officer,"New York, NY",Current Employee ,Great!,,0,All round awesome. Everything you could ever need or ask for in a company is readily available here amigos!,"Nothing I can think of. The only fault this company has is no fault at all. Just sit down, do your job and earn your top of the line pay.","Keep it up. Everything y'all be doing is great and all the workers, myself included appreciate everything.",5.0,5.0,5.0,5.0,5.0,5.0
2015-07-09,,,Current Employee ,Hardware,,0,"Great products, great position in the market, smart people, usually good teamwork, results oriented","Need more employee development support, could be more diverse, benefits could be better","Need better alignment between senior and executive management, better benefits, increased diversity, support for employee development",3.0,3.0,3.0,2.0,2.0,2.0
2015-06-23, CRM Manager,"San Francisco, CA",Former Employee ,CRM Manager,More than a year,0,"Great company, great product, high energy",no Clear technology direction for entire company,clear plan on enterprise wide technology,4.0,3.0,4.0,2.0,4.0,3.0
2015-06-03,,,Current Employee ,"“Excellent, fast paced company with passionate and friendly environment ”",,0,Passionate and friendly environment for all employees,Very Fast Paced and dynamic environment,Continue to focus on the culture,5.0,4.0,5.0,5.0,4.0,5.0
2015-05-17,,"Boston, MA",Current Employee ,Good culture,,0,Good culture and atmosphere at lively Boston office. Growing company with lots of opportunity.,Many fast changes in a growing company.,Keep listening,5.0,3.0,5.0,4.0,3.0,5.0
2015-05-20,,"San Francisco, CA",Former Employee ,"If Your Boss is a JERK, Oh WELL",,0,"Free food, fun folks, nice offices, some nice peeps.","There is rampant favoritism and if your boss does't like you, too damn bad. They boarder on abusive and that's just the way it is.

If you and your boss get along well, great! If not start looking because they will make your life miserable.

Too many snotty, entitled millennials. Grow up kids!

Oh, they have sold bulk orders to Monsanto. Help them get healthier while they kill us, great!","Please listen to the staff when you do polls that are anonymous. There is some very interesting information there, for those brave enough to write the truth.",2.0,3.0,2.0,1.0,4.0,1.0
2015-05-24,,,Current Employee ,painful,,0,exciting energetic company with good diversity,huge growth recently which effects culture and leads to more roles and responsibility confusion. unbaked processes and lots and lots of politics. sad for a company that is relatively small (or used to be). lots of politics.,"organize, and listen to people, not just the people who don't stop talking.",2.0,2.0,2.0,2.0,3.0,1.0
2015-04-21,,,Former Employee ,"Great Company, Great People",,0,"Great work environment, awesome people to work with, tons of opportunity to branch out.","Heavy workload with long hours, processes were not yet developed and were hard to improve upon due to resistance from certain players.","Remember this company was built on the hard work of great people, so continue to give them incentives to stay and continue to grow with the company past IPO, once you get there.",4.0,4.0,4.0,4.0,5.0,4.0
2015-04-15, Director,"San Francisco, CA",Current Employee ,"Great culture, huge opportunity",Less than a year,0,"Hypergrowth company, leader in an extremely hot space. Employees are engaged and passionate. People are very friendly. Company has done an amazing job of executing, leading to very high market share (over 60%). High growth means lots of opportunities to grow, learn and participate in all kinds of neat projects.","High growth companies aren't for everyone. Things are always changing (that's the nature of young, fast-growing companies). Fast pace of hiring could make it challenging to retain the culture.","Continue to execute, don't let the culture dissipate as the company grows.",5.0,4.0,5.0,5.0,4.0,5.0
