date,employee_title,location,employee_status,review_title,years_at_company,helpful,pros,cons,advice_to_mgmt,rating_overall,rating_balance,rating_culture,rating_career,rating_comp,rating_mgmt
2015-12-09,,"San Mateo, CA",Current Employee ,Indie Feel with Corporate Backing,Indie Feel with Corporate Backing,0,"We have a small, agile team that is backed by the power of a large company. This means that we have the freedom to make a game we're excited about, without having to worry about our paychecks coming in. Everyone is passionate and experienced, and management cares about your career goals and how they can help you reach them.","Office is still fairly new, so we don't have some of the amenities of our own HQ or other nearby companies. The company as a whole is slightly behind industry standards on perks and tech solutions. Some members of management say they want everyone's input, but can be stubborn about not trying new things that the company has not already proven out.",Keep paying attention to your staff. Passionate workers who believe in their product will be much more likely to put up with any company-wide cons.,4.0,4.0,3.0,4.0,3.0,4.0
2016-01-06,,"Bellevue, WA",Former Employee ,"Review on Glu Mobile Bellevue, WA. Not a well led studio, not an innovative studio, not one that will grow your career.","Review on Glu Mobile Bellevue, WA. Not a well led studio, not an innovative studio, not one that will grow your career.",0,"Free parking.
Work/Life Balance is fair.
Occasional free lunches.","First and foremost if it were possible to rate the studio at zero stars I would have done so but I guess one star will have to suffice since that is the minimum. Perhaps they deserve the singular star for offering free parking in a busy upcoming city!

How does one start a review without sounding bitter about working at this studio? That's the challenge because this was without a doubt THE WORST experience I have had in the business of working in video game design and production. Perhaps it's easier to just bullet point these negatives -

* The design department only ever finalizes a clear direction when they're at the finish line then expect everyone else to bend to their wavering, indecisive, safe and ill conceived whims. What's worse is that Production/Upper Management allows them to do so.
* Studio management is a 'boys club', you are either a member of it and can expect career advancement or you are VERY much not a member. If you are not you can expect to never be asked what you would like to do with your career nor see your base salary increase.
* Company CEO seems oblivious to the ineptitude of the GluW studio management, they fail (repeatedly) and point the blame at others and they carry on regardless while those under them lose their jobs because of THEIR failures.
* Unable to identify exactly why Deer Hunter 2014 was a runaway success they played it safe and created the same game in Deer Hunter 2016 with barely a fresh coat of paint, it failed miserably. With this failure the studio has now been reduced to a single game studio, down from it's previous production highs and positive atmosphere.
*Management laid-off two entire teams (30+ people) just a week before Christmas 2015, just a miserable, thoughtless and uncaring thing to do.
*Individual Directors (especially in Creative, Art) are disengaged and play favorites. They do not engage with the individual (unless they are a personal friend), openly lie about the studios future and the individuals role in upcoming projects. Carrots are dangled but they are quickly pulled away or in reality simply do not exist.
*Pay is well below the industry standard, the stock options offered are basically worthless given the continued stock price fall. No 401k matching, now non existent bonuses (bonus plan was pulled back to a once a year payout, now the employees have been told not to expect a bonus at all come February 2016).
*Expect to see your work/job turned over to an employee from the India studio who will complete your tasks for a 6th of the cost! A fact that was openly shared just before entire teams lost their jobs!
*There is no longer a well spring of creative direction at the studio, no solid choices based on wisdom, knowledge, inspiration and experience. Now just a light tread across safe waters based on data from uninspired data/number spinners which has ultimately led them to a creative and money making dead end.
* Work on bland games based on old technology, raise awareness that this could be a problem, be ignored, see the games fail - rinse and repeat!","Stop playing favorites.
Spend some time actually thinking about your employees as human beings.
Recognize that you are part of the problem and find different jobs in roles you can actually fulfill.",1.0,3.0,1.0,1.0,2.0,1.0
2015-12-22, Lead,"Issaquah, WA",Former Employee ,Don't work here.,Don't work here.,0,I guess they have some nice snacks you can enjoy while you labor away.,"Management is a joke. They are an inside group of people that will scratch each other's backs while continuously making poor decisions on projects. When failures arise management is never blamed and lower level employees will be faulted. Management also loves to follow the last big thing in mobile games, they don't know how to be creative or allow those with creative knowledge express it in products.
Glu the company has no vision now so little actually that they are allowing their own studios to cannibalize on other studios IP's resulting in poor products from copying studio and the original studio.
Don't trust a company that lays off 30 employees just a week before Christmas then has the audacity to to publish an article on pocketgame on how to work for them.","Information needs to be shared across the studio and not just the people you like, A lot of information isn't disseminated correctly and is simply lost. Employees will often find out about changes to their work hours maybe days before hand. This is why 10 people quit in less than 2 months all from the same team.",1.0,2.0,1.0,2.0,1.0,1.0
2015-10-27,,"San Mateo, CA",Current Employee ,Glu Shock rocks!,Glu Shock rocks!,0,"I’m part of the Glu Shock team in San Mateo. Great group of top talent working on an awesome project under terrific leadership. Small nimble team/studio backed with the stability of Glu. Great easygoing yet focused vibe - everyone is an expert at what they do and takes care of business.

There are some good project management/process systems in place that make production move along nicely without being too process heavy (for an agile-based production). The studio space in San Mateo has a lot of room and a relaxed atmosphere.

Glu corporate supports us but doesn’t get in the way, lets the devs be the devs. The CEO Niccolo conveys a feeling of trust in us which is appreciated, and (on a side note) I enjoy his wit and hearing him speak at the all hands meetings. It feels like a good amount of information is conveyed from the top down.","The snack situation is still working out the kinks, but they’re working on it. No Silicon Valley perks such as massages or yoga classes, but work/life balance gives you the chance to do those on your own time.","HR seems large and process heavy, yet some typical HR work falls to managers. Recruiters seem to come and go – they are your public facing evangelists so you should keep them around. Would be nice to see a larger variety of types of games to round out the portfolio.",5.0,5.0,4.0,4.0,4.0,5.0
2015-10-08,,"San Mateo, CA",Current Employee ,Feels Stable - Lots of Potential,Feels Stable - Lots of Potential,0,"- Company has an extensive history in mobile entertainment. - Product strategy drives toward completing and shipping projects. - Company structure allows teams creative autonomy (within reason). - Top-tier talent working here, great opportunities to learn and improve your craft.","- Some of the old-school corp structure outside the individual dev studio groups can bog down the process of ""getting-things-done"" that require centralized services (finance, HR, IT etc) - Benefits package could stand to be a bit more competitive with other companies in the marketplace.","If you want top tier talent, raise the bar a bit on compensation packages. Take a hard look at existing process and procedures for centralized services. There are new, more efficient ways of doing these things.",5.0,4.0,4.0,5.0,3.0,3.0
2015-10-29, Software Engineer,"San Francisco, CA",Former Employee ,Good Opportunity,Good Opportunity,0,"The company is very focused on its high performing products, so being part of a winning team lets you open up the creativity floodgates and reimagine every part of the process with an eye to maximizing retention and revenue. Pay is decent, and the HQ is in a great location.","While stability has increased under the guidance of the current CEO, the company is still living earnings-report to earnings-report so job stability can be a bit iffy. Since the focus is mainly on high performers, you may end up on a project that doesn't necessary interest you. They rely heavily on licensed products, which are fickle.",Keep communication open and promote an environment of transparency. Don't become EA.,3.0,3.0,3.0,4.0,4.0,3.0
2015-10-09, Senior Producer,"San Francisco, CA",Former Employee ,Glu Mobile,Glu Mobile,0,"Good office culture, had a great time interacting with new clients",Management tried to control the project and make rash decisions,,3.0,3.0,4.0,3.0,3.0,1.0
2015-09-01,,"San Mateo, CA",Current Employee ,"Great people, lots of potential","Great people, lots of potential",0,"-Talented, intelligent and creative people who are a pleasure to work with
-High level of empowerment and responsibility for development teams/studios
-Quality products with fun gameplay and high production values
-Company has followed a unique path and has a lot of potential
-Professional yet fun and rewarding studio culture","-Important to stay agile, but company shifts strategies a bit too quickly/often
-Benefits package could be better",Game development and publishing involves many challenges and difficulties. Continue to trust in your top talent and give the studios and central teams the support they need to be successful.,5.0,4.0,5.0,5.0,4.0,4.0
2015-05-17,,,Current Employee ,Work environment greatly depends on the studio,Work environment greatly depends on the studio,0,"Very smart people, great environment, nice perks, awesome place to work if you like playing and talking about games. Super creative atmosphere, people actually look forward to come to work on Mondays!","Salaries are often below market rate, bonuses are dependent on studio's performance. While great for super star studios, the ones in the middle and on the bottom often see no bonuses at all.

Upward mobility is also very limited, no clear career path.","Pay your top people accordingly, they are being poached right now, and will eventually leave when compensation in other companies becomes too tempting.",5.0,4.0,5.0,3.0,3.0,5.0
2015-04-23,,"Long Beach, CA",Current Employee ,Great Company,Great Company,0,"I recently started with this company, and I'm very happy here. My coworkers are talented, engaged, and very friendly. The people in this studio go out of their way to be inclusive and welcoming.

Each studio has a different culture, but the company as a whole is dedicated to making successful games and not burning out their employees in the process.

Management is honest. If there's a problem, we hear about it. When things are going well, we also hear about it. I am confident that we will not be blind sided at every all-hands meeting.

Everyone has a voice. No matter what your job is, if you have an idea about how something can be done better, you will be heard.","Communication between studios could be better.

Sharing resources between studios could be better.

Approvals can be slow at times, when it needs to go to corporate.",Great job. No advice needed.,5.0,4.0,5.0,5.0,5.0,5.0
2015-02-12, Associate Product Manager,"San Francisco, CA",Current Employee ,Good company with opportunity,Good company with opportunity,0,Good company that is not shaken by the economy in terms of job security. I have been here through the good and bad and still had a job (considering I am a stellar employee). There are good chances of moving around within the company.,The reason for most co-workers have left for - below competitive pay. There are many similar companies in the area offering up to 40% larger salaries for the same positions.,Be competitive.,4.0,3.0,3.0,5.0,2.0,4.0
2015-02-09, Director,"San Francisco, CA",Current Employee ,Great momentum,Great momentum,0,There's great energy and momentum - nothing like having a few hits to put smiles on everyone's faces.,"There's always a lot of work to do - plenty of resources, but time is still limited.","More advanced planning, please.",5.0,5.0,5.0,5.0,5.0,5.0
2015-02-27,,"San Francisco, CA",Former Employee ,Not so good. Lacks creativity and opportunities to grow. Poor compensation as compared to other companies in the area.,Not so good. Lacks creativity and opportunities to grow. Poor compensation as compared to other companies in the area.,0,"Nice people to work with. Free snacks, drinks and caltrain pass.","Innovation is definitely not the name of the game when it comes to Glu. The company makes sequels of previous hits, hoping to make similar kind of money, instead of being aggressive and innovating.
Your work will not be appreciated unless you are ""buddies"" with management. A lot of time and energy is spent on enforcing trivial rules rather than helping employees to be more productive. You will face the wrath of the management in case you deviate from these ""rules"" and the aforementioned ""buddies"" won't.
Glu doesn't pay their employees well and is way below industry average which will probably make it harder to attract and retain top talent.",Try to innovate instead of rehashing the old stuff over and over again. Make sure you pay your employees well.,2.0,3.0,2.0,2.0,2.0,2.0
2015-02-13, Senior Engineer,"San Francisco, CA",Current Employee ,Very friendly and open culture,Very friendly and open culture,0,"I joined as a senior engineer in the team and worked at Glu for almost 2 years and was overall satisfied with the culture and openness of the top management who would reach out to employees and convey the goals for each quarter out on a timely basis. Good health benefits and other perks including lavish bonuses at times when the company is really doing well. Lots of free snacks, drinks and games to chew upon when you feel you want to take a break from work. Some people in certain departments would stay long and dedicated but most would honor their work-life balance. Merit-based promotions and raises. Overall a great learning environment for newbies and freshers.","Intolerance for mistakes. Even a slight one could make you walk out of doors. Grumpy bosses who think they are the only authority and would not hesitate to shout at people even in meetings. Too much unnecessary power assumed by management and lots of unwanted meetings would take place even to discuss trivial things which would be a complete waste of time. HR slow in responding and things can take a long time to materialize even if its important to you simply because it wasn't important to them, so less caring. Managers holding certain positions can make a big fuss out of ordinary questions or situations and would be reluctant to share knowledge because they think that could endanger their hold on power. Control is what they want to assume even if it appears unreal or unnecessary. And layoff rounds would occur once every six months.",Mid-tier management is something that needs a drastic makeover or training on how to manage their people better and provide some autonomy in jobs to those who are held responsible for the same. In other words autonomy and responsibilities are highly imbalanced and top management should take steps to align these across departments.,4.0,3.0,4.0,4.0,4.0,3.0
2015-01-31,,"Bellevue, WA",Current Employee ,Glu is a great company to work for!,Glu is a great company to work for!,0,"The culture is great--it's a really fun place to work but people are also professional, collaborative and helpful when it comes to making great games. Upper management frequently communicates what is going on and what to expect. Work/life balance is taken seriously.",Sometimes the corporate mandates get in the way of productivity and/or releasing on schedule.,,5.0,5.0,5.0,4.0,5.0,5.0
2015-02-03,,"San Francisco, CA",Current Employee ,Company getting better each week,Company getting better each week,0,"The caliber of talent has improved dramatically since I started. Weak performers are being replaced by motivated, energetic, and talented hard workers. Very flexible work environment. Corporate communication is improving.",There is an overall lack of infrastructure but it is improving. The company is hiring the right people who are focusing on implementing the right infrastructure to support the company long term. Growth planning is non-existent which causes resource problems downstream.,"Quit with the conservative planning. Decide on a corporate ""identity"" and go with it.",4.0,5.0,3.0,4.0,4.0,5.0
2015-01-22, Artist,"Bellevue, WA",Current Employee ,Wonderful game development studio with excellent work/life balance (Bellevue office),Wonderful game development studio with excellent work/life balance (Bellevue office),0,"Work/life balance: Employees are encouraged to have a life outside of the office.

Positive studio culture: In general, everyone here gets along very well, and we regularly have fun activities. We decorate team areas to suit our individual personalities.

Successful products: While we are not making Candy Crush numbers, we have a successful product that allows us to pursue fun and interesting projects without having to lay people off.

The studio takes care of its employees: Managers and directors do everything they can to take care of the employees. There is genuine concern about everyone's well-being.

Transparent communication: Where applicable and possible (I understand there are legal areas we can't touch), communication is totally open and transparent. I rarely feel ""in the dark"" when it comes to studio and project statuses.

Flexible working arrangements: It's very easy to work from home if needed. This is especially beneficial for people who live in Seattle and areas far outside of Bellevue.","Communication between departments is rocky and needs work. For all the efforts made to unify the teams, there is still an ""us and them"" approach to things.

Career paths are unclear. Many people are unsure of how they can progress in their jobs.

Managers are often overtasked and spread too thin. Some employees are expected to be both a manger and an individual contributor on their projects.

There is a constant push of doing things faster and cheaper while maintaining high quality standards. This often results in fast and cheap and lowering the quality of our work, because, in the end, it's all about the money.

Too much focus on hitting our bonus targets. Yes, bonuses are really nice to have, but constantly using that as an incentive and reminder to do better/more work makes me uncomfortable.","Get out into the general team areas and talk to the individuals on each team. Don't stay in a silo in the director's area. Don't just stick with your respective disciplines/specialties. Branch out and get that ""cross-func"" thing going that you talk so much bout.

Balance out salaries, especially for the employees who have been with the company/group for years. There are many people who have been promoted into positions with more responsibilities, but their pay doesn't match. People in lower-ranked positions can often be paid more.",4.0,5.0,4.0,4.0,3.0,4.0
2015-01-21,,"San Francisco, CA",Former Employee ,Work in progress,Work in progress,0,The people employees are some of the best,Not so much a gaming culture for a gaming company.,Consider more training for new employees,2.0,1.0,3.0,2.0,3.0,2.0
2015-01-19, Animator,"Kirkland, WA",Former Employee ,"Good people in the trenches, but studio heads are well..... different kinds of heads.","Good people in the trenches, but studio heads are well..... different kinds of heads.",0,Soft toilet paper. Free water.,You have to fit in with the Thursday beer thirty crew and take the bean bags on the chin if you want to excel or not get laid off.,Choke yourself. Stick to shooting deer if you want to keep your nose above water.,1.0,3.0,1.0,1.0,3.0,1.0
2014-12-23,,,Former Employee ,"Good people in the trenches, horrible executive team.","Good people in the trenches, horrible executive team.",0,"The local studio was filled with amazing people, great work environment, good opportunities for growth, great work/life balance.",All the pros were hobbled by poor executive management always trying to boost the stock price instead of focusing on people and products. It's no wonder the stock price has languished below $6 for so long.,"If you focus on your people and in making great games, the stock price will follow. Unfortunately you're stuck in a rut and the company desperately needs new leadership.",3.0,5.0,3.0,3.0,4.0,1.0
2014-11-13, Producer,"San Francisco, CA",Former Employee ,Just More of the Same,Just More of the Same,0,"Some smart, passionate people, high energy environment, and a real focus on getting product out instead of waiting forever to make up their minds. The internal awards system is genuinely motivating.","Copycat is the name of the game, no pun intended, and leadership doesn't respect the employees. People gradually lose investment but still have to work a lot as drones. Sales figures aren't the only way to grow a career but it is a way to overextend your company.","Take a market leadership role and not a market participant role. Use your success to create successes, not to mimic successes.",3.0,2.0,3.0,3.0,4.0,3.0
2014-09-16, QA Tester,"Bellevue, WA",Current Employee ,A fun place to work for!,A fun place to work for!,0,"The company cares for its employees well being. The management cares for each employees experience at work. The company practices private conversation with the managers to speak out any of your ideas, concerns, etc . Employees gets incentives for their hard work and having fun at work is encouraged. Employees knows when to separate professional matters and fun times. Rules are applied but the workplace is lenient which gives the employees a sense of freedom and in my opinion a good stress reliever.",There are too many meetings and usually causes unproductive wasted work hours. Communication between departments could be improved.,,5.0,5.0,5.0,5.0,4.0,4.0
2014-08-19,,"San Francisco, CA",Current Employee ,"Great, but always room for improvement.","Great, but always room for improvement.",0,Hard working people producing and maintaining quality games.,Don't ask questions - a lot of people aren't interested in taking the time to answering them. Everyone's time here is so valuable...that attitude makes it hard to be efficient.,"You have some amazing remote employees that work 24/7 in Customer Care, yet they work through a temp agency. Please consider hiring them as actual Glu employees.",4.0,4.0,2.0,3.0,1.0,2.0
2014-07-30,,,Current Employee ,Extremely satisfied with my position at Glu Bellevue,Extremely satisfied with my position at Glu Bellevue,0,"This is a great place to work. Creative, knowledgeable people focused on individual growth and overall financial success. Fantastic bonuses and benefits. Culture of teamwork, unity, and progress. Emphasis on positive freemium monetization techniques. Quality titles and platforms. Name recognition. Absence of damaging egos. Collaborative atmosphere.","I have nothing negative to say about this place, and look forward to getting to work everyday.",,5.0,5.0,5.0,5.0,5.0,5.0
2014-07-24, Producer,"Seattle, WA",Current Employee ,"Seattle Glu - Established company, startup feel","Seattle Glu - Established company, startup feel",0,"For a company that's been in operation for years, joining I felt the energy, excitement and opportunity of a start up company. Everyone here loves their jobs. Management sits with everyone else and have monthly studio updates telling us where we were, what we're doing and where we are going. They are willing to let people try new things, encourage growth and really encourage work/home life balance. Crunch times are VERY rare and even then that usually means only 2 hours extra in a day.",Company is in the process of re-discovering itself. There's a handful of old habits that still popup from before the change in management that people are trying to shake off. Lack of understanding of career growth for certain disciplines. Occasional curve balls from corporate can make like difficult.,Keep doing what your doing. This company is doing great and is only going to keep getting better.,5.0,5.0,5.0,5.0,5.0,5.0
