date,employee_title,location,employee_status,review_title,years_at_company,helpful,pros,cons,advice_to_mgmt,rating_overall,rating_balance,rating_culture,rating_career,rating_comp,rating_mgmt
2019-01-11, Senior Designer,"San Francisco, CA",Current Employee ,Very happy!,Very happy!,0,"- Great team: the team I work on is like a family in many respects - team members genuinely care about each other and look out for each other, and legitimately enjoy spending time together at the office and at team events
- Work/life balance: unlike some other places I've worked at, Glu does a good job of limiting overtime, getting people out of the office at a reasonable hour, and accommodating folks with families
- Generous benefits: from my own experience and from other coworkers I've spoken with, compensation is typically market-competitive to above-market, with a wide range of additional benefits like free lunches and snacks, 401(k) matching, and annual performance bonuses","- Office location: While the office space itself is nice, it's located in a neighborhood that can be a bit sketchy at times, particularly in the evening (not a huge con, but it's a factor to consider if you're taking mass transit)",,5.0,5.0,5.0,4.0,5.0,4.0
2019-04-14, Concept Artist,"Seattle, WA",Current Employee ,Run,Run,0,There were sometimes good snacks and some fun people to work with.,"Corporate greed runs deep. As an employee you will suffer the consequence of leadership actions and get laid off. Don't worry. When you are either shut down or laid off, leadership will say, ""we didn't get large bonuses this year."" Their words, not mine.",Focus on original content and not just a meat grinder or rehashing tired ideas.,2.0,3.0,1.0,1.0,2.0,1.0
2019-04-01, Senior UI/User Experience Designer,"Long Beach, CA",Former Employee ,"Poor Management, Failed Products, Unhappy Employees","Poor Management, Failed Products, Unhappy Employees",0,"Catered lunch, free snacks and drinks, company parties, decent corporate structure for benefits, PTO/vacation, etc.","Poor management that is disconnected from the development process and the consumer. It feels like a bunch of old men in a high tower deciding what they think mobile game users want (spoiler alert, they usually don't), deciding on unrealistic timeframes and expectations without consulting the devs and locking them into that deal by pitching it to shareholders so that there's nothing you can do but crunch to make it happen.","Hire someone who actually understands the market so you can make products that aren't automatically doomed to fail. You've had to shut down most of the studios (including mine) and projects you've had since I've been there due to poor business sense. Consult with developers before committing to a project and pitching it to shareholders. When you undercut development time to make a project seem more attractive, you're actually just dooming it to fail since the quality is going to be so lackluster and the employees are going to get burnt out.",3.0,3.0,3.0,2.0,3.0,1.0
2018-12-20,,"San Francisco, CA",Current Employee ,"Fun place to work, but lack of career opportunities","Fun place to work, but lack of career opportunities",0,"Catered lunch, cultural aspect has been improved tremendously over the past 2 years","Lack of upward mobility, compensation overall under market value",,3.0,4.0,3.0,3.0,2.0,3.0
2018-09-06,,"San Francisco, CA",Current Employee ,Glu is thriving,Glu is thriving,0,"Collaborative and fun work environment
Great co workers
Flexibility to work on cool projects",Pace can be a little bumpy but its always headed in the right direction,Keep up with the transparency,5.0,5.0,5.0,5.0,4.0,5.0
2018-09-05, Senior Software Engineer,"Burlingame, CA",Current Employee ,"Great team culture, brilliant co-workers, exciting work. Sky’s the limit","Great team culture, brilliant co-workers, exciting work. Sky’s the limit",0,"This company is flat out awesome. They provide you the tools you need to succeed in your job. I’m a Engineer and can equate the work here as challenging, fun, and motivating as any other tech company. It’s a great atmosphere to learn and apply that knowledge. This company values their employees and it shows.",Non hat I can think of yet,Keep up the great work,5.0,5.0,5.0,5.0,5.0,5.0
2018-08-06,,,Current Employee ,Glu is the greatest!,Glu is the greatest!,0,"Glu has come a long way from the experience of previous employees! I can definitely say it is an brand new Glu! I see great things ahead in the upcoming years! It is an open and collaborative environment with lots of opportunity for growth. Upper management cares very much about keeping a positive culture.

Some perks include:

-Lunch catered 5 days a week
-Great work/life balance
-fun work events once a week","Gaming culture is not for everyone. If you don't like being a part of a close knit team and collaborating with your coworkers, then it may not be a fit.",,5.0,5.0,5.0,5.0,5.0,5.0
2018-02-24,,"San Francisco, CA",Current Employee ,A Brand New Glu,A Brand New Glu,0,"New office, new CEO, new culture.. I read a lot of the older reviews and was initially concerned... but it appears the new management has learned from past mistakes and is keen on putting employees first. This means a beautiful new office, catered lunches (yum!) 4 days a week, lots of cool perks... It's an exciting time to be at Glu, and the feeling seems to be mutual across the office...","The previous model of acquiring studios would naturally have some issues, especially if the prior investors didn't take care of their employees during the transition. From what I've learned during my tenure, they're hoping to move away from that model and build studios internally in the new HQ... the partnership with Disney being an example. The company has been around for a while and surely has some baggage, but this recent shift seems like a fresh start... fingers crossed!","Keep up the good work, and please stay true to your pledged values and intentions. it will guarantee happy employees and a bright future for everyone!",5.0,5.0,5.0,5.0,4.0,5.0
2018-02-25,,,Former Employee ,Great Place with the Right Studio,Great Place with the Right Studio,0,The PlayFirst/GluPlay studio is the gem of the entire company.,Culture outside the PlayFirst/GluPlay studio was vastly different and more button-down.,Ensure Glu Mobile staff are readily available to assist the most successful studio under their umbrella at anytime for any needs.,4.0,4.0,4.0,4.0,4.0,3.0
2018-02-08, Lead UI/User Experience,"San Francisco, CA",Current Employee ,Keep at it!,Keep at it!,0,The current GLU leadership seems to legitimacy care about transparency and building a strong foundation based on trust and respect.,"GLU is a game company intent on making money more than making fun games. Though making money is understandable, even desirable - many goals place the bottom line over player satisfaction, game creativity.",Keep at it! Your open dialogue and transparency is vital for a healthy organization. We all want to make awesome products - let us do it and we will all win!,4.0,3.0,3.0,3.0,4.0,4.0
2018-01-21, Software Engineer,"San Francisco, CA",Current Employee ,A good place to work,A good place to work,0,"Glu has been as good as any other place to work. Environment is nice. Compensation is nice. People are friendly. My schedule is manageable. I thrive on success and as long as Glu and I are both succeeding, I am happy.","My big concern is that people making fundamental decisions are not creatives and want to make informed, data supported, games. But in an industry as fast paced as mobile, that doesn't make a lot of sense. By the time you've cloned Clash of Clans, it's too late. You have to have new ideas.

Glu also has the unique and dubious history of cloning it's OWN games, which makes zero sense to me. I remember they had two Tiny Tower clones back in the day.","1. Make new games quickly, but build teams slowly. In mobile, you can make a prototype with 3-4 people. A prototype team doesn't need to be bigger than that. In fact, more people with dilute the core vision. Eventually, if the game is fun, you can move it into full production.

2. Stop cloning games. Especially your own games. Diner Dash is not a genre.",4.0,5.0,5.0,3.0,5.0,3.0
2018-01-01,,,Former Employee ,Steer Clear,Steer Clear,0,They paid me a reasonable amount. Benefits weren’t great but not bad.,Worked on two teams. I took on a lot of work and was given glowing reviews when I had them on my first team. Mismanagement all the way up the chain made that game set up for failure and it was killed shortly after being released. This is a very common theme there. My next team wasn’t much better but now I had a few people on the team that didn’t want to help the new team members (myself included) to get up to speed on the (already largely made game) codebase. I remember the boss one crunch night commented on how our team was the best because “we make the funniest jokes and are the meanest”. After being on the team a while I was suddenly fired because “I didn’t care enough about the game”. I was given no warning or way to change my ways... even tho I was acting like most of the others on the team. The team already had really low moral since we had been crunching and the game was unstable. They claimed that I was committing lots of bad code but I had already talked to my boss about how I was being given half finished and buggy code to build off of and had one guy breaking my code (aka setup for failure). I was just the last person to work on the area and management was so poor they didn’t check anyone’s work before me (since it was the last part). I assume I was actually fired because they were short on money since my lead told me that I should stop asking why I got fired since it “is just business”. Coward. Liar.,Listen to your workers when they’re saying there’s problems instead of sticking your head in the sand.,1.0,2.0,2.0,1.0,4.0,1.0
2017-11-08,,"San Francisco, CA",Current Employee ,Don't believe angry former employees,Don't believe angry former employees,0,"I've been at Glu for 5+ years, I've seen the good, the bad, and the ugly. Is it my dream job? No. Is it a horrible company to work for (like the angry reviews here)? Absolutely not. Glu's had some tough times with a lot of layoffs and changes but more and more I feel the company is going in the right direction and you can feel the vibe in the office. It's a much better place than a year ago but we still have ways to go.",We need more rewarding. And please don't wait years to let go of B players.,Continue listening to employees,4.0,4.0,4.0,4.0,4.0,4.0
2017-11-17,,,Former Employee ,Awful,Awful,0,"Great creative team, talented people.","Awful higher up decisions that led to the closure of other Glu mobile studios, putting tons of great people out of work",There will never be another Kim Kardashian game phenomena,3.0,2.0,3.0,3.0,2.0,
2017-10-11,,"San Francisco, CA",Current Employee ,"Good company, some bad managers","Good company, some bad managers",0,"- the company is awesome, we are doing really cool stuff
- people are friendly
- good environment in general","I really don't trust my manager. My manager is that type who takes credits for other people's work. While everything else at Glu is great, my manager is the reason I keep my resume up to date",get rid of bad managers,4.0,4.0,4.0,3.0,3.0,4.0
2017-10-14, Senior Software Engineer,"Burlingame, CA",Former Employee ,Glu blows around with the wind,Glu blows around with the wind,0,"- They attempt to make their employees happy.
- Just about every office is a smaller company that Glu acquired at some point, so each office has an individual culture and structure.
- My office had free lunch every day, but most other offices don't.","- Lack of a real unifying vision, most past visions didn't make money and had to be abandoned.
- The culture and working experience is very different depending on which office you happen to be in.","Administration is too large, they spend too much of their time creating unnecessary policies around hiring, purchases, and going to conferences and implementing those policies.",4.0,4.0,2.0,4.0,5.0,4.0
2017-09-20,,"San Francisco, CA",Current Employee ,"Great, uplifting place to work","Great, uplifting place to work",0,"Management, co-workers and company culture.",I wished Company has matched 401k.,Keep doing what it is you guys are doing. It is working!,5.0,5.0,5.0,5.0,5.0,5.0
2017-09-14,,,Former Employee ,"Enjoyed my time here, good experience, no regrets","Enjoyed my time here, good experience, no regrets",0,"Interesting work, good people, lots of opportunities, nice SF location",Large layoffs and studio closures have been a fairly common occurrence at Glu throughout the company's history. Consistent and stable financial performance has always been a challenge,,4.0,4.0,3.0,4.0,4.0,3.0
2017-10-02,,,Former Employee ,Corporate control causing a loss in revenue and team drive,Corporate control causing a loss in revenue and team drive,0,"My team was great
Everyone worked well together
Room for growth and improvement
Preferred to hire from within the studio","Many studios have been shut down, mine included.
Very unstable based off revenue and studio profit.
Decisions from hire ups would cause loss of revenue/player retention and studios would be blamed.","Trust the people working for you, they know the product and players best.",2.0,2.0,3.0,3.0,4.0,1.0
2017-08-28,,,Current Employee ,Great People Making a Great Company,Great People Making a Great Company,0,"Exquisite team of people, no matter which department you're in. Positive vibes all around, helpful colleagues, motivated people that love what they do. Fair pay, great benefits, fun perks and a growing sense of community. CEO seems to be really determined and passionate about what he's doing.","Occasionally some mild rivalry between studios and headquarters creep up. Could be avoided, we're all in this together. Free lunch would be rad.","Keep listening to the employees as you have been. Transparency and communication is one of the greatest things about Glu. When we feel encouraged to speak our minds and receive attention and feedback for it, mutual trust only grows.",5.0,4.0,5.0,3.0,5.0,5.0
2017-08-23,,"San Francisco, CA",Current Employee ,Great so far!,Great so far!,0,"I have been with Glu for 6 months and it has been great so far. There are lots of great projects, learning opportunities, and people to work with. I look forward to the time ahead with the business's leadership and strategic growth.",There are slight inter-departmental communication roadblocks,Keep doing what you're doing to bridge the gaps and silos making the One Glu the best Glu,5.0,5.0,5.0,5.0,5.0,5.0
2017-09-10, Software Engineer,"San Francisco, CA",Current Employee ,Software Engineer,Software Engineer,0,Nice environment nice people to work with.,Team get lay off so often.,"If you want to success, do your best to keep the talents.",2.0,5.0,2.0,1.0,1.0,1.0
2017-07-26,,,Current Employee ,QA Tester,QA Tester,0,Great Culture and Great People that make you feel excited to work there.,Not the best at planning some projects.,,5.0,5.0,5.0,5.0,5.0,4.0
2017-08-04,,,Former Employee ,Company on the rebound!?!,Company on the rebound!?!,0,Employees are smart and passionate about their work. There are a number of game and central teams that are talent dense that lay it on the line day in and day out. HR function is much improved even if a bit bloated.,"Pendulum of control and C-Suite love has swung a bit too far toward game studios leaving central functions in eclipse.

Glu is generally quite lean, both a good and bad thing. Folks on less glamorous teams can get strung out fighting fires, legacy systems, and processes. Particularly accounting and IT.",Focus on games and supporting game teams is certainly the right direction. Doing that to the exclusion of having a REAL and meaningful investment in central platforms is shortsighted and will leave you with... a collection of game studios no greater than the sum of its parts.,4.0,4.0,4.0,3.0,3.0,
2017-09-21,,,Former Employee ,Stepping Stone Experience,Stepping Stone Experience,0,"-Serious emphasis on a fun, game-studio culture. Lots of food and activities
-Teams are resourced properly. There are enough people to get the job done
-Work/life balance. Never felt like I couldn't leave at the end of the day or take vacation time
-A lot of problems to solve. You will learn and grow according to how well you can deal with ambiguity, find solutions, and unblock yourself","-Poor business decisions. Acquisitions that don't make sense for the long-term...the misguided dedication to the unproven ""celeb game"" genre...spending a ton of money on numerous executives with questionable backgrounds
-Lack of branding focus. Weak PR and marketing departments
-Layoffs, layoffs, layoffs. The game industry is unpredictable, but it seems like the mass layoffs in 2015-2017 could have been avoided or mitigated with even a little bit of focus on the big picture","The entire ""C-Suite"" and VP-level leadership teams are shrewd but shady, shady, shady. Even when they think are providing transparency and visibility to the greater employee population, a lot of decisions are clearly motivated purely by how much more the execs will earn in bonus and stock awards. There were objectives based on closing down studios and reducing workforce that were part of the new CEO's first bonus package. Right away Nick Earl focused on redistributing assets, reducing operating costs, offshoring to India, and jacking up the stock price. That's great for his bank account, but hurts the employee population and the game industry as a whole. If that's what your mission is then that's fine, just don't pretend that Glu is a great place to work on innovative games and advance your career.",1.0,4.0,3.0,1.0,3.0,1.0
2017-07-10,,"San Francisco, CA",Current Employee ,Lots of potential,Lots of potential,0,"- Solid leadership and lots of talented and fun people to work with
- Strong product portfolio and a promising pipeline of new products
- Fun and collaborative environment
- Growth opportunities within the company","- Benefits could be improved (e.g., 401k matching, cared lunch)",,5.0,4.0,4.0,4.0,4.0,
2017-08-07,,"San Francisco, CA",Former Employee ,Appearances can be deceiving.,Appearances can be deceiving.,0,"Great office location (close to BART, in the heart of the financial district), good benefits, lots of perks, events/outings.","Disclaimer: Glu was/is a large organization and each studio is different -- my opinions reflect my time in a leadership role at the San Francisco HQ in 2014 (when Niccolo De Masi was CEO).

I can say, without any doubt, that joining Glu was the worst decision I ever made in my career.

Within a week of arriving, our president of studios was let go, and 2-3 months later, many central roles were also cut (with no head's up or attempt to shift people to other roles within the org) -- apparently, re-orgs were quite common at Glu (I don't know if that's still the case).

I also found Glu to be a highly political environment (departments within SF [but also studio vs. studio ] engaged in politics, jealousy, and backbiting) with non-existent leadership at the very top (De Masi was practically invisible; occasionally, he would make an appearance, usually at a monthly all-hands meeting). In person, he would come across as rude, arrogant, unfriendly. My interactions with studio heads themselves, however, were fairly positive.

Recruiting had a strong presence but there was no HR leadership in SF at the time, which made for quite an unwelcoming experience.",Don't repeat the mistakes of the past -- please take care of your people. Welcome them and treat them with the respect/dignity they deserve. I wish Nick Earl the very best in turning things around!,1.0,4.0,1.0,2.0,4.0,1.0
2017-06-21, Animator,"Bellevue, WA",Former Employee ,"Great People, bad upper management.","Great People, bad upper management.",0,"- Lot of amazing and talented people to work with.
- Projects can be fun to work on.
- Great location
- Fun social/holiday events every year.","- Extremely poor upper management. Don't be surprised if your studio gets closed down and your jobs sent overseas because of their poor business decisions.
- Pay could be much better. Negotiate hard for a good wage if you're considering working here, because you wont get a raise. Do not expect to ever get a bonus, unless you happen to be at their ""current"" top preforming studio or if you're in the upper management.
- Glu's current strategy seems to buy studios, collect their IP's, is said studio isn't profitable in a year, close studio and send the IP overseas to India or Russia. Rinse and repeat.","- Invest more into supporting the studios and talent you do have, so that they can be successful. Bleeding talent you work hard to attract is never a good for business.
- Become more innovative and stop fast following yourselves and other companies.",2.0,4.0,3.0,1.0,2.0,1.0
2017-06-23,,,Former Employee ,Not that good,Not that good,0,Good working environments and benefits.,"very bed decisions on the high-ups, many good title failure.",,3.0,5.0,4.0,4.0,4.0,2.0
2017-05-22,,,Current Employee ,Great place to work overall - room for improvement,Great place to work overall - room for improvement,0,"- Competitive pay (probably not as high as it would be at Google or Apple but solid compared to my peers at the same level)
- Solid rewards for excellent work (bonus and base) - If you do good work you will be rewarded
- Growth opportunities and autonomy
- Lots of leadership development programs (coaching programs and ongoing manager training)
- I love my team - smart, driven, real, fun, and supportive
- I find that people are open to feedback at all levels (huge plus IMO)
- New CEO who truly cares about people and growing a healthy, creative culture
- Overall an excellent place to work and grow - I am constantly presented with opportunities to work on interesting projects, challenging projects","- Gaming industry is fast paced (which I love) and ever changing so if you are not adaptable to change then you might not be happy here
- No free lunch
- No pets at work
- No 401k match
- Maternity and paternity leave benefits could be more competitive for the bay area","Keep focusing on leadership development and building a strong, competitive culture to attract awesome people. Glu has a lot of potential and I'm excited to be along for the ride.",4.0,5.0,3.0,5.0,3.0,4.0
