date,employee_title,location,employee_status,review_title,years_at_company,helpful,pros,cons,advice_to_mgmt,rating_overall,rating_balance,rating_culture,rating_career,rating_comp,rating_mgmt
2016-09-12,,,Former Employee ,Server and Bartender,Server and Bartender,0,"Product is fantastic and consistent, thanks to former EC Bill Jackson.","This is by far the worst company I have ever worked for. Bottom line is they are only concerned about THEIR bottom line. You as an employee will pay for EVERYTHING, from the pens that customers will steal, to uniforms through them only (I was suspended for buying the same tie I found cheaper elsewhere) to credit card fees for the credit cards that customers use. They break so many labor laws that it is ludicrous. They will tie up workman's comp for so long that you will never see it. You are not allowed to take any breaks, or have any food or drinks other than water or fountain soda. 14 hour shifts are the norm as they require you to work a minimum of 10 shifts per week, and they love to force you to work at their other restaurants to fill in the schedule, even if it is nowhere near where you live.",Treat your employees like human beings.,1.0,1.0,1.0,1.0,1.0,1.0
2016-08-13, Server,"Fairfax, VA",Current Employee ,Over worked and underpaid,Over worked and underpaid,0,You have a set schedule for 3 months and you cannot go into overtime. Those are the only pros I can think of for this company.,"The money in no way matches the work you have to do and the scrutiny you are put under by management.
They operate with Team service to a fault. On top of doing all your server duties,you are expected to be a food runner,bus boy,host, janitor etc.. All with a smile on your face or else...they also time you on greets,first rounds and table resets (will literally get out stop watches and time your work)
Side work takes 2 hours on average even as a senior server to get out of a shift every night.
Dry cleaning cost $2,000 a year total just to be able to work there.
You only get 3 table sections but are expected to take care of 3x the tables and run work on them because of team service.
Employees are rude to each other, and management is even worse.
Employees steal money and belongings from each other on the regular, but there are no cameras in place.
If your not ""in"" with management don't expect a good section no matter how much experience you have.
The host stand is a mess as per usual in the restaraunt world. So you can expect a two top at your party table almost 80% of the time.
Constantly changing focus points at shift meetings that contradict the focus they previously held,but you cannot question anything lest your sections suffer the price.
They nickle and dime guests.
They don't care about their employees.
They only care about money and food quality(which is why people keep coming back)
Probably much more I am not mentioning but you get the idea I hope!","Management needs a facelift ASAP
Update your operations and employee manuals. Hitler should not be your business role model.",1.0,2.0,1.0,1.0,1.0,1.0
2016-06-17, Food Runner,"Annandale, VA",Current Employee ,Food Runner,Food Runner,0,"Fast paced, fun environment to work in. The management team at Great American communicated effectively and efficiently through their use of guided and structured corporate practices.","For a restaurant it is a very stressful environment. If you are just looking for a part time job just to get a couple bucks every week, there are much easier ways to do that.",From my perspective the management at Silverado is doing a great job with motivating the employees to perform at 110% customer service.,5.0,4.0,5.0,2.0,1.0,5.0
2016-06-04,,,Current Employee ,good stuff,good stuff,0,"great environment, cleanliness is important, team service is everything.",total commitment from work force,,4.0,,,,,
2016-06-14,,"Fairfax, VA",Former Employee ,Really Good Days...and REALLY Bad Days.,Really Good Days...and REALLY Bad Days.,0,"Flexible schedule except for holidays
Fun atmosphere when slow
Friendly People
TONS of regulars
Pay is really nice","Management needs to have better communication
Management needs to be more professional
Extreme coaching
Long hours no breaks",Communication is key! Please don't tell employees one thing so they can get yelled at by another manager. Don't yell at your employees. Do a better job at listening to your employees.,3.0,2.0,4.0,4.0,5.0,2.0
2016-05-17, Host,"Fairfax, VA",Current Employee ,Good job for while you are in school but don't stay longer than that,Good job for while you are in school but don't stay longer than that,0,"Good pay, very organized, everyone is well trained, the people are nice",People trying to work their way up in the company get a lot of false hope from the management and then often get dropped. Sexism is present in the company. If you want to be a host you have to be female and you will have to wear makeup every day in any front of house position. Uniforms are uncomfortable and ugly.,,3.0,4.0,1.0,3.0,4.0,2.0
2016-05-03,,,Current Employee ,Good food industry/hospitality company,Good food industry/hospitality company,0,Great company that hires some of the most wonderful people you will ever meet. Environment is fun and food is consistently good. The establishment has a recipe for success with the structure of how things are run and high standards.,"Disregard for your personal life, making work-life balance very difficult. Not always willing to work with you.",Show your hard workers some appreciation.,4.0,2.0,5.0,4.0,3.0,4.0
2016-05-03, Server,"Centreville, VA",Former Employee ,Server- Sweetwater Tavern Centreville,Server- Sweetwater Tavern Centreville,0,"Excellent first job, excellent, and a great team environment. The management staff varies from restaurant to restaurant- Sweetwater tavern centreville was excellent","You will have to work extremely hard, not really a con- but be prepared to work",Focus on working with employees time schedules more,5.0,3.0,5.0,4.0,4.0,5.0
2016-04-27,,,Former Employee ,Great Place. Great People,Great Place. Great People,0,The pro to Great American Restaurants is their commitment to excellence. Everything is perfect every time.,There are no cons to Great American Restaurants. There is plenty of mobility great attitudes,,5.0,5.0,5.0,5.0,5.0,5.0
2016-04-28," Server, Hospitality Leader","Shirlington, VA",Former Employee ,"Structure, Balance and Opportunity","Structure, Balance and Opportunity",0,"The organization has done all the work for you. The food is always top notch, and if there's ever an issue with a guest, the manager will handle it for you.

Busy restaurants even on week nights, so if you want to work, you'll make real money.","There's a little favoritism, but they tend to favor the hardest workers and those with the best attitudes, so there's your key to success.

You have to study hard and know the menu extremely well, however, that knowledge will make you more money because guests buy from confidence.","Enforce policies across the board. I was a favorite, so I always got away with small things like imperfect uniform and skipping a day shaving, but new staff watch those things and it causes resentment. I believe it made it harder for new staff to feel welcome, and less likely to put in the hard work necessary to get the better shifts and sections, raising turnover rates.",5.0,4.0,5.0,3.0,4.0,2.0
2016-03-31,,,Current Employee ,GAR STAR,GAR STAR,0,I think that GAR is a great company to work for and a lot of the people really care about the success of the team.,Sometimes the efforts to ensure guest happiness trumps the feelings of the employees and leaves a little more to be desired from management,D,4.0,2.0,5.0,2.0,3.0,5.0
2016-02-11,,,Current Employee ,Great place to work,Great place to work,0,"Great staff, good money, generally friendly clientele, high standards, and amazing food!! Good benefits if you are a full-time employee.","Usually there is not much room for growth within the company, especially without a college degree. Easy to get stuck here because the money is good. Difficult to have an early schedule or vibrant social life working restaurant hours.",Look for more ways to get involved with the community; I think there is a need for more marketing and PR for the company.,5.0,3.0,5.0,4.0,4.0,5.0
2016-02-03, Waitress,"Gaithersburg, MD",Former Employee ,Well Run Company,Well Run Company,0,"*very educational training program with food tastings
*great food
*family environment","*hard to make great money if not a shift captain
*have to get uniforms dry cleaned which is really pricey",*get a discount rage on dry cleaning for employees or give them a credit per shift they work.,4.0,4.0,4.0,4.0,4.0,4.0
2016-02-12, Hostess/Server,"Vienna, VA",Former Employee ,Server,Server,0,All employees are super helpful to each other.,Management was awful and I felt like they took advantage of me being able to work both as a hostess and a server.,,1.0,2.0,3.0,3.0,1.0,1.0
2016-01-04, Server,"Arlington Heights, IL",Former Employee ,Great Company!,Great Company!,0,"Ability to make as much money as you like, averages to about 20$ an hour. Can be more if promoted to Hospitality Leader or Bar.","Due to Team Service, you are reliant on your coworkers when it gets really busy. This can be amazing with great row mates, and a bit frustrating with never servers.",All management whom I've worked with were amazing. They are flexible and care about the staff needs when it matters,5.0,3.0,5.0,3.0,5.0,5.0
2016-01-04,,,Former Employee ,Server,Server,0,Great people staff is awesome,Managers are ok. Long hours,Care more about your employees,1.0,2.0,3.0,1.0,1.0,1.0
2015-11-18, Server,"Arlington, VA",Former Employee ,Fast-paced fun,Fast-paced fun,0,"The company prioritized guest satisfaction and a very clean, upbeat work environment. The time flew by at work and I mostly had a fun time while working there.",The standards were VERY high and sometimes ridiculous when working there.,,4.0,2.0,5.0,4.0,3.0,5.0
2015-11-09,,,Current Employee ,Server,Server,0,Environment thrives off team work and the idea that keeping your staff happy will make your guests happy.,"hours, schedule, inconsistent pay...normal server grievences",,5.0,2.0,5.0,2.0,3.0,3.0
2015-10-25, FOH,"Reston, VA",Current Employee ,Good gig if you can handle a corporate atmosphere,Good gig if you can handle a corporate atmosphere,0,"High volume, high check averages, and high tip percentages. Solid weekly business every day of the week and lunches aren't bad either.","Micro managing to the 10th degree. Everyday they are focusing on a new ""issue"". Some of these issues hold merit, but most are absolutely ridiculous.","They need to listen to the ""little guys"" more ofter and realize that they do make mistakes. They have a well run machine, but failure will be imminent if they don't heed the advice of their hourly employees.",4.0,4.0,2.0,4.0,4.0,2.0
2015-10-17, Host,"Centreville, VA",Former Employee ,Host,Host,0,"Great place to work! Pay is excellent (Hosts start @ $15/hr), plenty of growth opportunity, management recognizes everything and rewards you for going above and beyond. GAR is truly a class act.",When they find out your worth they'll take advantage of you. Management does play favorites. There is plenty of sexism in the company with their rules.,,5.0,4.0,4.0,5.0,5.0,5.0
2015-10-08, Host,,Former Employee ,Host,Host,0,Great food and fun people to work with,Managers favorite people and are quick to fire if you don't fit in,,3.0,3.0,3.0,3.0,4.0,2.0
2015-08-30,,"Fairfax, VA",Former Employee ,"High expectations, popularity game","High expectations, popularity game",0,"Benefits
Vacation time - three weeks from the start
More or less consistent schedule","Sometimes unrealistic expectations from directors.
Bonus structure is not fair for managers. It's up to the MP to distribute bonus money for the restaurant","Don't lose sight of where you began. You've had a lot of great people work for you, and unfortunately they looked elsewhere because you couldn't keep them happy.",3.0,2.0,3.0,4.0,4.0,3.0
2015-08-11, Server,"Gaithersburg, MD",Current Employee ,Server,Server,0,Great management. Service is based on teamwork and each employee is extremely hardworking and kind.,Training can take over two weeks. Lots of side work at the end of the shift.,Keep up the great work.,5.0,4.0,5.0,5.0,4.0,5.0
2015-09-07,,,Former Employee ,Superficial and unrealistic,Superficial and unrealistic,0,"Amazing food, okay pay (depending on who you are), management can be sweet (when they feel like it)",This company is based on making you feel inferior! Constantly critiquing you until you feel the need to change yourself. Basically if you can fake a smile hard enough you're good. But God forbid you make a mistake. You will literally be bullied by management do your shift. Never call out! (Feels like you work at the White House) and please don't act like you're worth anything more Han making their money!,"I've watched people who have worked for you for years walk out because you do not value your employees. It's supi to be casual dining, don't treat us like we're working for some crazy elite restaurant. You serve burgers for Christ sake! All of your employees feel replaceable at all times. And they are. (So are you)",1.0,,,,,
2015-08-16, Hostess,,Current Employee ,"Soul draining awful place, terrible management","Soul draining awful place, terrible management",0,You make good money but you also have to adhere to ridiculous standards. Fun place to work when managers feel like being friendly,"Incredibly superficial. You will 100% only be hired from the way you look. They aren't looking for genuine and sincere people they are looking for people who know how to fake it. They have this idea that they are the most exclusive restaurant ever and will make you feel like you aren't good enough 24/7 because you aren't ""spec"". Don't treat you with respect they treat you like youre disposable",Managers play favorites and even if you're a hard worker they will screw you over if you aren't on their good side. Managers are fake and pretend to be in your best interest but actually don't care at all.,1.0,1.0,1.0,1.0,2.0,1.0
2015-06-30, Hostess,"Lovettsville, VA",Current Employee ,Awesome Company,Awesome Company,0,"Flexible hours, can get quick raises, opportunities to advance, can get a company card if you work over 30 hours a week","Work holidays, weekends, can't request off",,5.0,4.0,5.0,5.0,3.0,3.0
2015-06-02,,,Current Employee ,Great place,Great place,0,"amazing people, great food, wonderful managers","no downside, amazing company with great food",keep it up!,5.0,5.0,5.0,5.0,5.0,5.0
2015-05-27,,,Current Employee ,Job title,Job title,0,great hospitality and service to all guests.,restaurants can get frustrating sometimes,management there is pretty awesome!,5.0,2.0,5.0,3.0,2.0,3.0
2015-05-08, Host,,Former Employee ,Great company with high standards.,Great company with high standards.,0,"Happy management, happy employees, great starting hourly rate, available advancement opportunities, high standards and expectations",High standards and expectations for uniforms that cost the employee excessive extra money,,4.0,3.0,5.0,3.0,4.0,4.0
2015-05-01,,,Former Employee ,Hostess,Hostess,0,"great pay
great team work
free food","management not on the same page, they see you as a replaceable object. I knew someone that worked for the company for 13 years and got hours reduced to almost half in order to fit new employees.",Please take into consideration all the hard work of your employees.,3.0,4.0,5.0,2.0,4.0,3.0
2015-04-24, Server,"Fairfax, VA",Current Employee ,"Could be better, could be worse","Could be better, could be worse",0,"GAR is the type of restaurant group that knows exactly what it wants and gets it. It's run very well, and everything always seems to be in place. Everyone knows what they're doing, they're all knowledgeable, the pay can be great, and it's a highly-regarded place to be. If you're trying to get a good job after GAR, you'll most likely get it, because businesses around here know how well we are trained, and how serious we are about hospitality.","It's strict. I've never known of any other place other than the government that stifles individuality so much. I would think that in our modern age, individuality would be more appreciated and values, but they train everyone to be like robots (reminds me of the thumb robots in spy kids). Everyone needs to look perfect in their uniforms. One wrinkle? Go change. Flyaways in your hair? Redo it. I've always been very artistic, and after being hired, I was told to change many things about the way I looked, and honestly I was a bit hurt. If you didn't like the way I looked when you interviewed me, you should have told me then before I made a decision to accept the job. Don't get me wrong, it is a great job, but I hate feeling like a cookie cutter.
Sometimes I feel like the managers micromanage too much. They definitely play favorites, and seem to love putting their employees down. I accidentally dropped a champagne flute during my first two months of officially serving (the flutes are flimsy and quite challenging to carry), and my manager gave me hell for the rest of the day and pretty much criticized everything I did afterwards. It sure made me feel bad.","We strive to create a place for gourmet CASUAL DINING, and yet no one is allowed to show their casual side. We understand that this is a business, but let your employees breathe a little! Let them show their little quirks when they work, and let them be individuals for god's sake!",2.0,1.0,4.0,2.0,2.0,3.0
2015-03-11,,,Current Employee ,Currently employed,Currently employed,0,This company has restaurant operations down to a science,Hard to tell how you're doing within the company,More active feedback,5.0,3.0,5.0,5.0,5.0,4.0
2015-02-25, Server,"Tyson's Corner, Fairfax, VA",Current Employee ,Fast paced environment with a employer who cares about its' business.,Fast paced environment with a employer who cares about its' business.,0,"Fun, fast environment. Great people to work with. Great skill development. High expectations. Able to grow personally. Very in-depth and adequate training.","Not a lot of upward movement, long shifts/days, very demanding of excellent work (could be a pro as well), not many work benefits.",More communication to lower level staff and allowing more open communication to upper level staff. More room for career development. Continue to stay true to organizational goals and make sure those goals are clear.,5.0,3.0,5.0,3.0,3.0,5.0
2015-02-23, Hostess,,Former Employee ,Great company,Great company,0,"Really feels like a family--coworkers are fun people and you can go to them with anything
Good part time job","Hours were kind of bad
Scheduling",,4.0,,,,,
2015-02-07,,"Fort Wayne, IN",Former Employee ,Didnt last long therel,Didnt last long therel,0,"Flexible hours, nice people. The food was very good.",I couldnt make any real money there. Tips were almost non existent.,,3.0,4.0,3.0,2.0,2.0,3.0
2015-02-02,,,Former Employee ,"Short exhausting hours, semi-ok pay as a food runner","Short exhausting hours, semi-ok pay as a food runner",0,"Management doesn't micromanage as long as you do your job and stay productive

Hourly pay is decent enough","Short shifts, very few hours. You need to pick upshifts if you want more",,3.0,,,,,
2014-12-04,,,Current Employee ,Great!,Great!,0,"The atmosphere and guest experience is fantastic, do to our Team Service model. Its something the staff prides themselves on. When the company's policies are to serve a guest BETTER than the service you would expect from someone, it drives the environment towards further and further positivity.","Team service only works if all members are on the same page and pulling their weight. Management can still pick favorites, and at times it feels as though the ""pretty"" people are hired or gain opportunities in the company.","If someone has outstanding work experience and work ethic, give them the same opportunities as those who are veterans to the company.",5.0,3.0,5.0,4.0,3.0,4.0
2014-12-02, Waiter,"Arlington, VA",Former Employee ,A week run composure,A week run composure,0,I worked at the Carlyle restaurant which is owned by Gar. The whole company has restaurant operations down to a science.,While they claim the are not corporate style of a company. Everything about the operations feels corporate.,I would've stayed with the company of their was a stronger sense of restaurant industry culture and more of a passion for food and beverages.,4.0,4.0,3.0,3.0,3.0,4.0
2014-10-18,,,Former Employee ,Great management staff,Great management staff,0,"Work advancement, compensation, positive management team, good corporate culture",Long and rigorous work hours,Great job,5.0,,,,,
2014-10-05,,,Current Employee ,Great Company to work for,Great Company to work for,0,"Great company to work for. Good benefits, training, and managers. They set the bar high and expect you to exceed it. You really get what you put into it.","Hard to find a lot of issues. Benefits could be better, but not a lot of restaurant companies offer them. Customers do expect a high level of service.",Keep the same caring attitude as the company expands.,5.0,4.0,5.0,4.0,4.0,5.0
2014-09-29, Server,"McLean, VA",Former Employee ,A place where you can have fun but have to be serious and focused at all times.,A place where you can have fun but have to be serious and focused at all times.,0,"short shifts, supportive team, team service, respect for each other, equalty","managers are too strict, too much time spending side work, hard to get days off",trust the employees a little more,4.0,4.0,4.0,4.0,4.0,3.0
2014-09-16,,,Former Employee ,server,server,0,Very high standards for the product they produce and the overall guest experience.,"Management forces you to use team service which means you have to be conscious of everyone you are working around and help others tables. This is good for new employees who struggle but ends up making the more senior employees carry the work load with no extra compensation. That means taking greets, orders, clearing tables, back of house side work, etc. for people around you but you don't have any way of pooling tips. The company's logic is that they will reciprocate the help with your tables, but they don't put stronger servers next to each other so you end up taking care of your tables and then the weaker servers around you.",Find a way to give an incentive to the servers who carry the load of the staff. Why would I want to work harder for someone else and not make any more money?,4.0,,,,,
2014-06-01, Server,"Springfield, VA",Former Employee ,Awesome company to work for.,Awesome company to work for.,0,GAR has set the standard in Northern Virginia for casual dining. This is due to having a great staff. Team service works great for the wait staff. This is a concept other chains can't replicate because it is not embedded into their company culture like it is at GAR.,"Lots of rules and technical stuff that is expected to be known and practiced at all times by the wait staff. This takes some time to get used to and to perfect. After the learning curve, it becomes easier to remember the technical aspects.",Keep up the great work and continue to build your image on social media.,5.0,3.0,5.0,3.0,3.0,4.0
2014-05-12, Server,"Fairfax, VA",Former Employee ,Server,Server,0,Positive work environment with a focus on integrity.,Hard to become more than a server.,Great job!,5.0,4.0,5.0,3.0,5.0,
2014-04-21, Server,"Falls Church, VA",Current Employee ,great,great,0,"Fun, fast paced, and tons of money to be made
Managers that care about you
Did I mention money, because there is alot of it there","Tough environment if you are new to serving. If you can stomach the rules and follow them you will be fine and not attract negative attention.

Serving is overall stressful and you can meet alot of guests who are kinda mean but there are more nice people out there.

Long hours",Keep it going,5.0,5.0,5.0,5.0,5.0,5.0
2014-04-19, Server,"Fairfax, VA",Current Employee ,A Great Place to Work,A Great Place to Work,0,"Holds you to high standards, but celebrates success. A great opportunity for $$$, and the culture and sense of belonging are great. Very high quality food, very good service, at a reasonable cost for guests","Scheduling is tough: if you want a shift off, you can't request off. Instead, you must cover every shift that you were previously scheduled. It can make emergencies and illnesses hard. Management is tough and constantly watching and rating you, you are always on stage (but this can also be a good thing)",None,5.0,3.0,5.0,4.0,4.0,5.0
2014-04-29, Server,,Current Employee ,Not a bad place to work,Not a bad place to work,0,Consistent clientele and the tip percentage is high.,Management tries to hard to like they're being productive and make changes with very few progressive ideas.,"Treat your staff like adults, and not children that need micromanaging",3.0,2.0,3.0,3.0,3.0,2.0
2014-05-09,,,Former Employee ,Typical cooperated company,Typical cooperated company,0,"If you stay for a short period and stay out of politics, you can enjoy the pay and the benefit.","It's just like a cult group. Management plays favorite A LOT. There are very little number of true managers. Others became managers only because they have stayed in the company long enough.

If you are different from others, they will make you feel very uncomfortable, and you will not be able to stay in the company eventually. Also, if you are in a minority, the chance to become their true favorite is very, … 
Show More",Stop abusing your front-line employees.,1.0,2.0,3.0,3.0,4.0,1.0
