date,employee_title,location,employee_status,review_title,years_at_company,helpful,pros,cons,advice_to_mgmt,rating_overall,rating_balance,rating_culture,rating_career,rating_comp,rating_mgmt
2018-11-05,,,Current Employee ,Amazing Company,Amazing Company,0,"great people, great management, love what i do",you need to be reachable and there is some weekend work. diversity is non-existent. everyone here is male and either indian or white.,"we need help to do the work, not more upper management. how about spending some of that money on sales or help to get the work done.",5.0,3.0,3.0,4.0,4.0,3.0
2019-02-09, Senior Support Engineer,"Richardson, TX",Current Employee ,Startup mode work,Startup mode work,0,"Start up mode work, new technologies, lot of challenges","Lack of standard procedures and enforcement leads issues to re-occur.
Lack of defined ownerships leads to chaos sometime.",,3.0,1.0,2.0,4.0,4.0,3.0
2019-01-25, Senior Manager,"Richardson, TX",Current Employee ,Senior Manager at Mavenir,Senior Manager at Mavenir,0,"Flexible hours, work from home when needed","Little training, Long hours, little bonus/raise",Over worked and lack of communication,4.0,1.0,3.0,3.0,3.0,3.0
2018-10-07,,"Richardson, TX",Current Employee ,Manager,Manager,0,"Agile environment, learning culture, young teams","Hero culture, less of processes",Focus on improving process orientation,3.0,3.0,2.0,3.0,3.0,2.0
2018-07-28, Product Management,"Dallas, TX",Current Employee ,best people are leaving,best people are leaving,0,Mavenir makes good powerpoint slideware,"Best people are leaving. CEO is a bully and management teams are copying this behavior. Products are not existing. Indian development teams are not under control and delivering bad quality. IMS deployments are replaced by competition, Traditional MVAS business is neglected and put in maintenace mode and 5G and RCS are not delivering successes",go on retirement,1.0,1.0,1.0,1.0,3.0,1.0
2018-07-06,,"Richardson, TX",Current Employee ,Not organized company,Not organized company,0,"Flexible work time, good work life balance","Not organized company, no employee relation activities",,2.0,3.0,1.0,3.0,2.0,2.0
2018-06-21, Intern,"Richardson, TX",Current Employee ,Intern,Intern,0,Management is really nice as far as i have seen,None that I have known,,5.0,,,,,
2018-07-09,,,Current Employee ,Administrative Assistant,Administrative Assistant,0,"There are no ""Pro's"" working here","Company is fraudulent!There are no ""real"" Managers/Employees. Feels like a SCAM. Not a good or helpful company.","Hire competent people instead of being so ""Confused"" about the things that are going wrong in the company.",1.0,1.0,1.0,1.0,1.0,1.0
2018-03-06,,,Current Employee ,Changing Work Environment,Changing Work Environment,0,Involved in wide array of technologies,future uncertain for some groups,,4.0,4.0,4.0,4.0,4.0,4.0
2018-02-27,,"Richardson, TX",Former Employee ,Buy out blues,Buy out blues,0,Great people at the Richardson Tx location.,Buyer of Mavenir never seemed to be in touch with division.,,2.0,2.0,3.0,1.0,2.0,2.0
2017-12-20,,,Current Employee ,Lack of focus,Lack of focus,0,"Short term projects execution is somewhat ok. However, there are frequent changes in directions that creates organizational fatigue and employee burnout.",Long term strategy and execution lack focus and commitment. The detrimental effects of the lack of vision can significantly alter the trajectory of the company.,Be cognizant of the long term vision and commit appropriate resources,2.0,2.0,1.0,2.0,2.0,2.0
2017-10-13,,,Former Employee ,Senior Systems Engineer,Senior Systems Engineer,0,"Different product line, lots of opportunity.","Not the best paying company, I think.",Should look into the employees' compensation a little more.,3.0,,,,,
2017-10-02, Senior Director,"Boston, MA",Former Employee ,Service,Service,0,Fast paced always and challenging,None that i can think of ?,none,4.0,3.0,3.0,4.0,4.0,3.0
2017-09-27, Delivery Lead,"Seattle, WA",Current Employee ,Tech lead,Tech lead,0,opportunity to work on latest telecom technology,Random work and need to improve planning,,5.0,,,,,
2017-10-06,,,Former Employee ,No Strategy Poor Mgmt,No Strategy Poor Mgmt,0,has some skin in the game for 5G,Poor communication by executives. No clear product strategy. Keep changing their minds on products all the time. Banking too much on 5G which may not pan out since its not clear if they actually have the oomph to deliver,Value your employees. Communicate to them.,2.0,1.0,1.0,2.0,2.0,1.0
2017-09-20,,,Former Employee ,Director,Director,0,Aggressive and innovative. Focusing on network core for the next generation of the Mobile networks.,Terrible work life balance. Strategy changes often.,Focus on specific areas of strength.,2.0,1.0,2.0,2.0,2.0,3.0
2017-10-01, Manager ,"Dallas, TX",Current Employee ,Head of anything / if I say where I am from I will be fired,Head of anything / if I say where I am from I will be fired,0,Nothing but 1990s mgt. did anyone see the latest marketing or LinkedIn campaign. Amateur hour.. spelling mistakes .. totally useless. I can believe any reasonable company would spend money on these idiots.,"Useless , incompetent Management - even worst than tartavell. He was not good. I really hope we lose the contract with our Big US client. We are totally useless with only top mgt thinking they are brilliant",Give up you losers,1.0,1.0,1.0,1.0,1.0,1.0
2017-06-20,,,Current Employee ,Support engineer,Support engineer,0,The people. It's a very pleasant and supportive work environment full of people more than happy to share their knowledge.,The hours. My position is 24/7 support over 3 shifts daily and can wear on you.,They seem detached from daily operation and have been letting people go over the last year due to mergers and the like. Including some experts of certain aspects of operation.,3.0,,,,,
2017-06-21, Team Leader,"Wakefield, MA",Current Employee ,Lack of direction,Lack of direction,0,Some of the newer products have potential. Recently acquired companies with experienced and knowledgeable employees. Employees who are laid off are given ample notice.,"Constant layoffs, no communicated direction, irrational demands from upper management, low morale. Upper management has created a toxic environment by having random layoffs and not communicating with the rank-and-file employees.","Communicate better with employees, provide direction and guidance, and help create pride in the brand. Start to undo the toxic environment you created.",2.0,2.0,2.0,1.0,2.0,1.0
2017-03-28,,,Current Employee ,Good fast paced work,Good fast paced work,0,"1) Pays well
2) Good performers are appreciated and taken care.","1) Work life balance is not great, depending on the project.
2) Still stuck in telecom vendor market","Change to newer things, explore to newer options other than telecom.",4.0,,,,,
2017-03-16, Operations,"Kansas City, KS",Current Employee ,Average,Average,0,"100% work from home
opportunities to learn and contribute","too many mergers and acquisitions
integrity issues with middle level management. actions does not reflect what is communicated",respect and value all your employees,3.0,2.0,2.0,1.0,2.0,2.0
2016-11-14,,"Richardson, TX",Former Employee ,Analyst,Analyst,0,"Start-up culture, minimal bureaucracy, lots of opportunities to work directly with upper management.","High value on engineering, less value on marketing. HR does not pay a fair wage, seeks to pay lowest on scale.",Regular town hall meetings with all employees would be helpful.,4.0,3.0,3.0,4.0,2.0,4.0
2016-04-01,,,Former Employee ,Operation Engineer,Operation Engineer,0,Chance of doing some real work.,Long hours. Hard demand. Harsh management.,,2.0,1.0,1.0,2.0,3.0,1.0
2016-03-17,,"Mesquite, TX",Former Employee ,Accounting,Accounting,0,"before it was Mitel, working there was wonderful, they provided free snacks, sodas and flexible work schedule. Now that it's Mitel, the accounting dept moved to AZ or India.",They were purchased by Mitel.,,4.0,5.0,3.0,3.0,5.0,3.0
2016-03-11,,,Former Employee ,Ok,Ok,0,Flexible schedules for some employees.,Management does not always seem to value their employees.,,2.0,2.0,3.0,2.0,3.0,2.0
2015-10-02, Software Engineer,"India, TX",Former Employee ,review,review,0,"Lots of learning opportunities, there is chance to work in different phases of software development life cycle. Salary is good","Lots of issues. Policy varies person to person, or can say no policy at all. In-efficient and in-experienced people sitting in project management.",TOP management should intervene and streamline the process,3.0,3.0,1.0,3.0,3.0,1.0
2015-10-19,,"Olympia, WA",Former Employee ,BEWARE,BEWARE,0,"Strategically positioned to be VERY competitive in their industry and be very disruptive to their major competitors (Ericsson, ALU, Nokia Siemens, etc).","Have serious issues with basic business ethics. They are grossly understaffed to deliver to their customer commitments and focus more on selling new business with little regard to delivering on business already under contract. They treat their employees as chattel. Project Managers in particular are used as ""expendable crewmen"" who are there only to take all of the incoming flack from the customer while management ducks behind them and acts surprised at the issues - even though they are repeated informed. PM's are routinely rotated in and out (as in laid off) as scape goats. Very Unprofessional organization. Expected the Mitel acquisition to help - but as of Fall 2015, it has not.",To Mitel management - you have serious issues in Richardson that need to be addressed. It is only a matter of time before the house of cards collapses.,1.0,1.0,1.0,1.0,3.0,1.0
2015-09-16,,"Dallas, TX",Former Employee ,Mitel shrinking Mavenir,Mitel shrinking Mavenir,0,"If you're on the product side (sales/service) and you keep your head down, you're probably ok.",Anyone else in business support or G&A will be redundant and jobs will move to Mitel corporate in Canada. It may take a long time for Mitel to understand the business and address customers making the road there very long and hard for those having to deal with the customers.,"Clean house at the top of sales and services, bring in real expertise with experience so you get the truth and can address it directly.",2.0,1.0,1.0,1.0,1.0,1.0
2015-08-17, Senior R&D Engineer,,Former Employee ,S/W Developer,S/W Developer,0,"You get to work on all phases of software development.
Pay is good.
Lot of free stuff","There is no formal training.
The company lacks direction",Make it more systematic,3.0,3.0,3.0,3.0,4.0,3.0
2015-07-23, Systems Test and Operations Engineer,"Richardson, TX",Current Employee ,system test & operation engineer,system test & operation engineer,0,"good work environment to work , helping people",we can work as ateam,,5.0,5.0,5.0,5.0,5.0,5.0
2015-08-05,,,Former Employee ,OK Place to work,OK Place to work,0,"Good customers, cutting edge products",No clear directions and how to execute,Help guide your employees,2.0,2.0,3.0,2.0,3.0,2.0
2015-07-06,,,Current Employee ,Manager,Manager,0,Get to work on cutting edge technology,Extended work hours. Lack of planning and strategy.,,4.0,,,,,
2015-08-06,,,Former Employee ,Moving to India,Moving to India,0,good people to work with. business growing. potential acquisition,"jobs moving to India, lack of upward mobility, potential acquisition",,1.0,2.0,2.0,1.0,2.0,1.0
2015-08-04,,,Former Employee ,Send all the jobs to Bangalore,Send all the jobs to Bangalore,0,I really can't think of anything to say good about Mavenir.,They have no qualms about sending all the jobs to Bangalore even at the expense of not meeting deadlines. They don't care about their customers and any contractual obligations they have to them.,"I understand the desire to save money, but at least take your time outsourcing and keep more knowledgeable staff here so you can meet your obligations.",1.0,3.0,1.0,1.0,2.0,1.0
2015-07-10, Senior Test Engineer,"Laurel Springs, Camden, NJ",Current Employee ,I don't want to vent.,I don't want to vent.,0,"The Mt. Laurel, NJ group are a hard working, dedicated and professional group that believes in producing a quality product.","The company is moving our jobs to India, which I and many other feel is a very bad move.",,2.0,,,,,
2015-07-24,,,Current Employee ,"Great place to work if you live in India (maybe, I don't live in India)","Great place to work if you live in India (maybe, I don't live in India)",0,none that I can determine,corporate greed is driving the engineering jobs to India.,Good luck. Your're going to need a lot of it.,1.0,1.0,1.0,,,
2015-07-20,,"New York, NY",Current Employee ,Engineer,Engineer,0,"Have a job, for now.",Outsourcing our jobs to India.,"Keep the people that made this product line profitable, something your other product lines are not.",1.0,1.0,1.0,1.0,1.0,1.0
2015-06-04,,"Dallas, TX",Current Employee ,Senior Software Engineer.,Senior Software Engineer.,0,"- Fast paced.
-Soda and snacks","Less tools, less process, less structure and so much less time to complete, too many tasks to complete.","Better tools, better structure is needed.",3.0,1.0,3.0,2.0,3.0,2.0
2015-05-19,,"Richardson, TX",Former Employee ,VoLTE business,VoLTE business,0,Fast pace environment to learn.,Things changed all the time.,N/A,3.0,2.0,1.0,2.0,3.0,3.0
2015-06-15,,,Current Employee ,ok,ok,0,It's been bought and someone made tons of money.,"Busy all the time, no personal life",,1.0,1.0,1.0,1.0,1.0,1.0
2015-05-07,,,Current Employee ,Digital Marketing,Digital Marketing,0,They offer and follow through with very flexable schedule,"A lot of ""firedrills"", C-suite lack team management skills",,4.0,5.0,3.0,5.0,3.0,4.0
2015-04-03,,,Former Employee ,"Watch out for the ""tone at the top.","Watch out for the ""tone at the top.",0,Flexible working hours and free snacks/drinks.,Too much pressure from the top to achieve results...giving rise to the potential for mistakes and/or errors of omission and improper financial reporting. Also a lack of professionalism in key functional areas.,Be careful how far you push your employees to achieve desired results. Your implicit directions may be misconstrued.,2.0,4.0,1.0,3.0,3.0,2.0
2014-10-27, Director of Business Development,"Richardson, TX",Current Employee ,Exciting Technology and Growth,Exciting Technology and Growth,0,"Innovation and technology - great products that make a whole lot of sense to describe to customers. Everything moves fast, but people are quick to pitch in to get it done. Management has passion to succeed.",Communication could be better to the staff.,Stay focused on customers and solving problems. Make sure employees both at HQ and remote have good communication and sense of pride in the company.,4.0,4.0,3.0,3.0,4.0,4.0
2014-10-04, Senior Engineer R&D,"Richardson, TX",Former Employee ,"Great startup:product,team and the management.","Great startup:product,team and the management.",0,"Great startup:product,team and the management.","Nope,Great startup:product,team and the management.",so far it's good.,5.0,5.0,5.0,5.0,5.0,5.0
2014-06-01, Ops Manager,"Richardson, TX",Current Employee ,Very excited to be part of Mavenir,Very excited to be part of Mavenir,0,"Cutting edge technology, you get to work on VoLTE, RCS and many other cutting edge technologies. The folks working here are razor sharp, no room for average brains or work ethic. Growth is unlimited as long as you prove your worth.","No 401match. Only 3 weeks of vacation. Sometimes its hard to keep work life balance but as long as you enjoy it, you will be happy.",Start making money. Sell only when profitable.,5.0,2.0,3.0,5.0,5.0,3.0
2014-05-08,,"Richardson, TX",Current Employee ,Good Company to work for,Good Company to work for,0,"work/life balance, good people to work with","no 401k matching, no bonusses",Please do Staff Quarterly Meeting to update the staff on what is going on with the company,4.0,4.0,4.0,3.0,4.0,4.0
2014-02-21, Technical Manager,"Richardson, TX",Current Employee ,Technical Manager,Technical Manager,0,"Cutting edge technology, the best industry brains work at Mavenir.","Too much work, can't hire fast enough.",Make more profitable sales,5.0,3.0,5.0,5.0,5.0,4.0
2014-02-05,,"Richardson, TX",Current Employee ,Tremendous learning opportunities,Tremendous learning opportunities,0,"Excellent Work Life balance, flexible timings","Not much opportunity to grow, management is unsure about career paths for the employees",,3.0,4.0,4.0,1.0,2.0,4.0
2013-10-16, Sales,"Richardson, TX",Former Employee ,"Great Talent Wasted by CEO and his ""insiders","Great Talent Wasted by CEO and his ""insiders",0,Cutting edge technology; bright people; good customers; window of opportunity in the marketplace to be successful.,"Where do I start? CEO should have left a LONG time ago. He's better for a start-up -- not for sustaining a business. He's a dictator -- nothing get's done without him and he's flaky and emotional -- no employee knows the future or direction of the company because the CEO changes like the wind, and that 'wind' can blow really hard!! Small group of insiders that get to do what they want and treat people poorly with no ramifications. Pay is poor, and company financial position is such that none of the employees will benefit from stock when company is acquired or they go public (what a joke!!). External customer satisfaction is very low due to lack of investment in customer care and abandonment of older products.","Get rid of the CEO, add structure to the executive suite, get rid of the head of marketing and business development, hire a real head of global sales, and beef up customer care.",1.0,3.0,2.0,1.0,2.0,1.0
2013-04-05,,"Richardson, TX",Current Employee ,"Innovative company, growing rapidly","Innovative company, growing rapidly",0,"Growing very quickly, which allows for a lot of finance activities. There is a lot of advancement potential for employees. As a newly certified CPA, I have been able to learn a lot about the corporate environment and put my education to good use.","Due to the fact that the company is small, there isn't a lot of formalize processes and procedures in place, especially regarding career advancement.",,5.0,5.0,4.0,5.0,2.0,4.0
2013-04-01,,"Richardson, TX",Current Employee ,Unethical and Poor Management,Unethical and Poor Management,0,Leading technology in the wireless telecom industry; flexibility to work from home if necessary,Poor Management; Poor work/life balance; Long hours with little to no appreciation from management. Some practices are pretty questionable and borderline unethical...will do things just to make the bottom line look good.,Do the right thing...not just want YOU want to do.,1.0,1.0,1.0,1.0,3.0,1.0
2013-02-18,,,Former Employee ,Terrible place to work. Poor work culture/ethics.,Terrible place to work. Poor work culture/ethics.,0,"Good market opportunity, fast growing space.","Poor culture promoted by exec team. Lack of structure, strategy, operating plan.",,1.0,2.0,1.0,1.0,3.0,1.0
2012-08-11, Dev Engineer,"Dallas, TX",Current Employee ,Dev Reviews of Engineer,Dev Reviews of Engineer,0,teamwork technologies protocols projects culture,"work and life balance, management",more team building activities,3.0,1.0,3.0,2.0,3.0,2.0
2012-02-24,,"Dallas, TX",Current Employee ,great place to work,great place to work,0,"flexibility, management and great place to work","consistent traveling, and mavenir is not a mature company",management is great at Mavenir,3.0,3.0,4.0,4.0,3.0,
2011-12-27, Sales,"Richardson, TX",Former Employee ,fun but hard to make money,fun but hard to make money,0,interesting leading edge technology. Lots of opportunity to influence corporate direction,"poor strategy
existing product late to market
new products too early to market",sell,2.0,4.0,3.5,2.0,2.0,
2019-04-25, Senior Principal Engineer,Bengaluru (India),Former Employee ,Great place to learn and enhance career,Great place to learn and enhance career,0,Mavenir is a place where you can learn a lot. Mavenir is working on latest technologies and having many products. Mavenir gives exposure to work in an end to end environment. There are many talented bunch in the organization which can be role model. As a CEO Pradeep have very good knowledge about all the products. Mavenir provides a platform which can be utilized to build an enhance career. Very happy and satisfied with the time spent with Mavenir. All the best.,Some improvements are needed in the way to mature the product before going to field and internal/external documentation needs to be improved.,"Apart from hiring outside, there should be focus on enhancing career path of existing employee.",5.0,5.0,5.0,4.0,4.0,3.0
2019-04-11,,,Former Employee ,Great people,Great people,0,Managers are technical and hands-n,Indian work culture can be challenging,,5.0,,,,,
2019-04-06, Software Engineer,Bengaluru (India),Former Employee ,Company review,Company review,0,Decent salary and an environment to learn more,Nothing as such as far as i know,Their are doing fine,5.0,2.0,4.0,5.0,3.0,4.0
2019-04-20,,,Former Employee ,OK Company,OK Company,0,Decent Salary and good work exposure,High work pressure and long work hours,,2.0,2.0,2.0,3.0,3.0,2.0
2019-03-29, Senior Software Development Engineer,Bengaluru (India),Current Employee ,Senior Software Engineer,Senior Software Engineer,0,"Work on latest technologies, good place to learn telecom related protocols","Work Culture, nature of work is not defined. should be ready to work on anything",,3.0,3.0,4.0,5.0,5.0,3.0
2019-03-14,,Bengaluru (India),Current Employee ,Security R & D 2nd staff,Security R & D 2nd staff,0,vulnerability Assessment and security guidence,Good to work here and nice working place,,4.0,4.0,4.0,4.0,4.0,4.0
2019-03-27, Integration Engineer,Tel Aviv-Yafo (Israel),Former Employee ,Integration Engineer,Integration Engineer,0,Comfortable working hours. Nice people.,Not stable. Uncertainty felling regarding future.,,2.0,5.0,2.0,2.0,2.0,3.0
2019-03-05,,Bangalore Rural (India),Current Employee ,Platform for Growth,Platform for Growth,0,"1) Employee friendly enviornment
2) Supportive management
3) helpful HR and Finance team
4) Continuous evaluation and recognition for the betterment",working hours needs to reduced,,5.0,4.0,5.0,5.0,5.0,5.0
2019-03-05, Manager,,Current Employee ,Progressive organisation with a vision and desire to become market leader in the communication network solution provider,Progressive organisation with a vision and desire to become market leader in the communication network solution provider,0,"Employee friendly policies, willing to listen to employee feedback and make a change, young and energetic work environment, opportunities to learn and grow in various new technologies",It's growing but need more time for it to become a mature organisation,Should create more solutions for better work life balance,5.0,3.0,5.0,5.0,5.0,5.0
2019-03-05, Senior Associate,Bengaluru (India),Current Employee ,Platform for individual contributors and team players,Platform for individual contributors and team players,0,"1) Good compensation package assured for all.
2) Good work environment.
3) Good facilities such as free breakfast and dinner for all employees plus free daily evening snacks.
4)Quick in TAT for any queries.
5)Good recruitment team - assistance provided anytime","1) No cab facility
2) Very poor WIFI connection provided for employees
3) Risk of job security","Give more time for the employees to perform their best.
Under performers need to be given more motivation than being penalized.",3.0,4.0,3.0,3.0,5.0,3.0
2019-04-02, Member of Technical Staff ,Bengaluru (India),Current Employee ,Think before joining RnD department,Think before joining RnD department,0,"Could not find any pros. Having worked in multiple telecom companies, I can say this is by far the worst experience as a developer.","No learning for experienced developers.
Haphazard way of development without any SDLC, unrealistic deadlines.
Too much politics, unprofessional managers
Management neither listens to employees nor wants to change.
No employee benefits, everything from leaves to work life balance depends on your manager. Even if HR wants to implements employee friendly policies, management doesnt let them.","Listen to HR, if not employees, and let them do their job.",1.0,1.0,1.0,1.0,2.0,1.0
2019-02-14,,,Current Employee ,Multitude of opportunities,Multitude of opportunities,0,"I've been in Mavenir for than 5 years and there's no dearth of work. Being a leader in the IMS space , there are lots of options to work on be it Development, individual node testing or end-to-end testing. If you're a person willing to work hard , then Mavenir is certainly a great company to work for",Work can be hectic and personal life can take a hit depending on the product/role,,4.0,2.0,3.0,4.0,3.0,3.0
2019-03-10,,,Current Employee ,Poor Work culture,Poor Work culture,0,Still trying to find out,"*There is no c++ based work , they will tell that you will get c++ work but reality is you end up working overtop on scxml . You get to realise after 1 month.
*People are biggest cons. Region based discrimination is there if you are North Indian in South Indian team you will get bullied. People Mimic till you get frustrated to resign.","Kindly take feedback from new college graduate who are employed , are they getting bullied at work place.",1.0,1.0,1.0,1.0,3.0,1.0
2019-01-12, Engineer R&D,Bengaluru (India),Former Employee ,Enginner R&D Fresher,Enginner R&D Fresher,0,Good start for a fresherman. Decent pay and exposure,"Lot of Politics, no reward for work! Politics ruled in my team. (AS)",Mavenir can't change because it doesn't want to,3.0,4.0,2.0,3.0,3.0,2.0
