date,employee_title,location,employee_status,review_title,years_at_company,helpful,pros,cons,advice_to_mgmt,rating_overall,rating_balance,rating_culture,rating_career,rating_comp,rating_mgmt
2019-01-20, Integration Engineer,Tel Aviv-Yafo (Israel),Former Employee ,Telecommunication and network company for small to mid-size,Telecommunication and network company for small to mid-size,0,Average pay in the market,Distance management with no real connection to the employees or the customers products.,,3.0,4.0,3.0,3.0,3.0,2.0
2019-01-16,,,Current Employee ,Member Technical Staff III,Member Technical Staff III,0,Can acquire good technical knowledge. Good pay-scale. Good hike.,Nothing as of now so far,,5.0,5.0,5.0,5.0,5.0,5.0
2019-02-07,,Bengaluru (India),Current Employee ,Lack of Vision and transparent culture,Lack of Vision and transparent culture,0,Payscale is good and potential for growth is high.,"Lack of vision and clarity in the path forward from management.
Culture of blame and finger-pointing is promoted
Bureaucracy is prevalent at all management levels impact overall productivity
Focus is more on bottom line improvement than top line growth causing high attrition
Overall emnployee morale is low and hence constant churn of high caliber talent","Bring transparency and merit based growth culture.
Consequence based leadership capable of listening to the team
Empower with accountability
Reward calculated risk and initiative to drive change to status quo.",1.0,1.0,1.0,3.0,4.0,1.0
2018-12-28, Java Programmer,Tel Aviv-Yafo (Israel),Current Employee ,Problematic. The employers don't want to invest in experienced workers who need to learn new technologies.,Problematic. The employers don't want to invest in experienced workers who need to learn new technologies.,0,Great Union that supports the employees,The managers who believe workers are replaceable,,3.0,4.0,4.0,3.0,4.0,2.0
2018-12-20,,,Current Employee ,Member of Technical Staff II,Member of Technical Staff II,0,Good learning And Pay based on the rewarding performance,Less onsite opportunity for developers in R&D,,4.0,4.0,4.0,4.0,4.0,4.0
2019-01-11, Senior Software Developer/Member of Technical Staff III,Bengaluru (India),Former Employee ,Worst company to work,Worst company to work,0,Nothing I can think of (or) came across,"You might have seen companies with worst policies. But Mavenir is the only company with worst HR policies along with worst HR team. (They act lika a Govt Employess, takes a week to give one HR letter)

Worst Team Management & leadership.
I my may team my manager wanted his subordinates just to say yes even for impossible things...which did not happen. So he started making his own team by recruiting all the team from his ex-company...Now Team is with all his ex employee and one fresher from infosys (I heard he is also searching)

If you want to survive, you must be best in politics & blame game so excel in your career with Mavenir. If you are bad in this, even if you are techincally gud...This is not the company for you.

I forgot to mention....When we as a team(all the teammates) when we gave compliant against manager about all this, it did fireback, as they were intrested in makeing ppl to leave instead of resolving the issue.

If you are very gud in blame game , religious activities & politics.....best company for you",Its a waste of time giving advice to management as they failed when we gave & made us (all the team) to leave the company,1.0,1.0,1.0,2.0,1.0,1.0
2019-01-08,,Brno (Czech Republic),Former Employee ,"Not suggested, unless you want to leave soon","Not suggested, unless you want to leave soon",0,"Reading the cons, you understand there aren't any pros.","- You could have a very good salary, but due to the huge amount of work they have it doesn't matter, it doesn't pay the effort, reason why every month someone disappears complaining by email, forget work/life balance
- Bad management in general","There is nothing you can do, Mavenir is Mavenir.",1.0,1.0,1.0,1.0,1.0,1.0
2018-12-02, Mobile Automation Engineer,Bengaluru (India),Current Employee ,Average company to work,Average company to work,0,"Flexible working hours and Overtime for some projects
Work from home option is available
Good Projects with upcoming technologies and lot of things to learn","Yearly increment is less
Management doesn't follow any process
People don't value of others time and efforts",Management should follow process so that team working under them can also work with process,3.0,2.0,3.0,3.0,4.0,3.0
2019-01-04,,,Current Employee ,Pathetic,Pathetic,0,None I can think of,If you are passionate and keen to work in a complete Mess this is the place for you.,Leave,1.0,,,,,
2018-11-29,,Bengaluru (India),Former Employee ,Culture and policies,Culture and policies,0,Did not find any .,"Worst Culture
1. Products are not stable any time it may crash in production.
2. You are expected to be available 24X7X365
3. If u are not available any day,take approval from manager.

Worst Policies
1. Imposed the Notice Period from 2 month to 3 Month.
2. Notice Period recovery is of Gross Salary.
3. Leave encashment is of Basic salary.
4. Won't provide any HR letter for the Notice Period recovery policy.

Comapny is making money from the Notice Period Recovery.

Guys please read the review carefully before u join it.
once u are in, it would be very difficult to leave.

Good Luck !!",,1.0,1.0,1.0,2.0,2.0,1.0
2018-10-30,,Bengaluru (India),Former Employee ,Member of Technical Staff -3,Member of Technical Staff -3,0,"1. With can survive without doing any work
2. WFH","1. Manager cheats employees
2. No career growth
3. They will promise some things to take back your resignation, later they will cheat
4. NO hikes
5. Fires at any time","No use, they will not consider",1.0,2.0,1.0,1.0,1.0,1.0
2018-09-19,,,Current Employee ,Good company,Good company,0,Flexible. Option for work from home,No work and life balance.,,4.0,,,,,
2018-09-07, Software Engineer,Brno (Czech Republic),Current Employee ,Good at all,Good at all,0,"Friendly collective.
Events etc.
More less free hands.
You are not strictly watched whether you are able to do your job well.
Paid sickness!","Year bonus is not very often - sometimes is skipped.
Employment growth is not handled very well.",,4.0,4.0,4.0,4.0,3.0,3.0
2018-10-05,,,Former Employee ,Over all a pathetic company,Over all a pathetic company,0,If u r good at politics even though doing nothing u can grow here.others better ignore this.For an example A guy comes to office at 2 PM and leaves at 6 PM and in between does only religious activities during this time being awarded Star award because of his this skill.,"1)You are expected to be available to work 24/7 and 365 days
2)Now a days annual hike is lesser than service based companies
3)Most of the products are not developed here instead got through acquisition.Once acquisition is done most or all the employees will be systematically laid off
4)Badly maintained products, No docs and no person aware of the products so there will be lot so issues so think why point 1 makes sense",Main problem is Mgmt.No point in advising,1.0,1.0,1.0,1.0,2.0,1.0
2018-09-02,,Bengaluru (India),Current Employee ,fresher working experience,fresher working experience,0,Great for learning if you get into right team,very bad HR and management,,3.0,3.0,3.0,4.0,2.0,1.0
2018-08-28,,,Current Employee ,Good product based company,Good product based company,0,"Nice work life balance,
Good to start career",There are no cons apart from heavy working hours.,Nothing much to needed everything was fine,4.0,4.0,5.0,4.0,4.0,5.0
2018-08-21, Senior Engineer,Bangalore Rural (India),Current Employee ,Good to work,Good to work,0,Good Learning and good pay,"Management is week, need to work on system to improve work life balance",Hire some good Managers,3.0,2.0,4.0,4.0,4.0,2.0
2018-09-15,,,Former Employee ,Mavenir is place a for more politics and less work,Mavenir is place a for more politics and less work,0,Nothing except work location. Not good for anything.,"If you don't know to play politics then don't go.

1. No work life balance. Your lead will ask you to work late at night.
2. No annual Increment.
3. No office activity.
4. Just for govt policy, they will do something.
5. You will be sick after going there in some time.
6. Only junk old projects are there which they will offer you and your career will spoil definitely.
7. Employees focus to praise seniors only.
8. Leaves they will give you easily.","Don't think only to make money. Without employees, you cannot do anything. Care to them.",1.0,1.0,1.0,1.0,1.0,1.0
2018-08-16,,,Current Employee ,Mavenir,Mavenir,0,"Agile, fast moving international working environment",organisation is very fluid and sometimes difficult to navigate,more frequent business updates for all staff to bring staff and high level management closer,2.0,,,,,
2018-08-13, Human Resources Manager,Tel Aviv-Yafo (Israel),Current Employee ,XX,XX,0,The pepole are great !!,Unstaible company with a lot if changes,XX,2.0,2.0,2.0,4.0,3.0,2.0
2018-08-14, Tech Lead,Bengaluru (India),Current Employee ,Poor Management and Lack Of Strategic Vision,Poor Management and Lack Of Strategic Vision,0,"1>Flexiable working hrs
2>Technically strong workforce","1>NFV is down and the company is in bad news
2>Company lack proper direction and vision
3>Low quality products
4>Too many Directors and program managers in Bangalore office
5>Some of the Directors in system test lacks maturity and poor people management skills",Reduce the number of Directors and program managers and get the Business headed in the Right Direction.,1.0,,,,,
2018-07-12,,,Current Employee ,about mavenir,about mavenir,0,"Will be working on latest telecom Domain, work from option","no proper management, not many customers",,4.0,4.0,3.0,3.0,3.0,3.0
2018-07-10, TAC Engineer,Mumbai (India),Current Employee ,Big learning environment and good organisation,Big learning environment and good organisation,0,Nice company and nice working environment,Helpful management and getting chance to grow up,Future growth,5.0,5.0,5.0,5.0,5.0,5.0
2018-07-10,,,Former Employee ,RnD Engineer,RnD Engineer,0,"Good Exposure, Learning, good team culture",The hike will depend on the team,,4.0,3.0,4.0,4.0,3.0,3.0
2018-07-04,,,Current Employee ,Working as a Technical Engineer in Mavenir,Working as a Technical Engineer in Mavenir,0,Good to work in Mavenir,Not Available to tell any Cons,,5.0,3.0,3.0,3.0,4.0,2.0
2018-07-05, Technical Meneger,Bengaluru (India),Current Employee ,"Mavenir - Cutting Edge, Fast, Cross-Functional, Unorganized","Mavenir - Cutting Edge, Fast, Cross-Functional, Unorganized",0,"Latest tech for voice/messaging based sw soutions
Open, cros-functional work culture
great exposure for end to end learning
Above market standard salaries","Unorganized
Less professionalism
Work-Life imbalance
Products instability
Poor product documentations","1. With company's expansion, its the need of the hour to bring in professionalism, 2. To document tacit knowledge lying in select people's mind.",3.0,2.0,2.0,3.0,4.0,3.0
2018-07-05,,Sofia (Bulgaria),Former Employee ,Pros and Cons,Pros and Cons,0,"nice and friendly stuff ,flexible working hours and good average salary",the company was acquired in 2015 tech machindra and 2 years after all the employees were dismissed .,,3.0,4.0,1.0,4.0,4.0,
2018-07-31,,,Current Employee ,"Going downhill , Hope it again comes back on track","Going downhill , Hope it again comes back on track",0,dynamic company gives opportunity to learn new technology,"No Direction, no quality , no ownership . People without experience or capability are promoted to management and that shows in Delivery and Quality failures .
Any feedback against existing process or decision are not accepted and leading to downfall of the company.",Please do a RCA of the recent failures and try to reach out to the ground level workers to find out the Root cause and correct it . Still possibility is there to get back on track.,1.0,1.0,2.0,1.0,2.0,1.0
2018-06-17,,,Current Employee ,Mixed Response,Mixed Response,0,Good place to learn new technologies,No Process or proper documentation. Company culture needs improvement.,,3.0,2.0,1.0,3.0,3.0,1.0
2018-06-05,,,Former Employee ,Good place to work at.,Good place to work at.,0,"Work Culture is favorable.
Works on latest technologies
Great innovations",Can improve on HR side.,,4.0,4.0,4.0,4.0,4.0,4.0
2018-06-05, Executive Team,,Former Employee ,No business transparency and employees not rewarded based on merit,No business transparency and employees not rewarded based on merit,0,"1. Good interaction and support given by investors
2. Products are relevant to market
3. Customer install base is a plus.","1. Global Sales head is biased, and does not reward based on performance
2. Company direction /decisions made by few individuals, with decisions not communicated down the line (even to senior execs)
3. Very politically motivated organization","1. Change existing leadership team to eradicate cronyism.
2. Corporation/Support from leadership team to each region needs to be more transparent and not politically driven.
3. Gauge actual contribution of individuals",2.0,2.0,1.0,3.0,2.0,1.0
2018-06-11, Software Engineer,"Reading, England (UK)",Current Employee ,"decreasing revenues, Sales of 2017 will not be reached in 2018","decreasing revenues, Sales of 2017 will not be reached in 2018",0,Some good experienced engineers mainly from the former Acision organisation. In 2017 good sales revenues of around 410M$ but mainly received from 1 large customer.,"Unmistakable Signs of a Bad Company , all signs are on red:

- Pardeep Kohli is a bully
- Over-Worked Employees
- Lack of Communication
- Lack of Team Spirit
- Bad Reputation
- hire of second rate bragging overrated new management positions","Be disruptive, replace yourself !",1.0,1.0,1.0,1.0,3.0,1.0
2018-05-03, Lead Engineer,Bangalore Rural (India),Current Employee ,average,average,0,"work from home
average salary
etc
etc
depend on project","no proper documentation
no work life balance
etc
etc
etc",,3.0,,,,,
2018-06-07, Lead Engineer,Bengaluru (India),Current Employee ,Company full of politics. Please change the senior mgmt.,Company full of politics. Please change the senior mgmt.,0,None that I can think of.,"1. People who just keep talking grow.
2. One should be good in politics to work here.
3. People just see whom to blame when something goes wrong including senior mgmt.
4. One is expected to be available on every weekends. You need to request your manager if you are not available on weekends. Worst work life balance.
5. Worst communication ever from senior mgmt. Everything is kept in dark.
6. List goes on and on...",I don't think they even care if advice is given.,1.0,1.0,1.0,1.0,1.0,1.0
2018-04-18,,,Current Employee ,Listen to the people they matter too!,Listen to the people they matter too!,0,"Flexible, pay is ok, always something new going on","The board don’t appreciate the work the people put in, long hours expected but not paid for, work load continues to increase whilst resources decline. No pay rise or bonus for those who actually put in the hours and work.",Listen to the people - they’re the ones at the forefront doing the work! You’ve lost a lot of good dedicated staff members.,4.0,2.0,2.0,2.0,2.0,2.0
2018-04-23,,,Current Employee ,Mavenir as Company,Mavenir as Company,0,Have the Comverse employees backbone,After merging with several employees the company lost its way...,Focus on innovation,3.0,3.0,3.0,2.0,3.0,2.0
2018-04-26, Specialist,Bengaluru (India),Current Employee ,Great technology platform and real time product development experience,Great technology platform and real time product development experience,0,"Awesome learning
Good benefits and HR engagement
Flexi hours and work life balance","No formal feedback evaluation
Increments not up to the mark
No managerial development","Invest more in developmental opportunities for workforce
More employer branding is required",4.0,3.0,3.0,4.0,3.0,3.0
2018-04-13, Program Manager,Jakarta (Indonesia),Current Employee ,Good place to work and learn,Good place to work and learn,0,"Opportunity to work in new technologies.
you can expand your role and learning opportunity.
Quick decision and turn around","Hurry to release the product.
Need process alignment and role clarity.",Focus to deliver mature product.,4.0,4.0,3.0,5.0,4.0,4.0
2018-04-18, Vice President Sales,"Reading, England (UK)",Current Employee ,Siris Capital has made huge mistakes and lost more than half of their investment .,Siris Capital has made huge mistakes and lost more than half of their investment .,0,Mavenir is the T-Mobile USA development House.,To much dependent on 1 large customer. Mavenir is a project based company. Products are not existing. No focus on the former Xura products. Bad delivery times. Bad designed products. No resources available to execute projects.,Centralize development in 1 country. Centralize product management in 1 country. Focus on the former Xura people.,1.0,1.0,1.0,1.0,1.0,1.0
2018-03-28, SMTS2,Bengaluru (India),Current Employee ,"Typical startup issues, lot of things at the same time.","Typical startup issues, lot of things at the same time.",0,"You learn to work under pressure.
Lot of work on newer technologies VoLTE, NFV, 5G - but same exposure not present across the board.
They are driven by customer & will do whatever customer will ask for; Nokias Ericcsons etc are way behind in the thought but are catching up.","Quick-fix mentality is killing the whole show; not just for one issue but each one of them. Balme game all the way from top to bottom.
Incapable middle management; no human aproach in Ops - they just work with authority.
Too much pressure for everything; managers get offended when asked why & what questions.
Too scared of customer.
No focus on automation especially for a start-up.
One person has to work on multiple things & results for both suffer - it's the case for almost 80% of the people on this company.
Horrible work-life balance; especially for people with kids, for bachelors its still ok.
You will hardly find a Manager or superior whom you can look upto.","Focus on automation at-least for 2 years - get majority of test cases for all products automated.
Start to push back on whims and fancies of the customer; at-least the big ones. they are not going to go anywhere else.
Treat people with more respect & foster a culture doing things the right way.
Train your middle management for managing. Hire a team of strong managers who are non-technical.",2.0,1.0,2.0,2.0,3.0,2.0
2018-03-06,,Bengaluru (India),Former Employee ,QA Analyst,QA Analyst,0,"Can work on Latest technologies
Good projects
Work from home option","Less pay now a days
HR department has to be standardised",,3.0,3.0,3.0,4.0,3.0,3.0
2018-03-15,,Mumbai (India),Current Employee ,"Not a great company to work for, certainly not bad","Not a great company to work for, certainly not bad",0,"Good benefits.
Descent pay.
Good company values.
Flexible working hours.","Very bad uppraisals.
No bonus payouts.
Lots of work pressure.",Please do look at the glassdoor reviews and give uppraisals and bonus matching the market.,2.0,1.0,5.0,4.0,3.0,4.0
2018-03-01, Deliveries Engineer,Singapore (Singapore),Former Employee ,Latest technology on virtualized network function.,Latest technology on virtualized network function.,0,Good environment to learn about virtualization technology.,Load of work with no proper technical documentation. Deployment always struggle onsite.,Need to improve on technical documentation.,3.0,3.0,4.0,3.0,1.0,2.0
2018-03-13,,Tel Aviv-Yafo (Israel),Current Employee ,Product Manager,Product Manager,0,"a company at the forefront of Technology 5G
Very aggressive and fast moving","In sake of fast moving the company is working completely in miss-order
the company does not leverage its employees capabilities",,2.0,2.0,1.0,2.0,2.0,2.0
2018-02-06,,,Current Employee ,worked for 3 years,worked for 3 years,0,work time flexibility is good,apart from salary no other benefits given to employees.,,3.0,2.0,3.0,3.0,2.0,2.0
2018-01-30, Junior Software Engineer,Brno (Czech Republic),Current Employee ,"Good start, better continue","Good start, better continue",0,"+ experienced coworkers
+ good environment
+ nice company
+ motivation bonuses","- need better coffee
- better salary",,5.0,3.0,4.0,4.0,4.0,4.0
2018-01-28,,Bengaluru (India),Current Employee ,Satisfactory,Satisfactory,0,"Good work life balance(depends on your team/project)
Good onsite opportunities for Testing/Ops people
Negotiate properly to get handsome offer","Hike is not that great compared to peers
No onsite for developers",,3.0,3.0,2.0,3.0,3.0,4.0
2018-01-02,,,Current Employee ,Not a great place to work...,Not a great place to work...,0,"1) Flexible office timings
2) Work from home (depends on your manager)
3) Good learning curve, good work","1) Bad pay hikes
2) No processes are followed, anywhere
3) HR policies are useless
4) 3-month notice period
5) Irrational deadlines
6) No work/life balance
7) No appreciation (not even verbal)/rewards to the employees who work hard. All such things are awarded to those bootlicking to the boss. No matter how well you do, you'll never be good enough. You'll always be condemned and taunted.
8) No team outings/activities most of the time.","Address employee concerns. Treat employees like family, not like slaves who have no personal life.",3.0,3.0,1.0,2.0,3.0,2.0
2018-01-18,,,Former Employee ,Nothing good to say,Nothing good to say,0,Today there is nothing good there.,"The new Mavenir management only care about their hires, not employees from Xura, plus they only care about US based customers - mainly Verizon. Unfortunately all the money making products aren't from Mavenir.",,1.0,1.0,1.0,1.0,2.0,1.0
2017-12-05, Smts,,Current Employee ,Go for learning only,Go for learning only,0,"Mavenir is innovative company and they are good in IMS netwrok nodes.
Now compnay is investing more on 5G technology
if some one really want to learn mavenir is right place .
growing company","1) no process in prodect development and delivery .
2) there is no work life balance for the people who are actually working .
3) politics in the team also destroying the team environment.
4) even after 10+ year, company is running like a startup . mostly activities are still track on excel sheet which is certainly not good.",,3.0,1.0,2.0,3.0,3.0,1.0
2017-12-13,,,Former Employee ,Can be good but...,Can be good but...,0,"flexible working hours, good package",everything moved to India (Pros for them though),,4.0,4.0,2.0,4.0,4.0,3.0
2017-12-12, Member of Technical Staff,Bengaluru (India),Current Employee ,Very Good Place to Work,Very Good Place to Work,0,"Good place to learn new technologies.
Flexible work timings.
friendly environment to work.
Supportive HR team.
Company policies and values are very good.",Lack of Process and documentation.,,5.0,5.0,5.0,5.0,5.0,3.0
2017-12-06,,,Current Employee ,Mavenir (Ex Comverse) current status,Mavenir (Ex Comverse) current status,0,"The human resource material here is one of the best there is in the Hi-tech industry, very flexible working hours","Company is on a ""hold"" for few years with all the merges and buying from position wise and salary",try to do more to keep the key personals,4.0,5.0,4.0,2.0,4.0,3.0
2017-11-29, Technical Lead,Bengaluru (India),Current Employee ,Technical Lead,Technical Lead,0,"Good work environment.
Have freedom to explore new technology stacks. You can explore whatever you want provided not screwing up the current project works.
Good recognition for your hard work.
Flexible timings.
Overall a good company to work","Sometimes the work will be hectic and the reason will be sales/delivery team's false committments.
Lot of improvements to be done in process and best practicises.Mere a CMM tag not going to help in the long run.
HR and Finance Team needs to be more employee friendly rather than responding like staff in Govt offices.",Employees are slowly losing the pride to say being part of Mavenir. You can easily fix it if you listen to the employees and take some action on glassdoor reviews.,4.0,4.0,5.0,4.0,4.0,4.0
2017-11-21,,Bengaluru (India),Current Employee ,Mavenir as your workplace,Mavenir as your workplace,0,"Mavenir has a wonderful working environment that's completely informal and where employees are encouraged to ask questions.
The compensation is highly competitive and top performers are recognized and rewarded
The scope to learn / implement something new is part of Mavenir DNA which helps keep employees constantly engaged",Work can be hectic at times,,4.0,3.0,4.0,4.0,4.0,4.0
2017-11-16,,,Former Employee ,Not Bad salary wise,Not Bad salary wise,0,"Good salary, no boundation for overtime depends on employee, if manager is understanding HR is no pain","Bad management, HR department is useless",Focus on building an employee skillwise,3.0,4.0,3.0,3.0,4.0,3.0
2017-11-02, Mobile App Developer,Bengaluru (India),Current Employee ,"Steep learning curve, flexible timings - good place to grow your career","Steep learning curve, flexible timings - good place to grow your career",0,"Growing company and hence good growth opportunities
Steep learning curve
flexible timings
good for career growth
salary",tight deadlines,,4.0,3.0,4.0,5.0,5.0,5.0
2017-10-19,,,Current Employee ,Sustaining,Sustaining,0,"To have 3 sickdays, some colleagues are fine and new technologies",Managers with big guns and stupid took at yuo,,2.0,2.0,1.0,2.0,3.0,2.0
