date,employee_title,location,employee_status,review_title,years_at_company,helpful,pros,cons,advice_to_mgmt,rating_overall,rating_balance,rating_culture,rating_career,rating_comp,rating_mgmt
2019-04-15, Technical Recruiter,"Irving, TX",Current Employee ,Awesome Culture & Endless Opportunities For Growth!,Awesome Culture & Endless Opportunities For Growth!,0,Have the opportunity to change individual's lives daily while matching them with career opportunities. The culture is relationship-driven internally and externally - going to work everyday is fun because of the people you work with. Tons of opportunities for upward mobility with various career path options and uncapped commission structure.,"While no company is perfect, management has been working diligently to adapt to changing market trends and listening to new ideas from internal employees to improve the overall work environment and streamline processes. This isn't a ""con"", but illustrates how open to change the company has become.",,5.0,5.0,5.0,5.0,4.0,5.0
2019-04-12,,,Current Employee ,This is a GREAT place to work and have an opportunity to be successful. I really enjoy being around my coworkers.,This is a GREAT place to work and have an opportunity to be successful. I really enjoy being around my coworkers.,0,"The impact you make for someone when you find them a new job is an added bonus. You can create a great life here if you are driven and have good work ethics. You have to give a little extra, but this is the only company I've worked for that actually rewards you for your effort.","While no place is going to be perfect, we tend to follow the old way of doing things sometimes. That's not always a bad thing, but we could look at our markets and adapt to change quicker.",Continue to motivate and lead us with an open mind and keep creating new opportunities for us to grow personally and professionally.,5.0,4.0,5.0,5.0,4.0,5.0
2019-01-26, Receptionist/Administrative Assistant,"Auburn Hills, MI",Former Employee ,Great Work Culture,Great Work Culture,0,"Competitive pay, benefits, friendly co-workers, community and volunteer events, upbeat moral, professional and clean environment, annual holiday party, incentive trips, career training, growth for those who work hard, employee events, free coffee, annual bonuses, competitive and quick paced.",Nothing that wasn't a reasonable request,"My time with Reliance One was split in a variety of ways. I have worked both directly for Reliance One as a temporary Administrative Assistant as well as a contract employee for various automotive companies. Both experiences over the years have been wonderful.

While working directly for Reliance One in their Auburn Hills office I thoroughly enjoyed myself. The culture is fun yet professional; competitive yet supportive. I often saw employees going out to lunch together leading me to believe that close relationships were established and they genuinely enjoyed each other's company. The longer I worked for them, the more I realized this was true.

I often found myself laughing and smiling each day while working with the rest of the administrative/accounts payable/human resources team. We were all held to a high standard of quality work by the VP of Administration, however with her kindness and real life outlook she was easily relate-able making us want to succeed in our department and help the company grow.

Throughout the year they have a variety of employee engagement events: Tiger's Games, Chili Cook Offs, Team Dinners, etc. They are involved heavily in giving back to the community and also reward their employees with a wonderful Holiday Party and Awards Ceremony at the end of the year. I also notice there are many training opportunities for their committed employees helping to advance them in their careers. While you are expected to work hard for them, they will also work hard for you!

While working as a contract employee for various companies I was able to experience them as a recruiting company as well. Each account manager I have worked for has been nothing short of professional. They genuinely want to see you succeed and help you in doing do. The last position I took through them was for an automotive company which was intended to be 6 months contract then direct hire. After going through the interview process, they assisted in the negotiation process after I expressed my wishes to shorten the contact time and increase pay. I was more than impressed with the commitment from both the recruiter and the account manager. Both checked in on me periodically and celebrated with me by taking me to lunch.

Over the years I have always referred Reliance One to friends or family looking for jobs because I know they will work hard for them and set them up to be successful.",5.0,5.0,5.0,5.0,5.0,5.0
2019-02-20, Account Manager,"Bingham Farms, MI",Former Employee ,Successful if You enjoy having no life,Successful if You enjoy having no life,0,Commission (as with any sales job),"- Arrogant senior management
- Zero work/life balance - don’t want to work weekends, you’re not “driven” enough
- Micromanaged at every level",Keep doing what you’re doing. The corner stone of every staffing company is high-turnover while the boys club take turns patting each other on the back for building such a “unique” company.,1.0,1.0,1.0,1.0,3.0,1.0
2018-11-19, Account Manager,"Detroit, MI",Current Employee ,Hard work pays off,Hard work pays off,0,great incentives and good pay. flexible time to work from home when you have put in the effort.,Long hours but you have to have a mindset of you work hard you play hard.,Open up the work from home a bit more and you will have happier employees.,5.0,5.0,5.0,5.0,5.0,5.0
2018-11-16,,"Bingham Farms, MI",Former Employee ,Technical Recruiter,Technical Recruiter,0,"They allow employees to play Nintendo during lunch, and have even seen employees playing during work hours.","I would not recommend working for or with this company. The entire company culture is very unprofessional, often vulgar, and all about just hitting your numbers at the end of the week. The numbers are there to gain ""rewards"" based on performance, and when employees start to regularly hit the numbers goals, the system changes to make it harder.

When joining the company they sold the idea that they are there to create relationships with the candidates and clients, which is untrue. The goal is to send people to jobs to get the number quota, without really taking the time to qualify. This goes back to the numbers game. You end up just sending people to the client just to keep up on your numbers, often sending people who are not completely qualified, just for the sake of hitting the quota.

On top of all of that, there is a high stress point placed on getting ""leads"" or references from candidates, just so that they can reach out to the employer to see if they are involved with a staffing agency. I feel that this is a very shady and unprofessional way to build a ""relationship"" business.

Most of the blame and stress gets laid out on the bottom level employees, who are also expected to work after work hours on a regular basis (not overtime). If you do not fit in with the culture, meaning that you will just blindly take orders from management without much question, and blindly ignore a lot of unprofessional banter around the office, you will not fit in.

Lastly, I got sick, went to urgent care and was given medicine to take care of a contagious illness (strep throat), took a day off to recover and then went to work the next day. I was asked if I was going to work from home while I was sick. Later that week was terminated for lack of performance. Mind you this is the week before Thanksgiving, and shortly before Christmas.

This company does not value their employees at any level.

I DO NOT recommend working at this company. The negative reviews are completely true, as I went through many of the same issues",,1.0,1.0,1.0,1.0,1.0,1.0
2018-10-09, Account Manager,,Former Employee ,Good Ole' Boy Club,Good Ole' Boy Club,0,Potential for high salary (like all other sales jobs),"No work/life balance
No growth opportunity
Old school sales mentality - not open to change",Hire external talent and listen to recommendations that they make. Things have changed in the last 20 years.,2.0,1.0,1.0,1.0,2.0,2.0
2018-09-06,,"Auburn Hills, MI",Current Employee ,Executive Recruiter,Executive Recruiter,0,"Growing company where culture comes first and they truly care about their employees. Their philosophy is no participation trophies. If you want it, you earn it. The great thing is that they take care of us. We have weekly, monthly, quarterly, and annual incentives. As a recruiter, I am going to be getting nearly at $10,000 bonus at the end of the year and I am going to Cancun in February. We also give back to the community and are encouraged to make sure we are their for our families. They believe that a happy work life is only possible if you have a healthy life outside of work.","It is hard work. The starting salary was lower than others I interviewed with, but I am making a ton more money because of the commissions I make. I do work some late nights and even some weekends.","You do a great job listening to your employees, but don't go back to the way it use to be. The culutre here is great and couldn't be happier.",5.0,4.0,5.0,5.0,5.0,4.0
2018-05-15,,,Former Employee ,Technical Recruiter,Technical Recruiter,0,"Upbeat and open environment
Peers and managers were friendly
Usually have fun events","Pressured to compete with peers
Consistently required to find leads for account managers
Frequently changes focus and requirements on us.",,3.0,4.0,4.0,3.0,4.0,3.0
2018-02-05,,,Former Employee ,R1 Overview,R1 Overview,0,"Reliance one has implemented many great changes to stay competitive and are doing a better job at listening to employees on the little day to day things, like implementing new wardrobes, allowances and giving more incentives for employees exceeding goals. This will keep retention in the company which is great.",Very clicky like to the point where you have Directors talking about other employees/managers to other employees??? Seems like more of a club than a place to grow a career. It is to the point where it becomes obnoxious to others around that are not included in click - because honestly they're probably choosing not to be. Favoritism runs HIGH here so if you want to compete with people to be successful have at it.,"Managers should be treated like Managers not children. When employees invest the amount of time that is expected from the executives, than to be treated as if an adult is appreciated and means more than a incentive of jeans day or etc. Its things like simply letting employees share their opinion without being threatened for their job that make people want to work for a company long term. You have to learn to listen and not enforce without consulting those around you, believe it or not the people underneath you may have some quality ideas that you're overlooking. Also practice what you preach.",3.0,1.0,1.0,3.0,3.0,1.0
2017-11-28,,,Current Employee ,Review,Review,0,"Open Work Environment
Friendly Employees
Rewarding When you are able to place people","Never off the clock
Emotional Rollercoaster",,5.0,,,,,
2017-11-10,,,Former Employee ,No course direction/training provided,No course direction/training provided,0,Get to meet lots of great people,"No technical training, just get on the phone and start pushing.
No direction, asked what an ideal company looks like to pursue was answered with we'll sell a janitor or a CEO, it doesn't matter.",,2.0,,,,,
2017-09-03, Regional Sales Director,"Dallas, TX",Former Employee ,Growing company that's on the move,Growing company that's on the move,0,"This is a company with a culture of hard work and accountability, two things every young recruiters needs to learn early in their career. I can't promise you working at Reliance One will be easy but I can say that you will develop the skills and habits that will make you successful in our industry.",No cons to speak of.,,4.0,4.0,5.0,5.0,5.0,5.0
2017-08-16, Account Manager,"Bingham Farms, MI",Current Employee ,Fun place to work with rewarding benefits,Fun place to work with rewarding benefits,0,Family feel from working close with Account Managers and Directors. Not everyday you see the owner of the company next to you and actually greets you. The Directors are point the AM's in the right direction to get the Recruiters on the right path.,"Long hours, some late night work/weekend work from home may be necessary but its rewarding at the end. 110% will get you far.",Don't give up quickly on someone. The right guidance/management may help different personal.,4.0,4.0,4.0,4.0,4.0,3.0
2017-08-14, Account Manager,"Auburn Hills, MI",Current Employee ,"Great Culture, Competetive Environment","Great Culture, Competetive Environment",0,"This company has one of the best training and development programs I have ever been a part of. Great culture that provides guidance, support, and motivation from folks around you that truly want to see you succeed.","Long hours that may require some late nights, but you get out of it what you put in. It is a challenging career, but one that is very rewarding.",,4.0,5.0,5.0,5.0,5.0,4.0
2017-08-10,,,Current Employee ,Administration,Administration,0,"-Reliance One is growing rapidly internally and externally
-Fun, open and energetic environment
-Little challenges to help recruiters hit their goals which results in different types of incentives, such as leaving work early on Friday's, lunch cook out's, etc.
-Many company events such as Tigers games, company picnics, company holiday parties
-Management is very involved with each person on their team and cares about employees on a personal level as well as a professional level.
-Executive team focuses heavily on what motivates the recruiters and gives everybody a voice","-If you want a standard 9-5, leave your work at work type job-- this may not be the right fit for you. You have to be committed, dedicated and determined to be successful. You get out of it what you put in but you can have the potential to be very successful at Reliance One.",,5.0,5.0,5.0,5.0,5.0,5.0
2017-08-10,,,Current Employee ,"Reliance One, Inc.","Reliance One, Inc.",0,"Reliance One has great culture, a fun atmosphere, great management, and fun incentives.","-Can have long hours
-Have to be on call all the time to make money",,5.0,3.0,5.0,5.0,3.0,5.0
2017-08-09, Manager,,Current Employee ,Account Manager,Account Manager,0,"Reliance One has a great company culture, as well as great people. For many entry level candidates, Reliance One provides the resources to help you excel and reach your goals within a reasonable amount of time. If you're hungry for success, Reliance One is a great place to be.

We are a fast growing company, but our leadership and executive teams make it a priority to be involved with the teams and make sure we are continually growing and improving on all levels internally and externally.","If you're looking for your typical 9-5 job, Reliance One isn't the right career path for you. To be successful here, you need to be fully committed and willing to put in the time and effort that it takes. You can't expect success overnight. However, if you are fully committed and have a ""do what it takes"" attitude, this isn't a ""con"" for you anyways.",,5.0,4.0,5.0,5.0,4.0,4.0
2017-08-09,,,Current Employee ,Account Manager,Account Manager,0,Wonderful work environment with lots of room for growth and development.,None at the moment.,Continue to encourage your team with positive reinforcement,5.0,5.0,5.0,5.0,3.0,5.0
2017-08-09,,,Current Employee ,Anything Worth Having is Worth Working Hard For,Anything Worth Having is Worth Working Hard For,0,"Opportunity unlimited! It's a proven fact that if you work hard, you reap the benefits.","There are some employees that make it seem a bit ""highschoolish"" with their cattiness and secrets....but you will find that in any organization.",,4.0,3.0,4.0,3.0,5.0,2.0
2017-02-10,,,Former Employee ,Take your great talents elsewhere... You're welcome :),Take your great talents elsewhere... You're welcome :),0,back on Xanax for a few months,"Long Hours-no work/life balance
High Level Stress
High Expectations
No training provided upon hiring new employees Management and Executive Staff
Untrustworthy and Highly Unethical Corporate Level Management.","You claim to be leaders and capable of ""Building Teams"" but you have to know it all starts with actually building a strong leadership team underneath you. Your employees truly need to feel they know what they are getting in a manager and that both people and issues will be dealt with fairly and consistently. Treat everybody with equal levels of respect and always be consistent in your values and mottos. Practice what you preach, and make sure people know what to expect from you starting Day 1. Managers who don’t set clear expectations get muddled results. Best of luck with your glorified temp agency and TEAM of semi-talented order takers.",1.0,1.0,,,,
2016-12-04, Recruiter,"Auburn Hills, MI",Former Employee ,Recruiter,Recruiter,0,"You definitely get pushed to be better.. constantly, but most of time without much reason.
You will learn how staffing works and all the other career paths you can take when you leave, so there's that.","Stuck in the 90's. Low pay, long hours. If you work 50 hours a week that is considered part time in management's eyes. Everything looks great and wonderful until a few weeks in when you start putting things together.

The average day..
""Go ahead, you cant break anything!
IS THAT A TYPO IN YOUR EMAIL OMG THIS IS A DISASTER""
- Says 8 different people","Stop with the power trips. Listen to your employees, and not just the one or two that agree with everything you say because they want a promotion. Good luck!",2.0,1.0,3.0,2.0,2.0,2.0
2016-12-07,,,Former Employee ,Recruiter,Recruiter,0,"Gives you a better understanding of the hiring process and how to prepare for the next position.
Pretty good at selling the company and making you think it's the best company in the world.","Poor communication
Long hours
work/life balance
favoritism","If you want experienced recruiters, hire experienced recruiters. If you are going to hire entry-level recruiters without experience, allow them the opportunity to learn and grow without the expectation to do it over night.",2.0,1.0,3.0,1.0,2.0,2.0
2016-12-01, Technical Recruiter,"Lisle, IL",Former Employee ,DON'T DO IT,DON'T DO IT,0,Starting pay for someone fresh out of college isn't bad,"No work-life balance
Constant employee turnover
Account Managers have no idea what they are doing or how to manage people
Long hours
Culture is awful - everyone is miserable
Time goes so slow
3 months to get commission checks
Boring
Work on low-level positions
Expected to work weekends if you don't hit your numbers
Management tries to brainwash you into believing in the company but it doesn't work
If you are a recruiter you basically sit behind a computer screen for 55+ hours a week, this place sucks the life out of you",,1.0,1.0,1.0,2.0,2.0,3.0
2016-10-21, Technical Recruiter,"Detroit, MI",Current Employee ,Recruiter,Recruiter,0,"Fun, fast paced atmosphere, lots of friends and family","clean shaving, no casual friday",,5.0,5.0,5.0,5.0,4.0,5.0
2016-10-18,,,Current Employee ,Great Company,Great Company,0,Overall a great career path,I don't have any cons as of yet,,5.0,3.0,4.0,5.0,4.0,4.0
2016-08-11, Account Manager,"Sunnyvale, TX",Current Employee ,Review,Review,0,Good culture with arriving new hires,"Poor training, old facilities. Need to update hardware/office supplies",Train more effectively with searching,3.0,3.0,4.0,3.0,2.0,3.0
2016-07-14,,,Current Employee ,Interviewer,Interviewer,0,Just another staffing firm. Not impressive. Very very small- maybe 7 recruiters. If you like start ups with bad pay then this is for you,"Why work here and get paid nothing ($30,000), when you can work at Robert half ($40,000) and Modis ($45,000)? It's just the same amount Of work but they're taking your money.","Pay your people. You're the same as any other staffing firm- at least the others have legitimacy, and they pay a livable salary- with commissions",1.0,,,,,
2016-06-09, Technical Recruiter,"Auburn Hills, MI",Former Employee ,Don't. You will thank me later,Don't. You will thank me later,0,"just don't do it. If you've been called by somebody or you're thinking about making a move, don't let it be to this place. You'll never see so much arrogance, stupidity and sleaziness in one place like you will here.","Just so much dumb. If you are desperate enough and choose to join this weird cult like place, you will see and hear some of the dumbest things you have ever seen/heard in your entire life. You will be exhausted from it. Just trust me, it's not worth it.","Start over. You guys are actually really good guys, but you've empowered some of the worst and most unintelligent people to be the faces of your business. The people you see as the brightest in your company are gutting it from the inside out because nobody can stand these people. Not their recruiters and certainly not the managers they deal with. You have one good account manager and if you don't change and you keep on the same path you're on, eventually she will wise up and she'll leave. When she does, she'll take the only good thing about your company (and all of the business) with her. Fix it before it's too late.",1.0,1.0,1.0,1.0,1.0,1.0
2016-02-22,,,Former Employee ,Good Experience,Good Experience,0,Reliance One is a great place to start your career. Lots of opportunities to learn about business every day.,Employees could be paid more and hours could be less intense.,,4.0,,,,,
2016-03-16, Technical Recruiter,"Rochester Hills, MI",Former Employee ,Technical Recruiter,Technical Recruiter,0,Great way to get your foot in the door to the staffing industry. Gives you the opportunity to help people improve their lives,"9 hour work days with the expectation to work mostly every weekend. Constant micro-managing by most of the leadership. Expectation to be able stomach getting along with all of these said managers, in order to be promoted.","Recognize when a manager is just awful at his/her job and take steps to correct this. Instead of having morning recruiter meetings centering around topics such as ""the correct way to wash hands after using the bathroom"", maybe focus on more meaningful subjects.",1.0,1.0,1.0,1.0,1.0,1.0
2015-12-10,,,Current Employee ,Progressive Company,Progressive Company,0,"Progressive and rewarding environment, looking to growth across US, customer service is a top priority, team building, gives back to the community, and referral bonuses.","Must be able to work under pressure, put in the hours, and be committed to the job if you expect results. High intensity environment, but it produces results.",,5.0,4.0,5.0,5.0,3.0,4.0
2015-08-21, Recruiter,"Auburn Hills, MI",Former Employee ,Recruiter - Dont Do it,Recruiter - Dont Do it,0,Great entry level sales job for people with no degree. But they will work you like Nike sweat shop,"Micro Managed to death/ 12 hour days and weekends will be required if you don't meet the quota.
Says there is vacation, there is some offered, but if you use it you will be fired.
No work life balance at all except for upper management
They will only promote the popular kids, rather than the hard workers",Stop promoting your friends and promote hard workers and maybe you will grow. Also invest in your employees and maybe you wouldn't have high turn over.,1.0,1.0,1.0,1.0,1.0,1.0
2015-05-22, Senior Quality Engineer,"Saginaw, MI",Current Employee ,Contract,Contract,0,Get company to work for. Always there to help with questions. Very friendly staff,Office is 75 miles from my current job.,"Offer more benefits, cover cost for needed job equipment.",5.0,,,,,
2015-03-18, Technical Recruiter,,Current Employee ,Growing Team with an Awesome Culture,Growing Team with an Awesome Culture,0,"Honestly one of the best decisions of my life was accepting my offer here, everyone here wants to see you succeed and it's like a big family here. The company and management will always help you and give you the right tools to succeed. If recruiting is your thing, Reliance One is a great place to work. (Rated top 30 places coolest places to work in Detroit).","Long hours, insurance is a bit pricey, some days can be hard if you're trying to fill a tough position but that's the nature of the business.",Keep the positive environment going and continue to focus towards growth and expanding into new markets!,4.0,4.0,5.0,5.0,4.0,4.0
2014-09-17,,,Current Employee ,Provides a good part time position,Provides a good part time position,0,If you like to drive for 8 to 10 hrs a day this is the job for you. New cars and trucks are provided.,Later starting time for start of shift would be helpful. I travel approx. 32 miles one way and starting at 5am requires me to get up at 3am.,Provide more on site management,4.0,,,,,
