date,employee_title,location,employee_status,review_title,years_at_company,helpful,pros,cons,advice_to_mgmt,rating_overall,rating_balance,rating_culture,rating_career,rating_comp,rating_mgmt
2019-02-06,,"Austin, TX",Former Employee ,Not worth the wage,Not worth the wage,0,"Kind of flexible schedule, some autonomy, free drinks","Sitting at one place for a long time, low wage",,3.0,,,,,
2019-02-27, Medical Scribe,"Austin, TX",Former Employee ,"not great, better off volunteering","not great, better off volunteering",0,the experience was helpful to some degree.,"extensive training for super low pay, too many hours to handle, draining and boring environment. higher ups don't appreciate their staff and overwhelm them. students looking for a resume boost are better off sticking to volunteering or shadowing, way less hours and more manageable.","cut hours/ be more flexible with them, hire more staff, and raise pay",1.0,1.0,1.0,1.0,1.0,1.0
2018-09-23,,"Austin, TX",Former Employee ,:(,:(,0,sitting for long periods of time,"quotas mandatory
schedule is not flexible if you're a student
very low pay $8.50, not worth it to sacrifice your time as a student when you can get paid better at a fast food or even on campus job
boring
too much sitting
boring",,1.0,1.0,1.0,2.0,1.0,1.0
