date,employee_title,location,employee_status,review_title,years_at_company,helpful,pros,cons,advice_to_mgmt,rating_overall,rating_balance,rating_culture,rating_career,rating_comp,rating_mgmt
2015-03-03,,,Current Employee ,"Great mission, sometimes needs help with execution",,0,"Samasource is full of smart and enthusiastic people. People are generally eager to help you when you need it. There's tons of room for growth. For a non-profit, their compensation packages are pretty competitive.","While there may be tons of room for growth, the path for that growth is not always well defined. Also, the passion about the mission can actually lead to burn out quickly. The company needs to be more proactive in not allowing its people to get to that point.","More focus in priorities and projects -- just like you can't change the world in a day, you can't do all you'd like to do to end poverty and its effects ""right now"". Sometimes doing really well on a project will mean saying ""no"" to another equally powerful initiative. That's just the economics of time and energy.",4.0,2.0,5.0,3.0,4.0,4.0
2015-03-04,,,Current Employee ,A social enterprise that has matured its overall management without stagnating its impact growth.,,0,Everyone is super nice with an array of talents from different backgrounds. The company still feels small enough where I feel like I'm making a significant contribution. And there are lots of exciting things to work on throughout the Sama Group.,"Pay is still below market, and hiring can be a challenge with such a competitive market in San Francisco.",Stay focused on impact and don't diverge too much on time-consuming distractions.,5.0,5.0,5.0,4.0,3.0,5.0
2015-03-03,,"San Francisco, CA",Current Employee ,"An exciting, innovative place to work.",Less than a year,0,"Lots of new perks and policies committed to employees. Fun place to work. Probably the biggest perk are the people at Sama. Everyone is incredibly smart, accomplished, and motivated by our mission. The mission and values are pervasive at Sama and are incorporated into everything we do. Managers are great, a culture of open feedback. The direction the company is heading is very exciting and I expect a lot of growth as we continue to move forward with our mission. Open office space, no one is stuck at their desk, there are lots of couches and other areas to work. Plenty of activities to encourage office bonding and cross-team interactions.","Not enough space! We have outgrown our space and its starting to get crowded. Also, it can get very hot inside of the office and there are not enough windows.",Keep doing what you've been doing! Things have really changed in the past year for the better and there have been many improvements.,5.0,5.0,5.0,5.0,4.0,5.0
2015-02-23,,,Current Employee ,Growing company doing great work.,,0,"The people - lots of talented, interesting people. Rewarding work that makes a difference in peoples lives. Open start up culture. Strong management team that is working hard to build relationships. Company looking at different ways to improve the employee experience and continue doing meaningful work.","Location - right in the heart of the mission and can be a difficult place to come to work. But the company knows that and is addressing it. Also, because it is a start up, it is sometimes easy to get pulled into something with very little notice. This can make it stressful to stay on track and get everything done. And there can be some hostility between certain departments that needs to be addressed.","Work towards transparent communication, sharing information between departments and addressing issues as they come up. Growing causes growing pains and adjustments have to be made to accommodate that.",4.0,4.0,4.0,4.0,4.0,4.0
2015-01-08,,"San Francisco, CA",Current Employee ,"Fabulous Working Environment, With a Few Kinks!",Less than a year,0,"-The people here are by and large the most intelligent, hardest working, and wonderful you could hope for. It feels like a family much of the time!
-The office itself is quite nice, with fun amenities like lots of snacks, beverages, and it's dog-friendly!
-The mission of the organization is fantastic, as are the people we work with overseas.
-Schedules are very flexible, and though there is a ton of work to be done, you are still able to work around your other commitments.
-Benefits are more than adequate, and include full health, dental, vision, life, plus little bonuses like cell phone and gym stipends.","-Leadership can be garbled at times. Individual teams are wonderful, but there is sometimes friction between teams and C-Level staff is often too distant or ill-informed to provide any assistance.
-The actual building that houses the office and the area of the Mission are pretty awful and scary. Once you get off Mission St there are lots of wonderful restaurants and shops, but the immediate area is gritty and dangerous.
-The CEO is a visionary and very intelligent, educated, and hard working, but extremely difficult to relate to. I think this is typical for big-idea people, but it can be grating on an interpersonal level. Most frustratingly, you can expect that it will always appear that Sama is a one-woman show (it's not, really, there are dozens of incredible people behind the scenes who make it happen!). Of course, we wouldn't exist without her, but it would be nice to feel a little more valued by her for making Sama what it is today.","Overall, management is hard at work scaling the organization, improving processes, recruiting fantastic people, and making the organization all that it has the potential to be.",5.0,4.0,5.0,5.0,4.0,4.0
2014-12-16, Junior Chief of Staff,"San Francisco, CA",Current Employee ,An innovative social enterprise and a great place to work!,Less than a year,0,"Sama is one of the best young, innovative social enterprises to work at today, having been one of major organizations contributing to the early growth of impact sourcing as an industry. Unlike other organizations in the space, the leadership is truly working to create a sustainable, break even business that has a huge social impact globally. The team is fun and passionate - all with diverse, unique world views, and most with previous experience working in developing countries in the field. The Founder and CEO, Leila Janah, is able to clearly and passionately communicate her vision and mission in a way that compels people from all backgrounds to contribute to the cause: providing opportunity to those born into poverty. I highly recommend working at Sama, especially if you want to have a career in social enterprise or social entrepreneurship.","Because the organization is still relatively young, it operates like a startup. For some from big corporate and traditional non-profit backgrounds, this can be a little shocking not having a lot of established processes or certainty in strategy. For others, it's a dream. You need to have a complete sense of accountability and transparency with your work to be able to fit in with the culture, and for some, that can be an adjustment. Because the organization is still firmly registered non-profit legally, salary packages are not reflective of the for-profit rates, although they're able to recruit some of the best talent from the for-profit world regardless. The organization has a tough application and interview process, and has a tendency to offer contract to hire positions instead of immediately providing a job offer. This works well to find a good cultural match internally for the longer term, but can be stressful and irritating to new hires initially.","Continue to recruit mainly for-profit and technology background experience, especially in more senior roles. Avoid hiring for experience in political fundraising and traditional non-profit management.",5.0,4.0,5.0,5.0,4.0,5.0
2014-11-20,,,Current Employee ,Run away,,0,Social Cause which great concept,"Terrible CEO
Good at MARKETING
Good in self promotion only",Treat people with respect the way you sell your services,1.0,4.0,4.0,2.0,2.0,1.0
2013-12-05,,"San Francisco, CA",Current Employee ,Promising mission but not executing properly,More than a year,0,"- CEO is inspiring, hard-working and highly visible leader that has brought significant attention and funding to the business
- Tackling a real problem and making a tiny, but genuinely helpful, impact
- Non CEO employees are nice, hard-working and aligned","- For all her benefits, the CEO is the biggest issue. Quite simply, the company will never succeed until they replace her
- Turnover has probably been 75% in the past year, and includes entry-level employees all the way to the COO and board of directors
- Low morale in an environment that should be the opposite; people don't seem to enjoy coming to work, and that starts at the top
- Talented employees are not incentivized to stay or to work on other things; without high pay or stock options, the company needs to give them other reasons to stick around
- CEO has unreasonably high expectations which not only frustrates employees but in turn affects current clients",,2.0,4.0,4.0,2.0,3.0,2.0
2013-07-23,,"San Francisco, CA",Current Employee ,Get ready for a rocky ride.,More than a year,0,"1. This IS a cool company in 100 ways.
2. Most of the people here are amazing, great and interesting people.
3. You will be given the opportunity to really own and build something to drive change -- not always, but at times.
4. General management team (including current COO) are strong, passionate, and reasonable.
5. Culture is good: respectful, fun-loving people.","Turnover is above and beyond what is 'normal' for a start-up or for a nonprofit. These are what I believe are the biggest reasons why:

1. Constant irrational demands from the top with unprofessional and patronizing delivery.
2. Money, HR, processes, and high level decisions are not managed well.
3. No efforts have been made to retain high performers. Their exits have hurt the company, year after year, since inception.","Your employees are not solely your pawns and are not stupid -- you need them just as they need you. You should trust your employees. Do not talk down, frame, misdirect, or ignore them. Try to resist ""going through the motions"", ""quick fixes"", and ""checking the box"" -- especially for major decisions. Continue to make steps in the right direction which will lead to improvement in both the short and long-term success of the company. The last few months have been promising.",3.0,3.0,3.0,3.0,2.0,2.0
2013-05-28,,"San Francisco, CA",Current Employee ,"Lots of Promise, But Ultimately a Disappointment",More than a year,0,"- Located in SF
- Smart, talented, dedicated, fun staff
- Social mission
- Genuine respect between most employees
- Great outward facing company image
- Excellent at framing/storytelling
- Hiring a COO is a step in the right direction but she needs full control to be successful","- Extremely high turnover: out of a 30 person office, in the last 12 months 18 FTEs have quit, 3 have been let go
- Highly inexperienced, micromanaging senior leadership (CEO, VP Operations)
- CEO is arguably the biggest reason for people leaving (difficult personality, lack of true business experience, egotistical behavior)
- Unstable business model -- missteps on the business side are gravely hurting the social mission
- Serious lack of focus and direction, major decisions and opinions change daily
- No alignment between Sales-Delivery-Marketing-Development team goals and direction
- Poor HR practices (no escalation process, no formal HR, no managerial oversight)
- HR and Finance are run uprofessionally by people without any experience
- Sensitive information (i.e. HR, pay, role changes) are handled without professionalism and stored in public folders
- Very tense/awkward office environment (negative culture)
- Little to no financial transparency
- No career path
- Arbitrary promotions and raises (not based on tenure, merit, or path)
- Not family friendly (long hours, no PTO for working or expectant parents)
- Lack of work-life balance is what is valued, not performance
- Favoritism (those “close” to upper management are out of the office 40% of the time)
- Acts like a start up when it’s convenient and a nonprofit when it’s convenient
- Wasteful with resources","- Be honest!!! Do not deceive or “frame” constantly
- Trust and value your employees
- Do not lead by fear, threats or intimidation
- Do not lead by negativity and criticism
- Bring in experienced leadership
- Focus less on short term fixes and address the real reasons why employees are unhappy
- Don’t just go through the motions of pretending to care about employees
- Make sure employees have a real career path
- Follow HR/legal practices",2.0,1.0,3.0,1.0,2.0,1.0
2012-12-17,,"San Francisco, CA",Former Employee ,"Samasource has a great mission, but does not have any focus on the employees.",,0,The mission is really wonderful.,Employees are not disposable assets.,The employees are just as passionate as management in the mission. Treat the employees with more respect.,3.0,1.0,4.0,3.0,2.0,3.0
2012-05-03, Director of Engineering,"San Francisco, CA",Current Employee ,World Class,,0,"The best reason to work at Samasource is the caliber and character of the people that work there. The company has an ambitious goal and world class leadership. It's still a young organization and change happens often and quickly. Samasource has cultured an amazing network of supporters from industry, academia, NGO, and government. It's a leader in the social enterprise and non-profit tech space and has built a great brand. The culture is very work hard, play hard. It's a great place to learn if you're willing to put in the effort and can deliver.","It's an intense environment and not for the faint of heart. There are high expectations for every employee. On joining you can expect to be challenged and the organization lives up to its mission of giving work. Things change pretty quickly, and success is usually dependent on taking ownership and being persistent.",thumbs up.,5.0,3.5,5.0,3.0,5.0,
2012-04-05,,"San Francisco, CA",Former Employee ,Inspiring Vision but arrogant and inconsiderate leadership to the point of driving employees away within months of hire,,0,"Microwork is a novel and incredible idea

Chance to work in downtown SF in SOMA

Samasource is a high- profile and inspiring nonprofit

chance to work in a small, diverse, energetic team

Everyone at the company is very intelligent, talented, and hard- working

brilliant board of Directors

chance to wear many different hats

Chance to ""give work"" to people living in impoverished areas in the world. You go to work everyday, knowing that you're helping thousands of workers in other countries.","Disrespect for entry- level employees. examples: an intern was told by management that he was ""low on the pole"", the entry- level employees are typically given seats facing the wall and in the corners, interns shared desks

Management bandwidth is limited. This resulted in very little guidance and direction from your direct manager.

Tiny office space; people can easily disrupt others simply because of the crowded space

Extreme hours and demands for low- income salary (Most people do not leave the office before 7 pm)

High turn-over rate (about 50% turnoever every few months)

the CEO, while inspiring, brilliant, and driven, was extremely hard to work with. She barked out people's names and orders, criticized harshly to the point of making employees cry, and rarely praised anybody's hard work.

lack of communication between management and employees. In such a small team and space, employees are hesitant to voice concerns to superiors (ie, about their hours, treatment by the management, compensation). Management withholds important information from employees.

General feeling of unhappiness and tension within the office, coworkers are not friends outside the office. Office happy hours feel unnatural","Form and encourage a culture of respect and admiration. Every employee you hire, whether intern, entry - level, contracter, or VP, is precious, intelligent, and well- connected. Former and current employees will talk and the Silicon Valley network is a small one.",2.0,2.5,1.5,1.0,2.0,
2012-03-22,,"San Francisco, CA",Current Employee ,"Because people want to get paid, instead of getting aid",,0,"Samasource provides jobs that pay living wages to those in the developing world. We specifically give internet-based work to people who have previously made less than 3 dollars a day, and sample tasks include transcription and data entry.

On the technology side, things are solid. I believe my colleagues are very good software developers, and the code base has good test coverage.

In addition, the transparency within this organization is very high.","It is a moot point because we are moving to a new office in May 2012, but one employee is allergic to something in the conference room.",,5.0,4.5,3.5,3.0,4.0,
2019-03-29, Customer Service Agent,,Current Employee ,Customer service,More than 3 years,0,"Excellent benefits
Flexible working hours
Structured management
Sufficient allowances
Room for growth","Involving work,
Limited holidays
Too much pressure
Lack of security
Minimal free time",,4.0,4.0,4.0,4.0,4.0,4.0
2019-03-20,,Nairobi (Kenya),Current Employee ,State of Affairs,More than a year,0,Good work environment with good people.,"We currently have an arrogant and all time bad management. We have a lot of pressing issues that are never addressed with the seriousness they deserve. It has failed to honor one of the pillars that he organization is built upon; Humanity.
Some of had to wait a whole year for a $5.00 salary increment. $5.00!! After a whole year!! What a big joke.
 Promotions are made, for lack of a better word, prematurely leading to frustrations instead of enjoying the perks that come with promotions. Vacancies are announced every other day but they are a very raw deal. We have people who have been in acting capacity for up to a year some of whom don’t even get paid incentives yet their KPIs are same as those who earn close to thrice their salary and are privileged with other resources which is VERY WRONG, not motivating at all and creates bitterness in a work environment.
Some of us have to work on weekends because of another project growing yet we don’t feel the impact of the growth.
The center is slowly being run down evident from things like team bonding being scrapped off.
All the loses the company is making is a making of our own resulting from the zero motivation and bad management and their irrational decisions. We are not a happy people!!","Motivation is everything to an employee. Try that more often.
Hire a comprehensive team to work on serious issues like promotions and planning of work days because what we at the moment is pure frustration.
Put back the human in human resource and uphold the humanity as in our values.
The company employing us is not a favor but a matter of mutual benefit so make it look like so.
Restore some sanity by hiring and firing of the top management who have gotten comfortable and are ruining a noble course.",4.0,2.0,5.0,4.0,3.0,1.0
2019-03-26, Agent,Nairobi (Kenya),Current Employee ,Good but could be (so much) better,Less than a year,0,Good working spaces plus affordable meals for the majority of the staff who are from poor backgrounds,Salary(200 USD per month) of an agent is too low considering Nairobi is ranked among the most expensive cities to live in Africa,Increase salary to about 350 USD for an agent but otherwise congratulations for changing lives of so many of us,3.0,1.0,5.0,1.0,3.0,
2019-03-25, Director,Nairobi (Kenya),Current Employee ,Director,More than 5 years,0,"If you are a true professional, try at your own demise.",The company portrays a false professional outlook while it runs like a personal kiosk.,"Stop preaching water and drinking wine. Avoid roadside declarations & decisions. Avoid running the organisation through gossip based discussions and personal feelings. Be honest and fully transparent in your impact agenda and the donations you receive. At this current rate, you will suffer a lot of loss in senior personnel resources.",2.0,2.0,2.0,2.0,2.0,2.0
2019-02-10, Agent,Nairobi (Kenya),Former Employee ,Wonderful,Less than a year,0,Encouraged team work and job security,Establish more job station in interior parts,Keep up with the good job,5.0,5.0,5.0,5.0,5.0,5.0
2019-02-07, Agent,Nairobi (Kenya),Current Employee ,Service delivery,More than a year,0,it is the best place with perfect management,too much pressure which is okay,you are the best,5.0,3.0,5.0,5.0,1.0,2.0
2019-02-10, Agent,Nairobi (Kenya),Former Employee ,Anonymous,Less than a year,0,Getting to know new people,Much work but Less pay,As much as you are improving the lives of your employees check on the inflation rates and consider hiking the salary for your employees. Employees are living from hand to mouth and thus cant grow or even be a help to their families.,2.0,1.0,5.0,1.0,1.0,3.0
2019-01-14, Call Center Agent,Nairobi (Kenya),Current Employee ,Agent,,0,"availability of resources, and recognition for accomplishments.",Restricted mobility Or Growth and Lesser job security.,,4.0,3.0,3.0,3.0,3.0,3.0
2018-12-19, Agent,Nairobi (Kenya),Current Employee ,Agent,Less than a year,0,Easy working space and awesome learnig experience.,times the internet is too low.,improve on the internet.,5.0,5.0,5.0,5.0,5.0,5.0
2018-12-14, Agent,Nairobi (Kenya),Current Employee ,Great Company but needs some improvements,More than a year,0,"Samasource gave me an opportunity to have a job when I had almost lost hope. I have gained digital skills and met new friends, it’s a great place to work.","Our targets are sometimes unrealistic, we work very long hours to meet targets and TLs don’t understand.
There’s also a lot of inequality between us Agents and the other staff, we are treated very lowly.
The HR who is our last hope is cold and unapproachable, and the way she treats her juniors is not any better.","Continue giving opportunities to youth but don’t treat us like it’s a favour, we work really hard.",4.0,2.0,5.0,2.0,3.0,3.0
2018-12-13,,Kampala (Uganda),Current Employee ,Individual Contributor,More than 5 years,0,"Multi cultural, career growth, involving",Neglect some of the posts,,5.0,5.0,4.0,3.0,3.0,3.0
2018-11-28, Team Leader,Nairobi (Kenya),Current Employee ,Perfect Place,More than 3 years,0,"Good place to be ,growth opportunity",No Cons for now .I love Samasource,Good job so far favoritism is not as much nowadays,5.0,5.0,5.0,5.0,5.0,5.0
2018-12-10, Administrative Assistant,,Current Employee ,Admin Assistant,Less than a year,0,It is a great company providing job opportunities for low-income earners,"The chances of growth are limited.
The salaries and benefits are also low compared to the work done.","Please put back the human in human resource. Value your employees by compensating them well.
Management should also allow junior employees to perform important tasks and guide them for them to develop their skills",2.0,3.0,4.0,2.0,2.0,4.0
2018-12-08, Agent,Nairobi (Kenya),Current Employee ,Agent,Less than a year,0,You get to meet new people everyday and you learn how to be a team player.,Sometimes the projects don't last that long.,Please notify the employs when a project is about to end.,3.0,,,,,
2018-11-28, Agent,Nairobi (Kenya),Current Employee ,Agent,More than a year,0,Job opportunity and good working environment,Too much work with poor payment,Consider your employers. do not show them that they are poor and you are doing them a favor. pay them according to the work they do.you make a lot of money from their jobs .,3.0,1.0,5.0,4.0,1.0,4.0
2018-11-05, Agent,Nairobi (Kenya),Current Employee ,Agent,More than a year,0,its okay to work here,they pay just the same with someone who has stayed longer and a new one,pay according to stay,4.0,3.0,3.0,3.0,3.0,3.0
2018-10-09, Agent,Nairobi Industrial Area (Kenya),Current Employee ,Agent,More than a year,0,We collaborate with one another many of times,Its a bit challenging to be promoted,"Not to consider certificate at all time,also to consider work experience.",5.0,4.0,4.0,3.0,4.0,4.0
2018-10-09,,,Current Employee ,agent,,0,continuous growth within employees yearly.,shift changes after a short duration.,keep up the good work,4.0,4.0,5.0,5.0,3.0,4.0
2018-09-25,,,Current Employee ,agent,,0,well equipped with modern materials and with literate and competent employees,its working environment is so favorable that one cant reason beyond Samasource,Keep on serving at the same spirit,5.0,2.0,,,,
2018-09-19, Adder,Nairobi (Kenya),Current Employee ,Adder,Less than a year,0,There is room for career growth.,Long hours in some projects.,'Don't judge a book by a cover',5.0,4.0,5.0,4.0,3.0,4.0
2018-09-03, Agent,Nairobi (Kenya),Current Employee ,sama source limited,More than a year,0,"good working environment
good health insurance","little pay
too much work plus a little pay",none,3.0,2.0,5.0,2.0,4.0,4.0
2018-09-20, Agent,Nairobi (Kenya),Former Employee ,Agent,More than 10 years,0,At least good salary for tinagers like us,Contract termination for a silly reason,Before you terminate the contract of a person look at the performance recently.dont just jump in to silly solutions.,1.0,1.0,1.0,1.0,3.0,1.0
2018-08-01, Agent,Nairobi (Kenya),Current Employee ,Agent,Less than a year,0,It has good management and the working conditions are okay.The benefits are very good and they are so understanding.,some small hiccups here and there.,Continue with the good work and spirit.,5.0,3.0,5.0,5.0,5.0,5.0
