date,employee_title,location,employee_status,review_title,years_at_company,helpful,pros,cons,advice_to_mgmt,rating_overall,rating_balance,rating_culture,rating_career,rating_comp,rating_mgmt
2018-04-12,,,Former Employee ,Dream job,,0,"-the best coworkers: intelligent, mission-driven, all around wonderful humans
-incredible leadership who take a personal interest in your well-being
-effective and impactful model: Samasource is changing lives in a sustainable way
-org wide commitment to excellence, transparency, and innovation
-approach to international development is built on respect and empowerment
-autonomy and creative freedom in your role
-flexibility to work from home
-paid a living wage (which is saying a lot for a nonprofit in SF)","-constantly shifting priorities
-too many hats, which sometimes made it difficult to be successful in specific functions",,5.0,5.0,5.0,4.0,5.0,5.0
2019-01-18,,,Current Employee ,Project Manager,,0,Supportive Culture and AMAZING people.,Pay is not that great.,,4.0,4.0,5.0,4.0,2.0,3.0
2017-10-30,,,Former Employee ,Summer Associate Intern Samasource/Samaschool,,0,-great colleagues and work environment,-lots of turnover and some politics,management should focus on professional development/retention,4.0,,,,,
2017-06-06,,"San Francisco, CA",Current Employee ,Social Enterprise with Incredibly Talented Team,More than 5 years,0,"As somebody who has been at Sama for many years, I can say quite sincerely that the org, the leadership and culture has evolved substantially in my time here, and that I feel very happy and fortunate to be here. I'm also looking forward to being part of Samasource's future as a leader in the world of social impact, as well as a provider of high quality services in the world of tech and machine learning in … 



Show More","The office location is not my favorite, as 16th and Mission can get pretty rowdy, and the building itself is a bit old, but it's something I can definitely live with, especially since there is flexibility to work from home more often than other jobs I've worked at.",,5.0,4.0,5.0,4.0,4.0,5.0
2016-12-14,,"San Francisco, CA",Former Employee ,"Great people and mission, fast-moving and ever-changing",More than a year,0,"I thoroughly enjoyed everyone I worked with. My co-workers were smart, dedicated, and fun to be around. I feel the organization is making a meaningful impact in the world. Management actively seeks out feedback from employees and works to improve areas that are challenging for employees.","My job title, manager, and responsibilities changed frequently due to turnover and shifting priorities. I was constantly taking on new projects and putting others on the back burner. It sometimes felt like we were chasing things rather than setting a strategy and pursuing it.","Continue to listen to feedback and build on the organization's strengths - it's people, mission, and work environment.",4.0,4.0,5.0,4.0,4.0,3.0
2016-11-01,,,Current Employee ,Cautiously optimistic,,0,"This organization is outcomes driven; constantly striving to evaluate and re-evaluate how to deepen and broaden impact. Impact sourcing is hard, especially in a competitive environment. However, the desire to continue experimenting, investing, succeeding and sometimes failing, makes this an incredibly inspiring place to work. I am consistently amazed at the maturity and caliber of talent this organization has.","Working in a budget constrained environment can be challenging. With a mission as broad as solving poverty, it can be tempting to lose focus and drive too many initiatives.",Focus - Keep your eye on the ball. Invest in your team by promoting from within and creating as many growth opportunities as possible. Keep a discipline of sustainable growth.,5.0,,,,,
2016-10-19,,,Former Employee ,"Sharp, values-driven employees",,0,"All-hands meetings were well-attended and valuable
Ops and product leadership are fantastic
Office space is beautiful, conveniently-located, and dog-friendly
Employees extremely welcoming of newcomers","High turnover leads to perpetual hiring cycles, which are difficult on all current employees
Sama brand has fragmented into too many different directions, sacrificing integrity
CEO is out of touch with daily operations",More emphasis on supporting internal movement to prevent problems with turnover. Many employees would benefit from and are interested in at least a trial period in another position.,4.0,4.0,5.0,4.0,4.0,4.0
2016-10-17,,"San Francisco, CA",Former Employee ,Samasource is a great brand and therefore stepping-stone to launch your career,More than a year,0,"I am sharing my experience at Samasource after having left the company more than 3 years ago. (I am writing this in the Fall of 2016, and I resigned of my own accord in mid-2013. I didn't depart to join another company; I left Sama to take some much-needed time off and gain some perspective.)

Within 3 months of my departure, 7 staff people (2 of which were on the management team) and 2 board members also … 

Show More","Back in 2013, Samasource was a sinking ship. However, to Leila's credit she rebuilt the team from the ground up, and in 2014 reset the management structure entirely. And, importantly, she reset the Board. Nevertheless, I still hear of regrettable attrition and there is even a closed / secret Facebook group of ex-Samasourcers, seeking counseling and support, after their negative experiences.

However the … 
Show More","Advice to management: Keep hiring the best and brightest. There is something in that Kool-Aid you serve that is oh so sweet and catches us all in like flies.

Advice to staff: Don't stay longer than 1-2 years. That's all you need to launch into the next iteration of yourself and your career. Samasource will use you; It's okay to use them too.",1.0,1.0,1.0,5.0,1.0,1.0
2016-08-26,,,Current Employee ,Project Manager,,0,"Amazing team, work environment, flexible schedule, career growth, learning opportunities, and being able to connect with people from all different backgrounds. I feel like the work we do truly is making a social impact and we are creating a model that can/should be followed by others. We are showing how it's possible to make sustainable social impact through a revenue model that gives us the ability to reinvest and … 
Show More","Since we connect low-income people to the digital work economy, it's challenging to deal with the inevitable lack of resources, skillsets, and infrastructure of these third-world economies when also striving to be competitive in the market. However, this biggest challenge is also the biggest motivator to continue what we are doing because we are beginning to prove how it can be done.","Continue to promote transparency, two-way feedback, collaborative office space, and future company direction updates. I recognize the bad reviews of Leila, but we wouldn't have the visibility, connections, and success that we've had (and are having) without her work. It takes a driven, commitment person to travel, speak, and connect with influential people as much as she has done and she is always thinking about how … 
Show More",5.0,4.0,4.0,4.0,4.0,5.0
2016-02-29, Executive Assistant,"San Francisco, CA",Current Employee ,Fighting Poverty Against All Odds,Less than a year,0,"Being at Sama is to become a gladiator in the greatest battle against inequality and to help give work and education to those that lost in the lottery of life. It is to spend everyday around people who leave you inspired by their brilliance, dedication, and resilience. It is that village of people creating change in the world, some of us are seeking to be part of. The work nurtures a strong dynamism and agility to … 

Show More",Fighting inequality is a battle. It is not a standard shift at the factory to clock in and out of. It requires a lot of heart and stamina because poverty is a monster with many limbs and there is no single solution to overcoming it. Some days it feels very heavy because inequality is a never-ending battle and the weight of it all sometimes follows you home and sits on your mind or your inbox.,Keep fighting the good fight,5.0,4.0,5.0,5.0,5.0,5.0
2016-02-29, Anonymous,"San Francisco, CA",Current Employee ,Strong mission and inspired leadership,,0,"I loved the culture (West Coast, non traditional) and people. Met some of the smartest people I've worked with. The mission is inspiring even though its ambitious. There are good opportunities for advancement.",The company could be better at communicating and salaries aren't as high as at a for-profit. Some people don't like the office location.,"Communicate more effectively - especially the thinking behind major decisions.
Promote more from within.",5.0,5.0,5.0,4.0,4.0,5.0
2016-02-29, Instructor,"Dumas, AR",Current Employee ,This is how an impactful organization is ran,More than a year,0,"Sama is a great place to work for anyone who is looking to begin or expand a career. Sama is especially for people that put their heart into their work. The salaries are great for a non-profit and the infrastructure is just as excellent. I have grown more in 1.5 years at Sama than I did in my previous 15 years in the workforce. In a microwave world, work that really matters doesn't matter to most because we are looking for quick fixes to get us through a project or assignment rather than digging deep to create substantial solutions. The thing I love about Leila Janah is the way she challenges and stretches you as a worker. It is a privilege to work with someone with such passion and a great brain to pick. My passion is helping those that are in need of empowerment and I have the right job and CEO for that.","I work remote, but I still love it!",Keep working hard and being innovative. You are making great impact for those that matter most in this line of work.,5.0,5.0,5.0,5.0,5.0,5.0
2016-02-15,,,Former Employee ,"Good colleagues, good mission - all stunted by CEO",,0,"- Great colleagues who, for the most part, are smart and dedicated
- Admirable mission: trying to reduce poverty in the developing world in a sustainable way
- Well-stocked kitchen
- Depending on your role, interesting travel opportunities","- The CEO is great at inspiring people externally and sharing the Samasource mission. However, she's dismal at internal communication and management. Smart senior managers get hired, aren't enabled to take ownership of their roles and make decisions, become disheartened, and leave after 12-18 months. Then the cycle repeats itself.
- This unfortunate cycle means that the organization's growth is incredibly stunted: they effectively have to start over every year. This has led to cash constraints and an overall negative effect on morale and company culture.
- Classic ""Founder's Syndrome"" is at work here. Samasource is 1) too founder-centric (vs. mission-centric); 2) poorly managed (CEO is good externally, poor internally); 3) no succession planning - unclear if management has a plan to have her transition to more of a Chairperson type role; 4) a Board with no teeth.",Figure out a way to address the Founder's Symptom issues - start enabling other senior managers to speak at conferences or take the lead on fundraising; remove the CEO from daily operations; make sure there is a clear plan for a new CEO to take over; install a new Board that will actually hold a new CEO accountable for impact.,2.0,3.0,2.0,2.0,3.0,1.0
2015-12-07,,"Farmington Hills, MI",Current Employee ,Agent,,0,Its the best place to work. with great benefits,No negative i have noticed,,5.0,4.0,5.0,5.0,4.0,4.0
2015-11-01, Executive Assistant to Chief Executive Officer,"San Francisco, CA",Former Employee ,"Great relationships built, all disheartened by CEO",More than a year,0,"Samasource is a great place for individuals directly out of college to grow and learn new real-life experiences in the work force. The company has tried to give employees more flexibility on their work environment, like working from home on various days. The office is in the heart of the Mission with lots of restaurants and unique shops. It is just unfortunate that it happens to be on the seediest intersection in the neighborhood. I made a lot of wonderful friends while work there who have a great understanding of the frustration that comes along with working at Sama.","The CEO's expectations are incredibly unreasonable, and she is extremely derogatory towards her employees. Her attitude is insincere and unfiltered. She may say this is because she is a new to management and has a lot of learning to do as a leader, but the way you treat people (especially when they aren't donating money or flying you somewhere) has a lot to do with your character. I have personally spoke with over 10 people that have worked there who have been verbally beaten down for something that could have been resolved with more effective communication skills. She is purely good as an outside motivation and networking piece to the company (she knows a lot of people), but she does not have enough emotional intelligence to head the company with real people, who work strenuously for the positive mission. The retention rate is crazy low.","Utilize your best resources - your employees. Ask them about their strengths. What they like about themselves. What they want to do next. What they don't think they're good at, and how they think that can be delivered by someone else in the company. Ask them if they feel like they have a sense of where the company is going, and be transparent about how you plan to get to the next steps. If they are afraid of failing, what drives that fear. How can you help them with overcoming those fears in a supportive role. Who do they enjoy spending time with, and what do they learn from those individuals. Do they like the work space. What is their preferred method of receiving feedback, and in what cadence. What are the top three things that are most important to them, both personally and professionally. Do they feel connected to the mission of the company. Ask, ask, ask. Take anonymous surveys all the time. Weekly if you have to. Even if it is something as simple as... provide examples of fun or exciting things the company could do to improve the culture. Each manager should build a structured roadmap for each of their reports, laying out specifically where they want to be, and when, then making a path of agreed upon steps to get there. Maybe it is taking on ""project x' two months from now, then checking in with that project, talking about what they are learning, then adding the next step on their roadmap. During this time, making sure this is truly adding to the expected obtained results. This will make them feel valued, and like they are making positive strides in their career during their time at Samasource. It keeps them motivated. The best manager I ever had told me, ""you are here because you want something from this company. What are you here to take and learn, and how can I be the person to help you do that. What is the positive impact you plan on making for yourself and the company along the way?""",2.0,2.0,2.0,3.0,3.0,1.0
2015-10-23, Undisclosed,"San Francisco, CA",Former Employee ,Great idea CEO a nightmare,More than a year,0,"Incredible idea and mission that could have been the great thing they claim in all their press.
Some great people there for the right reasons. Decent work like balance.","CEO ""borrowed"" charitable money contributions from samasource to launch her for profit cosmetic line and then misrepresented that fact to the press in interviews like Fast Company.
CEO uses company funds to do things like stay at $1,000 a night resorts for a wedding, hanging out with friends and riding horses (pictures on Facebook).
CEO is great in public but behind closed doors is only interested in promoting herself and is a poor manager and turnover is about 100% annually as a result.
The entire development team quit as a result of leadership claiming at the gala that fund a need money would go to doctors in the samahope program. Instead they built a party bus with the money and not one penny went to doctors. CEO has a loose relationship with the truth and engages in financial dealings as a non-profit that need to be subjected to a real rigorous external audit. Her personality gets most people to trust her and buy into her ideas and then they seem not to look behind the curtain.",Need to get a new CEO.,1.0,3.0,1.0,1.0,2.0,1.0
2015-08-17,,"San Francisco, CA",Former Employee ,"Dynamic, driven, young social enterprise!",,0,"I have really appreciated working for a social enterprise that is data-driven, transparent, dynamic, entrepreneurial and hungry for impact. The company moves fast and is not afraid of trying out new projects. The team is young, super smart and very fun and like to hang out together after work. The organization is very flat - it's easy to access management and discuss ideas at all times. There are lots of learning opportunities organized in the form of brown bag trainings and lectures. It's a strong female-led company with very female friendly policies.","As a West Coast based company, the culture is extremely polite. It can be hard to discuss failure or feedback.",Create more space for bottom-up feedback at early stages of new ideas.,4.0,5.0,5.0,4.0,3.0,5.0
2015-09-22,,"San Francisco, CA",Former Employee ,Work somewhere else,,0,"The company mission is worthwhile, even if it's not evident day-to-day. Some of the employees are great people and fun to work with. There's definitely an effort being made to improve some of the overarching issues within the company.","The company is an absolute mess, employees are disheartened and frustrated with poor management and general lack of appreciation for hard work. Office culture is nonexistent, compensation is abysmal, and there is very little room for professional growth, if any. Oh, and the office is located on a terrible corner where you have to walk past drug dealers, garbage and human excrement on a daily basis just to get in the office.","Keep hiring the best people you can, but make an effort to retain them. Appreciate your employees' work, try to build some sort of office culture, and focus your efforts on one initiative at a time.",1.0,2.0,1.0,1.0,1.0,1.0
2015-08-07,,,Former Employee ,CEO Holds Company and Mission Back,,0,"- Imperfect model that needs improvement, but makes real impact nonetheless
- Good people that care about their work
- Unique experience","- CEO Leila Janah does not treat her employees with any semblance of respect, and in return her employees do not respect her and do not see her as an effective leader in any capacity
- CEO Leila Janah's bullying and unbalanced nature causes rapid burn out and exits at all levels of the organization
- Despite many, many employees' best efforts at ""operational professionalization,"" there has never been consistent focus on any single small or large strategy","Leila should remain the core of the company but needs to seriously consider stepping out of the CEO role if she truly wants the company to run better and reach scale. Otherwise, the company will remain locked in ""potential"" and truly waste all its unique vision, momentum, and resources. Figure out how to push toward a governance structure with teeth.",3.0,3.0,5.0,3.0,2.0,3.0
2015-07-22,,,Former Employee ,"Good mission, but still need to figure out how to execute properly",,0,"work-life balance opportunities (gym stipend, yoga in the office, after work sports activities) and office social gatherings","As mentioned, the mission of the organization is great, but their execution is bad. They didn't have good, thought through processes to execute their work. Focus was very, very heavy on marketing, and not enough on other departments that were working towards actually executing the mission of the organization.

When employees are being overworked, it is an obvious sign that you need to hire more people, or work towards reducing the workload to keep happy employees.

Also felt like the CEO had a ton of ideas and was starting a lot of different projects, but the company needs to narrow focus to better execute with success.

Pay was terrible for my experience and background.","Communicate and be more transparent with your employees.

What does the CEO do when she goes on her trips around the world? It seemed like she was jet-setting, but no one ever really knew where she was or what she was doing. Giving updates on that would have been good.",2.0,4.0,3.0,2.0,2.0,2.0
2015-07-17,,,Former Employee ,"CEO can sell the idea, but that is the only thing the company has going for it",,0,"As someone else mentioned in a review further down, the junior team members on the first and second rungs of the organizational ladder are talented and hardworking.","Unfortunately, the company is rife with poor management and at times was borderline abusive. Turnover is extremely high-- 75% or more.

The business model itself is problematic. While Samasource's delivery team is in San Francisco-- the teams of workers completing the jobs are in Kenya and India. The Sama team has a weak presence in the field where the jobs are actually completed-- this creates a huge gap between the realities the actual ""disadvantaged"" workers face and what the folks at HQ perceive. Aside from a small outfit they run called the Samalab in Kenya, most of the work is completed by small business process outsourcing (BPO) partners that hire workers who are best fit for the job. Many of the workers are not ""disadvantaged""-- often they are middle class college grads who haven't found work elsewhere. The point is not that they should not get these jobs, but rather that the pitch Sama gives is highly misleading.

The model is also not as scaleable as they'd have you believe-- most businesses cannot afford triple or quadruple redundancy for their internet connection in Kenya and Uganda (where they have attempted to set up), given how often the internet goes down in the region. It is not possible to run a reliable BPO out of an IDP camp without the appropriate infrastructure. This company is a lot of hype and has been running on the fumes of good story telling.

Also to echo the reviews below, the CEO should have been replaced long ago. The whole organization seems to operate like a publicity stunt for her personal gain. Quite frankly this was the worst employer I've ever worked for.","Replace the CEO, understand what needs to change at the field level. And hire people with actual experience in the places where you claim to work.",1.0,2.0,1.0,3.0,1.0,1.0
2015-06-13,,"San Francisco, CA",Former Employee ,"Great People, Managed Terribly",,0,"Almost everyone on the first one or two rungs at Samasource is hardworking, interesting, and fun to be around. I plan to keep in touch with many. Also, the ""startup"" environment permits lots of ""step-up"" opportunities. This is a good and a bad thing.","CEO is self absorbed and motivated by fame. Lacks focus on core business Samasource and starts new ones, leading to distractions from mission and values. Lacks attention to detail, which has lead to misalignment between teams.","Replace the CEO. Reduce employees covered by shared services model* especially for Engineering. Hire higher performing developers. Focus on project management hires with client experience. Re-align sales and project management teams.

* (Where finance, engineering, HR etc are shared among affiliated businesses).",2.0,3.0,3.0,2.0,3.0,1.0
2015-05-03,,,Former Employee ,Unique experience for software engineers,,0,"I'd like to focus on the engineering team at Samasource. I'd strongly encourage any software engineer that is interested in building technology that makes a deep impact on people's lives to spend time at this organization. The SamaHub is a mturk-like task distribution system, so there are plenty of transactional processing, data-science and scaling problems to solve. Certainly beyond your typical non-profit engineering challenges.

But the real meat of what you'll learn with the wonderful people that work on this team is how to create a product that assists people in taking their first step into the digital jobs economy. You'll learn where technology can create opportunities that would otherwise be unimaginable, but more importantly, you'll learn the ways that technology falls frustratingly short. This is a humbling experience in a city where the virtue of humility is in short supply.","Fundraising in the non-profit space is still very activities-focused instead of outcomes-focused, and generally speaking, funding rolls in steady but incremental chunks rather than in the large rounds you might be familiar with having worked in the private sector. What this means for your experience on the engineering team is a challenge that resembles an intense established-but-growing bootstrapped business rather than ""ride the rocketship"" startup growth. You'll need patience.",Continue to bet heavily on R&D. Lead the way in helping funders understand how innovation works so they can know how and when to measure the outcomes of technology investments for social good.,5.0,,,,,
