date,employee_title,location,employee_status,review_title,years_at_company,helpful,pros,cons,advice_to_mgmt,rating_overall,rating_balance,rating_culture,rating_career,rating_comp,rating_mgmt
2015-10-16, Marketing,"Ridgefield Park, NJ",Former Employee ,Korea Rules Decisions,More than a year,0,"There are good and hard working people who are doing their best to drive the business. Even when they are successful, they are told it wasn't good enough. Good pay and benefits/perks.","When hired, I was told I would help shape strategy and decision making for the products I was working on. That was so far from the truth. There is an inherent lack of trust from Korea and they never believe they're wrong when there is a conflict in opinion on how to proceed. Oftentimes, you will reach agreement on something, only to come in the next morning to find out your Korean ""dispatchers"" have changed course during the night after you left the office. This goes even as far as forecasts to be manually changed in the system by the Koreans without your knowledge or agreement. Also, Korean culture is all about shaming you as a means of motivation. As if you'll do better in the future to hope not being talked down to like that again. However, as noted above - even when you do hit numbers or are successful, they'll be upset that you didn't exceed what you achieved. If you can deal with this kind of culture, you'll do well (and, frankly, some people do). But many people come and are gone in 3-6 months. Funny thing is most people measure your time there in ""dog years""....if you've made it a year, it's like working for 7 years at most other companies. That was the funniest thing I heard while working there - because it's true.","Not much advice, because Korean management won't accept it. However - for US based management. Be honest and open to incoming employees about the culture. I was told during interviews that Korean culture was minimized with the number of American employees and that decision making was in our hands in regards to the business here. None of that is true.",1.0,1.0,1.0,2.0,4.0,1.0
2015-09-14,,,Current Employee ,Great place to work,,0,"Smart people, challenging work, amazing cutting-edge products, exciting to be part of such a successful brand.","Fast moving environment, need to be on your game",,5.0,4.0,5.0,4.0,4.0,4.0
2015-10-20,,,Current Employee ,No work life balance,,0,Great insurance and innovative products,"No work/life balance
The company is ran like a small start up not a billion dollar corporation",Value your employees and actually listen to them,1.0,,,,,
2015-09-28, Financial Analyst,"Fort Lee, NJ",Current Employee ,analyst,Less than a year,0,"Good health benefits
Christmas gift in electronic goods","difficult and frustrating culture
low salary compared to workload",,2.0,2.0,2.0,3.0,2.0,1.0
2015-09-11, Summer Intern,,Former Employee ,Great summer internship experience,,0,Well organized corporate internship program for undergrads and MBA students; many networking opportunities;,Need to work hard to get more work,,5.0,5.0,5.0,5.0,5.0,4.0
2015-09-09, Senior Manager,"Ridgefield Park, NJ",Current Employee ,Great company with amazing leaders,More than a year,0,"Compensation and benefits
Great products
No 1 technology company","Work life balance is the major issue in the firm, super fast paced","Improve the work life balance, empower Employees",5.0,5.0,5.0,5.0,5.0,5.0
2015-09-09,,"Ridgefield Park, NJ",Former Employee ,"Good pay and benefits, poor work-life balance",,0,Challenging work and never a dull moment. Pay and benefits are quite good. Bonus structure is also good. Opportunity exists.,Culture and related management structure can be unproductive at times. Very short-term goal oriented. Better long-term planning would yield better results.,Let local management do their jobs. They have insight to local market conditions and customer behavior to make better decisions.,3.0,1.0,3.0,3.0,4.0,4.0
2015-10-09, Engineer,"San Jose, CA",Former Employee ,Mis-led into accepting contract job(after leaving another good contract) that was cancelled suddenly.,,0,"New building is outstanding, a very pleasant atmosphere. Cafe and Gym are nice. Most folks are very polite and cordial. Projects are technically interesting.",Technical employees seem really stressed deep down. Non-technical employees seem to not have a care in the world - polite and cordial are also traits of passive-aggressive behavior which the most destructive interaction. Not saying folks are passive-aggressive but after my experience the thought crossed my mind. I was very honest with my skill set during interview process and they did not test me much - the skill that I was light on and told them in the interview is the skill they expected me to hit the ground running at lighting speed and produce results in a few days without very clear communication with the current development process or a design of the build system. They were also late with a deadline and busy the first two weeks and I did not get much hand-off information. Maybe it was all a coincidence with misaligned expectations but almost seems like a set up to take a job (quitting a good one) and then different priorities skill set wise day one and not being given enough time to ramp up.,Being transparent is not the thing to do at Samsung for tech employees - having a good story that sorta works is the advice I would give to employees.,1.0,3.0,2.0,1.0,3.0,1.0
2015-08-26,,,Current Employee ,Very Corporate,,0,"Interesting projects, talented colleagues,",Korean management culture and hierarchical org makes it hard to implement creative ideas,,3.0,,,,,
2015-08-31,,,Former Employee ,sweat shop,More than 5 years,0,"high quality products, terrific advertising","negative culture, management by intimidation",,2.0,1.0,1.0,1.0,4.0,3.0
2015-08-23,,,Current Employee ,A good place to work,,0,Samsung promotes new ideas. The benefits are good and salary is at par with Bay area.,"A lot of turbulence in upper management. Lacks direction and focus, and coordinated efforts. The company thinks like a hardware company when building software. A lot hand holding from head quarters in Korea.",Have a clear coordinated effort towards the software ecosystem. Samsung has a lot of resources at its disposal but lack clear direction.,4.0,3.0,3.0,4.0,4.0,3.0
2015-08-26, Software QA Engineer,"Mountain View, CA",Current Employee ,Software QA Engineer,,0,Friendly company and if not budget cut I would stay here,I didn't find any downsite,,5.0,5.0,5.0,5.0,5.0,5.0
2015-09-30,,"Coppell, TX",Former Employee ,RMA Specialist,More than a year,0,"Flexible work hours, very casual work environment and they emphasize work life balance and taking care of family and self first. They pay really well","Very antiquated tools to work with and no sign of improving the ineffective and inefficient processes. Too much manual work which contributes to loads of rework. Poorly trained, poorly skilled privileged managers","Train managers thoroughly, make sure they are not micro managers and have people skills. A lot of waste is attributed to the antiquated tools used to perform jobs.",1.0,5.0,3.0,3.0,4.0,3.0
2015-08-17, Senior QA Engineer I,"Bellevue, WA",Current Employee ,Sr. QA Engineer III,More than a year,0,High salary compare to other companies,Too much overtime and stress,,3.0,,,,,
2015-08-26, Manager,"Atlantic, NC",Current Employee ,"Good Benefits, Poor Work-Life Balance",More than 3 years,0,"Fast paced, ability to work with cutting edge tech, develop retail relationships, local and regional travel, good company benefits package.","Changes in direction can happen within hours, too much importance given to data gathering, many demands out of the regular work schedule, constantly need to be available. Management glorifies team members who are attempting to advance instead of cultivating a cohesive team. Inability to provide truthful and meaningful input due to paternalistic company structure.","Listen to your employees, make the schedule less onerous and more family friendly. Allow for more planning time so teams can move as one. Stop using the ""do it first at all costs and fix things later"" approach. Too much lost efficiency.",2.0,1.0,2.0,1.0,4.0,1.0
2015-09-23, District Sales Manager,,Former Employee ,Push no matter what,,0,"It looks good on my resume
The products are great","No work life balance
Managers are worried about getting promoted",,1.0,1.0,1.0,1.0,4.0,1.0
2015-08-14, Sales Lead,,Former Employee ,Okay!,,0,"it's a fun job because I get to network with quite a bit of talent pool..
Everyone is supportive..","The management do not communicate well..and no one is ever in the same page...
Frustrating as hell...","Better follow through on communications please and visit your store often, when an employee wins a prize or nominated as an employee.. Greet them, meet them not send a crappy email with 3 words in it😒",3.0,1.0,3.0,1.0,2.0,1.0
2015-08-20,,,Former Employee ,"Good place, tough targets",,0,"Fast paced environment, big projects",hierarchal setup makes it hard,,3.0,2.0,3.0,3.0,3.0,3.0
2015-09-15, Human Resources,"Ridgefield Park, NJ",Former Employee ,"Great products, Horrible Environment",,0,"benefits, products, looks good on resume, no strategy","no work-life balance, terrible leadership, constant turnover, stress, lack of vision, low salaries",,1.0,1.0,1.0,2.0,3.0,2.0
2015-08-11,,,Current Employee ,can be much better,,0,"Great company to work for, laid back environment","location can be a challenge, not so exciting work environment",incorporate a more savvy work environment to make it more fun since this is a technology company it should have a modern exciting work environment,5.0,2.0,1.0,3.0,3.0,2.0
2015-08-11, Field Sales Manager,"Columbus, OH",Former Employee ,Field Sales,Less than a year,0,Salary is decent. Great field team co workers.,"Management has no trust with associates. Cares more about tracking you and quantity of visits more than what truly matters, the quality. No true flexibility in scheduling.",Never!,3.0,2.0,3.0,1.0,2.0,1.0
2015-09-10,,"Mountain View, CA",Former Employee ,"Learn to be political first, then do anything to keep your job.",More than a year,0,"A majority of people you encounter are smart, and they become the sole reason other than your paycheck why you keep coming back to this place.
The benefits are also good.
This place is known for an efficient top-down execution. All resources move on the queue from the someone above. When you have the political leverage, you can reign in your favor whatever position you may be.","Where do I start...
- Your non-Korean boss probably have a limited say in things whatever her/his title may be. It's run by the Koreans, especially those in finance. They place an American leadership to be the spearhead and also to be the scapegoat when things go south. The finance team communicates the most with HQ and they decide on everything what this American subsidiary can do. If lucky, HQ will be lenient for your pet projects so that you can get your paycheck and that's exactly how they think.
- No stock options, so be strategic when negotiating the salaries.
- You better deliver something in a year or two. That's the duration of the contracts of VPs or above, so you are being pushed to do something.
- But most of your projects will most likely get killed in any stage of the development. (You may get promoted as a consolation if your projects get killed for no reason however.)
- Samsung prefers to hire outsource and hire contractors over hiring full-time employees. They think it adds to flexibility, but it actually adds to the culture that cuts are coming; which is actually happening every quarter.
- The Koreans belittles you when they talk in Korean. Made me think of how Japanese used only sticks to flog the American captives during WWII and felt good about themselves.
- Slow. Everything is slow. Budget approval often takes months, by then, the market requirements already have changed. They have this thing called PUMI, which is supposed to be a documentation method for operational needs/budget uses, but it takes weeks to get approved, if lucky. And there is no logic in its rejection or approval. So you have to be political.
- They hire Koreans and keep them whether they can do work or not. You don't have to have the fitting background or capabilities to get hired if you speak Korean. And they use the unfitting background as a leverage to give lower salaries to the Koreans. Koreans in general are paid less compared to the Americans.
- Frequent changes in the top management... Going nowhere.
- Set up a gym and opened a cafeteria, and told people we take care of you... You still have to pay 50% of the food you buy, and haven't had Christmas party or any outing events for a while with decreasing sales and profits.
- There is only work, no work-life balance. Your PTO requests gets rejected, scrutinized, and you get called during your time offs. Sure, someone took 2 week vacation, then people will talk about it with envy for weeks.","Think long term, and think about culture. You are in America, so think like Americans to target the Americans effectively.",1.0,1.0,1.0,1.0,2.0,1.0
2015-08-06, Senior Staff Software Engineer,"New York, NY",Former Employee ,Hard to stay focused without much direction,More than a year,0,"Samsung took care of me to get me to take the job, including a compensation package including relocation and attractive bonuses.",Our project was cancelled prematurely without much warning or reason. We were left in limbo for a month before being given our severance package.,Please don't waste employee's time working on projects in duplicate that won't be able to see the light of day. There was a lot of miscommunication due to too many levels of management.,3.0,3.0,2.0,3.0,5.0,2.0
2015-09-09,,,Current Employee ,Benefits beware,,0,I used to think the benefits were pretty good and for the most part they are good.,"However, I just spoke to a colleague who is pregnant. Samsung clearly does not care about parents. The maternity leave is a joke and yet again demonstrates how Samsung simply 'checks the box' on things related to its people. Maternity leave is only 1 week of full pay and then it's simply the state mandate of short-term disability. Samsung has terrible short-term disability benefits! In addition, there is no work-life balance. People complain about strain with their spouse and children all the time... more so than the typical company. Samsung will never truly go out of their way to care about their people because the Korean HQ mentality is people are disposable. People should be dying to work for Samsung. Well, this is America and people run your company. For people still looking to develop professionally, Samsung is also not the place for you. People management, mentorship, basic feedback is not important. Samsung prides itself on independent work - sink or swim. No one will thank you if you succeed. They will point out where you failed in a non constructive manner.",Do something meaningful for once not because you have to (usually due to bad PR) but because it's the right thing to do. This goes the same for not only employees but community - corporate social responsibility.,1.0,1.0,1.0,1.0,2.0,1.0
2015-08-18, Senior Manager,"Ridgefield Park, NJ",Current Employee ,Sr. manager,,0,"Good salary. Smart people, great resume builder",Not inspiring place to work,,2.0,1.0,2.0,2.0,4.0,2.0
2015-07-21, Director,"Ridgefield Park, Bergen, NJ",Former Employee ,Hire indiscriminately - then layoff,More than a year,0,"Talented employees who are hard working, innovative and a joy to work with. Employees are supportive of one another. The company provides great benefits. Tim Baxter is a solid leader.",No strategy. Poor resource planning. Hire indiscriminately and then layoff brand new employees.,Proper resource planning is instrumental to the success of the company. Luring talent away from longterm employment and then eliminating their positions immediately after hiring is careless and demonstrates the company's disregard for their people.,3.0,2.0,1.0,3.0,4.0,3.0
2015-08-04,,,Former Employee ,Good company to do an internship,,0,Nice compensation package and very treatment for interns. Tons of events and support. They spent a lot of effort to make you happy.,Not in a very good location. People are very focused on patents and you might have a hard time if you want to publish some of your results.,,5.0,,,,,
2015-08-19,,"Richardson, TX",Current Employee ,Money is the only Pro...,More than 5 years,0,"Benefits, salary and bonuses...that's it.","No work/life balance, no advancement unless you have a CPA and speak Korean. Not a good work atmosphere. Bad turn-over rate.",Get to know people before you judge their personalities. Advancements should not be only based on education because many people have CPA's but are not good with people and that is why teams are unsuccessful at reaching goals.,2.0,1.0,1.0,1.0,5.0,1.0
2015-08-03, Business Analyst,"Ridgefield Park, NJ",Current Employee ,Business Analyst,More than 3 years,0,Global Company. You learn global mind and operation,Bad life-work balance. I guess it doesn't matter when you are motivated to work in this company or like the job.,,4.0,4.0,4.0,4.0,5.0,4.0
2015-08-13,,"The Colony, TX",Former Employee ,Samsung,,0,Corporate office is nicer compared to the other Samsung offices in Plano/Coppell. There are plenty of perks for full time employees. Great benefits.,"As a contractor, you do not receive the ""cool"" perks compared to full time employees which can be unfair especially for contractors who has been working at Samsung for several years. For a big company, you would think internal growth opportunities is easier. After working here for several years, I came to realize there weren't any advancement opportunities as told when I first interviewed for the job. It's all politic but then again, it's all part of the corporate world. I took the job offer at Samsung because of the name and though how great it would look on my resume and perhaps there will be room to advance later on. Boy was I wrong. Crazy workload. No work/life balance. Always changes within the organization and management. High turnover rates. New CEO is relocating every department to other states. Makes everyone feel unstable about their job.",,2.0,1.0,2.0,1.0,4.0,
2015-08-12," Staff, Strategic Support","Ridgefield Park, NJ",Current Employee ,Senior staff,More than 3 years,0,"If you are a tech person, You will get to hands on newest products available.",Work & life balance is terrible. Demanding too much from HQ that overtime is needed almost every day,,2.0,2.0,2.0,2.0,4.0,2.0
2015-07-25, Senior Engineer,"Somerville, NJ",Current Employee ,SEA,Less than a year,0,You will be working on Latest Technology.,Long working hours could be painful sometimes.,,4.0,3.0,3.0,3.0,4.0,4.0
2015-07-27, Senior Bus,"Plano, TX",Current Employee ,Sr business analyst,,0,Good bonus. Close to my house. Have free drinks free apples................:::,It really depends on department. Some departments have too much overtime,,3.0,2.0,2.0,2.0,3.0,2.0
2015-07-21, Regional Technical Trainer,"Atlanta, GA",Current Employee ,Great company although...,More than 3 years,0,"Innovative, fast paced, and there are many perks (401k, fitness benefits, and discounts). Flexible at times when you are local. Great people to work with on a daily basis and truly never boring. If you travel, Samsung helps make this a great experience!","Difficult to cultivate positive change and a very stubborn company. When tasked, the there is no flexibility and the work/life balance is difficult to execute. Career Promotions are hard for certain backgrounds. (Especially non Korean) Hard for family members.","Very simple: Lead by asking, not demanding. Give mutual respect and honor employees time. Also keep open to change. See: Nokia and Blackberry.",4.0,2.0,2.0,3.0,4.0,3.0
2015-07-20,,,Current Employee ,Great if you're a workaholic,,0,Office is quiet. You will get a lot of work done.,Office is too quiet. Can be boring at times.,Acknowledge good work that your team has been doing.,4.0,4.0,3.0,3.0,5.0,4.0
2015-08-26, Engineer II,"Bellevue, WA",Former Employee ,Hardware Test Engineer,More than a year,0,"Good company benefits, health insurance ,matching 401k","Too much racism, and prejudice. If you are not Korean don't expect to be treated nicely or given any opportunities to advance.",Provide fair chances to advance further to all employees especially black race.,1.0,1.0,1.0,1.0,5.0,1.0
2015-08-02, Director,"Allen, TX",Former Employee ,Director,Less than a year,0,good salary and bonus. I do not know what else I can add for pros.,"Frequent re-organization, no motiviation, no work and life balance",,2.0,1.0,1.0,3.0,4.0,1.0
2015-07-09, Senior Program Manager,"Overland Park, KS",Former Employee ,Samsung,More than a year,0,Ambitious company seeking entry into the United states Telecommunications markets as a provider of telecom equipment and installation / deployment services.,"Leadership has little to no experience in the United States, but refuses to listen to staff and managers who could help them navigate the waters successfully.
Micro management from Korea.
Hostile work environment.",Remove the chip from your shoulder and listen to the experienced staff and managers that can help you toward meeting your goals.,3.0,2.0,1.0,2.0,4.0,2.0
2015-07-11, Customer Service Representative,"San Diego, CA",Current Employee ,Customer Service Repesentative,,0,"Free meals. Overtime pay. MAX 16% bonuses (twice a year, 8% each)","Most people have to do overtime. The culture is different from an American company, so you may need to adjust to the culture. Work life balance is sacrificed",Focus on the future of the staff. Realize that there is a large turnover rate and try to make Samsung the place to work and not the boot camp before the ideal workplace,3.0,2.0,2.0,3.0,3.0,3.0
2015-07-10, Marketing Manager,"Plano, TX",Former Employee ,Marketing Manager,More than 3 years,0,"Samsung is an aggressive and competitive company, but has a good reputation and compensates accordingly.",Samsung Telecommunications America is driven by Headquarters and seldom has input on impacting decisions.,Listen to employees and their ideas and issues.,4.0,,,,,
2015-07-07,,,Former Employee ,best company to work for,,0,this company is perfect place to work at,no downside at all... perfect workzone,,5.0,5.0,5.0,5.0,5.0,5.0
2015-07-03, Manager,"New York, NY",Former Employee ,Good Benefits,More than a year,0,Employees are offered great benefits,"No focus on development, lack of work life balance.",,3.0,2.0,2.0,3.0,3.0,3.0
