date,employee_title,location,employee_status,review_title,years_at_company,helpful,pros,cons,advice_to_mgmt,rating_overall,rating_balance,rating_culture,rating_career,rating_comp,rating_mgmt
2019-01-15, Financial Analyst,,Current Employee ,Growth!,Less than a year,0,"Good pay, Great benefits, Growth, Diversity",Work comes first! Need better work balance,,5.0,3.0,4.0,4.0,5.0,5.0
2019-04-08,,,Former Employee ,Good place to work,More than a year,0,It is a good place to work with influx of tech. And a diverse environment. Recommended.,"There is little work/life balance. My life was all about work, work and work.",,3.0,3.0,3.0,3.0,3.0,3.0
2019-04-03, Field Sales Manager,"New York, NY",Current Employee ,Job not Career,More than 5 years,0,"Great health care, and 401k; Quick milage reimbursement; Fair pay and yearly raises.","Zero work life balance, unrealistic weekly work goals, everything is a fire drill, never knew how your schedule is going to change.",Get monthly work calander out to the team two weeks before hand so we can plain our lives.,3.0,1.0,3.0,2.0,5.0,2.0
2019-03-31, Senior Sales Manager,"Austin, TX",Current Employee ,Love the team I work with and the job I do. However Korean HQ micromanagement and short term focus is frustrating.,More than 8 years,0,"Great health insurance
Matching 401k
Innovative products","Korean HQ micromanagement
Short range thinking
Internal procedures are horrible
1990's IT technologies.",,3.0,3.0,2.0,4.0,4.0,4.0
2019-03-21,,"Ridgefield Park, NJ",Current Employee ,Wonderful to work,More than 5 years,0,Many opportunities to learn technologies.,Cultures are different and most of time to work with Korea in the night.,,4.0,4.0,3.0,4.0,5.0,4.0
2019-03-17,,,Current Employee ,Good pay but micro managed,,0,"Pay and Benefits, amazing products",GPS and more micro management,"Not having to work every Saturday and major holiday s like Thanksgiving. Work less Sundays. Less selling events, more control of schedules by field teams. more internal promotions",3.0,,,,,
2019-03-14,,"Ridgefield Park, NJ",Former Employee ,Great place to start career but difficult for growth,More than 5 years,0,Great health benefits and employee discount,Work life balance was challenging,,3.0,2.0,2.0,2.0,4.0,2.0
2019-03-12, Market Manager,"Atlanta, GA",Former Employee ,Challenging and Innovative Culture,More than 5 years,0,Amazing products to represent! Pride in being part of one of the largest and successful conglomerate in the world. Excellent benefits and opportunities for advancement for both education and career development. Innovation and improvement are part of core belief system at Samsung: Everything can be improved and feedback is appreciated.,Large corporation with many employees to navigate. Finding the correct person/resource for information could be an obstacle. Communication flow was sometimes challenging due to sheer volume of information distributed daily.,Continue the charge! Galaxy was an amazing brand to be a part of building and I look forward to being a loyal Samsung follower!,4.0,2.0,5.0,5.0,5.0,5.0
2019-03-07, Sales,,Former Employee ,Good and bad,More than 3 years,0,-Prestige of working for Samsung,"-Not as likely to hire/promote from within; they prefer bringing in people from other companies.
-Management always changing so direction of company constantly changing.",,3.0,,,,,
2019-04-04, Marketing Manager,"New York, NY",Former Employee ,Culture Clash Makes for Horrible Environment,More than 3 years,0,"Big brand with recognizable name

Big budgets",Everything you would imagine in any big organization but the real warning is that Korean leadership clashes horribly with a North American value system of integrity. Do not expect to be treated with any level of respect and there is no such thing as work/life balance.,,1.0,1.0,1.0,1.0,3.0,1.0
2019-04-01,,,Current Employee ,"Come for the pay, leave because of everything else",,0,Competitive pay. But only because they know they need to over pay a little to make up for the cons (see below),"Everything else.

Lack to respect or trust - US employees at all levels are not treated with trust or respect. We are always under a microscope from HQ. Constantly challenged, scrutinized and spoken down to regardless of level or expertise.

No understanding of US workplace culture or norms - working here is like working for a Korean company in Korea - in all the negative ways (e.g. hierarchical, always on, follow orders without question, motivate via fear and intimidation)

Constant musical chairs of leadership - senior leadership is rotated, by design, annually. This results in constant shifts in direction, constant re-orgs and general confusion and uncertainty for the masses. The current CEO, Tim Baxter is actually a good leader, but he's retiring in a month and being succeeded by career Samsung people from HQ.",,1.0,1.0,1.0,1.0,4.0,1.0
2019-03-28, Senior Manager,,Current Employee ,Job takes your life and soul away demanding 65+ hours per week.,More than 5 years,0,"Compensation is good
Benefits are reasonable
Co-workers support each other through the chaos with unreasonable demands from leadership and HQ","No work life balance
Culture is awful
Zero senior leadership support
Processes, procedures and systems are antiquated
Lack of diversity in senior leadership 90% Korean males that speak very limited English",Please correct the culture and diverisfy leadership.,1.0,1.0,1.0,3.0,5.0,1.0
2019-02-21, Financial Management Associate,"Ridgefield Park, NJ",Current Employee ,Great company poor management,More than 3 years,0,The benefits are fantastic,"Depending on the department, management can be poor.",Listen to your employees and things can be more efficient,3.0,1.0,3.0,3.0,4.0,1.0
2019-03-21,,"Ridgefield Park, NJ",Current Employee ,Poor Management,More than 5 years,0,"They pay well, consistent bonus payout.","This is not a US run company, despite the 18,000 US employees. The cultural differences can't me overstated. Top down mgmt structure stifles innovation. Being Busy > Being Smart. Major turnover at the top (CEO gave notice 2mo ago) and many other leaders are fleeing. Do your homework, at Director levels and above you will have problems if you're not able to adapt to the Korean structure, value system and mgmt style.",Be honest.,1.0,1.0,1.0,1.0,3.0,1.0
2019-02-19,,,Current Employee ,No Direction,More than 5 years,0,"-Above market pay and generous PTO
-Flexibility
-An extremely easy job if you know how to manage your time","-Hire externally even though there are people more than qualified to take management positions.
-Upper management is so far removed from the field that they have no idea what's going on. They dictate schedules even though they preach that their team should be ""entreprenuers""
-They hire new employees with the impression that they will be working M-F when in reality, you're probably working T-S and sometimes 6 day weeks without additional compensation",Look for talent within the field and be more in-tune to what the field is asking for. Give employees more autonomy and stop the politics.,2.0,3.0,2.0,1.0,4.0,1.0
2019-02-10, Senior Executive Secretary,"New York, NY",Current Employee ,It was a wonderful experience,More than 3 years,0,"The love of the job, the experience I have, the love of technology, the love of working in a big country and the love of having a office",Working together as Co worker,,4.0,5.0,5.0,5.0,5.0,5.0
2019-03-12, Analyst,"Ridgefield Park, NJ",Former Employee ,Not good,,0,"Widely known company, decent salary, that's about it.","Management by far is the worst part of the company. Clueless and disorganized. Everyone is a part of the suffering. No one enjoys it here. No career growth. No culture. I think the reviews over 3 stars are fake on here. This is not a place to call home. Don't expect it to be more than just a job, it's just a big name on a leased building.",Apple and Huawei are better.,1.0,2.0,1.0,1.0,2.0,1.0
2019-03-07, Product Manager,"Mountain View, CA",Current Employee ,Big Company with Big Problems,More than a year,0,The company does have some exciting products that could potentially represent great areas of learning and contribution.,"Poor talent across most teams I've worked with.
Politics and optics trumps everything else
Extremely hierarchical approach to things. If you're old enough, you're smart enough.
You would have to jump through so many hurdles to get even the most simple things done.
HR cannot be trusted","A big overhaul is needed
Revamp HR - they epitomize the bureaucracy that exists within the organization.
Have a flat organization - Team leads have a very top down approach and are almost untouchable. Evaluations are all one-sided.
Enforce strict cross organization collaboration
Hire more engineers than product/business people
Job security should be independent of a person's full time or contractual status
Incentivize employees largely based on their performance rather than their age/experience/other factors",1.0,1.0,1.0,1.0,2.0,1.0
2019-02-01,,,Current Employee ,Good to work,More than 10 years,0,Gap between contractor and RFT,5days PTO per year too low and so on,Need to hire more RFT not contractor,5.0,5.0,5.0,5.0,,
2019-01-25, Manager II,"New York, NY",Current Employee ,Strong Pros and Strong Cons,More than 3 years,0,"Flexible work schedule and location, pays well within industry","Company is handcuffed by processes and inflexibility, limited clarity in direction",,3.0,5.0,2.0,3.0,4.0,4.0
2019-01-22,,,Current Employee ,"Challenging, but exciting",More than 5 years,0,"Team works hard and solves for ambiguous problems. Some have a hard time navigating, but some can thrive.","Constantly evolving organization, but this keeps things interesting.",,4.0,5.0,3.0,4.0,4.0,4.0
2019-01-21,,,Former Employee ,Marketing,,0,Reastaurant was good and cheap,Hierarchical environment was a bit bad,,3.0,,,,,
2018-12-31, Project Manager,,Former Employee ,"Decent benefits, but...",More than a year,0,Good benefits including healthcare and pto,Managers lack leadership or do not know how to manage.,,3.0,4.0,3.0,3.0,3.0,3.0
2019-01-28, UI/User Experience Designer,"Seattle, WA",Former Employee ,No process. The nepotism make the office incompetent top down.,More than a year,0,"Luckily, I was able to be exposed to a big company and understand cultural differences in Eastern and Western eCommerce. There are a few people qualified for their jobs.","They expect you to be a ""yes man"". They will promise you things if you do what you're told. Your professional opinions do not matter. The PMs ideas are the best, even though they are given little thought. PMs will be in meetings all day and come to you at 3pm to do a handoff and the turn around is EoD or ""ASAP"". I once was told to go to an ""all hands"" meeting and it was a meeting in where the VP hired his motivational/religious friends that worked at Microsoft to give a speech on buying his book. Huge HR violation.",Get rid of them. Hire people who can do their jobs and understand the products.,1.0,1.0,1.0,1.0,1.0,1.0
2018-12-23, Field Sales Manager,"Phoenix, AZ",Current Employee ,Good Place to Work,More than 5 years,0,"Great benefits, good pay, and good people.",If you can't adapt to things changing on a minute by minute basis you will never make it at Samsung Electronics America. It is a lot of work but if you make it at Samsung you can make it in any company.,Stick to the thing that work and stop throwing things against the wall and seeing what sticks. Stop the crazy work days make the job Tuesday through Saturday.,4.0,3.0,5.0,3.0,5.0,4.0
2019-01-23,,,Current Employee ,not too good to work for!,,0,secure job - they don't fire employee that much,"no work life balance.
too much hierarchy
no room too grow",,1.0,,,,,
2018-12-28, Product Marketing Manager,"Ridgefield Park, NJ",Former Employee ,Learn a lot but lots of headaches,More than 3 years,0,"Lots of ups and downs. When things are going well it’s a rocket ship. When times are tough watch your back.

Overall with all the headaches, the company is very well run.",Not for everyone. Long nights and impossible deadlines (like really impossible) are the norm,Need to hire better execs. way too much of a revolving door at the top,2.0,2.0,3.0,2.0,3.0,1.0
2018-12-16,,,Current Employee ,Challenging,,0,Company products and reputation for innovation,management culture sometimes out of line with US culture,Focus on employees,3.0,,,,,
2018-12-21," ""Engineer""","Bridgewater, NJ",Former Employee ,Engineer,More than 5 years,0,"-Great benefits and amazing pay for ridiculously easy work - playing with phones all day
-Honestly, you don't need a degree to be an engineer in the department I was in... you just need a Samsung phone... Not sure why my computer science degree was needed for this job. Never coded or analysed codes once.","-No work-life balance
-Their methodologies are quite old, not agile at all.
-Very traditional Korean work culture - everything comes from the top and is micromanaged.
-Engineers from bigger corporations hold more skills than we do .
***I recommend anyone that is an engineer at Samsung to pick up coding skills in their own time or they will have a tough time finding a job outside of this which is what I did***
-It's a little discriminatory here. If you're not Korean, it's obvious who they favor more.",Change the work culture -the tradition is quite out of date; give your employees more opportunities to learn more skills,2.0,3.0,3.0,2.0,5.0,2.0
2018-12-05,,,Current Employee ,Manager,,0,"Fast paced, ever changing environment which keeps me engaged and excited.",Looks for you to self manage and that is hard for some.,Continue to trust your people.,5.0,5.0,5.0,5.0,5.0,5.0
2018-12-03,,"Ridgefield Park, Bergen, NJ",Former Employee ,A good place to work,More than 8 years,0,Diverse culture and learning programs,Hard to maintain work and life Balance,Need to change old fashioned management,4.0,1.0,5.0,4.0,4.0,3.0
2019-01-01,,,Former Employee ,Engineer,,0,Pay was good and lots of PTO,No work/life balance. Stressful work environment,,1.0,1.0,1.0,1.0,4.0,1.0
2018-11-16,,"Ridgefield Park, NJ",Current Employee ,Great innovative company!,More than a year,0,The people you work with are great. Mostly people who really like a challenge which makes for very engaged and committed colleagues.,There’s so much to do I often have a hard time shutting down.,"Improve in the area of change management and communication. A lot of changes take too long to get worked out, decided and communicated.",5.0,3.0,4.0,5.0,5.0,3.0
2018-11-09,,,Former Employee ,Samsung electronics america,,0,Face paced tech environment with good benefits.,Expected to work endless hours,,3.0,,,,,
2018-11-14,,"Mountain View, CA",Current Employee ,"Incredibly bureaucratic, seemingly meaningless work, but hey, seems like they pay most people pretty well.",,0,A pretty nice campus with some cute dogs and a cafe with free coffee and tea. Cafeteria has pretty good variety too. Parking is plentiful and it's in a safe and quiet neighborhood next to a golf course. People seem to get paid pretty well in general at Samsung in comparison to a lot of other competing Bay Area tech companies.,"1. Incredibly bureaucratic, hierarchical structure makes things difficult:
Now this is going to be the complaint of most everyone at large international corporations. I'm totally aware of that and am also aware of what other large corporations are like internally. The bureaucracy is on another level at Samsung. Every decision you make in management at some point in the chain goes back to Korea. Everything you do on your work computer is monitored by someone in Korea. You must fill out intense and tedious paperwork to gain approval to do almost anything and take extensive classes to learn how to assess your employees, your coworkers, your managers in the terms asked by HQ (every employee learns this pretty quickly it's not just a manager thing lol.) A lot of the issues in management and hierarchy are cultural to Samsung's business in Korea. Although management in the US across departments are constantly attempting to change their work environments, they cannot change where the budget comes from. Every decision made about every product / project comes down to the opinion of an executive. It's pretty exhausting. I'm sure it's probably exhausting for some of the executives too.

2. Sunday is Monday in Korea:
Work life balance is fine for the people that have it fine. For those who don't...it's not. This is something once again you'll find most anywhere but one thing is for sure -- Sunday in the US is Monday in Korea.

3. Not really a forward thinking company:
Overall Samsung is not really a forward thinking company. They have some great products and the semiconductor business is going well for those involved in that (they have a beautiful campus in San Jose.) But overall Samsung is often fighting against itself. Concepts are thrown away immediately if they do not make profit, teams are downsized at the will of executives to make room for new projects that get shut down when they don't immediately perform at the capacity executives would like. There is not ""lets build something for 5 years out"". It's mostly a business based on ""How do we make sales in the next two years?"" All Silicon Valley companies are aiming towards the future in some sense but a good way to gauge how forward thinking a company may be is the number of employees. Companies who hire large staff for research and concept building tend to keep more in the vault. That being said there is an incredibly large number of Samsung employees in Korea and many groundbreaking innovations in HQ. The same just simply can't be said for most of its American subsidiaries.

Even if the money is worth the stress temporarily it seems like there's a pretty high turnaround. Not sure where your limits are but seems like most are about 2 years. I'm not actually sure if that's good or bad, that's just how it is.",Honestly a lot of managers in the US seem to know what they are doing. I would beg mgmt in the US to do everything possible not to micromanage their teams even further and to hire larger teams (which I know isn't the easiest thing because of budget.),2.0,2.0,2.0,3.0,5.0,
2018-11-05, Sales Manager,"Ridgefield Park, NJ",Former Employee ,"Great pay, poor work life balance.",More than a year,0,"Fun to work for a global brand on the forefront of technology, plus they pay well.","Toxic culture, hard for women to get ahead, everything is a fire drill and urgent, you're at the whims of HQ in S Korea.",,3.0,1.0,1.0,3.0,4.0,1.0
2018-11-05,,,Former Employee ,Great company if in the right department,More than a year,0,"Great benefits, bonuses, and you can work from home",Favortism is evident in the work place,Treat ALL employees the same.,4.0,,,,,
2018-11-06,,"Columbia, MO",Current Employee ,Field sales Manager,More than 3 years,0,Always new stuff to do,"Culture is chaotic, Korean culture far different from American culture","Transparenc, reasoning behind of detectives",3.0,1.0,1.0,1.0,3.0,1.0
2018-10-27, Senior Manager,"Phoenix, AZ",Former Employee ,Samsung Electronic America,More than 8 years,0,Great place to work. I was treated very well at Samsung. I enjoyed my time there. If it weren't for the product line being discontinued I'd still be there. Great benefits and good people.,Not a place for slackers. If you are you will not like it here.,,5.0,4.0,4.0,3.0,5.0,4.0
2018-12-05,,"Mountain View, CA",Current Employee ,Software Developer,More than a year,0,"good name on your resume, nice campus","This company doesn't care about her employees at all - when team lay off happens due to frequent product roadmap changes (usually because of senior leadership in Korea changes their mind), there will be a lot of lay off to teams in Mountain View and New Jersey. Change, is common in silicon valley, but Samsung's throwing away employees like garbage as a result of the change is very very uncommon in silicon valley. Other big-name companies will make sure people laid off can be settled into other hiring needs of other internal teams, but Samsung won't do it. And other big-name companies will make sure when a lay-off notice is made to the employee, the impacted employees will have two months or even one year of paid time to search for internal jobs or external jobs, but Samsung won't do it, and Samsung will only gives you about 10 days of notice, and HR will stop picking up your calls to help you search for internal roles because you're on the list to be laid off.","If you don't take care of your employees, your employees won't take care of you either. Please work on your employee relationship to settle laid off employees well, by giving them more weeks for advanced notice, and by giving them more opportunities to be settled internally with teams who're hiring.",1.0,3.0,1.0,1.0,4.0,1.0
2018-11-30,,,Current Employee ,"Politics, chaos, bad culture",More than 3 years,0,The benefit is above average in the Bay Area,"The upper management team does not appreciate your hard work and the contribution you made. The weird Korean culture makes them think employees shall appreciate the opportunity they get from the company no matter what it is. Individual contributors have to deal with politics a lot. The HR team is another chaos. They are not there to help employees solve problems but to make things more complicated and worse. Every one in the management team is busy with politics, nobody cares about the technology and business.","Find better US Management team instead of assigning one from Korea who does not know the US culture. And give US team enough trust and flexibility. Otherwise, why bother to have a site in the US.",1.0,3.0,1.0,1.0,3.0,1.0
2018-10-29,,,Current Employee ,Analyst,,0,"cheap lunch.... nice outlook , cool company","micromanagement, stressful environment, hard to advance as temp",,3.0,2.0,1.0,4.0,3.0,2.0
2018-11-01, Process Innovation,"Frisco, TX",Former Employee ,"Breaks all the rules, sweatshop",More than a year,0,"Competitive pay with long hours of work; If you are minority and non Americans, you are okay.","Asks all kinds of personal questions, age, marriage, school, expect to work from 8am until 8pm everyday or even on Saturday and sunday. Majority are non Americans. Top people are Koreans who dont understand how American culture is and have no respect for American work life balance. No work life balance. Expects you to work after 6Pm after working 8hrs.. average work is more like 60hr per week with the same pay.","Change the company culture or continue to lose market share in innovation, customer service. Tech is not the driving force. It’s only a tool. You lost the customer experience .",2.0,1.0,1.0,1.0,2.0,1.0
2018-10-17, Field Sales Manager,"Phoenix, AZ",Current Employee ,Great company,Less than a year,0,Amazing team work and guidance,Very fast passed you must be organized,None,5.0,2.0,5.0,5.0,5.0,5.0
2018-10-12,,,Former Employee ,Good workplace,,0,Exciting place to work with cool ideas,Stressful and sometimes overwhelming. But good upper management,,4.0,3.0,3.0,5.0,5.0,4.0
2018-09-29,,,Current Employee ,Working in Samsung,,0,"Variety of experience in latest technologies, ability to move around different business environment, job accountability","Prepare to work 14-15 hours a day, micromanagement from South Korean HQ",,3.0,1.0,3.0,5.0,3.0,5.0
2018-09-18, Field Sales Manager,"Tulsa, OK",Former Employee ,FSM,More than a year,0,Pay was good as were benefits,"Zero work life balance , too many meetings and busy work that seemed useless. Wake up to endless e mails or a conference call. Antiquated required training decks we were to push on retail partners for swag was a drain on relationships.",Back off busy work. Take the daily time in traffic and travel into account.,3.0,1.0,2.0,2.0,3.0,2.0
2018-10-03, Market Manager,,Former Employee ,"High Expectations, Poor Business Sense",Less than a year,0,"Great Benefits Package
Potential for position transfer","Zero Work/Life Balance
Mediocre Pay
Business Decisions with no actual research or thought behind them","I worked as part of the Telecommunications Group as part of the Samsung/Best Buy partnership. The company had very aggressive goals (like, you were expected to sell more than what was in stock for a store on a day-to-day basis). Additionally, you were expected to be available to answer emails at pretty much any time they were sent, which could be in the middle of the night due to time difference. While I imagine working in other branches/departments might be better balanced, their retail program was a complete joke.",2.0,1.0,1.0,3.0,5.0,2.0
2018-09-15, Electronics Engineer,"Plano, TX",Former Employee ,Good place to work,More than a year,0,Good benefits. Paid time off,Some micromanagement. If you're not Korean you might have difficulty being take seriously,,4.0,3.0,2.0,3.0,4.0,3.0
2018-09-08, Buyer/Planner,"Plano, TX",Current Employee ,Buyer,More than 3 years,0,Learn lots of career building skills,"Depends on department. Too much politics/overtime. Not sure if there are enough opportunities to move up.

Too many changes in roles and responsibilities without proper explanations, etc","Pre-empt employees earlier with more details about the changes, as well as chances for raise/promotions.",3.0,2.0,2.0,3.0,3.0,
2018-09-05,,,Former Employee ,Logistics Manager,,0,Great place to work. Good salary and benefits,"No cons really. If you work hard, you are rewarded for it.",,4.0,,,,,
2018-08-13,,,Former Employee ,Principal Engineer,,0,Good salary and benefit and more.,hard work stress for product timeline,,5.0,4.0,3.0,3.0,5.0,4.0
