date,employee_title,location,employee_status,review_title,years_at_company,helpful,pros,cons,advice_to_mgmt,rating_overall,rating_balance,rating_culture,rating_career,rating_comp,rating_mgmt
2017-11-09, Market Manager,,Former Employee ,Market manger,More than 3 years,0,"Great group of people to work with. They really care about your personal development. Busy but fun environment, they really take note of your contributions. This all depending on the upper manager you were working for.","To many chains of command, to many departments that do not speak to one another. This causes issues not to be handled in a timely manor and caused your job to be difficult at times.",Do not allow favoritism to over shadow those that are doing a good job. Yes this happened blatantly!,4.0,4.0,5.0,3.0,5.0,3.0
2017-11-03,,,Current Employee ,Great Place to Find Yourself,Less than a year,0,"Above average salary with generous twice yearly bonuses.
Opportunities to work across different internal organizations
Great contacts for the future.","Too many reorgs
Executive level is disorganized and too focused on accumulating power.
Business goals change often.
A lot of employee turnover.
Work life balance varies depending on project VP.",,3.0,3.0,3.0,3.0,4.0,4.0
2017-11-02,,"Ridgefield Park, NJ",Current Employee ,Set Clear Boundaries Early Or They Will,More than 3 years,0,"Flexible, Somewhat Friendly Staff, Lots of Perks for the Right Teams","Long hours, no clear training and development plans, entitlement, managers do not set clear goals","Set clear goals, true pay for performance is needed (truly)",3.0,2.0,5.0,3.0,4.0,4.0
2017-11-21, Operations,"Plano, TX",Former Employee ,Employee,More than 5 years,0,Salary and benefits. Sadly there is not more that I can say. For the time that I was there I should have more pros but it was not not a positive experience and I was at Samsung for over 5 years.,Toxic environment! Constant threats of reorganization. Coworker turning on Coworker just to ensure they are not part of a reorg. The place is awful! The people that are in charge from Senior Management on up should NOT be in the positions they are in. At least not in the call center/e-commerce ops side. It is a poorly managed company run by people who do not have the skill set to do the job that they have been assigned. Many people have been there for over 10 years and it’s not based on their work performance...,Hire people who are qualified. Get rid of those that are taking up space and playing politics . And please stop keeping employees based solely on how well they drink and smoke and hangout! There are those employees that actually care about their health and choose not to indulge in nonstop work activities that include nothing more that drinking and lighting one cigarette off the other.,1.0,1.0,1.0,1.0,3.0,1.0
2017-11-13, FSM,"Middletown, NY",Former Employee ,Pushy & Unethical company,More than a year,0,They do listen to their customers.,"They really don't care about the employees, ethics, or rules so long as you get the desired result! And if you ask any questions they're NOT WELCOMED, you are considered a trouble maker if you ask any questions!",You have the wrong folks in management. Jokers!,1.0,1.0,1.0,1.0,1.0,1.0
2017-10-05,,,Current Employee ,"Not bad, could be better",,0,"Big name, you learn a lot very fast, dynamic, busy","Pay is not great compared to workload, can be long hours, weekends, holidays, management is based around expatriates.",Localize and trust local experts. Just because you are from headquarters doesn't make you right.,3.0,2.0,1.0,2.0,2.0,1.0
2017-10-07,,,Current Employee ,Instructional Design,,0,"This is a good company to work for, and the benefits are good.",Lack of leadership. Leaders need to be trained to help support and developed employees,Leaders need to be trained to help support and developed employees,3.0,3.0,2.0,3.0,4.0,2.0
2017-10-16, Middle Management,"Ridgefield Park, NJ",Former Employee ,Middle Management,More than 5 years,0,"Great Products, strategically relevant planning, knowledgeable people, quick implementation of plans once a direction is decided.",Lack of trust in local management by Korean HQ. Oversight by HQ is rigid to the point of being oppressive and unrealistic.,Allow local management autonomy in decision making and budgetary guidelines.,2.0,2.0,1.0,2.0,3.0,3.0
2017-10-02,,,Current Employee ,+Pay / Benefits .... - Culture,More than 3 years,0,Pay and benefits are good,Unique culture with heavy Korean influence,,3.0,3.0,2.0,3.0,5.0,4.0
2017-09-22, Field Sales Manager,"Salina, KS",Former Employee ,Field Sales Manager,More than 3 years,0,My duties were to educate cell phone carrier reps and big box store cell phone reps on the features and benefits of the new Samsung phones and devices. I enjoyed meeting new people and establishing relationships with them.,The job required lots of driving miles and lots of hours every week.,There were no opportunities for advancement in my area.,4.0,3.0,5.0,5.0,4.0,4.0
2017-09-13, Talent Acquisition Manager,"Dallas, TX",Current Employee ,"Great, challenging, environment.",More than 3 years,0,"This company let's you make am impact. It's challenging, but rewarding. The people here are amazing and it's a highly collaborative environment.",Some of the systems are challenging. They can get in the way of actually doing the work that is required.,,4.0,3.0,4.0,4.0,5.0,4.0
2017-10-09, Call Center Representative,"New York, NY",Current Employee ,I don't like it,More than 3 years,0,They lied to customers and then haRd to handle it.,"Hard to work and explain samsung mistake.
Like note8 problems",Hate it to lies to customers,1.0,1.0,1.0,1.0,1.0,1.0
2017-08-31,,,Current Employee ,Senior Manager,,0,"Pay, benefits, and the marketing team are some of the nicest people I have ever worked with. My direct boss is great.",Seattle E-commerce leadership does not care about their employees. If you are considering a role there be sure to have a thick skin because you might get cussed out very often or be a witness to many drive by demoralizing sessions. It is very unprofessional,"Consider who you hire in upper management, there is a direct correlation to employee moral and how employees are treated. Also consider promoting within.
Empower your employees to be owners, If you just want people to do things the way they have been done don't pull people from other top companies. Just hire college grads.",3.0,1.0,2.0,1.0,4.0,1.0
2017-09-28, Ecommerce,,Former Employee ,ECommerce Division,Less than a year,0,Pays very well and you are working in a growing environment. But the money is not worth it. There are much better options out there.,"If you like being treated like dog poop, this is the job for you. Leadership is abrasive, rude, & hated throughout the rest of the company. There is zero structure in this division. Probably the most disorganized structure I've ever seen.

They have successfully created a culture where you are being micromanaged beyond belief and are expected to hit unrealistic deadlines on a daily basis with zero direction.",Such a shame because DTC has so much potential for ecommerce but the culture and the amount of disorganization and cracks in that division is beyond anything imaginable. If eComm leadership doesn't see that this is a house of cards waiting to collapse then they are even more inept that I thought.,1.0,1.0,1.0,2.0,4.0,1.0
2017-08-31,,,Former Employee ,Marketing Manager,More than 10 years,0,"Pay is good, PTO is fair if you get to use it, good benefits","Long hours, whatever you achieve is never good enough/what have you done for me lately?",Don't toss aside the people who helped you get where you are today,3.0,,,,,
2017-08-04,,,Former Employee ,Risk Management Specialist,,0,Great director and a good team,takes time to adjust to the culture,,4.0,2.0,3.0,3.0,4.0,3.0
2017-08-14,,,Former Employee ,District Sales Manager,More than 5 years,0,The pay and bonus structure was decent,Field team was very micromanaged,Trust your people who have been out there doing it for a while,2.0,3.0,2.0,1.0,3.0,1.0
2017-07-30,,,Current Employee ,Current Status,,0,Amazing Brand with incredible products and solutions,"Need to increase transparency; institute better work/life balance initiatives; decrease ""title"" enablement; better L&D offerings",Take to heart the feedback given by employees and make a change. Being a large organization does not mean you can't be a thoughtful one.,3.0,2.0,3.0,3.0,4.0,2.0
2017-07-26, Senior Manager,"Richardson, TX",Former Employee ,Running Full Speed at Walls,More than a year,0,"Passionate employees, above average pay.","Executive dysfunction, overwhelmingly resistant to change",Create a well paved road before trying to drive 200 mph on it toward an under-defined goal.,3.0,2.0,2.0,4.0,5.0,1.0
2017-08-28, Business Operations Manager,"Mountain View, CA",Former Employee ,Business Dev and Partner Relations,More than 3 years,0,Multi-Cultural Environment and Experience Working in Korea,"Zero direction, hierarchy from dynastically structure company, no creative thinking encouraged and most products we worked on never saw the light of day. Became a toxic environment and sought therapy to cope with the head games upper management insisted on playing.","Seems like a lost cause even trying to make suggestions, because Samsung believes it is above its employees. Simply throwing a lot of money at a person does not make them devoted.",1.0,2.0,2.0,1.0,5.0,1.0
2017-07-14, Appliance Technician,"Bergen, NJ",Former Employee ,"Great company to work ,take workers first ,special health care benefits, as a technicians always on the go,fix right.",More than a year,0,"I loved it's here very much this is likt my personal business, i have learn a lots as I continued to grow as a top technicians with this company.","To get all your priority on target fix right first time,keep your daily tally up to standard ,set target achieved gold.",Let all's technicians get parts for jobs on times so repaired turn around time will be minimized and production goes up the charts.,4.0,4.0,4.0,5.0,5.0,5.0
2017-07-12,,,Former Employee ,Former Field Sales Manager,,0,Always on the cutting edge of the lastest technology,No work life balance especially during launch time and holidays. There is very little to no upward mobility especially for the Field team.,,3.0,,,,,
2017-07-07,,,Current Employee ,Great company,,0,"Great atmosphere, great salary, solid company.","High pressure, long hours work environment.",,4.0,4.0,4.0,4.0,4.0,4.0
2017-06-29,,,Current Employee ,Senior Sales Manager,,0,"Products, benefits, people, work-life balance, and compensation!",Absolutely none that I can see.,,5.0,4.0,4.0,5.0,5.0,
2017-07-28,,"Mountain View, CA",Former Employee ,Join only if you must,More than a year,0,Subsidized cafeteria and Decent health benefits.,Lots of frustrating starts and stops. Not coordinated. No stock options.,,1.0,3.0,2.0,1.0,2.0,1.0
2017-06-22, Sales Engineer,,Current Employee ,Excellent opportunities in B2B,More than 5 years,0,"Great pay and benefits
Amazing people!
Excellent reputation, business and government agencies feel confident buying the brand. Great digital signage software ecosystem.",Product roadmap reflects a serious disconnect between Korea's supply chain mentality and the certainty of product lifecycle that companies need.,Quick shuffling the account maps and push back on Korea and demand a roadmap that our customers expect.,5.0,5.0,5.0,4.0,5.0,4.0
2017-06-27, Administrative Assistant,"Plano, TX",Current Employee ,Admin,More than a year,0,The people that you work with. Thats all.,Everything good you do goes unnoticed except when you have an error all hell goes loose.,Notice the good in people.,2.0,1.0,2.0,1.0,1.0,1.0
2017-06-10, Experience Consultant,"Phila, PA",Current Employee ,Samsung Experience Store Lead,More than 3 years,0,"Amazing culture, great people, fulfilling work with above average pay. You get to work with the latest and greatest technology on a daily basis!","Occasionally conflicting messaging with the organization. This is frequently corrected, but after time and energy has been wasted on non profitable activities","Align process messaging across the platform before disseminating. While the end goal is frequently clearly stated, the process to get to that goal is frequently communicated poorly.",4.0,4.0,5.0,3.0,4.0,5.0
2017-06-08, Market Trainer,"Atlanta, GA",Former Employee ,Good Company,More than a year,0,"Access to some of the best tech on the planet, great communication from headquarters","Work life balance is not very good, the hours vary too much",Work life balance needs to be priority,3.0,2.0,3.0,4.0,4.0,3.0
2017-05-29, Samsung Experience Consultant,"Fort Worth, TX",Former Employee ,Great until layoffs happened,Less than a year,0,"Fun and a great learning experience. Fairly laid back and easy as long as you talk to customers. Management is great about working with your schedule and giving time off. Samsung culture was good, however you're more submerged in Best Buy's culture as an SEC.","Weekdays could be painfully slow. Limited training and often stressful whenever working alone. No matter how great your Samsung co-workers and managers were, a good work life was primarily dictated by whichever Best Buy you're placed at. Layoffs happened unexpectedly and were by tenure and had nothing to do with performance. And unfortunately, I was affected.",More extensive and in depth training would be beneficial.,4.0,5.0,5.0,2.0,2.0,4.0
2017-05-14, Staff Engineer,"San Jose, CA",Former Employee ,Game of Thrones,More than 3 years,0,"1. Good pay
2. Working hard to, not look like Korean Military / company. still, it's in their genes
3. Easy to get a job here, than in Apple , Google or Facebook!","1. It's a policy to shuffle certain number of VPs every year. They are in constant pressure to perform or get sacked, The quickest way for them to stay competitive is to shoot the pawns in front. That will keep other VPs in defence. This culture is seen company wide, if it's a smaller division like Samsung strategy and innovation center. It's more predominant.

Consequence for employees, you are always under pressure. Especially, if you are young in career, don't get spoiled by Samsung work culture.

In short, not recommend for early in your career",Invest on a performance appraisal system that is well rounded. Elevate only Leaders/ Managers who can empathize,3.0,3.0,2.0,4.0,4.0,1.0
2017-05-17,,,Former Employee ,Demand Generation Team,,0,Excellent pay and the management team use to be innovative.,CCO & Brand leads are clueless.,,4.0,1.0,2.0,1.0,4.0,1.0
2017-05-14,,,Current Employee ,Good long term stay,,0,"Good benefits, regular hours, subsidized lunch with huge portion, Christmas gift of company products, committed to corporate social resposibility, employee service day","Buearacracy , too much process and paper work",,4.0,5.0,3.0,4.0,4.0,3.0
2017-05-08, Senior Financial Analyst,"Ridgefield Park, NJ",Current Employee ,Coordinator in PM team,More than 5 years,0,"Reputation as company is globally recognized, Flexibility in working hour",Promotions are not transparent and often not fair. A lot of pressure from HQ,Need to be transparent and fair on promotion otherwise people will look for other opportunities always.,4.0,3.0,2.0,3.0,3.0,1.0
2017-05-01, Director,"Ridgefield Park, Bergen, NJ",Current Employee ,Aggressive company looking for continued sucess,More than 5 years,0,Goal oriented company seeking continuous growth,"Multiple layers of permission needed, even for the smallest expenditures",Seek more autonomy from Korean management,4.0,1.0,2.0,3.0,4.0,4.0
2017-04-28," Team Lead, Web Master, Tech Writer","Lake Hopatcong, NJ",Former Employee ,"Tech team lead, web master, Computer graphics,",More than 10 years,0,"Job environment was very comfortable and rewarding, employer was very understanding",Hard word but enjoyed it,I miss it.,5.0,5.0,5.0,5.0,5.0,5.0
2017-05-01,,,Former Employee ,Busy busy busy but learn a lot,,0,"- Good pay
- promising
- great products
- awesome for resume","- micro management
- no work life balance",,3.0,1.0,2.0,4.0,4.0,1.0
2017-04-27, Staff Product Engineer,"San Francisco, CA",Current Employee ,Staff Product Engineer,More than 5 years,0,"Flexible hours, Decent Benefits/Compensation, Snacks, Location","Bad Management, Lack of Clear Direction, No opportunity for Advancement","Promote from within, and develop clear processes for all business operations.",3.0,3.0,2.0,1.0,4.0,2.0
2017-04-08, Senior Digital Service Specialist,"Richardson, TX",Former Employee ,Fast paced environment but great career booster and pay,More than 3 years,0,"Well-paid positions all around, peers are what make this place great, travel opportunities are aplenty and benefits both health and perks are above and beyond. Opportunities to work from home and create your own projects (a la Google) was very much appreciated. The philanthropic efforts by the CEO are something you won't see in too many places.","As many other reviews have stated, this place is fast paced and regardless of your role, you are ""on call"" at all times. If you have a family, be prepared to make lots of sacrifices for this purpose as work/life balance is non-existent. Other possible cons are if you are a non-Korean speaker this puts you at a disadvantage in terms of career growth as the higher you get, the more it becomes an expectation (unofficially). My advice is to know that for the North American market, you have two managers, your direct (likely non-Korean) boss and an unofficial ""dispatcher"" (someone sent from HQ Korea) to watch over your team's efforts. Once you recognize the two layers of leadership and the ambitious (see: unrealistic) yearly goals, you can focus on what you can control and work towards meeting certain goals. Finally, be prepared to deal with inexperienced managers that put in the time for their role, but have never been trained to handle leadership function (also see: lack of ongoing training programs)",Transparency is lacking all around - reset your culture and be transparent by setting expectations from the start. Look for ways to make your employees full time and avoid contractors and third party layers - it is not working for other Fortune 50 companies and is creating a toxic environment and resentment from all. Your top talent is leaving because your annual HQ Korea survey is not showing any impact and is lacking transparency.,3.0,2.0,1.0,3.0,5.0,3.0
2017-04-14,,,Current Employee ,a lot of overtime,,0,A lot of time. Nice pay.,it is hard to be formal employee,,3.0,,,,,
2017-03-29,,"Ridgefield Park, Bergen, NJ",Former Employee ,Supply Chain Specialist,More than a year,0,Samsung is great place to work,"Great benefits, Great people, Great company culture",,5.0,4.0,5.0,5.0,5.0,5.0
2017-03-30, Manager,,Former Employee ,"Hostile environment, no communication, poor leadership, good pay",More than 3 years,0,"Good pay, quality recognized brand","verbal abuse is constant no matter the performance, no communication, no empowerment to actually do your job","regular communication to employees, empower employees to do their job, us the strengths of the people around you, listen to the people on the front line",2.0,1.0,1.0,2.0,5.0,1.0
2017-03-13, Engineer III,"Austin, TX",Current Employee ,Great Pay/Benefits. Long Hours.,More than 5 years,0,"Pay and benefits are great. The bonuses, PTO, gifts, and health insurance are some of the best I have seen compared to other companies",Long hours. 24/7 facility where you have risk of being called at any moment. Very fast paced that causes details to get missed,,4.0,2.0,3.0,3.0,5.0,3.0
2017-03-16,,"Ridgefield Park, NJ",Former Employee ,The Body Shop,More than a year,0,"Bonus structure, global company, solid earnings","Runs very lean, often performing jobs other than the one a person was hired for, very poor tools (computers) for employees to work with, more political than Washington DC, and poor work / life balance",,3.0,2.0,1.0,2.0,4.0,3.0
2017-03-16,,,Current Employee ,My review...,,0,Friendly environment. A great place if you wanna learn.,It could be better if cafe opens late...,,5.0,5.0,5.0,5.0,4.0,5.0
2017-03-15,,,Current Employee ,Good company,,0,"Good people, fast paced, good products",Too much bureaucracy and red tape. Challenging work life balance,True creativity is stifled by budgets and process. Foster a culture of work/life balance.,4.0,2.0,3.0,3.0,4.0,3.0
2017-03-14,,,Current Employee ,Channel Marketing and Program Development Assistant Manager,,0,Great benefits and fast paced,"micro management
no work life balance
does not take care of employees",,3.0,1.0,1.0,3.0,5.0,1.0
2017-03-20,,"Ridgefield Park, NJ",Former Employee ,Great on your resume,More than 8 years,0,Exposure to all aspects of business,Micro-management from 6000 miles away,,2.0,1.0,1.0,1.0,3.0,1.0
2017-03-07, Logistics Coordinator,"San Diego, CA",Former Employee ,Solid Company Overall,More than 5 years,0,Great benefits and casual but fast paced work environment,Culture takes some getting used to. Great Work Place initiatives were cancelled.,,3.0,3.0,3.0,3.0,4.0,3.0
2017-04-03,,"Ridgefield Park, NJ",Former Employee ,Polluted company,More than 5 years,0,"Brand name (big company), nice medical benefits",Work becomes your whole life. So much redundant work to be done; work is not distributed fairly; no efficiency; broken communication between every level; no one is truly honest. Company is all about winning and meeting unrealistic deadline without focusing on the quality. Company is trying to make good working environment but not being good at it (usually comes up with juvenile ideas). This company is trying to be innovative in many ways without having strong foundation: It's like decorating your home without furniture. Too political and hatred everywhere.....,"Do not assume! And you guys are not getting helpful feedback unfortunately!
Upper management often communicate with only the 10% of people but those 10% of people are often wrong......",1.0,1.0,1.0,4.0,1.0,
2017-03-11,,,Current Employee ,Not a software company,,0,Great Hardware designs and concepts.,"Company tries so hard to be a software company which their not. Everything is driven by the hardware design.
Decision is all driven from Headquarters in Korea and limits the local offices to be creative and innovate.
Good management don't last long at the company.",,2.0,1.0,2.0,2.0,3.0,2.0
2017-02-25,,,Current Employee ,Senior Accounting Manager,More than 3 years,0,The pay is above average with good benefits.,Cumbersome approval processes to get things done efficiently.,,4.0,3.0,3.0,4.0,5.0,3.0
2017-02-24,,"San Diego, CA",Former Employee ,Logistics,More than 3 years,0,"Excellent health benefits, challenging environment, broad experience","Difficult culture, very competitive employee's, work/life balance difficult and not a company focus",Embrace your employee's and emphasize teamwork and cooperation,3.0,1.0,2.0,4.0,4.0,3.0
2017-02-19, Senior Marketing Manager,,Current Employee ,Senior Marketing Manager,More than a year,0,Benefits are great; Will learn a lot.,No work life balance and lots of politics,,3.0,1.0,3.0,3.0,5.0,3.0
2017-02-20,,,Current Employee ,Financial Analyst,,0,Great benefit package. Fast paced organization,Extremely poor work life balance,,4.0,1.0,1.0,3.0,5.0,2.0
2017-02-18,,,Current Employee ,Love to challenge,,0,Make your weakness to become your strength,Prepare yourself to dive in.,,3.0,,,,,
2017-02-15,,,Current Employee ,Brand Ambassador,,0,Easy hours. Very flexible. Good pay.,Not too much. This isn't any ordinary Samsung job so it's hard to relate.,,5.0,3.0,3.0,3.0,3.0,3.0
2017-02-13,,,Former Employee ,Fast paced and challenging,More than 5 years,0,"High pay, lots of benefits, and access to new technologies.","Never time to utilize benefits, constantly changing just to have change. Never know the direction of the company even if it is pertinent to your job function.",More communication about the direction of the company. Respect your employee's family time. Don't change goals mid-quarter and don't have competing goals or directions.,3.0,2.0,2.0,2.0,4.0,3.0
2017-03-14, Software Engineer,"Bridgewater, NJ",Current Employee ,Software Engineer,More than 5 years,0,Deposits on my account is the only pros.,"Everything is focusing on ""How to acts affectionately toward boss"".
There's no genuine evaluation by the employee's own merits.",Key reason of losing talented people if in the inner culture.,1.0,2.0,1.0,3.0,2.0,1.0
2017-02-07, Market Manager,"Washington, DC",Current Employee ,Market Manager,More than 3 years,0,Great brand and great coworkers,Lack of growth opportunities,,3.0,3.0,3.0,2.0,3.0,3.0
2017-02-15,,,Former Employee ,Marketing Supervisor,More than a year,0,"great products, nice office, made some good friends there","overwork, bad management, HR poor, harassment",,2.0,1.0,1.0,2.0,3.0,1.0
2017-02-03, Manager,,Former Employee ,Potential,More than 3 years,0,"Good benefits, great products, a lot of energy and synergy","A lot of titles, less the authority",Hold leaders accountable .....,3.0,2.0,3.0,2.0,4.0,2.0
2017-02-16,,"Ridgefield Park, Bergen, NJ",Former Employee ,Good Benefits but you have work for it,More than 5 years,0,"Medical and 401k is good, Job security",lots lots of hours of working. you will lose everything.,Please listen to employees,2.0,1.0,1.0,3.0,5.0,3.0
2017-01-31, Business Analyst,"Overland Park, KS",Current Employee ,Great benefits and good pay,More than 5 years,0,They pay very well. They have great benefits and vacation. A lot of opportunities if you are willing to travel/relocate.,"The environment is very competitive, making team work difficult. They are more concerned with quantity than quality and often do not look past appearances when evaluating employees.",Need to do more to foster cooperation. Should look closer at employees and the work that they do.,3.0,3.0,2.0,3.0,5.0,4.0
