date,employee_title,location,employee_status,review_title,years_at_company,helpful,pros,cons,advice_to_mgmt,rating_overall,rating_balance,rating_culture,rating_career,rating_comp,rating_mgmt
2016-08-17,,,Former Employee ,They Beat You Down,More than 3 years,0,"There is not a whole lot of positive about this place. They pay well, but it's blood money...","Being female is tough, very misogynist culture. Prepare to be challenged constantly...and not in a good, push your limits way, but rather a ""You are an idiot"" kind of way. American management has given up. They used to care, but have become very removed from the business and the people. Newer VPs hired from CPG are clueless, lack direction, and therefore can't give any...Working is a constant and exhausting fight that isn't worth it. AVOID at all costs.",,1.0,1.0,1.0,1.0,4.0,1.0
2016-07-13, Supply Chain Specialist,,Current Employee ,Supply Chain Specialist,More than a year,0,"I was lucky that I work with the coolest people :)
Free food all the time :D",OT since we have to communicate with Korea HQ,Work–life balance is important,3.0,2.0,2.0,3.0,2.0,2.0
2016-08-17, Market Manager,"Detroit, MI",Former Employee ,Market Manager Role,,0,Great benefits package. Partnership with Host Vendor and Third Party Labor Team,"Terrible leadership, No Work Life Balance, Support, Structure, or Operational intelligence, Very political climate without morals.",,1.0,1.0,1.0,1.0,2.0,1.0
2016-07-21, UI Designer,"Bridgewater, NJ",Former Employee ,Not worth it...,,0,"It can be cool to see something you've worked on being popular out in the real world.

Benefits package was relatively good.","Long hours are expected rather than appreciated. Working only 8 hours a day gets you labeled ""not a team player"".

Opportunities to make a difference from the American branches are limited, because all important decisions are made at HQ in Seoul. Design team managers come to the US from South Korea for 2-3 years. There is severely limited opportunity for advancement if you start in an American office.

Anyone who does not speak Korean is constantly at a severe disadvantage trying to overcome the language barriers.",,2.0,1.0,1.0,1.0,4.0,1.0
2016-08-10, MSCA Director,"Mountain View, CA",Former Employee ,Know what you want,More than a year,0,"+ great salary
+ looks good on the resume
+ subsidized (good) food on main campus

If you want these things, have a tough skin and don't get too invested in your work, you can make it here.","- HQ holds the reigns
- false sense of autonomy in the US
- figurehead leadership with no power (unless they are Korean)
- no people management at all...no 1:1s, no effort, no interest
- culture of blame
- no one trusts anybody
- terrible corporate culture (good deeds are for show)
- HR is incompetent / recruiting is understaffed

If you want to make a difference, you will be swimming up stream against a raging river. You will eventually lose strength and just let go. It's not worth it. You'll wash up a on some river bank a broken person.","The company environment not only stifles innovation, it crushes the soul of it in your employees. I learned to cope with the chaos by disconnecting and not caring. More and more, I came to expect the chaos and have to wonder if it isn't a management tool. Continue down this path without making some real changes will lead to a staff of hired guns...only there to clock in, get paid and not care.

The way the recent staff reductions were handled utterly shocked me. This showed how little people who dedicated themselves to their work are worth to the company. Such a waste.

I think the problems are too large and too many to fix. Samsung should move all product development back to Korea and have the US only focus on sales and marketing.",1.0,1.0,1.0,2.0,5.0,1.0
2016-08-03, Senior Software Engineer,"Mountain View, CA",Former Employee ,Terrible,,0,They have a subsidized cafeteria.,"This is the worst organization that I have worked for. If you love toiling until the wee hours and also weekends, then this is the place for you. All decisions are made at HQ, from scheduling down to the last dot on the screen, with minimal input from the developers actually doing the work. I have been exposed to some Program Management anti-patterns that I didn't even know existed. The project meetings seem to be focused on assigning blame, rather than effective planning and getting work done. Everyone, from senior management down, lives in mortal fear of not satisfying the latest edict from HQ. I would not recommend this place at all.","Recognize the cultural differences with operating in the US, provide more autonomy for product development, and abandon the sweat-shop mentality.",1.0,1.0,1.0,1.0,3.0,1.0
2016-07-08,,,Current Employee ,Samsung Review,,0,"Great salary and benefits package. Employee discounts on Samsung products, and also discounts for friends and family",Hierarchical management where Korea HQ has final decision-making power. Career growth can stagnate if you get stuck in wrong team.,,2.0,2.0,2.0,2.0,4.0,2.0
2016-07-07," Senior Manager, Strategic Planning","Richardson, TX",Former Employee ,Frustrating experience,More than 3 years,0,"They push the envelope on new technologies and you get to work on some pretty cool, cutting edge devices and features.","Decisions are made centrally (in Korea), and high up in the organization. You have tons of responsibility but no control over your success. You are expected to work crazy hours and to be on calls at night with Korea, plus respond to email/phone calls at any hour, even on vacation.",Respect employees' down time.,2.0,1.0,1.0,3.0,4.0,1.0
2016-06-14,,"Ridgefield Park, NJ",Former Employee ,"Great forward looking, dynamic company but be weary of culture differences and dispatcher system",More than 3 years,0,"One of the best benefits progam I've ever seen. 401k 100% match. Good salary, smart, dedicated people","The company ""culture"" can sometimes be a hindrance. Bottom up communication is sometimes ignored","Seek to transition to a broad based meritocracy as opposed to the current system to fairly compensate and keep talent. Also strive to localize company culture - when in Rome, do as the Romans do",3.0,3.0,3.0,4.0,4.0,3.0
2016-06-15,,,Former Employee ,Experience,,0,it is a good company to work with,Work load is a bit higher,,4.0,,,,,
2016-06-07,,"Plano, TX",Former Employee ,Work 24/7,More than a year,0,Pay is good and great benefits. Samsung does give back to the community and makes good products. I would take lesser pay to have a job I enjoyed.,Micro managed. Multiple approvals needed to complete a simple job task. Systems are out dated and not user friendly. Minimal training. If you go on vacation and someone needs to ask a question you better respond. STRESSFUL! Contractors are not included in correspondence then the regular full time employees have to educate.,"Take away processes that are non productive and require multiple approvals. Offices are not welcoming and sterile. White walls, no art, bright lights..... Desks give you no privacy and if you are on the phone the whole room can hear you. Do you want employees or robots??? Offer on-line courses in Microsoft Office and other internal systems.",3.0,1.0,3.0,3.0,5.0,3.0
2016-06-17,,"Ridgefield Park, NJ",Current Employee ,Poor leadership,More than a year,0,"Samsung has a good brand name, and makes good products. Good benefits",The environment is extremely political and key decisions are driven from their headquarters in Korea. Career development is limited and internal systems and tools are regressive and poorly implemented,,2.0,2.0,1.0,1.0,3.0,1.0
2016-06-18,,"Ridgefield Park, NJ",Current Employee ,"Good pay, nice park.",,0,Good place to start your career. a lot of learning opportunities,"No work/life balance.
HQ dispatchers always making decisions themselves. No communication
Some Korean directors and managers need to come to realization that this is not Korea.",,2.0,1.0,1.0,2.0,3.0,1.0
2016-06-06,,,Current Employee ,Different,,0,You will learn alot really quickly,Culture is not great. Wouldn't recommend,,3.0,3.0,1.0,2.0,5.0,2.0
2016-06-06,,"Plano, TX",Current Employee ,I have worked as a full-time employee for over 3 years,More than 3 years,0,"Great salary and benefits. Day of Service is nice to be a part of and holiday gifts have been good. Depending on the department, a lot of friendly and professional talent. It's great experience and you'll learn a lot.",The culture here is difficult if you want to get certain things done. Your overall experience here will depend on what department you're in. Some employees are unbelievably rude and unprofessional. It is common to be treated as though you're the competitor/enemy (for lack of a better word).,"Let the people you hired to do the job...DO THEIR JOB! Lots of experienced people are there to make your business better so stop putting up road blocks that keep good things from happening. Stop spending money only on the things you think are important, listen to the other professionals who really are trying to help you conserve money over the long haul.",2.0,3.0,1.0,2.0,4.0,1.0
2016-06-18, Software Engineer III,"Seattle, WA",Former Employee ,Software Engineer,More than a year,0,"Benefit in cash, matches the same level in other companies, e.g. mircosoft. You will experience and have to do a lot extra job, including PM job, testing, as a developer -- a quick way to learn everything","No respect for people. Manager calls you anytime they want, even in your wedding, to ask you the project information, as they may not know it as your manager. They also ""nicely"" advice you to cancel your vocation, or even wedding, which they approved months back, of course you are responsible for your own cost.

Promotion is not based on performance. They play dirty tricks (or say lied, in some extend) on the offer letter about the immigration support.",,1.0,1.0,1.0,1.0,3.0,1.0
2016-05-13, Financial Analyst,"Ridgefield Park, NJ",Former Employee ,Great company to start your career,,0,The professionals here are one of the smartest people in their field. You will learn a lot of transferable skills. And also looks great on your resume.,The way this company treats contractors is terrible. Does not promote inclusion. Total seperation even though contractors do the same or more than full time employees. The culture is very Korean and rigid. I'd like to say that 80% of the people who work here are Korean. If you want to work for a diverse company this is not the one. To rise Up the corporate ladder is extremely difficult.,,3.0,2.0,1.0,3.0,2.0,3.0
2016-06-16,,"Seattle, WA",Current Employee ,Samsung R&D - don't ever join,,0,Very decent benefits and good exposure to mobile projects. Please find new employer sooner.,"1) Very Poor HR performance review system for R&D.
2) micromanagement and no respect for engineers.
3) only rate race.
4) lot of Monkey managers and very poor project execution.","Please create a decent work place(DWP) and don't continue to encourage monkey managers.

Lot of discrimination and poor execution.",1.0,3.0,1.0,1.0,3.0,1.0
2016-05-06, Director,"Ridgefield Park, NJ",Current Employee ,Director of Technology and Business Development,,0,Very focussed sales driven organization,Supply chain and mobility are the main drivers.,,4.0,3.0,4.0,4.0,5.0,3.0
2016-05-08, Business Planning Manager,"Dallas, TX",Former Employee ,Provides experience at a global leading tech device company,More than a year,0,"Provide opportunities to learn tech device industry. well organized and quite traditional corporate culture, big name/industry leader",quite male oriented company. double leadership line of Korean dispatchers and local leadership. More steps and lines of communication.,Need to be more transparent in decision making. Communicate and engage more with employees on company's vision and strategy,3.0,3.0,3.0,3.0,4.0,3.0
2016-05-03, Manager,"Richardson, TX",Former Employee ,Manager Engineering,More than 3 years,0,"Good pay, good work place. flexible hrs",very long hrs of work.,"if it long term contract, convert them to full time",3.0,1.0,3.0,3.0,5.0,1.0
2016-05-02,,"Allen, TX",Current Employee ,Vendor Manager,More than a year,0,You get what you put in.,Long work hours and high stress,,4.0,,,,,
2016-04-19,,,Current Employee ,It was better before current leadership,,0,Great products and most people are decent.,Has become very slow and beauracratic. The company went thru a major hiring cycle two years ago but the hires have been nothing but dead weight. Also the company does a poor job of coaching difficult people and instead likes to promote the problem.,All of the CDO people hired the past two years are nothing but high paid individuals who provide no value,3.0,1.0,1.0,2.0,3.0,2.0
2016-05-11, Field Sales Manager,"Saint Louis, MO",Former Employee ,field sales manager,Less than a year,0,"great company, great products, fun training.","unrealistic goals, poor management, not a lot of room for growth.",,2.0,3.0,3.0,1.0,5.0,1.0
2016-05-05,,,Former Employee ,Senior Manager Business Solutions,,0,"Pay and benefits are top notch, brand is super strong and opens doors and conversations to promote business opportunities, travel and expense policy is acceptable.","The company as run in the US business unit is rudderless. The company hires top notch people and then has them running around in circles. The majority of leadership is theater, without substance or real impact. Leadership does not want to hear the truth if it doesn't reinforce their perspectives. This is a miserable place to work.",,2.0,2.0,2.0,2.0,5.0,2.0
2016-04-25, Senior Product Manager II,"Richardson, TX",Current Employee ,Not that bad,More than 5 years,0,Lots of opportunities for growth and personal development,Majority of the time there is a disconnect from the executive level and the rest of us.,need to be a little more consistent with the communication from the top down.,4.0,2.0,3.0,4.0,5.0,3.0
2016-04-21,,,Former Employee ,Learned variety of tasks but limited culture,More than 3 years,0,"Learned at least 15 different items
Very good benefits and holiday gifts","Poor political culture within certain departments
Long hours throughout the week","Widen culture gap within certain departments
Hire more non koreans in managerial positions
Discipline overly political employees",3.0,2.0,3.0,3.0,4.0,2.0
2016-04-21, Lead QA Engineer,"Ridgefield Park, NJ",Current Employee ,Good holidays and benefits,More than 3 years,0,"Holidays, benefits are good, good bonuses.",No opportunity to grow and management from korea is tough,Need to improve globalization and have more opportunities for growth,3.0,3.0,3.0,1.0,4.0,1.0
2016-04-13, Senior Manager,"Dallas, TX",Current Employee ,Difficult culture /environment.,More than 5 years,0,"Salary/bonus, benefits, although some are being reduced, vacation (except difficult to use), good on resume","HQ Korea, Dispachers, difficult environment, decisions often overturned, US employees not trusted or considered valuable,",Dissolve NAHQ,3.0,2.0,2.0,3.0,4.0,3.0
2016-04-18, Service Manager,"Los Angeles, CA",Former Employee ,service manager,,0,great benefits. Medical and emplyee benefits.,Quick Management change. too big .,,3.0,2.0,3.0,4.0,4.0,2.0
2016-04-12, Retail Market Manager/Operations Lead,"Enfield, CT",Former Employee ,Market Manager,More than a year,0,Awesome technology tons of opportunity to represent the works largest band in consumer electronics,limited work/life balance and connectivity to leadership,,3.0,,,,,
2016-04-11,,"Norwalk, CA",Current Employee ,Samsung Electronics America,More than 8 years,0,Great benefits and work environment,Growth and advancement is limited to non Korean speaking employee.,,4.0,,,,,
2016-04-12, District Sales Manager,"Dallas, TX",Current Employee ,District Sales Manager,More than 3 years,0,"Fast pace, great benefits edge of technology",Must deal with ambiguity daily,,3.0,2.0,3.0,3.0,4.0,2.0
2016-04-11,,,Current Employee ,QA Engineer,,0,The pay is good. Great work culture. Benifits are outstanding.Fast pace environment,Long work hours. No stock benifits as the company is korean based.,,4.0,3.0,4.0,4.0,4.0,3.0
2016-04-18, Product Marketing,,Current Employee ,Good Salary. Not much else.,,0,Has some of the best salary (no stock though) out there. Good company to have on your resume - you end up working on globally relevant products (depending on your job).,"Culture is slow. Management is slow. A lot of favoritism if you ""get in line"". Boring, no other perks.",Make the office interesting instead of boring zombie work.,2.0,3.0,1.0,3.0,4.0,1.0
2016-04-04, Senior Business Analyst,"Richardson, TX",Current Employee ,Stalling,More than 3 years,0,"Great compensation & PHENOMENAL benefits, but it's a honey trap.","Everyone drops everything when HQ makes a request, and the company continues to lack strategic direction. Politics are happening upstream, but North American HQ has been withdrawing autonomy from Samsung Mobile in Richardson",Figure out what what you want to be and go for it. Stop chasing Apple or other competitors and decide what Samsung stands for. Drop the culture of constantly appeasing HQ visitors.,3.0,3.0,2.0,2.0,5.0,3.0
2016-03-31, Engineering Manager & Staff Engineer,"Issaquah, WA",Current Employee ,manager,More than 3 years,0,good salary and benefits compared to professional ability and experience,Keep working and working 24/7/365,,4.0,,,,,
2016-04-11, Inside Sales Representative,"Ridgefield Park, NJ",Current Employee ,Inside Sales,More than 3 years,0,"Great PTO, Great Healthcare, Great 401K, no pressure to sell, great way to time pass, and no way upper management can track sales.","No management leadership, directions change every year, no director, and no competitive salary.","Upper Management, look at the managers that is running this department",2.0,3.0,1.0,2.0,1.0,1.0
2016-03-29, Biz Control Manager,"Irving, TX",Current Employee ,great company but tough work environment,More than a year,0,it's big company with many internal job opportunities. decent compensation and benefit packages. great to build a career path.,"tough work environment, specially not easy to adjust to company culture since the company is HQ oriented.",need more transparency.,3.0,1.0,2.0,4.0,4.0,3.0
2016-03-28, Content Team Manager,"New York, NY",Former Employee ,Content Team Manager,More than a year,0,"- Exciting Projects in an ever growing space
- Stimulating, intelligent co-workers
- Samsung pays quite generously with beaucoup bonuses and wonderful benefits","- HQ is often distant and there can be great disconnect, particularly with the main HQ tens of thousands of miles away in Seoul.
- Project ended suddenly despite there being a need and future growth potential for product on which my team was working.",- Communicate better and stick by your projects instead of flitting from idea to idea,3.0,4.0,3.0,5.0,5.0,2.0
2016-04-27, Digital Marketing Manager,"New York, NY",Former Employee ,Digital Marketing Manager,More than a year,0,A constantly changing environment and work is exciting.,"Consistently changing goal posts and as changes happen top down, there is zero communication from leadership to organization so every few months there are massive changes impacting culture, team and moral. Not motivating to want to come to work every day.","Eliminate the lifelong employees who are resistant to change.
Remove the Korean militant culture.
Stop the optics of having to be physically in a seat at 8:30am for perception reasons.
Focus on performance and empower employees
Offer guidance and support to employees",1.0,1.0,1.0,1.0,3.0,1.0
2016-03-20, Marketing Project Manager,"Detroit, MI",Former Employee ,MArket Project Manager,More than a year,0,Allowes me to communicate with potential clients on a high level to better understand their needs and to be able to present them with a better field constructability plan.,Sales Force not being very agressive when looking for more work,"Listen to employees advise and recommendations, we know whats best for the company.",4.0,1.0,4.0,2.0,3.0,1.0
2016-03-16, Test Engineer,"Long Beach, CA",Former Employee ,Great company to work for,More than 5 years,0,Good work/life balance and compensation.,Not much room to move up. Senior management disconnected from the day to day business.,,4.0,5.0,3.0,3.0,4.0,1.0
2016-03-16,,,Former Employee ,"Good Pay, Hectic Work Environment",,0,Good salaries and benefits. Projects can be well funded.,The salaries and benefits are good but it is a hectic environment to work in and not a lot of career advancement.,,4.0,3.0,3.0,3.0,5.0,3.0
2016-02-16,,,Current Employee ,Amazingly challenging but even more rewarding. True to word....you get out of this what you are willing to put into it,,0,Incredible autonomy to get the job done. Management trusts you in a way that breeds excitement and creativity. I have yet to be in a company that has challenged me at the level as this one yet made me feel so empowered that I could do anything. Work Life balance is incredibly forgiving as long as you are willing to put the work part in.,Pay is average when compared to like jobs with different companies but its hard to pass up because of the day to day work environment.,Keep doing what you are doing. It's working!,5.0,4.0,5.0,5.0,4.0,5.0
2016-03-15,,,Current Employee ,Operation,,0,"Well organized, good place to develop career. Huge volumes to manage, easy to interact with coworkers. Bonus is good, provides good benefits including 401k and medical.","Most directors are from Korea, there are some cultural differences to deal with. Hard to get recognized by upper managements. Bad work life balace.","Should encourage highly motivated workers, also need some more company activities to ensure better atmosphere. Need to manage employees who does not perform with efforts",3.0,3.0,1.0,4.0,4.0,1.0
2016-03-13,,"Ridgefield Park, NJ",Current Employee ,Inside Sales Representative,,0,"Supportive management, great advancement opportunities",Cultural barrier can be difficult to overcome.,,4.0,3.0,5.0,4.0,4.0,3.0
2016-03-10, Android Developer,"Kansas City, MO",Current Employee ,Review,Less than a year,0,"Good framework experience, get to work on new devices.","Harsh deadlines, long-long working hours, work at night, work on weekends.",,3.0,2.0,2.0,2.0,2.0,2.0
2016-03-23, Director,,Former Employee ,Spent 80% of my time on politics; Game of Thrones environment,More than 5 years,0,They pay was good. The benefits were great but have been slimmed down.,I was a non-software engineer mid-level exec. There is no strategy or direction. All decisions come from Korea. The US workforce is there to execute and not ask questions. I had 5 bosses in 5 years due to constant and somewhat arbitrary restructuring. It is rare for any employee to last more than 2 years. Promotions only happen for staff below Director level. No one will every say thank you or good job. You are only told to work harder. Raises are 2% for average performers and 2.5% for workaholics that get the top 10% of a bell curve rating. Bonus is based on how much your liked and nothing to do with KPI goals.,"No point, this culture is completely entrenched",2.0,1.0,1.0,1.0,4.0,1.0
2016-03-09, Lead Samsung Experience Consultant,"New York, NY",Former Employee ,Review,More than a year,0,"Good hours, good pay, good benefits.","Working holidays of course.
Always a new training structure that was useless for sales team members.",Less aggressive on pushing sales.,4.0,4.0,4.0,4.0,4.0,4.0
2016-03-07,,,Current Employee ,Nimble and fast paced company with Korea culture impact,,0,"Willing to try out and test
Fast to act and quick to change/adapt
Good and hardworking people around
Best industry and exciting products","Korean culture impact
Not effective working system
Multiple reporting lines and very ineffective process
Demanding and culture can be very tough for some to survive","Determination to change and streamline the process.
Better manage local vs. HQ working process and responsibilities. Reduce ineffective reporting system and work smart.",3.0,3.0,3.0,3.0,3.0,3.0
2016-04-06, Marketing Analyst,"Ridgefield Park, NJ",Current Employee ,Soul draining,More than a year,0,"Good benefits, cool products, handful of brilliant folks preventing this ship from sinking

My last day is not too far away","Incompetent coworkers, some people are lacking basic life survival skills

Management changes their mind every other day

No strategic directions. Everyone is more concerned about kissing up to their bosses than doing actual work. 21st century Game of Thrones

If you are considering to apply, please avoid this company like the Plague",Please reward people based on their actual performance instead of made up KPIs,1.0,1.0,1.0,1.0,4.0,1.0
2016-03-05, Manager,"Ridgefield Park, NJ",Current Employee ,Seen this company grow into better,More than 10 years,0,"This is completely subjective to my experience, but if you work in the right department you have great benefits, flex time, huge vacation packages, very good bonus packages, best health-care, volunteer time off, high end work computer and phone, paid gym membership up to 400, paid health screening, and more.",If you are not motivated you will not succeed. If you are not familiar with Asian style work ethic you will have a hard time adjusting.,Continue to promote from within and keep working on those market adjustments for those who have stayed loyal to the company and are paid less than new comers.,5.0,5.0,4.0,4.0,4.0,4.0
