date,employee_title,location,employee_status,review_title,years_at_company,helpful,pros,cons,advice_to_mgmt,rating_overall,rating_balance,rating_culture,rating_career,rating_comp,rating_mgmt
2015-03-03, IT Professional,"Port Washington, NY",Former Employee ,"This company is a disaster, people in the upper management have no clue what they are doing.","This company is a disaster, people in the upper management have no clue what they are doing.",0,"There is nothing positive about the company, they lie, keep repeating the same mistakes over and over. There is no job security, full time employees get fired, consultants are send out without notice. No professional attitude by any one in upper management. Thinking that by hiring new higher level people can manage the company but they are wrong as these reputed people doesn't even know what AGILE methodology is.","OMG, just thinking that this company is a health care based, its wrong. They sell old technology pager, product consists of a bunch of oldies, promises numerous things to client, change requirements written by professional business analyst, try to throw subordinates under the buzz! All day long on headsets with no clue about what the meeting is about, promises everything to client without even discussing with the team to check whether it is possible to deliver. Many projects have been cancelled. People work like 12-14 hours in this group with no use and they expect everyone to do the same. It doesn't take 12-14 hours to complete your tasks if you know how to be productive. This very clearly shows how worthless such people are. And these people are been there for ages.",All the people should be fired and new experienced professionals should be hired if the company has to atleast maintain the clients they have.,1.0,1.0,1.0,1.0,4.0,1.0
2015-01-28,,,Current Employee ,Disorganized,Disorganized,0,none that i can think of,No training and support. Mismanagement. Bad sales contracts.,Provide training and professional development to employees,2.0,1.0,1.0,2.0,3.0,
2015-01-19, Senior Management,"Port Washington, NY",Former Employee ,"Company in need of intelligent management, guidance and direction.","Company in need of intelligent management, guidance and direction.",0,If you get into the right circles you can make a good salary.,"1 - Bad management. Lacks direction and has no talent when it comes to valuing the hard working employees.
2 - Absolutely no respect or regard for a standard work/life balance. People are expected to be on calls even if they are on vacation, at lunch, in another meeting, on the weekend, on holidays, etc.
3 - Employees are not valued for their ability to contribute to the success of the company. Only cronyism and nepotism matter.
4 - Terrible product offerings for customers.
5 - There is no such thing as customer service, client retention or forward-thinking client relationship management - only inadequate reaction to bad products on which all company resources are directed without every actually addressing the real issues with the products - this due to cronyism and nepotism.
6 - The customer is the not at all valued. Legacy customers suffer on outdated products but get ignored when they report issues. Their only recourse is to upgrade to the new product which doesn't even meet the minimum existing functionality of the old legacy products!
7 - Customer support reps have no training but are expected to take oftentimes abusive calls from angry and irate customers.",Clean house!,2.0,1.0,1.0,1.0,2.0,1.0
2015-01-27,,,Former Employee ,Worst place to work for,Worst place to work for,0,No pros.. this is the worst company to work for,"Everyone lies, no customer respect, no concept of care or respect for the client.
Poor very old technology ....",,1.0,1.0,1.0,1.0,1.0,1.0
2015-01-26, Fomer Employee,"Port Washington, NY",Former Employee ,Turn Away Fast....A Lot of Employee Turnover,Turn Away Fast....A Lot of Employee Turnover,0,Nothing positive to say - job on LI,"I agree with the poster from January 19th. If you are not part of the inner circle, forget it. It's not what you know, but who you know here. I know this common in every company, but it is very, very prominent at Sandata. It's like being in elementary school with the bullies and jocs. There is no structure and no communication within departments and companies. Employees and clients do whatever they want and when they want. The clients run this company and not management.",Sell,1.0,1.0,1.0,1.0,2.0,1.0
2015-01-04, Customer Service Representative,"Port Washington, NY",Former Employee ,Customer Service Rep,Customer Service Rep,0,"Go People, Friendly place to work. Room for advancement if desired. Rewarded for good work. Good Work/Personal life balance.",Training can use much work. Management worries more about getting new products out to clients than they do with assuring quality control. Some products are rolled out way before they are ready. High turn over when it comes to senior managers.,Get and consider employee input before making radical changes.,3.0,4.0,3.0,3.0,3.0,2.0
2014-11-25,,,Former Employee ,Anonymous,Anonymous,0,Overall the environment is laid back.,"No stability, managers can let you go without good reasons or personal preferences (Weak HR)
Not much to learn
No process , Mis-management",,2.0,2.0,3.0,2.0,3.0,1.0
2014-09-30,,,Former Employee ,Poor Training,Poor Training,0,"Most of the people were nice. They're in Long Island. Free gym, and parking","I worked here a few years ago, back when I was just out of college. To this day, all I remember about working there is how bad the training was. To this day, I cannot even tell you exactly what their product is. I was never trained on the product, what it was, how to use it, or ANYTHING even though client relations is supposed to be the main part of that business.

I was never given any feedback (bad OR good) from management. I eventually quit when I found a job that was closer to my home and paid better. Once I quit, however, THEN all of a sudden they had negative feedback for me. They criticized me for not knowing how to use Microsoft Word, which made NO sense whatsoever! They just made something up to make it sound like I was bad at what I did. To top it all off, I worked sometimes more than 50 hours a week with not much extra pay.

Their management was also clueless, and could never answer questions. It once took over a month for a manager to answer ONE of my questions because she had to find someone who knew!","Hire managers who can actually answer questions in a timely manner, and offer actual training on what your product is- because no one seems to understand it there!",2.0,3.0,1.0,1.0,3.0,1.0
2014-07-29, Administrative,"Port Washington, NY",Current Employee ,Great place to work.,Great place to work.,0,"I have worked at Sandata for a little over ten years. My experience as an employee at Sandata has overall been very positive. I strongly disagree with some of the other reviewers, particularly relating to employee recognition, advancement opportunities and management. I feel that there is opportunity for advancement within Sandata if you work hard and prove yourself. I know this is true because I experienced it firsthand when I was promoted to a position that better suited my skill set and experience a couple of years ago. I do feel that Sandata does care about its employees and that overall it offers a very pleasant work environment. I’m not sure if some of the other reviewers have worked in many other places during their careers but many of the issues they cited exist in virtually every other company out there, especially companies that have experienced the rapid growth that Sandata has over the past few years. No company is perfect. Sandata offers a stable work environment as evidenced by the fact that many of its employees have been here in excess of 15 years. That's not easy to find, especially on Long Island and especially these days. I work for a great manager who is always open to my ideas and who I feel values my input. As a working mother I find that Sandata is sensitive to family issues and very supportive of its employees as people. There is a lot of value in that aspect of the company alone. As previously stated I was surprised by the negative reviews and can only imagine that they were written by disgruntled ex-employees who may have not made the grade. And if they are written by current employees, maybe they should consider the positive aspects of working here or get another job. Work is work and the grass is not always greener on the other side.",For me the biggest con of working at Sandata is the commute which is problematic for most people who drive to work anywhere on Long Island.,"I believe that all employees in the company, regardless of their department, should receive a general training session of all of Sandata's products and services at commencement of employment. As new products or services are introduced brief training sessions should be given to all employees to familiarize them and keep them abreast of what we are doing.
Also, it would be helpful if new employees would be familiarized with the various departments within Sandata and the responsibilities of each department. This would just help with the proper flow of work within the organization.
I also think the office could use a bit of an update. New painting, carpeting and bathroom renovations would help. I believe people who feel good about their work environment bring a more positive attitude to the table.",5.0,5.0,5.0,4.0,5.0,5.0
2014-07-31,,,Former Employee ,Response to recent review of Sandata by current employee,Response to recent review of Sandata by current employee,0,"The only pro is a pay check. And if you live nearby, it is more convenient that having to go into Manhattan to work.","I almost died laughing when I saw this review. First of all, there are very few people who have been with the company for 10 years. Enough said on that part.....and that usually speaks for itself.

I have no doubt that the person who wrote this review is in management or HR and they are clearly trying to do a little PR to fix the company's reputation. It is transparent.",,1.0,3.0,1.0,1.0,3.0,1.0
2014-04-24,,"Port Washington, NY",Former Employee ,Company lacks direction,Company lacks direction,0,Many great people within the general population. Everyone works VERY hard and really make an effort to do a good job. There are the usual 'characters' as in any company but for the most part those people are well known and people just tend to avoid them at all cost.,"The company made several key acquisitions over the past few years that greatly upgraded their portfolio. However, due to a tremendous lack of understanding of the value proposition of the accumulated intellectual properties acquired and how to make them work cohesively, they constantly make some serious missteps in implementing and distributing said products. This has also led to a major departure of key personnel from the company which in turn leads to a hoard of unhappy customers, some of which are state agencies. Work hours are outrageous. People are expected to be on-call 24/7 even if they are on vacation, at night, week-ends, etc. Customer complaints are always high and reflect a laundry list of issues with the base product as well as with outstanding issues which continue to accumulate. Legacy customers are basically ignored and new customers are generally mislead regarding system function and capabilities.","Get a realistic view of what you have in people and products, come up with a roadmap for making the stuff work and stick to it! Also try treating people better when it comes to the work environment - not very healthy for the past few years. People who work remote are actually better off because they don't have to deal with the corporate office environment. And try to actually treat your customers as if the life of the company depended on keeping them happy.",2.0,1.0,1.0,2.0,2.0,1.0
2014-02-26, Customer Service Representative,"Port Washington, NY",Current Employee ,Worst company ever,Worst company ever,0,None. Stressful work environment because customers want answers and no one has any.,No training...customers irate because the product has so many glitches. It takes ages to slove a customer problem. Worst Customer support ever!,Close down...before all of your customers leave.,1.0,1.0,1.0,1.0,3.0,1.0
2013-12-29,,,Current Employee ,"Poor managment, bad experience.","Poor managment, bad experience.",0,"No pros ro working at this company, except for location if you live on Long Island and prefer the drive commute","Poor management. Software tends to have more bugs than most applications. Company is always trying to invent new software applications, but would be better to spend their resources trying to fix the current software first. Lots of unhappy customers.","Total management turnover is needed. Management is arrogant and their ideas are bloated. Nothing ever comes to fruition, or takes forever. Stop selling applications to customers that we don't have yet.",1.0,1.0,1.0,1.0,1.0,1.0
2013-11-27,,"Port Washington, NY",Former Employee ,Squandered Potential,Squandered Potential,0,"Good pay, Great Telephony product Santrax. Good support for Santrax with many happy users.","Agency Management Product - Santrax Agency Management product was brought to market at least a year before it should have been. Filled with bugs and missing functionality.
Poor product management. Senior management doesn't have the capabilities to deliver quality products and service to the marketplace. As a result middle management spends too much time in CYA mode. Very high turnover of staff.",Stop listening to the software developers and product boosters optimism about the products future. Look at the competitive products and if you can't upgrade your existing software in 6 months to be competitive start over. You can't build a skyscraper on a shaky foundation. It's better to build a new software product from the ground up.,2.0,3.0,2.0,3.0,4.0,1.0
2013-08-18, Customer Service Representative,"Port Washington, NY",Former Employee ,Former client service worker,Former client service worker,0,"Good benefits, good industry that can be recession proof if you have a good product. They try to be a big company with a small company feel.","Completely disorganized. Management more interested in politics (CYA) than customers. Management does not understand any of the products and processes as virtually all the VP's are from the outside. The EVP's, SVP's and VP's all got their positions because of who they know, not what they know. The VP's have no accountability for failures.If you are not part of the inner circle. there is no promotion from within to meaningful positions. In fact the current group of ""outsider"" managers have a great deal of disdain for long time employees. Only a few people in the IT area know how to fix problems and they are in meetings all day instead of fixing the many customer complaints. There are too many chiefs and not enough people who do work which is causing major client complaints.",Replace ALL the VP's with people who know what is going on and will actually do work to fix problems. Stop with all the patronizing slogans and train employees on the product so they can service customers. Make management accountable.,1.0,4.0,1.0,1.0,2.0,1.0
2013-07-27, Customer Service Representative,"Port Washington, NY",Former Employee ,Bad all round,Bad all round,0,"In LI, gym, monthly birthday gatherings, free on site parking","Poor management, poor communication, no accountability. I worked in the Customer Care Dept. customer service agents are not trained in the product - or rather the clients of the companies call in their issues in which the rep has no
Idea on how to resolve since the ""training"" wasn't on how to resolve the issue but how to
Use the system so therefore it's not applicable. Tey have a generous PTO time and paid time off. Management, directors etc are given their
Jobs based on ""if you know someone"". Tickets were issued and the network developers would take a long long time to resolve the issues.","Fire everyone in management positions, hire people that have network and development experience, hire trainers to appropriately train csrs to trouble
Shoot and don't wait 6+ months to answer 1 question.",1.0,2.0,1.0,1.0,5.0,1.0
2012-06-18, Analyst,"Port Washington, NY",Current Employee ,Company needs professional managers at all levels,Company needs professional managers at all levels,0,"Job on Long Island.
Good for family person.","Most unprofessionally managed company.
Unqualified Managers who are in poistions based on their personal relationships. They treat the employees terrible.","Change all the managers, directors, presidents, vice presidents and all managerial positions. Company needs a complete revamp.",1.0,2.0,1.0,1.0,2.0,1.0
2012-03-30, Client Relations,"Port Washington, NY",Former Employee ,Not Bad / Not Good,Not Bad / Not Good,0,"The HR department try to emphasize on the employee experience with a lot of different activities and offers for the employees such as occasional free ice cream/breakfast/ and flu shots!

They have decent coffee for 25 cents a pack.

Company GYM !

Free Parking !","The company as a whole is completely unorganized. The client relations team are the first point of contact but have no knowledge training. The client relations rep must self teach himself on a product that honestly no one truly understands. Its hard to self train because all the materials are outdated !

The only people that truly understand the product are the engineering and implementation/training teams. The engineering members are very nice and easy to talk. Most members of engineering are truly helpful and try their best to help but are slow in getting the issue resolved. Most members of the implementation / training crew are up to their ears in work and have no time to train other staff members.

The client relations team are expected to do all the grunge work and DO NOT GET THE CREDIT FOR IT!

Could be a great company, needs new management and structure !","New employees at Sandata are poorly trained. There is no common knowledge of what the product is,how it works and no clear sources to find that info other than asking someone. There is no way to self train and get up to speed without depending on other employees and their availability.",1.0,1.0,1.0,1.0,1.0,
2018-08-15, Java Developer,Chennai (India),Former Employee ,Java developers,Java developers,0,Best company to work good management,No cons anything is ok,No good keep it up,3.0,3.0,3.0,3.0,3.0,3.0
2013-01-14,,,Former Employee ,Good potential but poor implementation,Good potential but poor implementation,0,"Good products, friendly coworkers. Nice environment except for management","Managers are nice as people but horrible at running things. Cross training is non-existent but you are expected to know every product. Managers who have continually shown poor leadership and customer service skill are still promoted and given more responsibility over cusutomer contact, despite customer complaints.","If you give a survey to your employees, at least make an effort to pretend you are following their advice. Give your employees reviews with actual feedback about the job they perform with realistic expectations about responibilities.",3.0,3.0,1.0,1.0,2.0,1.0
