date,employee_title,location,employee_status,review_title,years_at_company,helpful,pros,cons,advice_to_mgmt,rating_overall,rating_balance,rating_culture,rating_career,rating_comp,rating_mgmt
2019-03-06,,"Port Washington, NY",Current Employee ,Great Tech Career Move,Great Tech Career Move,0,"Career development/lateral opportunities significant
Compensation is great
Good, nice people
Remote work flexibility
Open-minded to change, new ideas
First to market advantage - company has been around a long time, customer loyalty","Commute
Office / culture a bit bland, old / old-fashioned
Some of the old guard work ethic / talent level not particularly inspiring","Continue being open minded to change, utilizing new, cutting edge software/ tools. Continue to try and think and act like a tech startup culturally to enhance employee satisfaction/ retention, along with long term new talent acquisition.",5.0,5.0,4.0,5.0,5.0,5.0
2019-01-23,,,Current Employee ,Amazing Workplace!,Amazing Workplace!,0,"Benefits (employee events, clubs, etc)
Support from management and coworkers
Work load is great, nothing that can't be handled in a timely manner
Hour paid lunch","Like any new job, you have to adjust and it takes some time. If more people were open to getting to know the new employees it would make things a lot better",,5.0,5.0,5.0,5.0,4.0,5.0
2019-01-23, Human Resources Director,"Port Washington, NY",Current Employee ,The best company I've worked for!,The best company I've worked for!,0,"Senior management truly cares about the Sandata employees and frames their actions in that manner. They are transparent about the highs and lows of the business, and they love to brag about extraordinary employees and their extraordinary efforts that make Sandata #1.","If there is a con, at Sandata the employees voices are heard, and typically things get rectified.",It's a wonderful culture. Let's keep it that way!,5.0,5.0,5.0,5.0,5.0,5.0
2018-12-19,,,Former Employee ,Network Admin.,Network Admin.,0,"Great department, Great insurance, Supervisors that are easy to speak to, and amazing team.",Transportation without a car is problematic.,,5.0,,,,,
2018-11-21, Human Resources Administrator,"Port Washington, NY",Former Employee ,Excellent company!,Excellent company!,0,The people. The amount of care the HR department puts into everything they do.,"Can't think of any! Great team, great attitudes!",Keep listening to your people.,5.0,5.0,5.0,5.0,5.0,5.0
2018-10-19,,,Current Employee ,Fantastic!,Fantastic!,0,"Sandata is a phenomenal place to work, from the people and culture to the day-to-day work that we do. A premier tech company inventing and implementing cutting edge healthcare solutions for over 40 years, Sandata is the perfect mix of an established, credible technology force with entrepreneurial spirit and passion.",No notable 'cons' for working at Sandata.,Keep investing in the company and people to keep this a top tech spot for new talent on Long Island!,5.0,5.0,5.0,5.0,5.0,5.0
2018-03-07,,"New York, NY",Current Employee ,solid workplace,solid workplace,0,"great benefits
solid leadership
great IT dept","long work hours
long commute
Not enough time off",None to think of,4.0,3.0,5.0,4.0,4.0,5.0
2018-02-28,,,Current Employee ,Working at Sandata,Working at Sandata,0,"I love working at Sandata. There is great work life balance, I get the opportunity to work on many different things and interact with many different departments, I enjoy the people I work with, my manager really lets me take the lead on various projects.","Sometimes I do think there can be disconnects between the departments, but I know the company is always working on ways to improve this",,5.0,5.0,5.0,5.0,5.0,5.0
2018-02-14, Senior Accountant,,Current Employee ,Best Place To Work Is Sandata Technologies,Best Place To Work Is Sandata Technologies,0,"Sandata is a Growing Innovative Company that Promotes Employee Growth and Forward Thinking. Executive Management is GENUINELY Open to New Ideas and Suggestions. Unlike other companies, Sandata values their employees and promote a ""Family Atmosphere."" While deadlines need to be met, Management always has the well-being of its employees at their forefront. The work is far from Mundane and quite honestly exceeds Challenging. Working for Sandata is not just a job; it is a Career wrapped around Stability within a Family Environment. Being part of the Sandata Family is a privilege. I wouldn’t want to work for any","From where I sit, there are no Cons working for Sandata - Only PROs",Keep Doing What You are Doing the Way You Are Doing It,5.0,5.0,5.0,5.0,5.0,5.0
2018-01-12,,"Port Washington, NY",Current Employee ,Nice Place to Work,Nice Place to Work,0,People are great; flexible hours (within reason) that helps me maintain a good work/life balance. Leadership seems to care about employee's well-being.,Commute for me is a bit far.,,5.0,5.0,4.0,5.0,4.0,5.0
2017-08-10,,,Current Employee ,Technical Support Specialist,Technical Support Specialist,0,For the most part this is a decent place to work. Salary and benefits are ok nothing out of the ordinary.,"The rules are for some not for all. Some employees can get away with everything because upper management allows it to happen. There's no real sense of direction from management and they will never back you up. What they say, the customer is always right, is very true here. I've been working here for over three years and there have been three massive layouts. No appreciation for what you do but if you are the ""favorite"" then you have nothing to worry about.",Be fair and professional. Treat your employees equally base on their job performance not on your personal feelings towards them.,3.0,2.0,2.0,2.0,2.0,1.0
2017-06-12,,"Port Washington, NY",Current Employee ,No Stability,No Stability,0,"long island area , free parking",No Stability - High turnover ratio,,2.0,2.0,3.0,2.0,3.0,2.0
2017-05-23, Devops,"Port Washington, NY",Former Employee ,Lots of promises no substance,Lots of promises no substance,0,"New technology on and great dev people. Everyone who is not a manager or director is great.
Everyone comes in after 9 am","Directors and VP's are full or themselves.
Expectations are set very high no one seems to be able to communicate internally
Questionable credentials on a few directors and VP's.
Everyone leaves after 7 pm",Needs total revamping of management. Everyone manages and no one knows what to do or is expected.,1.0,1.0,2.0,2.0,3.0,1.0
2017-04-03, Cash Applications Specialist,"Port Washington, NY",Former Employee ,Cash Application Specialist,Cash Application Specialist,0,"Flexible working hours, great co workers",None I can think of.,,5.0,5.0,5.0,3.0,3.0,4.0
2017-03-07,,,Current Employee ,Great company with continued growth,Great company with continued growth,0,"Sandata provides a great work environment! All departments work well with one another, and everyone has the same goal; to deliver innovative solutions that optimize the delivery of home care services. Upper management provides ongoing communications to the company keeping them informed on industry updates, company updates, and offers resources to help employees prosper in their current position.","In the past Sandata had a reputation of taking on too much all at once, which made it difficult to manage time and priorities, but that mindset has changed and now the company has a more focused approach and plan in place to help position themselves to be more effective.",,4.0,4.0,4.0,4.0,4.0,4.0
2017-01-19, Implementation Specialist,"New York, NY",Former Employee ,Director,Director,0,"Filling a real need in the home care industry. Bringing technology, accountability, and efficiency to a market that needs it badly. Well positioned, leading technology supplier for an up and coming part of the healthcare market.","Implementations are complex and challenging. The end result was gratifying, but introducing new technologies to companies that are not accustomed to using advanced technologies is hard work. The documented processes need improvement, as they are growing faster than their ability to document best practices",Streamline implementations by automation and better documentation of process.,4.0,3.0,5.0,4.0,4.0,4.0
2017-01-23,,,Current Employee ,Vice President,Vice President,0,Great team to work with and very committed shareholders in the company. Significant opportunity to help grow the suite of products and make a positive impact on large healthcare payors and providers.,"Management needs to listen more to their teams - many employees have deep experience, expertise and good insights. There is a a new formal process in place to improve employee engagement and collect feedback so I am optimistic.",,5.0,5.0,5.0,5.0,5.0,5.0
2016-12-28,,"Port Washington, NY",Former Employee ,A good place to work for some,A good place to work for some,0,"Generally good coworkers
Offers a lot of flexibility for employees
Historically has been an industry leader
Small company where everyone knows everyone.","Limited real growth
Too many people in management, not enough individual contributors under them
Position in the market place is being challenged by competitors
You'll make more somewhere else","Tough to say, management has been gutted and mostly replaced in the year and change that I've been away. Significant investments need to be made in the products and services to remain competitive in the market though.",3.0,4.0,3.0,2.0,3.0,3.0
2016-11-28, Computer Operator,"Port Washington, NY",Former Employee ,computer operator,computer operator,0,good working conditions for all,does not train you all the way,good,5.0,5.0,5.0,5.0,5.0,4.0
2016-11-16,,,Current Employee ,Very Happy Here,Very Happy Here,0,"Great team
Amazing Supervisor
Wonderful environment to grow and develop as a professional",None that I can see so far,,5.0,5.0,5.0,5.0,5.0,5.0
2016-11-28,,,Former Employee ,Assistant,Assistant,0,"co-workers are nice, can be lenient with time","Management isn't present, pay is below average, do not know how to budget",,2.0,4.0,1.0,1.0,1.0,
2016-10-13,,,Former Employee ,"Not what I expected from an established organization"".","Not what I expected from an established organization"".",0,"The company offered a few decent discount perks, a few decent benefits and overall there were some decent and down to earth people to work with.","The company does not invest in their employees to enhance their overall knowledge of their products, work performance, and quality of work.
The company does not provide additional and effective training to their employees for them to learn and better understand the company products.
There is a lack of communication or poor communication transferred between upper management, middle management, management and all other departments/staff.
As a whole, there is not enough employee relationship building within the company.","Learn how to invest in your employees by providing additional and effective training of the company's products so that employees are competent enough to perform their jobs/task.
Learn how to properly manage your teams/departments by effective communication and by getting to know your employees and where the real problems stem from, instead of looking to blame random employees for why the company is soo unorganized and unstructured.
Last but not least learn how to manage.",1.0,2.0,2.0,1.0,4.0,1.0
2016-08-01, Analyst Manager,"Port Washington, NY",Former Employee ,not a good forecast,not a good forecast,0,"great people, my VP is what every employee wants. work life balance is good, room for growth if allowed.",layoffs as soon as a project is delayed. EMT needs to learn that they are laying off the wrong workers. no accountability.,Open your eyes!,2.0,3.0,3.0,3.0,2.0,1.0
2016-07-13,,,Former Employee ,Good Leadership in Database Team,Good Leadership in Database Team,0,Had privilege of working in a well managed and well run team. learned a lot,Other teams and senior management need better co-ordination,,5.0,,,,,
2016-08-04, Manager of Reporting and Analytics,"Lawrence, NY",Former Employee ,Be careful,Be careful,0,Nice people to work with,each department seems different so be careful,,1.0,2.0,1.0,1.0,1.0,1.0
2016-07-01,,"Port Washington, NY",Current Employee ,"Not a terrible place to work, depending on your department. They are trying to make improvements but have a way to go.","Not a terrible place to work, depending on your department. They are trying to make improvements but have a way to go.",0,"Almost all the people are great to work with. People really try to do their best work. They are pretty flexible as far as time as long as you get the work done. They try to make it a comfortable work environment. PlayStation in the common area, gym, healthy snacks and sandwich available. Discount movie tickets, Costco card and telecommuting is an available option for many.",This company is lacking in internal communication. I also believe they over promise and under deliver too often. This put an incredible burden on the development and support staff. A lot of chefs in the kitchen each seemingly working on their own dish. Compensation($$$) is questionable as well.,"None, they don't pay enough for my advice.",3.0,4.0,3.0,3.0,2.0,3.0
2016-07-21,,,Former Employee ,Management,Management,0,None that I can think of,"The product is broken. Nothing works for the clients and the Sales team is rude, unprofessional and will sell anything to make a buck even if the product doesn't exist because they don't have to implement it. Most people are rude and unhelpful. It's not a collaborative team environment. There's no training plan for internal staff and employees are forced to talk to clients without having knowledge of the product which brings the company down even more. Unrealistic timelines within the development area to make improvements on the product which infuriates the client.",Get a new Sales team and work on a training plan for staff. Fix the product so that clients stick around and not jump to the competitors. Work on employee morale and stop micro managing.,1.0,1.0,1.0,1.0,1.0,1.0
2016-07-16, Data Entry Operator,"Little Neck, NY",Former Employee ,Really Bad Training,Really Bad Training,0,There were none that I could think of.,"People there are rude and, training is so bad! They let you go because of your ethnicity, and marital status.",Learn to train people better and stop micromanaging.,1.0,1.0,1.0,1.0,1.0,1.0
2016-06-04, Customer Support,,Former Employee ,Customer Support,Customer Support,0,Working with great coworkers and clients in health industry,Expensive benefits. Too costly. Major dept layoffs,Sell the pop sickle stand while it has clients,3.0,3.0,3.0,2.0,2.0,2.0
2016-03-11,,,Current Employee ,Information Technology,Information Technology,0,"Hard working, great people. Company going through positive change. Hard work but also rewarding.",Conflicting priorities. Too many meetings.,Focus on top priorities and continue working on positive change.,4.0,3.0,4.0,4.0,3.0,4.0
2016-03-15,,"New York, NY",Former Employee ,Client Services,Client Services,0,"Physically a nice environment, they offered favorable benefits and HR practiced activities to honor the staff.","Failed to establish and share a strategic (company) vision. Also, senior level leaders displayed poor communication skills and lacked integrity.","Demonstrate integrity, work with enthusiasm, display visionary leadership skills, develop and maintain two-way communication.",2.0,3.0,2.0,2.0,2.0,1.0
2016-02-19, Vice President,"New York, NY",Former Employee ,VP,VP,0,One of the best delivery teams I have ever had the pleasure to work with in Healthcare,Management was confused with direction and lacked commitment. Conitnued flipping senior management.,be dedicated to a direction select your market and your products and pursue with vigor,1.0,4.0,1.0,2.0,2.0,1.0
2015-11-05,,,Current Employee ,Manager,Manager,0,Good salary and good folks to work with.,Lack of solid processes. Lots of running around like chickens without heads. No accountability for the people who don't do what is needed to do. Many broken promises and smoke screens.,Get someone who knows how to run the technology department and not just placate while pointing fingers at others. If you build it and it works then they will come.,3.0,,,,,
2015-09-16,,"Port Washington, NY",Former Employee ,Worst Experience of My Career,Worst Experience of My Career,0,Many great people below C-level. Folks who are NY based get perks like discount movie and sports tickets.,"Lack of coherent processes, little documentation for processes that do exist. Legacy technology. Crumbling, offices with no access to public transit.",,3.0,3.0,2.0,2.0,2.0,1.0
2015-07-28,,,Current Employee ,Review,Review,0,"Good, mostly flexible work environment",Usual corporate nonsense. Company-wide decisions often stupid,,4.0,,,,,
2015-07-13,,"Port Washington, NY",Current Employee ,Management overhaul needed,Management overhaul needed,0,Knowledgeable staff...that management needs to listen to and learn from.,"Lack of focus on the management level. Management is quick to through staff ""under the bus"" when development and ""poor"" management excuses and delays run out of rope.","WORK with the staff...come out of your ""Ivory Tower"" and begin dealing with the reality that your working staff DO have good ideas, suggestions and concerns...especially since they are the one that have a REAL working relationship with the client and understands firsthand what their needs and expectations are.",1.0,1.0,,,,
2015-06-20,,"Port Washington, NY",Current Employee ,Operations,Operations,0,"Good people, decent work environment, management seriously working on making the work environment better","poor pay, limited internal advancement opportunities,","pay industry competitive salaries to keep talent, coach people better; provide external training for staff career growth.",3.0,4.0,3.0,2.0,2.0,3.0
2015-06-18,,"Port Washington, NY",Former Employee ,Good Temp job,Good Temp job,0,"Very relaxed work environment, everyone I encountered was kind. The job was easy to do, and for a college summer job the pay was great.","I was assigned to tasks that I should not have been doing, such as calling clients who were having issue with the company's products, I had no idea what to do in these situations. Many days I showed up and there was literally nothing for me to do. I gained no real experience from working there.","Don't hire temps if there is no work for them to do. Although it's great to do nothing and get paid for it, some real experience is preferred.",3.0,,,,,
2015-06-22,,,Former Employee ,Client services: it had potential.,Client services: it had potential.,0,"Most of the people are nice. There is an on-site gym, and there is always free food in the office. It is also a job on Long Island, which is good if you do not want to spend a fortune on train travel into the city. The pay was OK. That's all that is positive.","No security, and very little effective communication from management. Management is also highly unprofessional, and pretty much useless when it comes to answering questions in a timely manner (if they can answer the question at all!) People who work in client services have the toughest job of all- trying to explain the company's products to clients, when no one receives any proper training on the company's products to begin with!

People at Sandata routinely work 12 to 14 hour days at this company for pretty much no reason since it does not take that long to complete tasks if you know how to be productive.","Listen to your employees, and know their value. If a manager does not know the answer to something then perhaps that manager should undergo some additional training themselves.",1.0,,,,,
2015-05-20, Account Manager,"Knoxville, TN",Former Employee ,Sandata outlook,Sandata outlook,0,Cutting edge software for home health services.,Company cant seem to make a profit. Everything is old or cheap.,Concentrate on making more from residuals instead of install fees.,2.0,3.0,4.0,2.0,2.0,3.0
2015-04-22, Software Developer,"Long Island City, NY",Current Employee ,Developer,Developer,0,Diversity of platforms & technologies. Very intelligent technical staff. Excellent CTO and management.,Fast growing past paced mean you have to be on your toes. This is not a cushy place to work... but if you have initiative and self motivation you can grow and learn and you will be appreciated.,Keep focusing on customer satisfaction and open mindedness as it relates to your employees. Don't be afraid to spend money to make money. You have very long standing relationships with your existing customer base. Treat them well.,5.0,4.0,4.0,5.0,3.0,5.0
2015-05-05, Senior Training Specialist,"Ashland City, TN",Former Employee ,Sr. Training Specialist,Sr. Training Specialist,0,"Strong presence in a growing field.
Open door policy makes it easy to speak to managers and executives.","Customer support and Implementation departments are understaffed.
Recently restructured, will need several months to stabilize.","Sales brings in clients, but responsive operations, training and support keep them. Don't let the company as a whole get out of balance.",3.0,,,,,
2015-04-16,,"Port Washington, NY",Former Employee ,Run away don't walk away as fast as you can,Run away don't walk away as fast as you can,0,Basically none except for working on Long Island. And You may be able to work from home if there is a snow storm.,"Application Development has a hard time programming their way out of a paper bag. Total reactionary shop, only work on what is the latest fire. Functional and Technical Analysis/Design is either non-existent or just fluff, and for some reason they love the guy that rights the Functional Fluff.He does do a good job of kissing the CTO and SVP behinds. Try to be creative and create a really good design for the customer and your idea will be squashed and the lousy design will be 4 months late anyway.

Change in Technical management did nothing to improve the culture or work produced. Managers who do the least amount of work possible are rewarded , try to be creative or use initiative and get shot down quickly.
Company does a conversion from one version of their product to another version of it 5 months later still 100+ issues with the data with new ones everyday. If the one person who knows anything is busy or out sick forget ever getting a solution.
As other have said if your not part of the old boy click forget about any job security or doing anything interesting. Those that are in the click can do no wrong, failure is the norm and accepted. Close enough for government work would be to high a bar to be hit from this company.

Only take a job here if you are Unemployed and need to pay your bills, take it till you find a real job.","Not sure how you have stayed in business so long except that clients find it hard to move off your application.
My advice to clean house completely from top to bottom, maybe all new blood and ideas will help you survive.Getting a coffee maker and water cooler after 10+ years does not improve the culture. Get rid of the culture of cronyism and maybe you will survive.
Redesigning the product will help but why do it in secret and you better believe it will take twice as long as predicted and still have dozens of bugs.
Stop letting IT run the shop they haven't done a good job it. The business should run the shop IT is a cost center no a profit producer. Move the Product group back to the business, hire a real Functional Analyst, learn how to create a functional/technical design, get rid of people who have been there forever and are not good, train people before making them managers, and maybe you will be a halfway decent organization in a year or two",1.0,2.0,1.0,1.0,1.0,1.0
2015-01-27,,,Current Employee ,"Good company, making great strides","Good company, making great strides",0,"Sandata has come a long way, with improvement in several key areas. First, the company has put a real focus on its NY business, which experienced ""growing pains"" when the company turned its focus elsewhere as it began to expand nationally a few years ago. Things are much better for the company now on its home turf. Second, the company has done a good job hiring quiality staff. After being with the company many years, I believe we now have better management in place than ever before. There is a better balance of internal and external priorities than I've seen in some time, too. Finally, while no company is perfect in this regard, there is more harmony and open communication across departments than has been the case in a long while. Kudos to upper management!",There is little training or educational opportunity at Sandata vs other technology companies. Professional development is something the company needs to take more seriously.,"While the company has done a good job of acquiring better talent and creating a more open culture, it should consciously invest more in educating and growing its existing employees.

Keep up the good work Sandata!",5.0,5.0,4.0,3.0,3.0,5.0
