date,employee_title,location,employee_status,review_title,years_at_company,helpful,pros,cons,advice_to_mgmt,rating_overall,rating_balance,rating_culture,rating_career,rating_comp,rating_mgmt
2019-03-04,,"Lyndhurst, NJ",Current Employee ,Eh.. Ok I guess.,Eh.. Ok I guess.,0,"snacks, drinks, coffee, PTO, Working remotely/from home","Working from home and PTO depend heavily on which department you work in, so don't get too excited.

They made a game room and are making a quiet lounge area, so you can work even more hours and feel like you don't need to ever go home!

Upper management is clueless, out of touch. The CEO talks about her 'golfing handicap' as if people are really concerned about it too.. We're concerned about our health, finances, and families. Get it together people.","Pay attention to each department, you're gonna lose good people.. even though the company already has.",2.0,3.0,2.0,2.0,2.0,1.0
2019-03-07,,,Former Employee ,Awful culture and leadership,Awful culture and leadership,0,"If you think the food and perks are the best thing, it's a problem",CEO is a narcissist and misleading bureaucrat. Can't pick a strategy and stick with it. Not a tech company. Toxic culture because management is rarely in the HQ's and doesn't share information,,1.0,4.0,1.0,2.0,2.0,1.0
2019-01-28, Account Executive,"Lyndhurst, NJ",Former Employee ,Vitals,Vitals,0,"Flexible work/life balance, nice office","Changing company from media to SaaS, different leadership, poor communication",,4.0,5.0,4.0,3.0,4.0,4.0
2019-02-12,,,Former Employee ,"If you have ambition, Vital's isn't for you","If you have ambition, Vital's isn't for you",0,"Free snacks
Open PTO policy
Occasional free lunch","Upper management at this company is toxic and political. Nepotism is rampant at Vitals and the only people who are promoted are friends of the higher ups. Employees below upper management are not treated fairly or with respect. There is no flexible work-life balance and the open PTO policy only applies if you're manager ""likes"" you. No one is happy at Vitals and it's obvious on a day-to-day basis. Employees are no longer motivated and feel defeated.",Hire and promote employees who are fit to be leaders not just managers. Stop lying to employees about the lay offs that are happening and be truthful,1.0,1.0,1.0,1.0,2.0,1.0
2018-11-08, NONE,"Lyndhurst, NJ",Former Employee ,Middle mismanagement.,Middle mismanagement.,0,The company's senior leadership and HR genuinely try to make the people doing the work everyday happy and respond to feedback when it is unhindered. There is a genuine attempt to be lively and have a startup culture. The people are very friendly. Teams have full freedom to self govern.,"Teams have full freedom to self govern. The disconnect mentioned in other reviews is because since your relationship with your team is everything, the manager of your team has full authority over your satisfaction here, regardless of the direction of the company. If your manager isn't fond of you, good luck; if your manager is sexist, good luck; if your manager doesn't feel like you need the unlimited paid time off, flexible work schedule, whatever, because she is vindictive, temperamental, or spiteful because you stopped taking lunch together, got friendlier with other coworkers, or never went to the gym together... good luck. If you have an issue with that, you can see the door.","Honesty and transparency of management needs addressing. Information Doesn't leave the teams. Middle management is the issue at this company, 100%, when it has the freedom and empowerment from senior leadership to be it's strength. Facilitate better communication between the top and the bottom, the surveys are coached; People's team needs to be the channel. There are people who work from the office four days a week, three, or only two. There are people who work in peace, and there are people pestered and provoked. I'd bet senior leadership and HR couldn't identify whom, because information doesn't leave teams. Your performance isn't based on your performance, it's based on how your manager feels about you or is willing to state. People are being let go due to budget, but they and People's team are being told that there were performance concerns. The CEO is capable and the senior leadership have a goal, but the horsepower isn't reaching the tires.",2.0,3.0,4.0,3.0,3.0,4.0
2018-07-17,,"Lyndhurst, NJ",Former Employee ,Law Clerk,Law Clerk,0,Great environment. Very Collaborative.,"Pay was a little low, but I was just an intern.",,5.0,5.0,5.0,5.0,3.0,4.0
2018-01-16,,,Current Employee ,Bureaucratic startup,Bureaucratic startup,0,"So many reviews praise the snacks, work / life balance and unlimited vacation policy. That's really a ""pro"" at a start up? What about pride in the product / service?","Run like a large company, but repeatedly misses it's financial projections. CEO is pandering, disingenuous and inconsistent. Senior managers are usually not in the office and if they are, their doors are closed. Rewards ""yes men"" who don't rock the boat. Feels like an antiquated 1950's company with all sorts of soft incentives that miss the mark. Culture is weak. The proof is in the results.",,2.0,5.0,1.0,2.0,3.0,1.0
2017-12-31,,,Former Employee ,Glad I Left,Glad I Left,0,"There werent many at all.
Snacks (and not healthy ones) Time off. Most people nice in my location, not NY, or NJ.","No 401k match, health benefits high, coverage bad. Management top heavy, HR and CEO disconnected. No trust. Turned into political Game of Thrones.","Concentrate on the producers mid and low level. They are the ones in the trenches getting it done.

Let HR, CFO, CEO know that no one cares about snacks, and chair massages, cakes to celebrate and balloons. Waste of $.

Bonuses and raises, along with the co. making money is what makes employees happy.

And everyone should get stock.",1.0,3.0,2.0,2.0,2.0,2.0
2017-11-17, Software Engineer,,Current Employee ,Loving my time at Vitals.,Loving my time at Vitals.,0,"Laid back, helpful, friendly, work at home opportunities, learning opportunities. Great work life balances. Usually okay deadlines to meet.","Maybe not a con, but embracing new technologies and dropping technologies just as fast. Be ready for a learning curve.",Bring back cheaper insurance premiums.,5.0,5.0,5.0,5.0,4.0,4.0
2017-11-17, Software Engineer,"Tulsa, OK",Current Employee ,A great place to work!,A great place to work!,0,Employee-centric company. Flexible hours. Comfortable work environment. Excellent work-life balance. Great people to work with.,None that I can think of.,Keep up the good work!,5.0,5.0,5.0,5.0,5.0,5.0
2017-11-13, Software Engineer,"Lyndhurst, NJ",Current Employee ,Excellent culture,Excellent culture,0,"Vitals is committed to their employees. The engineers are well respected by the executive team. Teams are distributed and effective--wide array of languages and tooling.

Engineers can look forward to an extremely generous PTO policy. Nobody is micromanaging you at Vitals. There is freedom to explore new technology while expecting to uphold best practices during development.

The executive team is composed of veterans very adept at navigating the complexities of healthcare.",Complex codebase can make onboarding challenging for new engineers as well as difficult to untangle and improve.,Keep it up!,4.0,5.0,5.0,4.0,4.0,5.0
2017-11-06, Sales,"Lyndhurst, NJ",Current Employee ,Good Company,Good Company,0,Flexible hours and nice environment to work,No 401k match and not much in terms of benefits,,4.0,,,,,
2017-11-03,,,Former Employee ,A good group,A good group,0,"growing business, good team, great benefits, various locations","The various locations made collaboration harder at times, though they have travel between locations, company events, etc to try to make up for it.",,5.0,5.0,5.0,5.0,4.0,4.0
2017-09-22,,"Lyndhurst, NJ",Current Employee ,I hope they improve soon...,I hope they improve soon...,0,"Great work life balance, flexible hours, free snacks and drinks","No real processes, low morale",Stop pretending to not be aware of the problems going on with senior leadership and do something to fix it!,2.0,5.0,3.0,1.0,2.0,1.0
2017-08-16,,,Current Employee ,Working at Vitals,Working at Vitals,0,The company has a clear and compelling value proposition-to positively impact the cost of healthcare. There is real effort made to communicate how all employees contribute to the progress toward that vision. There is a lot of emphasis placed on recognizing individual contributions and their impact.,"Not a ""con"" per se, but a rapid growth environment is very different than what exists in more established companies, and in order to succeed you really need to be capable of finding the balance between ""just doing it"" vs waiting for direction.",,5.0,5.0,5.0,4.0,4.0,5.0
2017-09-01,,,Former Employee ,Very Good but also very hectic!,Very Good but also very hectic!,0,"Good pay, good people, and a fully stocked kitchen with plenty of snacks and drinks","Hectic work, every project is very last minute, most things are done rushed and need to be completed quickly.",,3.0,3.0,4.0,4.0,3.0,5.0
2017-08-13,,,Former Employee ,Middle management,Middle management,0,"Small group of people, free snacks and massage. Flexible work schedules in most departments. Good short term gig right out of college.","Management has no clue how to make it work. Incompetent and insecure people under the executive team are being rewarded while others have left or made to leave.

Every time they miss numbers, it is due to external factors. Their bonus figures are not earned because they keep missing targets. Do not believe the positive spin in management presentation to employees.

All incompetent people get salary their adjusted so they do not leave since they do not get bonus and they need them around for short term. Also a person with real talent would not join them considering what is going on at vitals. Check the profile of existing people on LinkedIn see their jobs before vitals and at vitals and the title progression.

During interview:

-Ask them why did they could not replace COO? The real story why they ended up making three people joint COOs after the candidate rejected the offer. Why that candidate rejected the offer?

-Ask them why none of the executives are in the office for weeks at a time? Why are they disengaged?

- Ask them when do they expect to turn profit? And how many times that target has been changed due to ""external factors"". Even this latest budget seemed do able earlier (at the minimum they thought they would get the low end), but now are they making numbers?

-Ask them about loans and investments in the company and cash situation.

Engineering team, product and few sales people are one of the best ones at vitals rest are bunch of incompetent people who would not find the same job outside vitals.

I would be surprised if they are around in a few years.",Do not make people leave good jobs to join vitals when there seems no long term direction.,1.0,3.0,2.0,1.0,1.0,1.0
2017-06-29, Release Manager,"Lyndhurst, NJ",Current Employee ,Vitals - a cool place to be,Vitals - a cool place to be,0,"Flexible organization still maintaining that ""start up"" feel",Rapid paced changing priorities,Implement and Enterprise wide project portfolio for better organizational visibility,5.0,3.0,4.0,4.0,4.0,4.0
2017-06-19, Director of IT and Security,,Current Employee ,Current Employee,Current Employee,0,"Innovative, fast paced company that gives employees a chance to work with new technologies. Vitals empowers employees to make a difference and encourages creativity and 'out of the box' thinking. If you're the type of individual that enjoys taking on challenges and wants to help in creating a culture collaboration and communication. Vitals is the place for you.",The challenges that Vitals face is no different than any organization growing at a rapid pace. Sometimes things and staff are taken for granted. Leaders need to know when to take the foot of the pedal and allow for one to take a breath. The management staff needs to demonstrate by example. There are still many entrenched silos that block collaboration and productivity.,Promoting internally for senior management positions will demonstrate confidence in current staff and maintain continuity within the company.,4.0,4.0,4.0,4.0,4.0,4.0
2017-05-30, Software Engineer,"New York, NY",Current Employee ,Great to their engineers,Great to their engineers,0,"Vitals doesn't micro-manage its engineers, trusts their judgment, gives them a good team setup and light-touch management to produce some really great results. Also, no big egos - everyone works well together. Unlimited vacation, flexible time-off policy, excellent work-life balance.","E-suite people are a bit out of touch with what everyone else is doing/saying/thinking. We only get a ""Here's how our company's doing"" meeting once every 4 months or so. Also no matching on 401k.",Get us a match on our 401k's already. And let us know what's happening - we shouldn't have to wait till company gossip gets to us to know whether or not we're doing well.,4.0,,,,,
2017-05-09,,,Former Employee ,Regional Account Executive,Regional Account Executive,0,The management is great! They give you a lot of autonomy to do your job.,The product development and sales teams seem like 2 separate companies at times.,Put customers first.,4.0,4.0,4.0,3.0,3.0,4.0
2016-09-01,,,Current Employee ,Company seems lost,Company seems lost,0,Good work life balance.,Little opportunity for growth,,3.0,5.0,3.0,2.0,2.0,2.0
2016-07-20, Software Engineer,,Current Employee ,Great times at Vitals,Great times at Vitals,0,"Relaxed, inspiring, and happy people.",Meetings and communication would be better.,,5.0,5.0,5.0,5.0,4.0,4.0
2016-05-20,,,Current Employee ,Enjoy working at Vitals,Enjoy working at Vitals,0,Decent amenities/perks - not top of the line but way better than companies I came from. Great work life balance and flexibility which I appreciate as a parent with kids. Energetic CEO who is passionate about our mission. Pretty exciting industry and opportunity to make a difference in healthcare in the U.S.,"Hear a lot that sales are ""coming soon"" but mostly don't. Appears that some people take advantage of the system and there is some favoritism at the senior level. A lot of different locations makes communication challenging and inefficient. Not sure why we need so many offices.",I'm pretty happy with the way things are going and where I'm at. Would be nice to have a 401k match!,4.0,5.0,4.0,4.0,4.0,4.0
2016-05-24,,,Current Employee ,"Real potential, but-","Real potential, but-",0,"1) Very progressive startup feel with exceptional work-life balance (e.g., flexibility to work remote) and laid back work environment (casual attire and flexible hours).
2) On the bleeding edge of burgeoning business space and fervent about implications therein with cost of healthcare (e.g., create competitive provider market). Compelling to say the least.
3) Extremely high caliber individuals within engineering team that demonstrate willingness to collaborate and a passion for tech.","1) Lack of cohesion amongst the various office locations. Still very tribal and isolationist in nature.
2) Chaos tends to be more the rule than the exception. Much of the proverbial ""who's on first?"" syndrome.
3) Politics and siloing of expertise have tended to cause disruption with development and support initiatives.
4) Not exactly a clear path of progression for career growth. That being said, Vitals is still a company that is in startup mode so this may change in the years ahead.","1) LISTEN to your employees. Harvest ideas and input from these very talented constituents. You'll be surprised how much involvement of this nature yields positive morale.
2) Vitals is not yet a publicly-traded corporation (yet); trying to foster a big corporate culture before the requisite growth will drive out talent and introduce more inefficiency.
3) LISTEN to your customers instead of react to them. Give prospects a reason to want what Vitals offers.
4) Show the employee population that you're sincerely interested in high tech.",3.0,5.0,3.0,3.0,4.0,2.0
2016-04-07, Software Engineer,,Current Employee ,"Nice place to work, esp. as an engineer","Nice place to work, esp. as an engineer",0,"Coworkers are smart, talented people who are really dedicated to working as a team. Engineering team can work from home or the office, option of NY office or NJ office, and lots of small things like bean bag chairs and snacks are nice. Agile working environment means good organization and planning. Most teams collaborate well with each other, and leadership is competent and moving us in the right direction, I think.","The higher-ups seem kind of out of touch with their employees. Yes, they show up to bowling night, but their big exciting announcements always seem to be about what they're doing and not what we're doing. No 401k match, which is a major bummer. Hiring in leadership positions always seems to come from outside, rather than within.","Get working on 401k match, and add some time for Q&A to pulse meetings. Talking with > talking at.",4.0,5.0,4.0,3.0,4.0,4.0
2016-03-19, Sales,"Lyndhurst, NJ",Current Employee ,"Smartest people dedicated to a singular, and lofty, mission!","Smartest people dedicated to a singular, and lofty, mission!",0,"Dedication to mission with the lofty goal of enabling EVERYONE to shop for healthcare like an expert, strong financial backing, crazy bright talent, great leadership, great mix of industry expertise (technology, engineering, healthcare, data management and digital), strong competitive position","Vitals is in a very typical stage of culture conflict (startup to rapid growth), and all of the challenges that come with that. With a steep growth trajectory ahead, this is also a very common stage to be dealing with the push and pull of ""earnings vs growth investment"".",The best companies manage to continue innovating despite the competing priority of massive market interest in today's solutions. Don't lose sight of the need to stay ahead of the market.,5.0,5.0,5.0,5.0,5.0,5.0
2016-03-20, Director of Engineering,"Tulsa, OK",Former Employee ,Difficult Tenure at Promising Company,Difficult Tenure at Promising Company,0,"Healthcare is an excellent industry in which to work and the recent funding provides a couple of years of additional runway. The enterprise engineering team in NYC and Tulsa are very progressive, working to build a modern Ruby stack enabled by an emerging DevOps culture that appreciates craftsmanship, mature decision making, and peer review.","Vitals lacks alignment across locations, divisions, and functional organizations and is a difficult and frequently political environment where everything is more challenging than it should be. There is a general lack of organizational harmony which is enabled by difficult personalities across all locations.","Pursue organizational alignment at all cost by eliminating remaining distractions (UCHC, CMT, finders/widgets, data vending) and associated personnel, and forming a single Product Development organization. Fold the consumer organization into the much more capable, organized, and progressive enterprise organization--product, engineering, UX, and data--and eliminate project and middle management.",2.0,3.0,2.0,2.0,3.0,2.0
2016-03-07, Manager,"Lyndhurst, NJ",Current Employee ,Manager,Manager,0,"After a long period of indecision we are in a better place than when I started. New Mission, Vision and Values, which are key to the success of a company. New office, big improvement.
I believe that Sr. Mgt. is working on getting it right. It is a work in progress.","The word silo comes up, and though I see it, I believe that mgt. is working on a resolve.
Time to stop sr. management positions and focus on promoting within. Career development, and training. Would like to see a 401K match, think it will come in due time. I knew it was a start up when I started, so I've been patient with the change.","Keep the teams updated regularly, and clear concise messaging. Hold team meetings by department to include everyone at every level. All people are here for the greater good of the company, and that is for Vitals to thrive! I'm onboard and excited by our product, and the changes to come.",4.0,5.0,3.0,3.0,3.0,3.0
2016-02-29,,,Current Employee ,Positive transition for amazing opportunity,Positive transition for amazing opportunity,0,"Vitals has made meaningful adjustments over the last year as it has evolved its business strategy and execution plan. Like any early stage, high growth software company, change is inevitable and we have that going on here. What's unique and different however, is the thoughtful approach the executive team has taken to engage its staff and its markets to inform how Vitals will change.

Since arriving in late 2014, its been increasingly clear how unique this company's opportunity is and how well positioned it is to succeed. Vitals has work to do, but is solidly moving in the right direction and with a culture that empowers its people to make a difference.","Vitals is growing fast which necessitates more change to improve and scale its business model. That type of environment may not work for all people, but I would also suggest that those people are better off in blue-chip software companies.","Keep progressing on narrowing the focus on priorities. Good work has been done, more work to do.",5.0,4.0,4.0,4.0,3.0,4.0
2016-02-25, New Jersey,"Lyndhurst, NJ",Current Employee ,A Nice Place to Work,A Nice Place to Work,0,"Very casual environment and has a good work life balance. Everyone is friendly, not a lot of drama exists as with other companies. I have learned a great deal as an employee. When asked for more challenges they have given them to me. I am always learning. It is a good midsize company to build your resume. Once a month we are informed on how the company is doing which makes me feel apart of a team. Free gym membership and snacks is a plus.",Would like to see upper management present in the office more. I think that would be motivational.,"It would be beneficial for more internal promotion. It would be nice to see your colleagues move up and the company to acknowledge it. It happens, but not as much as it should.",4.0,5.0,5.0,4.0,4.0,4.0
2016-02-27,,"Lyndhurst, NJ",Current Employee ,Proud to Work at Vitals,Proud to Work at Vitals,0,"Vitals is an organization where everyone’s contribution is valued, no one gets lost in the shuffle here.

There are many terrific leaders and managers that are committed to the company and the people that work for them. My manager and coworkers are dedicated professionals that are supportive and fun! Through the years, I have had the opportunity to learn and better myself professionally.

Employees are given lots of freedom to maintain work/life balance. Vitals actively supports its employees well-being by paying for gym membership and yoga classes.","Frequent reorganization makes employees uneasy.

Workload doesn't seem equal across the company.",Cultivate the company and explain the long term vision so we understand the big picture.,4.0,4.0,3.0,4.0,4.0,4.0
2016-03-03, Data Analyst,,Current Employee ,Average,Average,0,Casual atmosphere. Encourages start-up vibe. Might get bonuses. Great work-life balance,"Top heavy. Lots of management, not enough people to carry out promises. No room for career development or upward advancement. Ambition is discouraged",Take a look at what actually needs to be accomplished and if there are enough resources to execute,3.0,5.0,3.0,2.0,3.0,3.0
2016-02-02,,"Lyndhurst, NJ",Current Employee ,Awful,Awful,0,Nice new office. Good work - personal life balance.,Poor management. No leadership. High turnover. Weak benefits.,Free coffee and snacks will not help you retain employees. Improve the working environment.,1.0,3.0,2.0,1.0,2.0,1.0
2015-10-21,,,Current Employee ,Good company,Good company,0,"Good culture, casual work environment, friendly atmosphere","no room for growth,",,3.0,,,,,
2015-09-18, Contract Staffing,,Current Employee ,Wonderdful experience to date,Wonderdful experience to date,0,"Contract staffing for Vitals. Wonderfully communicative, excellent HR department, dedicated and focused. A company that is focused on attracting the best talent to deliver quality products to their customers. Everyone i've encountered truly cares...","nothing as of yet... All businesses have challenges, but i don't categorize that as a 'con'",,5.0,,,,,
2015-09-02,,"Lyndhurst, NJ",Current Employee ,I like coming to work,I like coming to work,0,"Most of the people are really nice here and create a positive environment. I never get bored here, always something new going on. For some people it may be a negative, but it's a big positive for me. The new space in NJ is really nice and a huge improvement from the old set-up. I get a lot of autonomy in what I do and feel that my opinion and suggestions are taken into consideration and always addressed. And unlike someone mentioned in an earlier comment, I'm not from HR and giving the company a good rating.","Along with never being bored, there is definitely some uncertainty with some of the changes taking place. I think the change is going into the right direction, but it's taking some time. Some of the company communication is not too clear and causes confusion sometimes.",To pay closer attention to information going out to the whole company and to make sure it provides more clarity rather than added confusion.,4.0,3.0,4.0,4.0,4.0,4.0
