date,employee_title,location,employee_status,review_title,years_at_company,helpful,pros,cons,advice_to_mgmt,rating_overall,rating_balance,rating_culture,rating_career,rating_comp,rating_mgmt
2015-09-09,,,Current Employee ,Vitals must be like a box of chocolates,Vitals must be like a box of chocolates,0,"Vitals must be like a box of chocolates, you don't know what you are going to get .. A 4 start job you like going to or a 1 star mess you can't wait to get out of. Maybe different groups are different.

My job is not all bad. I make decent money with benefits, the new office is nice if a little sterile, most people are really nice, my boss is great, the free snacks are good and the gym is free if you want it. Some remote work and flex time.

For all that I give them 4 stars!","So how did they end up with only 2 stars? MANAGEMENT. The management is awful, there is no other way to put it. Management here is bad. Really bad. From here on earth it seems like no one knows what they are doing, or cares. New CEO - ugh. Yes, they needed change but maybe not this change. Becoming more corporate-like so here comes the BS, the politics, the greed. They just cleaned house. They are bringing in more management (more of their friends to share the kitty?) and none of the working problems are getting solved. I have terrible teamwork with other groups and LOTS of long long hours. No promotions. No future that I can see.

So for all that I give then a 0. That comes out to 2.","While doing whatever it is that you are doing (probably a power point presentation and begging for funding), please also bring in someone who can actually RUN a tech company efficiently. And stop banning plants. Sheesh.",2.0,2.0,1.0,1.0,3.0,1.0
2015-09-23, Manager,"Lyndhurst, NJ",Current Employee ,Manager,Manager,0,"Free snacks and drinks, gym membership, great to work with except upper management. Nice office space. Flexible hours and work from home.",The entire upper management. They seem to have this mentality of just hiring within their own circle of retired friends. Instead of promoting from within. None of them have a clue how to manage a software company. All they care about is themselves. Not a care about the people that actually do the work to move the company forward. There's no loyalty and you have to constantly watch your back because sooner or later they will stab you in the back.,Fire all upper management and hire a more technical knowledgeable young open minded minds.,1.0,5.0,1.0,1.0,1.0,1.0
2015-08-14,,,Current Employee ,Positive Growth Potential,Positive Growth Potential,0,"- I believe in the product (and path the product is going) and thus the market potential for huge growth. Because of that, I see a bright future for Vitals as a whole.
- Gym membership, and flexibility with schedule and working from home.
- One of the first things the new executives did was align the entire company to a vision and mission. Absolutely needed as we were scattered and not focused.
- People in general are friendly and want to help
- Management in my experience has been supportive with an open door policy","- Transitioning from startup to a more organized, process filled structure is difficult. Until we get there, there's a lot of questions to be answered, and things to be figured out.
- Lots of changes (which I think are good), but listing as a con here because people in general have problem with any change.
- Disorganized to a degree. Hoping that we reach a point where we get ""settled in"" and processes are in place.
- Minimal training provided. Left to figure it out yourself.
- Product quality isn't there yet.","- Follow through with your plan with honesty and integrity. It's ridiculous to think that new management would come in and NOT make any changes.
- Treat your employees as real people and not numbers that can be subtracted from a spreadsheet.
- Spot the brown nosers. Promote/reward those through real metrics; not because they are good at kissing arse. Eliminate office politics.",4.0,4.0,4.0,3.0,4.0,4.0
2015-08-29,,"Lyndhurst, NJ",Current Employee ,A quiet storm of corporate cultural decay,A quiet storm of corporate cultural decay,0,Cafeteria in the building. Open floor plan. Snacks are provided and the company does pay for a gym membership at a nearby gym.,"As many have shared, the company is in a bit of an identity crisis. There have been layoffs and numerous exits over the last several weeks. Shifts in business direction as well.

While leadership has recently tried to create a mission and values based organization, it has proven to be nothing more than a paper statement. The culture, as best I can describe it, is dead. There is no energy, no excitement, no passion, and no sense of team or purpose. At 5pm employees head to the door as if a school bell has gone off and class dismissed. I don't have confidence that the leadership cares to address this issue either. These days, a corporate culture should be synonymous with its brand. Bad culture inside affects the brand on the outside.","Interact with the employees to better understand the culture and address the ""blah"" attitude that has become pervasive. Provide some direction, create goals, and come out of your offices once in a while so you can see first-hand the issues that require your attention.",1.0,2.0,1.0,1.0,1.0,1.0
2015-07-22,,,Former Employee ,Review for Vitals,Review for Vitals,0,"good people to work for, good culture, relaxed environment, people care about the company executive staff very committed. All in all looks like the company is there to stay and has future potential to grow","disorganized. My qa director was not professional at all. although the rest of the company was great all the way up to the ceo. but they need to improve on organizational policies, more structure etc",,4.0,4.0,4.0,4.0,2.0,4.0
2015-08-26,,,Current Employee ,Company is in a state of flux,Company is in a state of flux,0,"snacks, time off, gym membership","1984 type of environment, morale is at an all time low. Employees are starting a mass exodus a month after 10% of the company was let go",There seems to be an identity crisis in which direction the company wants to go. All eggs seem to be in the Smart Shopper basket which still seems a hard sell.,1.0,3.0,1.0,1.0,3.0,1.0
2015-08-18,,"Lyndhurst, NJ",Current Employee ,Anything above 1 STAR are from HR people.,Anything above 1 STAR are from HR people.,0,You get healthy snacks and get to wear sandals,"This company is a joke. Every since new management came, it's been a total disaster. This woman Hayward doesn't know anything about how to run a company.
Forget getting a promotion or bonuses as promised.
The moral is this place is so bad that everyone is looking for jobs. We employees call this place a ""death chamber"".
This is a miserable place to work for and can't wait to get out of here.","Give the place back to Mitch to run.
Admit that you are a failure.",1.0,1.0,1.0,1.0,1.0,1.0
2015-08-19, Software Engineer,"Lyndhurst, NJ",Current Employee ,"Run far, run fast","Run far, run fast",0,None. Come here at your own risk. YOU WERE WARNED!,"Company is about to go bankrupt. Most people are interviewing (They don't have cash to last to end of year) including some of management.
Horrible people. Any good review you see is written by management. They are so slippery you can't trust them. They are busy trying to stab each other in the back. Do not come here or you will regret it!",What's the point? You won't listen.,1.0,,,,,
2015-08-10, Data Center Engineer,"Lyndhurst, NJ",Former Employee ,Company is going under,Company is going under,0,"No accountability for work performed so you can slide by very easily, snacks provided. They don't block websites like Facebook like most companies do.","Most likely going out of business, it's the 8th month of 2015 and all employees are still waiting for their 2014 year end bonus which probably isn't coming. No raises ever. New CEO Heywerd has been unable to convince any investor that this is something they want to invest in.

The pulse of Vitals is getting very week and the company is about to flat line. RIP. Don't believe the fake reviews being posted by Vitals HR department on this site.","I would say bring back Mitch, but it's definitely already too late to turn it around.",1.0,1.0,1.0,1.0,1.0,1.0
2015-07-15,,,Former Employee ,"Great people, disorganized company","Great people, disorganized company",0,"The people who work at Vitals are great. They make for a fun work experience, and now that the office is in a new space there are more opportunities to be social and talk to everyone. They also pay well for starting salaries.",The company is still very disorganized and multiple attempts at making changes with the structure hasn't done much to change that. Communication within departments is little to none which made planning ahead with projects and campaigns very difficult.,"Communicate to your team, and communicate with other teams that rely on your work to do their work. It seems a bit crazy that even when you are making the decision to let people go to further the company mission (which I do wish all the best in that), that managers aren't even aware that their own employees won't be working for them any longer. You can do better.",3.0,5.0,2.0,3.0,4.0,2.0
2015-07-09,,,Current Employee ,They need to fix their management issues,They need to fix their management issues,0,"The people are the best in the business. They are fun to work with personable and outside a few people that I couldn't work with I really enjoyed the people there.

The Lyndhurst gym membership is a great perk. And the new office in Lyndhurst looks great. I hope they finish it.","The management.

Mitch was a great CEO, I'd work with him again. He busted his butt for the company and as a result his team did too. But the new CEO is the opposite. She seems very selfish and disinterested in the company.

Management is willing to spend a lot of money to do things. However they are spending way too much money and for a company that is cash strapped it appears callous and is very risky. There is no corporate culture of saving money in this company at all. And they need to.

There is no promote from within. No career growth at all. To date I've not seen one person get promoted to director, or a director to VP. They always hire from the outside. Don't treat this company as a career but as a stop on your path.

Forget bonuses or raises. You can take on tremendous responsibilities but management will not reward it.

They just did a round of layoffs so be careful if you are looking to start there.","Reward the people that work for you. Give them growth opportunities. Instead of hiring tons of VP's and Directors try promoting the people you have and hiring junior staff.

The Engineering team needs to be more organized. Right now it is chaos with some people working towards one goal and others an opposite goal. Its very fractured. They need to come together and figure out what they are doing.

Layoffs are not the way to bring a company out of a rut.

You need to update glassdoor.com . Mitch is no longer CEO. Put Heyward Donigan's name and picture here.",2.0,4.0,1.0,2.0,3.0,1.0
2015-07-29,,,Former Employee ,Short Stay,Short Stay,0,Just like most people have said in prior reviews--- some nice people - Other than that Can't think of anything- oh yes pay checks did not bounce.,Most people seem to be miserable and want to leave- It is pretty obvious and If Management does not see that well they are in for a rude awakening. I can't imagine any one staying much longer... If they do not get laid off.,Look at the people there. Enough said.,1.0,4.0,1.0,1.0,2.0,1.0
2015-06-25,,,Former Employee ,Analyst,Analyst,0,"Nice people and environment, great learning experience",Can't think of anything bad,,5.0,5.0,5.0,5.0,5.0,5.0
2015-07-18, Data Engineer,"Lyndhurst, NJ",Former Employee ,Failing company,Failing company,0,"Nice fellow employees, if you remain employed there.","Company is failing and laying off people now as investors run scared. New CEO and upper management lacks knowledge in the digital arena, and is taking the company in the wrong direction. As a result they are looking at the downfall of a company that could have been great and successful.","Reinstate previous CEO before it's too late, if it's not already too late to save the company.",1.0,1.0,1.0,1.0,1.0,1.0
2015-07-18, Employee,"New York, NY",Former Employee ,a company in utter disarray,a company in utter disarray,0,"• low level employees are very friendly
• easy to work remotely","• constant management turnover
• lack of communication about company's struggles
• inability to secure investor funding to continue regular operations
• poor communication with management, even direct supervisors","Pick a strategy and stick with it, eliminate the bloated management ranks, and/or look for a buyer… at this point an exit makes the most sense, as the company is unable to keep pace with competitors.

Also, Mitch is not the CEO anymore, it's somebody new (a woman named Hayward… or maybe Hayward?). She's so far proven rather incompetent.",1.0,3.0,2.0,1.0,2.0,1.0
2015-06-30,,,Current Employee ,Account Execuative,Account Execuative,0,Lots of time to do other things besides work.,"No vision, support or leadership",,1.0,3.0,1.0,1.0,2.0,1.0
2015-05-20,,,Current Employee ,Exciting Company,Exciting Company,0,This is an exciting place to work. There are a lot of smart people working here. It is growing at a fast pace has a product that the market likes.,None that I would like to share at this time.,,5.0,5.0,5.0,5.0,4.0,5.0
2015-03-20,,,Former Employee ,A Good Startup Company To Work For!,A Good Startup Company To Work For!,0,"Work-Life Balance, Casual Environment, and most of all the People I worked with.","Many changes since my departure. New CEO, hired from bottom-up instead of top-down. Completely lacked direction in terms of segmenting departments, roles and appreciation. Don't expect annual salary raises or review (even if it is in writing). At one point the entire company's cohesion was great, but lack of appreciation led to many of the talented employees to leave. CTO lacks any management ability and plays the blame game on other departments","Appreciate talent when you have it, even if it costs money because good talent is hard to find. People once lived and breathed Vitals, that mantra has completely disappeared. The startup atmosphere has diminished and current employees have been shuffled all over. Founders have left.",4.0,4.0,4.0,3.0,3.0,2.0
2015-03-10, Account Manager,"Lyndhurst, NJ",Current Employee ,"Awesome people, bad management","Awesome people, bad management",0,"Great working environment, Free Gym, Stock Option is a plus. People are really nice and friendly.",Management doesn't know what they want to do. They run around in circles from meeting to meeting expecting you to do something. But it's impossible to work when your always in a meeting. Always biting too much than they can swallow. If there was better leadership this place will sky rocket.,Focus more on developing people and leading them instead of focusing so much on the money. Add Value to people and they will add value to the company which is much more greater than the money you will ever have.,3.0,3.0,2.0,3.0,3.0,1.0
2014-10-22,,,Current Employee ,overall happy with my job,overall happy with my job,0,great company to work for with great people,disorganized and needs help with client management,,4.0,,,,,
2014-10-15, Rather Not Say,"New York, NY",Former Employee ,A short stay at Vitals,A short stay at Vitals,0,I like what they do and I liked the CEO. They were understanding of my leaving and went out of their way to make things right for me. It was more than I expected and I'm grateful.,"Unfortunately, I was unable to do my job because of one particular employee and felt it was best to remove myself. Outside of that, I enjoyed the job.",It's hard to give advice without knowing the specifics of why one person was allowed to operate in such an unprofessional manner. There are things I'm sure I don't know about the situation. I can't give someone advice when I'm not in their shoes.,3.0,4.0,2.0,4.0,4.0,4.0
2014-11-01,,,Current Employee ,Terrible choice of career for anyone who has their head screwed on,Terrible choice of career for anyone who has their head screwed on,0,None that I can think of apart from a weekly paycheck for now,"Bad culture, rotten ethics stay away",Get out before someone does it for you,1.0,,,,,
2014-09-05, Product Manager,"New York, NY",Current Employee ,Product Managemetn,Product Managemetn,0,Open office environment in heart of SoHo,"Long hours - everyone works long because others are just 'there'
Management seems to have anterior motives solely focused on how to get sales/clients and an easy way to exit
Not a clear roadmap and thus priorities shift as do timelines which cases rework",Train better and have a clearly defined roadmap and expectations,2.0,2.0,2.0,2.0,4.0,2.0
2014-08-16,,,Current Employee ,An absolutely great place to work,An absolutely great place to work,0,Vitals has been my favorite place work. Management takes the time to recognise contribution and talent. They pay fair salaries. 98% of the people I work with are always friendly and very professional. Working during normal hours and not overworking yourself is always encouraged. Management conducts a town hall style meeting once a month to bring everyone up to date with how the company is doing and to get feedback from employees. The CEO is very competent and cares greatly about the company and it's employees.,"Project management could use some TLC. There are always several projects in development on different schedules and requiring varying resources. I believe it's too much for one, or even two people to manage. This can make for a very stressful environment, especially during project planning meetings. Resources feel a bit misappropriated.","Maybe consider hiring additional project managers to help with the high project loads as of late. People who can really focus on individual projects and the needs within. Other than that, keep being awesome.",5.0,5.0,5.0,5.0,5.0,5.0
2014-07-23,,,Current Employee ,"Trying so hard to do right; usually doesn't understand what ""right"" is.","Trying so hard to do right; usually doesn't understand what ""right"" is.",0,"The large percentage of the people you will work with, in any office, are good people. Lots of intelligence across almost all departments. They try very hard to make it a happy place with miscellaneous perks. HR had a problem with lack of experience; new head of department perfect for repairing that. CEO willing to listen and wants you to be happy (you probably won't change his mind though). Opportunity for knowledge growth.","The few people who aren't the ""good people"" are like well placed secret bombs in the company infrastructure. It's like someone designed the company's org chart as an impossible video game dungeon; eventually you will hit a problem child. Sadly, they are so well rooted in their respective areas that it's unlikely these poison apples will ever get trimmed. Miscellaneous perks are all very nice; but really, who cares about an unplugged arcade emulator and themed breakfasts in comparison to workspace issues, salary concerns and long standing unresolved problems. Company still does the startup-esque excuse of ""work hard now because we're in a sensitive stage"" as they dangle your stock options in front of you during your 50-60 hr work week. Concepts and processes built on old thoughts and faulty foundations that seemingly will never get truly ripped down for better infrastructure in the name of ""moving forward"". Knowledge may be ready available; the chance to learn new stuff may be there, but good luck getting actual promotions that aren't just title only. Even lateral moves are near impossible, unless you're in the right column of the org chart to begin with. Morale isn't horrific, but I certainly wouldn't even call it neutral.","Be straight, with your employees, with your investors, with your partners and clients. You've done a great job, but a lot of technology is going to crumble. Stop ""striking while the iron is hot""; if you don't have enough people to handle it now, I don't care that this is the best chance to get more business. Fix your foundation before building more levels. Take a good, hard look at the inequalities between locations and departments; there's a reason NYC people smile more than the other 3 locations. Why not just put a jacuzzi and a steam room in that trophy of an office? Giant waste of money in the name of claiming we're in the city + ridiculous pressure of select employees who didn't like the commute to NJ.",3.0,3.0,3.0,2.0,3.0,3.0
2014-06-20, Social Media Coordinator,"New York, NY",Current Employee ,Room to be Creative,Room to be Creative,0,"Treated like a valuable employee. People trust me to test new methods without judgement. Beautiful NYC office. Startup feel. CEO is very available, will sit down to talk. HR is on top of things.",Traveling to New Jersey for the monthly staff meeting can be a pain if you don't have a car.,"It would be nice to have more internal lunches, like a monthly pizza party in the conference room. NYC office should have a comped gym like the NJ office does (I know that is probably cost prohibitive, but still... a gym would be great).",4.0,5.0,5.0,5.0,4.0,4.0
2014-05-08,,,Current Employee ,Great place,Great place,0,"The people are great, the projects are challenging. Good processing. Everyone is dedicated",I could see no cons so far,,5.0,5.0,5.0,5.0,5.0,5.0
2014-05-07,,"Lyndhurst, NJ",Current Employee ,A fast-paced Medical Directories Pioneer,A fast-paced Medical Directories Pioneer,0,"-Many employees highly believe in our company's values and vision. We are arming the society with transparency in health care
The atmosphere at the headquarters in Lyndhurst is very laid-back.
-There is no formal attire required, just casual.
-The CEO is transparent and very sociable. He is always the first one in the office and the last one out. He is always in the office on holidays and snow days.
-HR hosts an events committee- there are monthly events in the office excluding monthly company-wide meetings followed by a ""Thursday Thursday""
-Perks- free hot yoga membership and gym membership at a local gym (this facility is old)
-Annual Bonuses
-Start-up feel","-HR is very controlling, very fake, up-tight, unapproachable
-High turn over rate
-Rapidly expanding employee count but focused in the wrong positions= too many directors and too much micromanagement
-Lack of training is the most popular complaint. It is barely offered to new employees.
-Small office space
-Barely any perks- no 401K","Invest in your current employees instead of blindly hiring new employees. The employees here need adequate training. If you supply employees with training, they will be more committed to their roles.",3.0,3.0,3.0,3.0,2.0,3.0
2014-04-16,,"Lyndhurst, NJ",Former Employee ,"A total, dysfunctional mess","A total, dysfunctional mess",0,There were good eating opportunities around the building. Lunch and going home were usually the highlight of the day.,"Very dysfunctional and chaotic environment and stressful, too. There was a severe lack of structure and training at Vitals. How on earth can a company provide no training?!? The turnover was high as well which wasn't surprising. Company name isn't even recognizable, so it doesn't even look great on resume when you are job hunting which you should start doing the minute you start working there. Once you get ""settled"" into your role, you may realize what you've gotten yourself into and realize it's not something positive. Just a total mess, SMH.",Get it together and paint the office walls a different color!,1.0,2.0,2.0,1.0,2.0,1.0
2014-03-12, Data,"Lyndhurst, NJ",Former Employee ,"Great at first glance, but horribly managed and operated once you begin to work there","Great at first glance, but horribly managed and operated once you begin to work there",0,"Intensely Casual Dress
Stock Options
Good Benefits","Hired employees from the bottom up instead of top down (senior management first then the rest of the teams)
No raises, ever.
Managers have no clue what they are doing- You ask a question and they just say figure it out
No value for employees
Watch out for the unlimited vacation policy, sounds good at first, but in reality if you have days left and get fired or laid off they do NOT have to pay you for any accrued days.
Human Resources is by far the worst department",Stop advancing towards corporate hierarchy culture and revert back to the start up culture that was there in the beginning. That was the main reason you lost the BEST talent!,2.0,3.0,2.0,1.0,2.0,2.0
2014-03-27,,,Current Employee ,Sketchy company.....avoid if possible.,Sketchy company.....avoid if possible.,0,Good location if you live in NJ. Decent compensation. Fellow employees are friendly.,"""Management"" truly lacks knowledge, leadership skills and vision; it's alarming. There's no structure in this place. There are so many red flags in the way the company is operated it's not even funny. There are no SOP's, no set protocols. ""HR"" is a mess. Any negative (truthful) reviews of Vitals are quickly followed up by positive (inaccurate and misleading) reviews. My advice - If you do end up working here stay a year, get some business experience, and move on to greener pastures.",N/A.,1.0,2.0,2.0,1.0,3.0,1.0
