date,employee_title,location,employee_status,review_title,years_at_company,helpful,pros,cons,advice_to_mgmt,rating_overall,rating_balance,rating_culture,rating_career,rating_comp,rating_mgmt
2013-05-14,,"Lyndhurst, NJ",Former Employee ,More deceptive than professional,More deceptive than professional,0,"Good place to start your career
Good location if you live in or near Northern NJ","On-boarding process and interviews give the impression that Vitals' cares about its' employees, but once the work begins, you will realize this:

No formal training process in place, upper management's advice is to ""figure it out.""

High employee turnover which means LOW employee retention. This company isn't in the business of paying more to get quality talent, they'd prefer to hire either: a) green, fresh out of college kids as temps to avoid providing benefits or b) hire decent talent that doesn't realize they are being taken advantage of. When employees are consistently leaving, that says a lot.

It would be rare to find a definitive job spec pertaining to your position pre and post-hire. What they do supply is vague and when you start working you'll end up having work that has absolutely NOTHING to do with why you were hired.

CEO & Founders are primarily interested in turning profit hoping for the chance to be bought out by a larger company or issue an IPO then cash out. Their lack of interest in keeping talented employees not only expresses how cheap they are about paying for talent, but it also demonstrates that people are less important than the product that they are responsible for creating.

A great deal of the Senior Managers lack the education, experience, and knowledge to be in their current roles. They look to people paid awfully and treated horribly for the right answer, then when it backfires they can blame someone other than themselves.

Don't be confused by the offer of 'Unlimited Vacation', the notion sounds wonderful, but the HR department is barely qualified to read a resume, let alone make decisions on vacation and keeping track of the days. If it was truly unlimited, why would someone keep track? That said, the real reason any company (esp. Vitals) offers 'Unlimited Vacation' is so they don't have to pay you for time earned if you choose to leave the company or you get terminated.

Absolutely nothing is planned, designed, developed, tested, and produced in a reasonable time constraint. Mostly everything is a 'drop everything' scenario where you have less time than it would take an expert to complete the assigned task.

They also claim to offer a flexible schedule, but when employees happen to leave earlier than 5:00, regardless of start time, they are reprimanded via some immature game of telephone where everything gets confused and just causes more stress than anything.

Vitals also pretends that they value you and will evaluate your performance for salary purposes, but even IF those meetings occur, you won't see a dime.","Perhaps if any of the management moves to a new company, they would consider building the team from the top down, meaning hire the right senior executives first then let them choose who to hire, and so on. Unfortunately, because the CEO can't say no to any partnership or business deal that involves money, the company was built in a piecemeal fashion. Additionally, management needs to leave their 'I know it all' attitudes at home and be open to any employee's thoughts, ideas, or comments. Comments here could be endless, but I'm not going to waste my knowledge on a company that wasted my time.",1.0,2.0,2.0,2.0,1.0,1.0
2013-05-06,,,Former Employee ,"Chaotic vision, inexperienced management","Chaotic vision, inexperienced management",0,"solid business idea and concept, potential to grow is strong. can expand into many areas,
good commute if you don't want to go into city.","no frills company.
high turnover of people,
poor vision from upper management, at times frenetic.
not a great place to grow professionally",,1.0,4.0,4.0,2.0,3.0,2.0
2010-09-29, Sales,"Lyndhurst, NJ",Former Employee ,Dont waste your time,Dont waste your time,0,"Relaxed atmosphere
Everyone with the exception of the CEO are great people.
Good support when needed","Pay
Too many focuses
Lack of structure
Lack of communication
Benefits
Poor company moral.",Let the people that bring in revenue make the decision. CEO is focused on too many things to make any singular company successful.,2.0,4.0,2.0,1.0,3.0,
2010-06-21, Project Manager,"Lyndhurst, NJ",Current Employee ,Vitals.com,Vitals.com,0,Great small company - start up atmosphere with a great work mentality. Room for advancement with this up and coming doctor review website.,Outside of New York City so the reverse commute is rough. Offices are positioned in a commercial park in the Meadowlands.,Try not to focus on too many projects/side companies and devote time and effort to seeing Vitals.com succeed. Great opportunity to grow!,5.0,4.0,5.0,3.0,5.0,
2011-07-01, Manager,,Current Employee ,"Good people, but poor structure and disrespectful management.","Good people, but poor structure and disrespectful management.",0,"Social atmosphere
Interesting culture
Decent website concept
Startup ""feel""","Management hires young to take advantage of inexperience
Employees encouraged to believe they are going to get ""rich"" from M/A
Management is disrespectful and disgruntled
No clear business plan
Relies heavily on investment money and is controlled by an unseen board
Much of the talent has left for other opportunities
Poor morale","Define roles, up quality control - reduce number of staff
Weed out the bad management, keep and reward the good
Ask employees for opinion of each manager and structure accordingly
Acquire new talent and replace problem employees
Keep side work separate from the Vitals.com website",2.0,2.5,2.5,2.0,1.0,
