date,employee_title,location,employee_status,review_title,years_at_company,helpful,pros,cons,advice_to_mgmt,rating_overall,rating_balance,rating_culture,rating_career,rating_comp,rating_mgmt
2017-09-08,,,Current Employee ,Watch your skills erode,Watch your skills erode,0,Good pay and time off,Poor project planning. Very little research and documentation prior to development. Lots of rework. Very little personal growth once you're pegged for a position. Plan to do the same thing for your entire career.,,2.0,3.0,1.0,1.0,5.0,1.0
2017-08-23, Chief Executive Officer,"Houston, TX",Current Employee ,great company,great company,0,great benefits and insurance advancement very good,"long
parking a bit difficult",,5.0,4.0,5.0,5.0,5.0,5.0
2017-08-15,,,Current Employee ,Account Manager,Account Manager,0,"Company car, 401k, health, life, work independent","quotas, task, hard to get service work done without help from home office",help with maangers in field,3.0,2.0,3.0,3.0,5.0,5.0
2017-08-08,,,Former Employee ,claims,claims,0,Decent benefits/ 401k match / PTO earned starting day one./ Co-workers are friendly and willing to help out.,Work load is heavy and you will need to work more than 40 hours a week every week to keep up.,,2.0,1.0,1.0,1.0,3.0,1.0
2017-05-14, Software Developer,"Madison, WI",Current Employee ,Software Developer,Software Developer,0,Job security. Good management. Good pay,Personally I think insurance is boring.,None actually. Management does a great job of moving people around and allocating fair amounts of work.,4.0,4.0,4.0,4.0,5.0,4.0
2017-05-10, Workers Compensation Claims Adjuster,"Stevens Point, WI",Current Employee ,Great place,Great place,0,The people are very nice.. Training is very thorough and complete.. They are always open to questions and willing to help.,Phone calls come in a lot.. If you are an active person you will get ansty,Keep it up!,5.0,5.0,5.0,5.0,5.0,5.0
2017-05-29,,,Former Employee ,IT department is amazingly inefficient,IT department is amazingly inefficient,0,"The company pays pretty well for the area, and it's possible to maintain your position without doing too much work.","The data services IT department is astonishingly inefficient and wasteful. A response to another review, the company stated proudly that Sentry has the largest IT organization in central Wisconsin. I'm sure that's true, and that's exactly the problem.

Sentry has thousands of people doing work that could be accomplished by about 150 skilled developers and database admins. That's not to say they don't have skilled developers--they do, but the project managers and directors tend to be incompetent and there are rarely sufficient requirements passed to developers.

My department hilariously tried to implement a half-agile methodology. We had scrum meetings every other day, no sprint review, but a ""sprint planning"" where the project manager simply told us what we were doing the rest of the month-long sprint. The ""sprints"" often ended up being useless since the project manager was unable to address logistical issues by the time it ended.

As a result, for months at a time I did practically nothing at work. No one really cared, because the sprints were so unproductive anyway that I blended in.

I could go on for hours about this, but suffice to say, the Sentry IT department is one you want to avoid if you are interested in gaining skills for your career. If only I could get this portion of my life back...","Take a serious look at how much productivity you get from each department. Consider replacing project managers and directors, and adopting a true agile methodology. Research continuous integration and other industry topics.",1.0,3.0,2.0,1.0,3.0,1.0
2017-04-01,,,Former Employee ,Business Analyst,Business Analyst,0,Good pay and benefit opportunities.,Micromanagement and not a friendly work culture.,Be more personable and less corporate.,3.0,2.0,2.0,4.0,4.0,2.0
2017-04-21, Sales Representative,"Madison, WI",Current Employee ,Account manager,Account manager,0,"Company car, gas card 401k with matching save all you can it will be short lived work from home while you look for another job.",Same old sales job 4 tier sales structure and everything roles down hill. Upper management hides behind performance of everyone below them so if you are an acct manager you will be at the bottom. Sales acct mgrs have no say in anything underwriting controls everything acct managers deliver policy and sale what is approved by underwriting at the highest price.,"no advice you are under the same ""save your own butt"" philosophy as everyone else. Sum it up as a luck of the draw. Future uncertain good luck. Sentry is not going to remain a direct writer. Maybe you can work for one of our competitors",1.0,2.0,1.0,1.0,3.0,1.0
2017-02-28, Account Manager,"Kansas City, KS",Current Employee ,Four out of five,Four out of five,0,Flexibility on scheduling based on customers availability. Ability to maintain a steady stream of income with protected territory. Company provided vehicle and expense reimbursement for approved expenses.,"Maximum travel time, long drives on turnpike. Base client fluctuates on underwriting. Push hard on 401k production from the gate.",These are long term relationships that take time to build. To much pressure to product in first quarter of the year for yearly goals. Would be more attainable and motivating to have quarterly goals.,4.0,3.0,3.0,3.0,4.0,2.0
2017-02-02, Claims Representative,,Current Employee ,very solid company,very solid company,0,"good pay, benefits, work environment",There were limited options for career advancement.,you're mostly doing well. just keep up incentives for employees to move forward.,4.0,4.0,4.0,2.0,4.0,3.0
2017-03-10,,"Madison, WI",Former Employee ,Conservative,Conservative,0,Good company history and pride,Antiquated mentality and definitely old school thinking,"One word they need to get familiar with: ""trending""",1.0,1.0,1.0,1.0,1.0,1.0
2017-02-16, Accountant,,Current Employee ,Accountant,Accountant,0,"The benefits are good
Compensation is competitive
Decent people to work with","Work is stale
No real incentives
""Work is life"" attitude among top mangement","More communication to employees on the good things they are doing. Hearing ""good job today"" every once in a while goes a long way.",3.0,2.0,3.0,2.0,4.0,2.0
2017-01-24, Claims Representative I,"Stevens Point, WI",Former Employee ,Claims Representative 1,Claims Representative 1,0,Great company to work for. Plenty of opportunities for advancement within the company.,Downsides are pretty comparable to any job. Communication with upper management could be improved.,,5.0,5.0,5.0,5.0,4.0,4.0
2017-01-25,,,Former Employee ,Account manager,Account manager,0,Great 401k plan and a company car,"Management, long work hours, bonus plan is awful.","Stop micromanaging! Let the sales
Reps manage their territory. Not everything is black and white!",2.0,1.0,1.0,2.0,3.0,1.0
2017-01-30,,"Richmond, VA",Former Employee ,Claims Representative,Claims Representative,0,6% contribution in 401k from day 1.,"Senior adjusters carry the highest claim count with same complexity as ""Analysts"", but are paid less. Supervisor gave preferential treatment to her favs. So much Cronyism it is nauseating.
Claims system is years behind your competitors technology!",Job titles are very misleading. An adjuster with 2 years work at Sentry does not qualify as a Senior Adjuster in the industry.,1.0,1.0,1.0,1.0,1.0,1.0
2017-01-03, Claim Representative I,"Goldsboro, NC",Former Employee ,Not what I expected. Claims Representative.,Not what I expected. Claims Representative.,0,Great money and benefits for the area. The maternity leave is their best perk. 6 weeks paid and falls under FMLA.,No work/life balance. Over worked and under paid. Very stressful. Unrealistic expectations. Salary means working 6 days a week at times. Expect anxiety attacks. This is not a 40 hour/week job no matter what the trainer tells you...,"Show interest in the employees who want to be there and want to promote. Don't overwork the employees who actually do their jobs. Doing other people's work isn't something I should have had to do, my own workload was more than enough.",2.0,1.0,3.0,3.0,5.0,1.0
2017-01-04, Claims Representative II,"Goldsboro, NC",Former Employee ,Good job for a student,Good job for a student,0,Decent pay for a call center,the micromanaging is unlike anything I have ever seen,,3.0,,,,,
2016-12-18, Software Engineer,"Stevens Point, WI",Current Employee ,Software Engineer,Software Engineer,0,A great company that is generous with extras for employees,A very large company in central Wisconsin,,4.0,4.0,4.0,3.0,3.0,4.0
2016-12-07, Consumer Products Specialist,"Glendale, AZ",Former Employee ,Consumer Product Specialist,Consumer Product Specialist,0,Great company. Great training. Great people I worked with in management really assisted in anyway they could.,More competitive products for the region.,None,4.0,4.0,4.0,4.0,5.0,5.0
