date,employee_title,location,employee_status,review_title,years_at_company,helpful,pros,cons,advice_to_mgmt,rating_overall,rating_balance,rating_culture,rating_career,rating_comp,rating_mgmt
2019-04-10, Compliance Analyst,,Current Employee ,Sentry,Sentry,0,It is a good company,None it is a good company,No advice to management at Sentry,5.0,5.0,4.0,4.0,4.0,4.0
2019-04-01, Advanced Analytics Modeler,"Stevens Point, WI",Current Employee ,Great Company,Great Company,0,"Amazing 401K match, great PTO policy, good bonus program, excellent employee perks such as cafeteria, exercise facilities, pool, golf course, etc.",Health insurance is a little on the expensive side.,Continue to make this a great place to work.,5.0,5.0,5.0,4.0,4.0,5.0
2019-03-28, Claims Technician,"Scottsdale, AZ",Current Employee ,Part Time schedules for students,Part Time schedules for students,0,They offer decent pay for part-time work. Very appealing for students.,Very repetitive and you're expected to be an emotional punching bag for all customers. They can say anything they want and you're expected to have no feelings while people cuss you out back to back all day. No one is happy to be in a car accident so the calls are all pretty draining.,Realize workers are humans. Provide more chances for them to destress and take care of their mental health.,4.0,3.0,2.0,3.0,5.0,1.0
2019-03-12, Account Manager,,Former Employee ,Good company - a bit of a boys club,Good company - a bit of a boys club,0,Great individuals at home office to assist - training was solid.,"Bit of boys club, specifically in Sales. Insurance sales in general is that way.","With Sentry growing and marketing more, would be nice if they looked to diversify their sales account managers. Would bring fresh perspective to the industry.",4.0,4.0,3.0,3.0,4.0,3.0
2019-04-12,,,Current Employee ,Worst company.,Worst company.,0,Nothing Nothing Nothing Nothing Nothing,The worst HR organization a company can have.,,1.0,1.0,1.0,1.0,3.0,1.0
2019-02-24, Claims Adjuster,,Former Employee ,"Not the best, for sure.","Not the best, for sure.",0,I received a paycheck as expected.,"Training - non-existent.
Management - I don't even know what to say - it was bad. They were there to tell you what you did wrong and didn't acknowledge anything that you did above the expectations.",Learn how much it costs you in employee turnover and start implementing practices that let employees grow.,3.0,2.0,1.0,3.0,2.0,1.0
2019-01-29, Claims Representative,"Salem, OR",Former Employee ,Great company to work for. They focused on learning and development.,Great company to work for. They focused on learning and development.,0,Able to work around you life. Great work life home life balance. Bay far one of the best companies to work for.,"Salaries can be better
Health insurance can be better, hard to pay deductibles and co insurance if anything major happens",Offer better pay and better benefits,4.0,5.0,5.0,5.0,3.0,5.0
2019-01-25,,,Current Employee ,Dream World,Dream World,0,Lucky to still have pension plan,"Some are favored to get ahead, others are marked for failure...lots of favoritism.",,2.0,,,,,
2019-01-09, Director If IT,"Stevens Point, WI",Current Employee ,Great place to work,Great place to work,0,"Open, collaborative culture with positive peers. Modern campus. Good pay and benefits.",Nothing that I can think of.,,5.0,5.0,5.0,5.0,4.0,5.0
2018-12-21, Associate Software Developer,,Current Employee ,Great College Co-op Program,Great College Co-op Program,0,"They treat you like royalty. Nice flexibility with hours, real world projects, and great employees.","Not many cons. If I had to be picky, they could dedicate more time for training.",,5.0,5.0,5.0,5.0,5.0,5.0
2018-12-22,,,Current Employee ,Region Manager,Region Manager,0,"Fantastic company to work for, great pay, benefits, and company support.",There are no cons that I can think of.,,5.0,4.0,5.0,5.0,5.0,5.0
2018-12-18, Associate Software Developer,"Madison, WI",Current Employee ,Great Company and Great People,Great Company and Great People,0,Treat the employees better than you can even imagine.,Literally none that I can think of.,,5.0,5.0,5.0,5.0,5.0,5.0
2018-12-02, Senior Account Manager,"Los Angeles, CA",Former Employee ,Conservite company that provides secure employment,Conservite company that provides secure employment,0,Employees are highly valued. Company mantra is that your co-workers are like your clients. The same respect and courtesies should apply,Hard to make changes. Very conservative,,4.0,5.0,4.0,5.0,5.0,4.0
2018-11-20,,,Current Employee ,Financial Analyst,Financial Analyst,0,The people and environment are great,The location if you like big cities,,5.0,5.0,5.0,4.0,4.0,5.0
2018-11-19,,,Current Employee ,Great Employer!,Great Employer!,0,"Flexible Schedule, Work from Home","Micro Managers, Time on calls are managed",Allow skilled people to do what you hired them to do,5.0,4.0,5.0,3.0,4.0,3.0
2018-12-19,,"Stevens Point, WI",Former Employee ,Immature drama between and with leadership.,Immature drama between and with leadership.,0,Great compensation. Good people (associates).,"If you don’t live near the corporate office or are a local, you’re treated differently. Leadership and Senior Leadership in IT and Information Security are in constant conflict and unfortunately this drags other associates down.",Be up front with associates and be genuine.,1.0,4.0,1.0,1.0,4.0,1.0
2018-11-24, Data Quality Analyst,"Freeport, IL",Former Employee ,"Great benefits, team environment but you are treated well only if you suck up to the right people and there's favoritism","Great benefits, team environment but you are treated well only if you suck up to the right people and there's favoritism",0,"Good benefits and pay, team environment, like to have food days and fun","Too many close friendships with managers and their direct reports. There is favoritism, if you aren't in the right crowd you're targeted and find things to say you're doing wrong","Treat everyone equal, don't take one person's side and not allow us to defend ourselves. There are always two sides to every story so don't assume. Get proof of the offense",2.0,3.0,1.0,4.0,4.0,2.0
2018-11-05,,,Former Employee ,Business Products Manager,Business Products Manager,0,"Great culture, benefits, and leadership development",Not much to say in the way of cons,,5.0,,,,,
2018-10-16, Systems Administrator,"Stevens Point, WI",Former Employee ,Fun environment and community,Fun environment and community,0,Room to expand is available,Managers have tendency to play favorites,,4.0,3.0,4.0,4.0,4.0,4.0
2018-10-13,,,Former Employee ,Estimatir,Estimatir,0,Great people in this office,None that I can think of,,4.0,4.0,4.0,4.0,4.0,3.0
2018-10-02,,,Current Employee ,Product Support Processor,Product Support Processor,0,Great company with good benefits. I love that you can move to a new job position within the same company.,You have to wait a year before moving to each new position. Some entry level jobs pay very little.,,5.0,5.0,5.0,5.0,5.0,5.0
2018-09-17,,,Current Employee ,Administrative Assistant,Administrative Assistant,0,"Great company
Cares about employees
Great benefits
Competitive pay",There is really no cons for Sentry. This is a great company to work for!,,4.0,4.0,4.0,4.0,4.0,4.0
2018-09-03, Scanner,"Stevens Point, WI",Current Employee ,Scanning Tech,Scanning Tech,0,Works with School hours for college,Early Mornings starting time roughly at 6am,,5.0,4.0,5.0,4.0,5.0,4.0
2018-09-07,,,Current Employee ,Good Company,Good Company,0,Sentry truly cares about their employees and management is always willing to listen and help you when needed. Benefits are pretty good and the 401k match is unheard of!,A large organization that can be slow to get approval at times. Pay could be slightly higher than it is.,,4.0,5.0,5.0,4.0,4.0,5.0
2018-09-28, Claims Representative I,"Goldsboro, NC",Former Employee ,Dumpster Fire,Dumpster Fire,0,"Zero, low pay and terrible management.",They do not reward commitment or intelligence.,Fire management.,1.0,1.0,1.0,1.0,1.0,1.0
2018-09-02,,,Former Employee ,Ok,Ok,0,"Quick to hire, that is it.","Cheap pay, slave drivers, no room for promotion",Grow up,3.0,1.0,1.0,1.0,2.0,1.0
2018-07-17, Associate Product Analyst,"Madison, WI",Current Employee ,"Great work environment, lots of room to move up within company.","Great work environment, lots of room to move up within company.",0,"Friendly Environment, Good Pay, Great Benefits",No real cons that I can think of,,5.0,4.0,5.0,4.0,5.0,4.0
2018-08-09, Claims Adjuster,"Scottsdale, AZ",Former Employee ,Good Ole Boy Management,Good Ole Boy Management,0,Great coworkers and 401K match,"Management micromanages to the point adjuster were unable to get their daily work completed. You would think management is there to be positive and help their employees succeed, over the last few years they seemed to spend their days reviewing files, emails and messages for any actions that the employee could be written up and possibly terminated. There is a constant letting go of tenured experienced employees in lieu of replacements with no experience and a lower salary, this put a strain on all the employees by increased workloads. Management is a good ole boy network that if you do not fit their mold good luck! You'll feel the heat.","Clear out management from the Associate Director down, in lieu of management that wants to see their employees succeed. Stop managing by numbers, lead by example not and the Good ole boy network.",1.0,3.0,4.0,4.0,3.0,1.0
2018-06-19, Claims Adjuster,"Stevens Point, WI",Current Employee ,Claims Adjuster,Claims Adjuster,0,Decent pay and Great benefits,"Raises and bonuses suck
Upper management is detached from reality. We have a 55 hr work load but only allowed 45 hrs
Stressful",Work on hiring more people and having HR in each facility so that they regularly recruit and handle inner office issues,4.0,2.0,3.0,4.0,5.0,1.0
2018-06-23, Account Manager,,Current Employee ,Account Manager - Sales,Account Manager - Sales,0,"The obvious and apparent pros would be working from home, company car, and expenses covered. However, the best part about being an “Account Manager” at Sentry is the unlimited earning potential, and the support you receive from management to reach your goals. If you have strong work ethic, and want to challenge yourself, Sentry is a great place to work. If not, you may be one of those leaving a negative review! With recent territory changes, an Account Manager job should be a very coveted job in the insurance industry.","There is some uncertainty about the future of the direct writing field force, although, I will say that Semtry has communicated their commitment to it.","Continued communication on changes with Sentry, and how they relate to the future of the Direct Writer field force.

The title “Account Manager” does not correlate with how the rest of the insurance industry views the position. In order to attract top talent, I would look at changing our title.",5.0,4.0,4.0,4.0,5.0,4.0
2018-06-22, CR Senior,,Current Employee ,"good, better, sentry","good, better, sentry",0,"pay, benefits, 8% 401k match, allows some to work from home, willingness to improve","claims are claims, job isnt for everyone",for the most part keep it up. I've worked for other carriers and I'm happy here,4.0,5.0,4.0,4.0,5.0,4.0
2018-07-16, Claims Adjuster,"Davenport, IA",Former Employee ,Claims Department is Juvenile,Claims Department is Juvenile,0,Every two weeks there was a paycheck,"Seriously, everything else. Management was so negative and overbearing, no one could do their work. And the way they make it clear that they are reading and reviewing all your mail and messages, waiting for you to step out of line!
You would imagine that they have no claims to look after, just employees they try to fire. I think my boss spent his days looking for ways to write people up. And the director is no better. Just an overgrown child that is used to bullying people to get his way.","Clear out the management starting with the director and CAM's. Stop managing by numbers. Start leading your people by example, not by clique management.",1.0,1.0,1.0,1.0,2.0,3.0
2018-06-09, Claims Representative II,"Davenport, IA",Current Employee ,"Never thought I’d work in Insurance, but I love my job!","Never thought I’d work in Insurance, but I love my job!",0,"Love my coworkers
Lots of training provided by Sentry
They want you to succeed and move up within the company","Pressure to hit metrics
At times the workload can be daunting",,4.0,4.0,5.0,5.0,3.0,5.0
2018-05-21,,,Current Employee ,Culture change,Culture change,0,"Respect of management, flexibility, better training program, great leadership of Brad Pomp, passion for customer service, team concept, stable work.","Not all departments in Longwood communicate between themselves or to Divisions, family insurance coverage is way to expensive, some people with the company for a long time do not give internal service, too many family members being hired, high turnover in Longwood office.","Continue on the path of more training for ALL positions, listen more to what employees want, pay more since #3 in nation, lower cost medical insurance, if employees don’t follow the culture replace them with people that are the culture.",4.0,,,,,
2018-05-08,,,Former Employee ,Good Products.,Good Products.,0,Good products and talented colleagues.,None that come to mind.,,4.0,,,,,
2018-05-02, Claims Representative II,"Goldsboro, NC",Former Employee ,Not bad once you get going,Not bad once you get going,0,"Working at Sentry was great for the most part. It is a busy job due to claim volume, but I was okay with that since I came in already expecting it. Training is excellent, culture is excellent. Great team building exercises, etc. The work itself wasn't bad thanks to the systems we used to help us work efficiently. I enjoyed my time there.","Location was my biggest issue. I did not want to move to the city the job was located in.

Also, high volume is also a con.",Keep up the good work. Award your efficient and best employees with raises so that you can keep them there for the long run.,4.0,2.0,4.0,2.0,4.0,3.0
2018-04-10,,"Salem, OR",Former Employee ,Claims Rep,Claims Rep,0,"Great benefits, decent pay, fun coworkers, strong promotional opportunities",Overworked and understaffed. You almost have to work overtime every week unless you want to fall behind on all of your work. Management always slapping you on the hand for silly things but not acknowledging good things everyone does.,,3.0,4.0,4.0,3.0,5.0,
2018-03-14,,,Current Employee ,National Accounts,National Accounts,0,Great benefits and corporate structure. They really make you feel welcome and important,None so far just a great company all around,Keep up the good work,5.0,4.0,5.0,5.0,5.0,5.0
2018-04-15,,,Former Employee ,Frauds,Frauds,0,They're not closed down yet.,Everything that is under the Sun.,"Treat your employees with respect and stop stealing money from your jobs. For you to be a vendor, you train people how to manage stolen money. Also. Give more room for advancement .. Which doesn't exist.",1.0,1.0,1.0,1.0,1.0,1.0
2018-03-21,,,Current Employee ,Claims representative,Claims representative,0,Great company. Good benefits. Sentry bonus. 8% company match 401k,"Work load is unmanagable. No time to take breaks, lunch, go to the restroom. High stress. High volume. No compassion for the massive workload.",,2.0,1.0,2.0,2.0,5.0,1.0
2018-02-24,,,Current Employee ,Life as a Sentry Associate,Life as a Sentry Associate,0,Sentry is a very family oriented company. They are fair but tough. Expect to work beyond normal business hours and days as you climb the corporate ladder.,You'll need to be able to adjust to living in small towns for most of their job opportunities. Big city folks may not like the job location if working at the home office.,I feel that overall the senior managrment id very intelligent and set to take the organization to the next level.,4.0,3.0,4.0,4.0,4.0,4.0
2018-03-08, Claims Representative,"Stevens Point, WI",Former Employee ,Boring,Boring,0,You worked mainly on your own. Managed claims from open to close. You had a lot of resources to reach out to if you needed help.,"Very boring work. I would get done with my daily tasks by noon almost every day. Training was horrible, you read a manual then got thrown in.",,3.0,5.0,4.0,4.0,4.0,4.0
2018-02-14,,,Former Employee ,Pretty Nice,Pretty Nice,0,"Great Benefits, matched 401k, pool, gym, nice building",Lots of corporate red tape,,5.0,,,,,
2018-02-05,,,Former Employee ,Operations Technician,Operations Technician,0,Supervisors were always helpful and kind to the staff.,"Some co-workers seem to talk more than work, but that's how you build relationships within the company.",None,4.0,3.0,3.0,4.0,3.0,4.0
2018-01-30,,,Current Employee ,Review,Review,0,"family environment, changes are publicly made","HR matters aren't kept private, high stress work environment",,5.0,,,,,
2018-02-02,,,Former Employee ,Solid Company - Slightly unknown direction,Solid Company - Slightly unknown direction,0,"Benefits, Autonomy, Ability to succeed as a producer if you have a strong work ethic.","Unknown future, changes in structure, combining territories.",Clear vision statement.,4.0,4.0,4.0,3.0,5.0,4.0
2018-01-29, Claims Specialist,"Stevens Point, WI",Current Employee ,Great company with excellent benefits that you will need!,Great company with excellent benefits that you will need!,0,Company is exciting and fun place to work with great growth opportunities and fantastic visions. Upper management consistently sends messages encouraging employees to shine.,"The better you do, the more work that is piled on you. You are micromanaged and expected to meet unobtainable goals with pendings that double industry standards",Worry less about the technicalities and let the results speak for themselves. Clogging up the files with file notes that add no value to the outcome of out management only slows adjusters down.,4.0,1.0,4.0,4.0,4.0,4.0
2018-02-08,,,Former Employee ,Dealer Operations Account Manager,Dealer Operations Account Manager,0,Excellent 401K plan. Company car provided. Decent earnings if you are hired to sell and service in an already established territory. Strong claims department and reputation.,Product restrictions and rules in specific target market make it difficult to grow the business. Over-emphasis on profits limits growth and account retention. Not very flexible underwriting. Certain geographic markets are more competitive than others. Cumbersome quoting process.,Need to be more flexible with product features and guidelines. Balance opportunity for sales success in all geographic markets.,3.0,,,,,
2017-12-27,,,Current Employee ,Strong Community-Oriented Company,Strong Community-Oriented Company,0,"Community Oriented, Competitive Pay, Work/Life balance, Strong company in a strong industry, Growth opportunities, Headquartered in a great small community",Conservative control-based culture (but probably appropriate for an insurance company),,5.0,5.0,5.0,5.0,4.0,5.0
2017-12-25,,,Former Employee ,Supportive Environment,Supportive Environment,0,Awesome supervisors who were always there for support.,None that I can think of.,,5.0,,,,,
2017-12-18, Claims Specialist,,Former Employee ,"Mostly fine, until today.","Mostly fine, until today.",0,"As before, coworkers are great. There were some decent attempts at modernization as well. I also hear the home office cafeteria is delightful.","You all fired me a week before Christmas, also knowing I had a newborn after all this talk of getting morale improved after a ton of turnover during the last few years. It's an especially cute touch to refuse to provide the reason for termination beyond vague, essentially meaningless phrases and then rather than answer questions, just read a script. Rather insulting really. No respect for a longer term employee, no warning. Well done guys.",,2.0,2.0,3.0,2.0,3.0,1.0
2017-12-06,,,Former Employee ,Employer your employees,Employer your employees,0,"Sentry’s CEO, Pete McPartland, is an amazingly kind, knowledgeable and caring person.

The company is investing a lot of money into the home offices to make them much better for employees and the community.

For the area, the jobs pay well. However, the benefits are average.","The department I worked it had a lot of first-time managers who did not necessarily have the experience to be managers. As a result, instances of fear-based management techniques, lack of trust in team’s abilities even though the team was entirely capable and talented, and micromanaging and nitpicking were regular occurances. Because of this, turnover has been extremely high and great talent has been lost.

There was also a severe lack of professional development and forward-thinking career planning.","Learn to empower and trust those who you’ve hired. Also, don’t be afraid to learn from them. There are some incredibly talented, and kind people who work at Sentry. Put your egos aside and work with your team and other departments. Understand that everyone in the building works for Sentry, and ultimately everyone has the same goal.",2.0,3.0,2.0,1.0,3.0,2.0
2017-10-17, Financial Analyst,"Stevens Point, WI",Former Employee ,Current Review,Current Review,0,"Good benefits, location and facilities.",Some areas are micromanaged and lack support of associate growth.,,4.0,3.0,3.0,4.0,4.0,3.0
2017-10-04, Claim Representative I,"Salem, OR",Current Employee ,Overall satisfied,Overall satisfied,0,"A lot of experienced and senior adjusters, friendly and welcoming environment, a lot of support from management to asure that you are within guidelines and you learn a lot of laws in different states",Very fast pace and you have to be the type of individual that can treat every customer with respect regardless the scenario,None,4.0,3.0,3.0,3.0,2.0,3.0
2017-10-08,,,Former Employee ,"Good Perks, but demanding - Remote employees","Good Perks, but demanding - Remote employees",0,"Sentry has some good perks, and they've recently put a lot of money into rebranding and providing more services at the home office in WI. Which they need because that building was stuck in the 70s. Average health and life benefits. 401k match 6%. Remote employees get company car, and some expenses paid for","- Remote employees like Sales Account Managers and Safety Consultants don't get to take advantage of the resources at the home office in WI.
-Lots of travel required for remote positions for sales, and even more for safety. You get a company car, and they use that as a selling point for the position. But you're always driving, and that takes away from customer service and reports.
-You get old equipment like old dell laptops running windows 7. And old Oracle interfaces. These are slowly getting updated, but its hard to be efficient from a home office with that equipment.

-The home office will push out new procedures or requirements and not tell the remote employees. Then remote employees get in trouble for not doing them, or doing them wrong.

-Very poor work life balance for remote employees. And they try to tell you that you cant get a job that pays this good, and lets you work from home.
-Limited job growth unless you want to take a job in the home office. But you're either on the road, or stressing over your reports, and always bringing work home. There are other similar jobs that have better balance","More training for remote employees, education/resources on work life balance for remote employees, office ergonomic equipment for remote employees... Don't push out new policies or producers without educating remote employees first",2.0,1.0,2.0,2.0,5.0,3.0
2017-10-09,,,Current Employee ,Rapid Review,Rapid Review,0,Management is great about work life balance.,"Over worked, under staffed and underappreciated",,2.0,,,,,
2017-10-25,,,Current Employee ,Terrible management,Terrible management,0,Good pto to start and match on 401k,Can not use pto when you want it and only 6 holidays,Management is very negative and always looking for someone to blame,1.0,1.0,1.0,1.0,2.0,1.0
2017-09-13,,,Current Employee ,Manager,Manager,0,Sentry is a wonderful place to work. Excellent leadership and great opportunity.,I honestly can't think of anything negative about working for Sentry.,,5.0,5.0,5.0,5.0,5.0,5.0
2017-08-30, Claims,"Stevens Point, WI",Current Employee ,Excellent Company to work for!,Excellent Company to work for!,0,I have worked and continue to work for Sentry over the past 40+ years and can't say enough about what a great company Sentry is. They have a competitive wage and benefit package. Sentry and the associates contribute greatly to the community. I am very proud to say that I'm a longstanding Sentry associate.,"My only wish is that the health insurance currently offered now (Anthem BC/BS) was as good a plan as we had many years ago when Security Health was offered. I do, however, understand that things have to change to keep premiums at an affordable level.","Upper/Senior management...don't be afraid to commend the associates that prove to be outstanding, no matter how unimportant you feel their position is and don't be of the mindset that no one in Claims Department is an ~Exceeds~ rating just to make youself and the numbers look good. Underappreciated associates will leave and you'll have high turnover which puts a burden on the dedicated associates that stay the course.",4.0,4.0,5.0,5.0,4.0,2.0
2017-08-28, Claims Representative,,Current Employee ,Great employer,Great employer,0,You are given the opportunity to learn and grow. The salary is excellent for the area. The management staff is knowledgeable and listen.,At times the volume outways the staffing. It is hard to get all your vacation time due to staffing and available.,,5.0,5.0,5.0,5.0,5.0,5.0
