date,employee_title,location,employee_status,review_title,years_at_company,helpful,pros,cons,advice_to_mgmt,rating_overall,rating_balance,rating_culture,rating_career,rating_comp,rating_mgmt
2013-10-07,,,Current Employee ,I feel lucky to be a part of something so great,More than a year,0,"- Awesome leadership that acknowledges and nurtures hard working and talented employees
- Great company with a product that really is making an impact
- Great culture and family atmosphere. FUN is highly encouraged, I might even sat it is required :)
- Great resources and benefits available for all employees
- I learn something new every day
- I have referred tons of friends and former colleagues here which I would not do if I didn't believe in the company and the great opportunity it offers. I recently wrote the following when I posted available jobs to my social group: ""My company is hiring! BIG TIME!!! There are 5 open sales executive positions, several in marketing, tons in engineering, product, and many, many more.

What can I say about the company: It is by far the best place I have ever worked! It's not often that someone can honestly say ""I LOVE my job, the company, and all of my colleagues!"", but I find myself saying that just about every time someone asks me what I do. Come be a rockstar at Taulia!!""

Overall the best professional experience I have had to date.",- There is a lot to be done and this can be overwhelming to some.,Continue being awesome!,5.0,4.0,5.0,5.0,5.0,5.0
2013-10-07,,,Current Employee ,Taulia is Amazing!,,0,"great support from the management, friendly co-workers, new office in SOMA, free lunch on Tuesday & Thursday",I can't think of any!,You are doing an amazing job!,5.0,5.0,5.0,4.0,5.0,4.0
2013-09-20,,,Current Employee ,Not a best place to work,,0,"Office in nice location
I would advise this to someone who is not serious about their work, career","They have very good marketing skills because the job description on their careers website and the work you do onsite don't really match. They are very good at misleading people. They hire good qualified people and make them do useless work which you can't even put on them on your resume. The job title, job description don't match at all with the tasks assigned. So this company is not advisable for some one who is serious about their career.",Don't waste other's time.,1.0,2.0,1.0,1.0,2.0,1.0
2013-08-23, Consultant,"San Francisco, CA",Former Employee ,"Nice place to work, good people and great atmosphere",Less than a year,0,"Great experience, passionate and amazing product team. The idea is outstanding and the go-to-market seems to be inline with the growth expectations.","Needs to grow, maintain focus and redefine a few product features as the market is demanding some sort of new ideas and processes are not in line with the market. Global market is still to far.",,3.0,4.0,3.0,3.0,3.0,3.0
2013-03-20, Project Manager,"San Francisco, CA",Current Employee ,My other family,More than a year,0,"People.
I work with very smart and very passionate people. There is respect and good amount of sharing.
Team dynamics is great.

Compassion
Management pays close attention to giving a helping hand when situation arises.

Opportunity
The opportunity to grow and possibility to transition to other roles.
Management support of my graduate education and professional development.",Growth - it can sometimes be difficult to meet work deadlines and balancing life especialy with a new born. Office space is slowly getting to be an issue,Hire the best and keep the current dynamics. It is working.,4.0,4.0,5.0,4.0,3.0,4.0
2012-08-13, Supplier Outreach,"Park City, UT",Current Employee ,Small Company Engagement with Big Company Production,Less than a year,0,"Taulia knows how to treat employees well. Everyone is able to help you with a project and provide their expertise. Outside of work, their is a community of friendship maintained and they make a point to nurture those relationships.

If you have an idea that you want implemented, the people in charge want to know what you have to say and give you the freedom to see it come into reality. Everyone works hard to make improvements happen and happen fast.

You are given the responsibility to get your job down without having to be micromanaged. When a project is completed, you feel responsible for its success and credit/appreciation is given where due.","Most everyone at Taulia is an A-game player. Everyone works hard and is capable to find a solution to almost any problem. You don't have to expect crazy hours, but expect to work hard at your job. If you are one of those people that like to show up, do the bare minimum, and go home, you probably won't fit in and won't like working for Taulia.","Taulia is on the cuspe of becoming a large and very successful company. Ending the year of 2012, it will start to move out of the small company startup feel and into the big company structure. During this transition, don't lose the small company feel and focus on emphasizing the worth of every employee.",5.0,5.0,4.0,4.0,4.0,5.0
2012-08-13, Senior Project Manager,"Park City, UT",Current Employee ,Love being a part of a start up company,More than a year,0,"I prefer a small start up company where I can contribute to the team in many different ways. Taulia offers me that opportunity and it's very rewarding to see the results of my labor make the company better. Our professional services team is only made up of ""A"" players so you can rely in each person to do their job well and also be available to you if you need any help.",It's been difficult to find SAP experts to work on our team. This means that the rest of us have to come up to speed on SAP which takes some time. Taulia has been great at getting us SAP training to help in that process.,"Keep finding great people to join our team. In the end, it's the people who make the company!",5.0,5.0,5.0,5.0,5.0,5.0
2012-08-07,,"San Francisco, CA",Current Employee ,Great Company. Awesome Product. Genuine People/Co-workers,Less than a year,0,"Working with the founders is very rewarding.
Startup culture with happiness and engineering at the forefront of their vision.
Great technology. Smooth process for product changes.
Go Carts. Catered food. Pac-man. yes all this is in the office.
This company hires well, so you're working with smart people everyday.",The office coffee kind of sucks.,keep it up.,5.0,4.0,5.0,5.0,4.0,5.0
2012-08-07,,"San Francisco, CA",Current Employee ,Awesome people and satisfying work,More than a year,0,"#1 thing for me is the people. You will never face a problem alone, and everyone is willing to help you go the extra mile to make the product better. You will genuinely like the people you work with.

Company culture encapsulates the ""Get Sh*t Done"" philosophy. People are laid back here for the most part, but will become scarily laser-focused to solve whatever issues present themselves.

Benefits are great: above average vacay, fully stocked kitchen, frequent free lunches, game room with Foosball table and vintage arcade cabinet, awesome new office in a cool part of SF with great nearby restaurants and close to BART, commuter benefits, etc.

Executive team and management in general are totally open and available. They will help you work through problems as opposed to just expecting you to deal with it yourself. They are passionate about what they do and that passion is contagious. My experience is they genuinely care about your career progression, health/sanity, and overall happiness, and will take active steps to work with you to ensure you're satisfied with your role.","You will be challenged. It's a startup, so the typical problem of having a lot of work and not always having enough resources to satisfactorily tackle that work becomes an issue from time to time.

Processes change frequently. Again, a byproduct of being an agile startup. This frustrates some people.",Just maintain the awesomeness as the company grows.,5.0,4.0,5.0,5.0,4.0,5.0
2012-08-07, Software Engineer,"San Francisco, CA",Current Employee ,"Exciting, fun, dedicated",More than 3 years,0,"Everyday is a new learning experience.
One of the best reasons to work here is the people, everyone here is dedicated and united on their goal to succeed as a team.
Opportunity to learn and work on new and exciting topics.
Very powerful Product idea and an immense scope to improve in various directions.
Working with some of the smartest people. People with the amount of experience and credibility coming together is not very common.
Working with more and more new technologies.
So many existing customers and the list keeps growing very fast.

Awesome new office in Downtown San Francisco next to Union Square.
Game room, beautiful patio, catered lunches... on and on.","There are two GoKarts in the office and yet NO ramps to jump off of !!! :P

The only negative which i guess is subjective or dependent on an individual, is that its a very fast growing and changing environment where each individual contributes, is ready for almost anything. Some people would say its very opposite to a slow moving big corporation. Some folks like it (like me), some dont.","Every organization has its ups and downs in various areas, for a startup issues are different. I believe its unfair to nitpick on temporary issues. We understand, we learn, we grow, crush the problems and push forward. The management has been very proactive around this area and advise is to not ignore that as the company grows. Its because everyone is listened to, that everyone is dedicated as they are.

Most important suggestion is to make sure this unique culture stays more or less the same as the company grows.",5.0,4.0,5.0,5.0,5.0,5.0
2011-08-26,,"San Francisco, CA",Former Employee ,A fun and rewarding place to work!,,0,"Advancement Opportunities
Easy Going and Fun Atmosphere
Great Health Plan
Senior Management Very Accessible
Three Weeks Vacation in the first Year!!!
Four Weeks Vacation in the second Year!!!
Five Weeks Vacation in the third Year!!!","If you aren't use to working at a small company, this might not be the one for you, but it is quickly growing.","To any management of a company I always say to make sure the employees feel important and valued. During my time there, I feel you did a great job at this, just don't forget to continue doing this during your growth!",5.0,5.0,5.0,5.0,5.0,
2011-06-02,,"San Francisco, CA",Former Employee ,Sucked dry and cast aside,,0,"A ""young"" company trying new technologies, with money and business coming in to fund it.
International group, if you like to work with Europeans, especially Germans.","Inexperienced management who don't know how to manage people and don't care to do so.

They subscribe to the ""startup mantra"" of hire quickly, fire quickly. This means that you can be working long hours, hustling to get things done, putting your heart into the place, only to find that without any feedback or discussion of there being a problem, they have laid you off. Some people like that flexibility--I find it demoralizing and unsavory.

Some of the management doesn't know how to delegate.",Devise some more formal and regular way of measuring employee progress and communicating it. Look into real employee development instead of just treating them like black boxes that produce labor.,2.0,3.5,2.0,3.5,2.0,
2019-02-19,,Sofia (Bulgaria),Current Employee ,Best of the best! I love it!,Less than a year,0,"People, people, people - they make the culture and the working environment so friendly and welcoming. Also, flexibility to define your own aims and way to do things and last but not least, lots of benefits.","Actually, there is nothing to add here. It is a perfect fit for me personally.",Continue to be as close to the people as possible and share your vision and mission regularly.,5.0,5.0,5.0,4.0,5.0,5.0
2019-02-21,,,Current Employee ,Weird faked reviews,More than 3 years,0,"Pretty good SAP add-on for eInvoicing and supplier portal.
Innovative financing partner for supply chain financing (Greensill)","I don't usually contribute to platforms like these but I feel I have to because it's clear to me that many of the recent reviews are fake, or at least, overly-positive contributions by our management team or 'marketing' department, as:

- they don't reflect the prevailing atmosphere and attitude of many of my co-workers
- they are suspiciously positive, and all 5*, which I guess is an effort to bump up the glassdoor scores from what they were before.

Recommend that if you want a more balanced view of the company you look at the reviews from Jan 2018 and before.",Have the courage to concentrate on what you say you want to do as a company and stop trying to fake it,1.0,1.0,1.0,2.0,2.0,1.0
2018-06-01,,,Current Employee ,Three years has flown,More than 3 years,0,Started in 2015 and three years has flown by. Great people to work with and a growing customer and revenue base make this a good company to work for. My opinions/suggestions are listened to and my colleagues and I can help shape the company direction. Really enjoying the challenge of growing Taulia,Moving from Startup mentality to semi corporate is like growing pains - can be difficult going through them but worth it at the end.,"Keep moving the business forward and bring your employees with you, they make the difference.",5.0,,,,,
2018-01-17,,,Current Employee ,Exiting Environemnt,More than 3 years,0,"+Flexible working hours
+Good Team and Team Spirit
+Good Pay","-Product is still under development
-Extreme Resource constraints after lay off",,4.0,4.0,4.0,2.0,4.0,4.0
2017-12-08,,Sofia (Bulgaria),Current Employee ,A remarkable place,,0,"- Top-notch working conditions
- Vanguard technologies
- Flexibility in terms of working hours
- Friendly, team-building and culture nurturing environment
- Above-average social benefits and office perks",- Possible evening time meetings for coordination with the colleagues in the US office. However time zones are taken into consideration.,,5.0,5.0,5.0,5.0,,
2017-12-05,,Sofia (Bulgaria),Current Employee ,The best place I have ever worked for,Less than a year,0,"The team I work for is just incredible.
I have never learned so much and grown as a person and as a professional as much as in Taulia.
The overall office atmosphere is like between very close friends. I love being at the office, working with those people, laughing and chatting with them.
Each day is like a teambuilding.","We are still growing, learning, shifting between lines and of course - making mistakes, but then we try to fix them and continue stronger.",,5.0,5.0,4.0,5.0,5.0,4.0
2017-12-06,,,Current Employee ,Great culture and amazing opportunities,,0,"Great people - not only on professional level, but also on personal. Everyone is ready to help you, guide you and support you, even if you haven't ever met in person

Amazing opportunities - Taulia is growing and you have the opportunity to grow and develop along the way

Awesome culture - you feel like someone who has been cared for, you are not coming to work, but coming to face a new challenge and have fun","Changing the course of management more often that it should be
Lack of carrier opportunities due to the size of the company",The communication between senior management and the employees should be improved,5.0,5.0,5.0,2.0,4.0,2.0
2017-12-06,,Sofia (Bulgaria),Current Employee ,"East, West - Taulia is the best",More than 3 years,0,"- Great culture and work environment, amazing teammates
- Great work-life balance
- This feeling of being respected and appreciated by your manager
- The freedom to raise your voice, to suggest changes and improvements
- Autonomy
- Felxibility when it comes to working hours
- We in Sofia office are not just teammates, but a family
- Fun and regular parties, tournaments and team buildings
- The fact that we all come to work with pleasure and we enjoy being at the office says so much about the atmosphere
- Social benefits and perks","- Lack of clear career path for some positions
- The company had some tough times during the last year and some of the decisions were not communicated in the best way possible","- Human factor is the most important one
- You should be more careful when choosing the middle management - some of them seriously lack soft skills, as well as proper management skills and style",5.0,5.0,5.0,4.0,5.0,5.0
2017-12-05, Quality Assurance Engineer,Sofia (Bulgaria),Current Employee ,Excellent startup company with a market-leading product and a few weak spots,More than 3 years,0,"- It is a product company and working on the core product is interesting and motivating
- Cutting-edge technologies
- Great office culture and work environment
- Office perks","- Weak middle management
- Lack of a formal career path
- Some bureaucracy practices","Middle management is weak and inefficient. There are people who obviously lack management and organizational skills but are still being promoted.
Invest more in people. Career path opportunities for long-term employees.",5.0,5.0,5.0,4.0,5.0,4.0
2017-12-05,,Sofia (Bulgaria),Current Employee ,Good working place (almost great),More than 3 years,0,"Great culture
Great people to work with
One can learn a lot
Freedom to give ideas and innovate, improve existing company processes","Often-switching priorities
Lay-offs which increases the pressure on the few ones that remained","Stick to a plan
Commit and execute
Be more transparent as we are not just hard-working ants",4.0,5.0,4.0,3.0,4.0,3.0
2017-08-01,,,Current Employee ,Lack of vision and desastrous management,More than 3 years,0,nice people and interesting product.,"Leadership doesn't have clear vision where they want to go and employees will have to pay. Many lay-offs during last two years.
No workplace flexibility. (used to be fairly flexibel, but no home office allowed any more except on Fridays)",Just resign already. You cost enough people their jobs.,2.0,2.0,2.0,1.0,3.0,1.0
2017-08-06, Software Engineer,,Former Employee ,Great product - bad sales. High turnover.,More than 3 years,0,Very good people (most of the great people are not with the company any more). The product is great. The tech stack is incredible. Very good processes are in place. Very nice offices. One could learn a lot working at Taulia so I would recommend it.,"High turnover, 2 rounds of lay-offs in the last 2 years. Dev Ops team is almost non-existent. Useless people managed to evade second lay-offs and management still can`t figure them out. Support is being outsourced. Budgets cut and computers put on sale. Offices are needlessly expensive. Not enough workforce which is scattered on different things. In just 2 years Taulia managed to go from THE BEST place one can work to just a place.",,2.0,4.0,4.0,2.0,4.0,3.0
2017-02-23, Account Manager,,Current Employee ,Taulia Review,More than a year,0,"Great Social Benefits, Health, Live Insurance, Food Vouchers, Sport, Transport, Telephone, Cell Phone expense

Additional PTO With the experience. Great office atmosphere. Flexible working time.",Unclear Career path. Not well established process. Responsibilities are not well defined and you got lost what exactly have to do.,Work more to improve the career development. Define clear and sustainable process to have clear roles and responsibilities not changing them every 2 months.,4.0,4.0,5.0,3.0,5.0,4.0
2016-07-26,,,Current Employee ,Best Place to be,,0,everyone is committed to win,sometimes acting like a big oranization,,5.0,4.0,4.0,3.0,4.0,4.0
2015-12-15, Engineering Team Lead,Sofia (Bulgaria),Current Employee ,A mostly awesome place to work,More than a year,0,"Great people and culture.
Meaningful product that actually makes a huge impact. Cool technologies.
Challenging work on a daily basis. There's a lot more to be done, yet working environment is very chill and friendly.
Good flexibility with working hours, working from home etc.
Great attitude from management. Your opinion actually matters.
Excellent compensation and benefits.","Taulia is growing really fast, which puts some pressure on work/life balance. Nobody is asking you to stay late though. But when you actually realise how much of the company's success depends on your team and you personally and the level of trust management has in you, you naturally want to hit your objectives, even if that means working a few extra hours sometimes.",,5.0,3.0,5.0,4.0,5.0,5.0
2015-10-21, Quality Engineer,Sofia (Bulgaria),Current Employee ,Taulia FTW,More than a year,0,"I truly love my job at Taulia.
The best reasons to work at Taulia:
- Very exciting fast growing company with rich culture
- Opportunity to work with the latest software development technologies
- Very friendly environment, easy communication with the management
- Cultural diversity
- Career opportunities
- All the smart people you can learn from",I personally cannot think of any downsides of working at Taulia.,Keep investing in the company culture with the same passion!,5.0,5.0,5.0,5.0,5.0,5.0
2015-10-07, Human Resources Specialist (HR Specialist),Sofia (Bulgaria),Current Employee ,Great experience,Less than a year,0,"A very friendly and stimulating atmosphere. The company gives you the opportunity to develop and always listens to what you have to say. The colleagues are AWESOME! We work and have fun together, travel and participate in charity initiatives. We are like a big family. The company takes great care of us when it comes to working conditions, opportunities to learn and develop and career paths.","It is way too windy during the summer in San Francisco, where our HQ is located :)",Just keep up the great work and please remain the same awesome and down-to-earth people you are!,5.0,5.0,5.0,5.0,5.0,5.0
2015-10-02, Support Analyst,Sofia (Bulgaria),Current Employee ,What is that?,,0,"- Self management
- Great people
- Motivating envornment","The Cons simply don't fit with Taulia. Honestly, you will find only Pros & Opportunities in this company.","Don't worry, be happy!",5.0,5.0,5.0,5.0,5.0,5.0
2015-10-02, Supplier Integration Specialist,Sofia (Bulgaria),Current Employee ,Taulia review - Gabriela Nikolova,Less than a year,0,I have joined Tauliia 3 months ago coming from a similar professional background. My first and overall impression of Taulia is that the company really cares about its employees. Taulia has an amazing company culture where employees feel as they belong to the Taulia family. Team members and the management are very approachable and I have felt welcome since day 1!,"We have recently faced some stressful work situations, however we have overcome them as a team effort.","I am overall happy with my management. As an advice I can say, that we shouldn't let the stress get to us in more intense situations;",5.0,5.0,5.0,4.0,4.0,4.0
2015-09-24, Software Engineer,Sofia (Bulgaria),Current Employee ,The best weird company!,More than a year,0,"Great professionals, extremely useful internal knowledge sharing, very seamless integration for new employees, dynamic working schedules. Chances to travel, visit conferences and improve yourself. Usage of new technologies, respect from all employees, core values, monthly company parties",- - - - -,,5.0,5.0,5.0,5.0,5.0,5.0
2015-10-09, Consulting Solutions Director,"London, England (UK)",Current Employee ,Top company with loads of energy!,,0,"Started about 3 months ago being one of the new members of the European sales team. Things I like so far are:

- very good onboarding procedures
- great atmosphere
- everybody seems to be on the same page and is helping each other
- loads of freedom to organise your work well
- clear goals set by management
- everybody is very enthousiastic which gives extra energy
- good compensation packages

All in all I am one of the proud Taulians and hope and expect to stay one for a long time to come","Couple of minor things:

- a lot of online /internal meetings are held at US west coast time zone. For Europeans this sometimes means meetings very late on the day (between 6:00-10:00 pm)
- To control costs, some approval process would make sense especially as we are growing rapily",Stay focused on the goal. Keep an eye on costs and keep organising fun stuff!,4.0,3.0,5.0,3.0,5.0,4.0
