date,employee_title,location,employee_status,review_title,years_at_company,helpful,pros,cons,advice_to_mgmt,rating_overall,rating_balance,rating_culture,rating_career,rating_comp,rating_mgmt
2019-03-14,,"San Francisco, CA",Current Employee ,Taulia Really Believes in What It's Doing.,More than a year,0,"Taulia is a place that truly tries to put the effort in to everything it does. The people here invest a lot of work and compassion into the company and their fellow colleagues, which can often promote a really inclusive culture built on relationships. The leadership is incredibly transparent and hold Q & A's called ""Fireside Chats,"" where we can all gather (through videoconference as well) and discuss issues or questions we all have as employees. They make the roadmap and strategy of the company available to us and involve us all in the process.

Taulia is composed of so many good people all over the world who generally care about the well being of others.

Opportunities for professional development.","There have been a few times that folks have left with a sour taste after being let go for whatever reason, or not agreeing with a leadership decision, which is bound to happen in any company. It can be really vulnerable to lose one's job, so the sentiment is understandable.

Since it is a startup, it also makes sense that there are operational inefficiencies that have grown and needed work in the past (and currently) in most departments. However, many people find that part of it invigorating.

Resources are not always available in the capacity that everyone wants it to be.","Continue to be transparent and treat employees as human beings, and the rest will work out.",5.0,5.0,5.0,5.0,5.0,5.0
2019-01-17, Account Executive,,Current Employee ,Great Company with Great People!!!,Less than a year,0,"I have been working here for over 4 months and completely love it!!! They offer amazing benefits, great salary, and amazing perks!! Love that we each get a Macbook Air, $100 per month for our phone bill, plus three-weeks vacation. Work-life balance is great as well. One of the most fun companies I have ever worked for.","None at this point. So far, so good!",Keep it up!!!,5.0,5.0,5.0,5.0,5.0,5.0
2018-10-30,,,Current Employee ,Great Company & Great Product & Great People,More than a year,0,"Great Culture - teams have fun, work hard, and honestly enjoy working together. Great product. - solutions are best in class and evolving. Growing business - fun to be part of a winning company with constant growth. Good managers - people management is getting better as company grows. Positive impact on customers business - customers are winning and greating great value. Taulia is a place where your ideas are heard and you can make a difference. Leadership is very open and communicates well. Every employee is given clear visibility into the company goals and plans, future direction and vision, and the current status of the overall health of the business. Overall a very good place to work with smart people who believe in the company mission and make it happen every day.",No real negatives. Minor items - remote employees do not enjoy the benefits provided to office-based employees. No 401K match.,Keep the focus on the core business of Working Capital solutions which have tremendous growth potential. Ensure the company does not get distracted by too many initiatives and new products.,5.0,4.0,5.0,5.0,4.0,5.0
2018-10-04, Manager,,Current Employee ,Work with talented people and grow your career!,More than 3 years,0,"Talented people

Best early payment product in the market

Transparency into company goals/objectives & expectations to ensure individual/team goals align

Great opportunity to learn and expand career

As still in it's ""young adult"" phase, great opportunity to make a difference and build the playbook","Due to ""young adult"" phase, not all processes are built out (yet see above)

Some teams are stronger than others

Not enough resources to get everything done that you envision (but it's for a purpose...no more funding rounds, time for Taulia to be financial self-sufficient)",,5.0,5.0,5.0,5.0,5.0,5.0
2018-10-02,,,Current Employee ,It's a great place to work!,More than a year,0,"- People (including managers) are fun, friendly, helpful, intelligent and understanding
- Generous bonus and good health care
- Gives recognition and celebrates hard working/helpful people and company achievements
- Work flexibility
- Good Product
- Well stocked pantry with lunch provided on some days","- 401k match would be nice, but not critical as the pay/bonus/perks are pretty generous
- Some department may need more head count as work is piling up. Company adding more people but not necessary at the right places.
- Need more process documentation for each department. This includes department process and work process.",Look at each department and see who needs 'help'. You have a few 1-3 team in a department and they are overworked. Everyone is important in the company and these 1-3 manned people should also be taken into account.,5.0,5.0,5.0,5.0,5.0,5.0
2018-09-17, Customer Success,"San Francisco, CA",Current Employee ,Excellent Company,More than 3 years,0,"Taulia is the best place I’ve worked in my career. When I wake up in the morning, I want to go to work. Taulia has an awesome team, as a business we are winning and as an individual there’s opportunity to contribute. Despite the growth we’ve had, we’ve been able to maintain our startup culture and have kept politics to a minimum.","There have certainly been bumps, but things have been better recently
Some teams are not as strong as others / are still developing",Keep hiring great people and continue to maintain our culture.,5.0,5.0,5.0,5.0,4.0,5.0
2018-08-28,,,Current Employee ,"Great company, good people, growing fast",More than 3 years,0,"Engineering team is full of very talented people
Leadership is invested in technical excellence
Company is winning, growing fast","Teams could be a bit bigger
Release process could use some tightening up","Hire more engineers, continue to invest in architecture",5.0,5.0,4.0,5.0,5.0,5.0
2018-08-23,,,Current Employee ,I love Taulia,More than a year,0,"-Flexibility
-Great people
-Transparency within the company
-Love the number of vacation days we get
-I can honestly say I look forward to coming into work and it is because of the work and the great people that make it worth it.",A good amount of turnover but glad to see that it is turning back around,,5.0,5.0,5.0,5.0,5.0,5.0
2018-06-28,,"Salt Lake City, UT",Current Employee ,Amazing company to work for,More than 3 years,0,"- Smart and talented people with a great attitude
- A chance to make a real difference in people's lives
- There are no BS jobs here, every job/person counts
- The CEO is very enthusiastic
- A Lot of transparency within the company with regards to sharing information
- Employees are treated really well
- Great/Exciting future prospects
- Stock options","- 401k match would be nice, but not critical as the pay/bonus/perks are pretty generous
- Need to hire people more aggressively, the current rate of hiring seems too laid back in filling open positions - we need more smart people urgently",,5.0,,,,,
2018-06-18,,"New Orleans, LA",Current Employee ,Account Executive,More than a year,0,"Treat employees well, uncapped commissions, flexible with schedule if have an outside event you need to attend, good business model and a lot of growth opportunity","Sometimes the Support team is slow to respond to customer concerns, but that has been improving recently.",,5.0,5.0,4.0,4.0,5.0,5.0
2018-06-12,,,Current Employee ,Taulia is a great company and on the right track,More than 3 years,0,"- Great people, great solution
- Good direction and fantastic traction
- Reasonable benefits, vacation is especially great
- Did I mention the people? The tech is great too, but the people truly make a difference
- Good focus on company culture, inclusion, and diversity
- New Sales leadership are doing a great job (Jon K. specifically) and clearly understand what needs to be done for growth - renewed focus on sales is refreshing","- Definitely some missteps along the way, but that has actually made the company as it is today MUCH stronger, MORE focused, and on a GREAT trajectory
- 401k match would be nice, but stock options may offset this
- Less upward mobility for now - perhaps this will change over time",Keep on the current path and focus on customer satisfaction (Since Customer Success IS our success),5.0,4.0,5.0,3.0,4.0,5.0
2018-05-13, Account Executive,"Austin, TX",Current Employee ,"Products, customers and company",More than 5 years,0,"Taulia is the only company offering supplier finance programs that has figured out how to make these programs work for ALL suppliers and for our buyer customers. It took years and a whole lot of sweat, frustration and pain to get to this point but now these early payment programs have become a large part of our revenue. Suppliers are never forced to take early payments in return for a discount -- they take early payments because they want and need the money and because the Taulia EP offers are better for them than alternatives (credit cards, factors and buyer P-Card programs are really really costly for suppliers when compared to Taulia financing). Suppliers are not charged a single penny for eInvoicing, PO delivery, visibility into transactions with their customers... on the Taulia network.","Executing on the changes necessary to become a profitable startup company has been challenging but I’d rather work at a self sufficient, profitable company than one desperately holding on from one fund raise to the next as is the case with many of our competitors.",Stay the course and remain focused on our customers.,5.0,5.0,5.0,5.0,5.0,5.0
2018-05-18, Business Consultant,"Salt Lake City, UT",Current Employee ,Great people / solid business fundamentals / good things ahead,More than a year,0,"Diverse customer portfolio. Strong product appreciation by end users. Great colleagues who are fully committed but also value their lives outside of working hours. Growing revenue streams (especially through performance pricing). Catered lunches. Investing in the right places to ensure the success of clients. Lots of flexibility (focus is on output, not hours worked) and autonomy (focus on doing what is right for the customer and the business in spite of how it might have worked in the past).",Fair amount of turnover in the last year (but honestly mostly as a result of the uncommitted who have left). Undeveloped processes (also part of what makes the opportunity exciting --- opportunity to be a part of establishing those).,"Continue to focus on people --- find the right talent, groom / provide opportunities to current talent. Continue to celebrate our successes --- yes, we have far to travel in our ambitious goals, but let's take time to celebrate how far we've come.",5.0,5.0,5.0,4.0,4.0,5.0
2018-04-27, Vice President of Professional Services,"Salt Lake City, UT",Current Employee ,Never been prouder to be a Taulian,More than 5 years,0,"I'm very excited for Taulia's future. The momentum is increasing and so many positive things are happening at Taulia. My favorite thing about working at Taulia is the ability to make an impact and do things that you are passionate about. I have my job responsibilities, but I'm also encouraged to look around for ways to improve the processes, fix challenges, or contribute to our culture. I work in a beautiful office with some of the brightest people I have ever worked with in my career.","We don't have every process or challenge figured out yet, so we have work to do, and as with any high growth company, getting all of that done quickly is a challenge.",Keep encouraging everyone in the organization to rise up and take on new projects to help us solve our challenges. We have a lot of smart people who want to help!,5.0,4.0,5.0,5.0,5.0,5.0
2018-04-30, Head of Working Capital Solution Consulting,,Current Employee ,Outstanding Company & Management,More than 5 years,0,Taulia management genuinely care about employees (and seek employee feedback). Flat organizational structure where everyone has an open door policy. Taulia is a well-known brand and clear global leader in supplier finance solutions. Great place to grow/learn about innovative supplier finance solutions.,Managed growth will be the key.,Keep up the great work and 'always optimistic' attitude. Taulia is changing the game as validated by its ever-growing global supplier network and customer base. Stay focused on the innovation roadmap and supplier/customer feedback.,5.0,5.0,5.0,5.0,5.0,5.0
2018-05-10, Director,"Salt Lake City, UT",Current Employee ,Nothing worth doing is easy,More than 3 years,0,"Taulia has a solid market position, performs better than the competition, and has great people.

That said, it's been hard. Building a product and company that transforms the way companies regard cash flows has required several pivots. We don't exist in a vacuum and the competition is fierce and comes after us because we are a real threat. The road to success has had pitfalls and stress. It always does.

I think people at Taulia genuinely care about the people and the work. It feels like we're doing something big.","Although some of the core features of the company have remained constant, the overall value proposition, product, and strategy have evolved a lot. Consistent internal communication can suffer.",,4.0,4.0,4.0,5.0,5.0,4.0
2018-03-05,,"Salt Lake City, UT",Current Employee ,Great company poised for future growth,More than 3 years,0,Very strong product positioned for the future. Great people to work with. Excellent compensation. Beautiful office to work in.,Need to continue to make the transition to a working capital solution provider.,"(See ""Cons"".)",5.0,5.0,5.0,5.0,5.0,5.0
2018-02-11,,"San Francisco, CA",Current Employee ,good fundamentals and good people. has it challenges but not unique to taulia,Less than a year,0,good people who are committed to making customers successful. good market position,selling to large enterprise customers is a slow process and can feel like we aren't making progress in the market. many offices for small company can make people feel disconnected,"be aggressive on sales, but realistic as well",5.0,4.0,5.0,4.0,5.0,4.0
2018-01-11,,,Current Employee ,NOLA Office: Aggressive con artists,,0,Easy to get a job there. Didn't take much to get the position.,Really aggressive sales tactics combined with a gross work environment and an almost universal willingness to force customers into payment solutions that were very bad for them.,Gut the New Orleans office and start over.,1.0,1.0,1.0,5.0,1.0,1.0
2017-11-10,,,Current Employee ,Well positioned to WIN in the market.,More than a year,0,"No politics. Lots of work to do / challenges. Autonomy to take something, own it, see it delivered. Get stuff done. Still attention to having fun, working hard / playing hard - even as we grow up and have the work and challenges of a larger company. Well funded, well positioned to beat our competition. Solution is cool, it works, we can deliver credible (and significant) value $ for customers.",Managing with tight budgets to ensure we execute on plan to profitability. Always need to do more with less. But that is what makes it a challenge - and what will ultimately make Taulia successful.,Keep the focus - avoid too many distractions. Recent attention to cross company alignment on our OKRs is important so we all are pushing in the same direction. Building good momentum - time to make Taulia a huge success.,5.0,3.0,4.0,4.0,4.0,4.0
2017-11-28,,,Former Employee ,Beware!,,0,A once great idea with good people in places.,The company is being run by an out of control CEO that has no idea what he is doing. To say he is lieing the majority of the time is only incorrect because he is so arrogant that he possibly doesn’t know he is making things up at times. Potential employees beware. Go back and read the articles available. They are packed full of lies that in retrospect now are obvious. Go back and talk to one of the many CFOs that left or any of the many other employees. Even the founders have now all bailed on the business.,"Step down. You are hurting hard working people. Stop lieing to investures. Stop fabricating numbers like 100% rention, number of companies useing your supplier discounting tools, current and past success rates.",1.0,3.0,1.0,1.0,3.0,1.0
2017-11-03,,"San Francisco, CA",Former Employee ,"Great concept, but needs a steady direction",,0,"Good Product
Great engineering team
Good collaboration between teams
Well stocked Kitchen","Yearly layoffs
No career advancement opportunities
Culture is all talk but no substance
Sales team makes promises knowing the product cannot and will not fulfill them",Decide what you core product will be and stick too it. Hire C level leaders who understand how the SaaS market. And realize that lay-offs are not the only way to trim costs and become profitable.,2.0,2.0,1.0,1.0,3.0,1.0
2017-10-20,,"Park City, UT",Current Employee ,I have learned a lot here,More than 3 years,0,"- Great office perks: lunches, drinks, and friendly office manager!
- People are caring and want to help
- Opportunities for growth and gaining work experience
- Every day you learn something new
- Never boring
- Great team and leaders in the company","- Recent lay-offs decreased company morale
- Many changes can make it difficult to keep up
- Org structure changes too much sometimes",We have goals but we are missing what our “vision” is. What are we here to do?,4.0,4.0,5.0,5.0,4.0,4.0
2017-10-09,,"San Francisco, CA",Former Employee ,Concept is good but execution is poor,More than 3 years,0,"In the beginning, I was really excited to work for this company. I think the idea behind their business is great and there are some very talented and hard working people who do their best.","The area that I worked in, had no management that had any clue as to the 'real wold' practices of this part of the business. They thought they could just make it up. It seems that the people that were put in charge of this area were there because they were someone's favorite and not because they knew anything.",Don't put people in management roles because you like them or because they say 'yes' to what you want to hear. Step back and look at who actually has experience in the area and listen to those people.,2.0,3.0,3.0,2.0,3.0,1.0
2017-10-03,,,Former Employee ,"Promising Company, Poor Management",,0,The product offering really does set the company apart from its competitors. The company has learned from its mistakes and takes seriously at least some of the services required to make the product successful.,Management is weak and has very little experience with the actual products and services being sold. The bottom line is considered more important than the customers and customers are not as successful as they should/could be. Management is only looking out for themselves.,Put customers first so you'll get more referenceable customers.,3.0,4.0,2.0,3.0,4.0,1.0
2017-08-07,,,Current Employee ,Still a Great Place,More than 3 years,0,"- As a start-up, there has been some ups and downs, but mostly ups.
- Sales growth is still really great and the company is poised to become profitable next year.
- The company has expanded its product and revenue model in four years by investing heavily is gain share attached to the new SCF+ product which has been built from scratch by the Engineering team.
- The core people at Taulia are quite strong. Smart and good people.
- One person can make an impact at Taulia. You will know the CEO, he will listen to you and know you by name. You can positively influence the products or a business process. That is empowering and fun.
- The new executive group is very business savvy. They aren't quite as fun as some of the old group, but they are what Taulia needs right now. It isn't easy going from where Taulia was, hemoaging cash, to a profitable company. This crew is smart and makes, generally, good business decisions.
- The Engineering group is strong. They have a good work ethic and still apply the core values of the company in what they do. The Product group, once a weakness of Taulia with lots of turnover, has mostly begun to stabilize. The longer tenured portion of Sales is strong as well, with good, impactful sales people.
- There are ups and downs as we continue the journey, but Taulia remains fun and engaging.","- Taulia grew too aggressively in 2014 and has paid the price in 2016 and 2017 with layoffs.
- Culture and values have taken a little hit as the CEO and executive team micromanage it a bit when they should just trust their managers to get the job done. Culture is built from the bottom up, not from the top down.
- There has been some attrition over the last couple years. We have seen some good people leave. There will be some ups and downs at a start up and some people haven't coped well with that, opting for what they perceive as more stable companies. I think people that seek stablility in large companies, may find it. But, they may also find themselves part of a layoff if they have a bad quarter. I guarantee they won't have as much opportunity to positively impact the company.
- Some groups have lost sight of our core values, adopting large corporate processes that neither help get things done faster nor foster connection. But this is only a couple of groups.
- S.F., the head office, no longer feels like the cultural Mecca it once was. Other sites like Sofia, Austin, and Park City carry on parts of S.F.'S once great culture. This makes it a little harder for new employees to visit any one site to see what Taulia is about.","- Core values used to be a bigger part of who we were as Taulians. I don't always see these core values in the Executive team or see them as an integral part of the hiring process.
- Don't micromanage. Set clear expectations and trust your managers to get it done.",5.0,5.0,4.0,4.0,5.0,4.0
2017-08-26,,"San Francisco, CA",Current Employee ,"Great mission, great market, great culture. So why is the performance so underwhelming?",More than 3 years,0,Great people working in a fun laid-back culture. The values and sense of shared mission are strong. The market is tremendous and Taulia is the first to bring Dynamic Discounting and Supply Chain Finance into a flexible working capital solution that should become the norm for smart Treasurers who want to actively utilize their Supply Chain as a strategic investment or source of working capital.,Lots of turnover in senior management ranks. Taulia has raised too many rounds of funding and hasn't been able to hit their (albeit aggressive) revenue targets in recent years. I don't always see a sense of urgency from the rank and file to achieve the potential that is there.,Relentlessly focus on driving revenue. Commit to making data driven decisions and bring some discipline to the sales and marketing functions. Find a way to activate the partner sales channel.,4.0,5.0,4.0,4.0,4.0,3.0
2017-08-10,,,Current Employee ,A little weird and no longer fun,More than a year,0,"Benefits: Taulia still has good perks and benefits.

People: Most of the people working there are very talented.

Location: The main office is in San Francisco’s financial district, but there are many offices around the US and in Europe. Remote office is an option.","Management: With seemingly little experience in the technology industry, senior management clings almost cultishly to mantras, like being “fun and weird” or “fish in the pond”, while the company is behind target. Monthly all hands meetings and “fireside chats” feel more like a circus than a professional company meeting.

Product: Taulia software has become a collection of fixes and on/off switches. Instead of addressing critical issues, many teams cultivate pet projects, like new buttons or screen labels, that add very little value and often don’t even work.

Culture: I really believe that almost everyone at Taulia wants to succeed, but the company has become lost. Many people seem to follow procedure without knowing why and just do things because they are told to. People are frustrated and employee morale is very low.

Organization: Taulia is a technology company, but most in senior management have a finance background. As a result, they seek improvement by changing financial parameters in the organization, like changing the bonus plan and now lay offs again, while the core software product deteriorates.","You are ultimately responsible for the situation at Taulia. But instead of owning it or maybe even asking the different teams what can be done to improve the situation, you wait until it is too late, suddenly ramble something about how “a company has to be profitable”, and lay off people that were actually doing work making it even worse for those left behind.

Stop treating employees like they are little children and get your act together.",2.0,2.0,2.0,2.0,2.0,1.0
2017-08-17,,,Former Employee ,Customer Facing Role,,0,The people are very nice and welcoming.,Taulia is continuing to find it's self. My time at Taulia was cut short by an unexpected layoff. Internal communication is lacking as well as focus on product enhancements.,Get a plan and stick to it.,2.0,4.0,4.0,2.0,3.0,1.0
2017-07-13, Senior Data Engineer,"Park City, UT",Current Employee ,Great Company and Culture,More than a year,0,"Great people, fun atmosphere, challenging environment, interesting work","Some attrition to better opportunities, many rounds of funding a concern, some immature technology practices",Keep up the good work - continue to attract talent and keep telling success stories,5.0,5.0,5.0,5.0,5.0,5.0
