date,employee_title,location,employee_status,review_title,years_at_company,helpful,pros,cons,advice_to_mgmt,rating_overall,rating_balance,rating_culture,rating_career,rating_comp,rating_mgmt
2017-08-22,,,Former Employee ,Definitely NO,More than a year,0,Good work life balance .,"Most dis-organized place I worked in my entire career so far. I have no idea why did i stick here for what ever time I was there . Team I worked in had no future path . Manager was leaving in his/ her on dreams thinking team is preforming awesome and everyone is busy . Leadership had no clue what work is being done exactly . Highly miss managed organization . Internal opportunities in the company are not based on Talent and experience but totally based on networking and how much you connect with other people ( ""Culturally""). Not a place where you want to build your career and grow",Get more involved .,1.0,4.0,2.0,1.0,2.0,1.0
2017-08-04, Anonymous,,Former Employee ,Hamstrung,More than a year,0,Free lunches twice a week in the office. Great office locations in San Francisco and Park City. Benefits are good.,"Management wants to be ""cool"" but does not know what they are doing. Problems with the core technology are not addressed. Few senior people take responsibility for what is going wrong. Mismanagement led to hiring freeze and lay-offs.",Stop overselling and work on the core technology issues.,1.0,2.0,1.0,1.0,1.0,1.0
2017-07-27, Software Engineer,"San Francisco, CA",Current Employee ,Company slipping into non existence.,More than 3 years,0,"Cool location. If you are single, benefits are good. Not so good if you have a family. Stocked kitchen. Good hardware to develop on.","Company is on the downward slope. They just had a hiring freeze and now a reduction in force. Managers are extremely narcissistic. I would not recommend any of my friends even interview here. They may be around for a while, but there is no grow in the company. No career growth. Lots of back biting in the company. Just a terrible environment.",Reward hard workers who help others make the company better. Not just the names you know.,1.0,2.0,4.0,1.0,3.0,1.0
2017-06-28, L1 Support,,Current Employee ,Taulia Is the BEST,More than a year,0,"This is the first job in a long time where I actually want to come in to EVERYDAY! I am motivated to come in because I love my job, the work I do, and the best manager, and co-workers. This company is very flexible and are very empathetic to their employees.",None that I can think of?,None.,5.0,5.0,5.0,5.0,5.0,5.0
2017-07-28,,,Former Employee ,Just sell the company already,More than a year,0,"HR staff is friendly
Interesting technology
Good location

Fairly good transparency from CEO.","High turn over, and two series of layoffs withing two years.

Management just cannot seem to get together and focus on getting sales.

No sales plan, marketing department can't connect to audience.

Most of the founders are completely disengaged, which is disheartening in a company that is still trying to find itself.

It's obvious that they are trying to groom the company to be sold to someone bigger with more stability. And the sooner that happens, the sooner upper management can take their cut and bail.",Figure out how to connect with your customers.,1.0,2.0,3.0,1.0,3.0,1.0
2017-06-27,,,Former Employee ,Definitely a unique experience,More than a year,0,"- Most employees are fun-loving, passionate, and intelligent people who you can really learn a lot from
- Awesome product, fast-growing industry
- Opportunity to explore different career paths, room to take on extra responsibilities that don't directly fall under your role, but could benefit you professionally in the long run
- Good benefits/perks
- Great culture overall","- High turnover reduces employee morale, deeply impacts day-to-day operations
- Most on the business operations side look out for themselves only; a difficult place for someone to start your career as you'll likely learn little of value and have little guidance",,3.0,5.0,5.0,2.0,3.0,2.0
2017-06-02,,"New York, NY",Former Employee ,Not the same Taulia,Less than a year,0,"You can sit around and do absolutely nothing and get paid! That's not too bad if you're into that sort of thing. No one is really held accountable, so if you don't like having to perform then this could be a Pro. Nice people. I read previous posts about racism and other HR issues...total B.S. Taulia is at least an HR responsible organization and cares about their people on a personal level. Has ultimately become a lifestyle company.","Tons of turnover in Marketing, Sales, nearly all Solution Consultants are gone, the partner team is a revolving door.

Lack of executive leadership! The executive leadership are genuinely good people, however they have zero experience, zero market intelligence and zero plan. This is very different from the days when the founders ran the company and drove the strategy. The company has unfortunately lacked all humility and has convinced themselves that they're the market leader in supplier financing, yet in all honesty they rely completely on their finance partner for market intelligence. The product is in dire straights and zero product development for years now. All of the product improvements are ""fixes""...nothing new or innovative. Implementations and account management is all over the place.

Generally speaking Taulia is still more concerned about creating a weird ""cool"" culture more than creating a mature, professional and accountable culture. It's time for Taulia to grow-up, become humble once again and find real leaders with a vision and with executive experience. Time is running out.

It also seemed like the Sales leadership for the last couple of years has zero understanding of Taulia's business, which could be a big reason for the underperformance.",None,2.0,5.0,3.0,1.0,2.0,1.0
2017-05-31,,,Current Employee ,There's nowhere I'd rather be!,,0,"Taulia really is a place where you can make of it what you want. I have been here for some time now and have been able to grow in my career and take on whatever my heart desires. Since we are still a start up we definitely have gone through our fair share of growing pains, but we have such an amazing group of folks here that always keep the energy high in the office. As a matter of fact anytime you ask someone what their favorite part of Taulia is, it's very rare for them to say anything other than ""the people"".",No cons - I actually look forward to coming to work!,"Since some of our management team has only been here for a year or so, I think they are getting into the groove of things now and it's been awesome to see. One thing that I've always appreciated about our management team is that they have always appreciated hard work. If you work hard here you can excel vastly. Please continue to do so!",5.0,5.0,5.0,5.0,4.0,5.0
2017-05-31, QA Engineer,"Park City, UT",Former Employee ,Taulia sucks it up big time,More than 3 years,0,"They definitely bring you in with the lure of drinking on the job (illegal), and claiming that no matter what the work always gets done.

I'm not there anymore.","They tout all this team activity - but actually do something maybe twice a year, and it's only very local - while the managers get to go off multiple more times to offsites that are at really neat places - leaving the rest of the employees to drudge away at a failing technology.

The managers (in at least the engineering department) don't have much of any insight into what actually needs to be put in to their application from testing to release - and have begun to harbor a morale busting approach of disparaging engineers rather than being fully supportive in actually getting the work done.

They do not assign work that applies to the career path an engineer has followed up to working here - as such it makes people either keep working for them in technologies they don't want to work in - or they are forced to try and find new work after having gotten rusty at what they used to be good at.","Be supportive to your team members - using thinly veiled excuses to punish people who are doing their best only serves to make you look like horrible people who I would strongly suggest against working for. The higher management needs to do some realization that their subordinates are causing massive drops in morale - and the teams I worked with do not enjoy working under the current management, with many looking to move elsewhere after they relearn the skills this company forced them to move away from. Let front end people do front end - forcing the back end up their back end is no way to keep people both working for you and happy.",1.0,2.0,1.0,1.0,3.0,1.0
2017-03-15,,,Current Employee ,Has potential but isn't reaching it.,More than a year,0,"Some fun events, a lot of good people work there and are skilled at what they do, some employees have top notch technical skills and a willingness to work well with others, used to be a really exciting place to work","high turnover, constant changes in staffing and policy, right hand doesn't know what the left hand is doing sort of thing. Don't think a lot of decision makers know what they're doing or else they don't know have enough information/insight to make effective decisions.",Not sure.,3.0,3.0,4.0,3.0,3.0,3.0
2017-02-16,,,Current Employee ,"A fun, fast moving, and challenging environment",More than a year,0,"The Taulia team is a fantastic group to work with. Everyone has a very good team attitude, they are willing to chip in and help each other, and aren't afraid to be open and honest about where we do well and where we need to improve. There is no ego or politics going on.",It's fast moving. The business is growing quickly and thus we're always growing and realigning as an organization and as individuals. You have to be ok with that constant change and personal growth that comes with it.,Keep doing what your doing! It's great to see the momentum the company continuing to build and see the personal growth from employees along that journey. Keep promoting from within and continuing to challenge employees to grow with the business.,5.0,4.0,5.0,5.0,4.0,5.0
2016-07-29,,,Current Employee ,"Great company, incredible growth",More than 3 years,0,"Worked here for 3+ years; great company, industry-leading value prop (yield enablement and/or SCF all-in-one and scales to thousands of suppliers). Taulia cares about its employees.",None that I've witnessed over the past three years.,Keep up the great work. Stay focused on targets.,5.0,5.0,5.0,5.0,5.0,5.0
2016-06-15,,,Current Employee ,taulia,,0,Good people for the most part.,Future company outlook is tough.,,1.0,2.0,2.0,1.0,3.0,1.0
2015-12-17,,"San Francisco, CA",Current Employee ,Very happy to be here,Less than a year,0,"Our number one company value is ""We Get Sh*t Done"", and we do. We've dedicated ourselves to helping our customers in supply chain financing options. It's challenging work. And it's rewarding work. We're well funded, and know where we're headed. Company culture is paramount to keeping us motivated. The management team is awesome! We're not stuck to our chairs..grab your laptop and take a comfortable seat next to the window. We're a diverse group of people, we have fun and embrace staying weird. Management is truly interested in your ideas, and will support your growth. We have monthly parties, lunch is brought in a couple times a week, a manicurist and masseuse regularly. The location couldn't be better! 2 blocks from the Embarcadero, great food, shopping and transportation.","No Cons, but some advice: We're a fast growing company. If you're given the opportunity to be here, recognize your good fortune, and embrace the environment. Learn everything you can. Be motivated, be flexible and contribute to this awesome culture we have. Taulia is unique.",,5.0,5.0,5.0,5.0,5.0,5.0
2015-12-16,,"San Francisco, CA",Current Employee ,A company made to allow you to develop professionally,,0,"I joined Taulia a long time ago, as a Junior Software Engineer. Since then I was given the chance to choose what is next according to my personal/professional preferences. I was never blocked or interrupted by anything/anyone during my pursuit of my goals, in fact I was always supported.
On the personal side, I got out a lot more. Since first day I build up close friendships with multiple people at the company. Yes we worked hard, but together going in the same direction.
I always felt that you could approach anyone at any given time, and everyone was happy to have a chat about anything. No egos, no bulls**t.","As any given startup, things change fast. People leaving, change in some parts of the organization hierarchy... Most of the times, all of that happens for a good reason, for everyone. You need to be cool about that pace and be able to adapt fast.",,5.0,5.0,5.0,5.0,5.0,4.0
2015-12-18, Software Engineer,"San Francisco, CA",Former Employee ,A once good company goes down with too many C players,More than a year,0,"A unique culture, the HR team does it's best to keep the spirits of the company up. The founders are fantastic people, the location is prime. (Downtown by Embarcadero Pier). The engineering is motivated to lift itself and become better but lacks experience and wherewithal to do the same. Some really smart and fun people work over here, the culture is casual and work life balance is good.","When I started, the company was full of bright and smart people and a tight knit culture. Overtime, a majority departed and the culture revealed itself as cliquey.
By the time my employment ended, it was dominated by politics and insecure management that saw good people being forced to resign or fired. Politics interfered and sadly the company is now made up of C players when at a time it was full of A and B+ players looking to lift the company in a better direction. Execution on most projects was sloppy.","Cut the politicians, they have vested interests. Remove the C players and reinstate the things that made the company special again. I wish you best!",2.0,5.0,4.0,2.0,3.0,1.0
2015-12-09,,"San Francisco, CA",Current Employee ,Growing pains,More than a year,0,"Good Marketing team, presenting a cutting edge vision for the company. HR organizes fun parties and monthly celebrations.","High turnover throughout the company. Morale is an issue. Several VP executive positions open for extended times, which is hurting growth. Lack of enterprise B2B knowledge hurting product development execution. Company needs to get the right talent into key position to make it to the next level.","CEO is high quality, but needs to address problems.",2.0,2.0,3.0,1.0,2.0,1.0
2015-11-20, Senior Software Engineer,"San Francisco, CA",Current Employee ,"Great work culture and startup environment, thrive to success",More than a year,0,"- Smart colleagues, always willing to go the extra mile
- Solid product and promising business domain
- Challenging environment, transforming into a scalable business organization
- Startup like perks","- Challenge can be also a drawback, as it implies little more effort",,4.0,3.0,5.0,4.0,4.0,4.0
2015-10-20,,,Current Employee ,Everything I'd want for in a fast growing startup!,,0,"- There is a huge opportunity in front of the company, the space is very interesting and exciting. We have a massive opportunity in front of us to redefine an industry, it's very exciting and fun to work on that every day.
- The mgmt team is an impressive group, both great and open/transparent leaders, but also having amazing industry experience.
- Everyone is very helpful and open to sharing/teaching each other.
- There is a great sense of community, we're all in this together across the company. There are no lines between groups or departments.","- Like with any fast growing startup there is a lot of change. As we've ""grown up"" and turned from a small startup into a small company in the past 2 years, lots of change during that process, you need to be comfortable in a world of change.
- You need to be hungry and passionate. The space is exciting and there is a huge opportunity, but that also means there is lots to do! There is a constant desire from everyone in the company to do more and get farther. Which is a good thing, it makes it an exciting and rewarding experience, but you have to comfortable in that environment.",,5.0,4.0,5.0,5.0,4.0,5.0
2015-10-08, Enterprise Business Representative,"San Francisco, CA",Current Employee ,Life-Changing Company,,0,"I am excited to get to the office in the morning.
I feel respected and cared about by management.
I am encouraged to be creative and make mistakes.
I have a balance between work and life.
I am excited by where the company is going.
I have the most fun workers anywhere.
There is plenty of opportunity for advancement as the company grows.
My productivity is celebrated.","It is honestly difficult to think of cons. I have been sitting here for 5 minutes trying to think of one. Maybe that the average age of the employees is (I would guess) mid-30's, so it was a bit of an adjustment accepting that my manager was younger than me.",Continue to invest in the best and celebrate your employees. We appreciate it very much.,5.0,5.0,5.0,5.0,5.0,5.0
2015-10-02,,"Park City, UT",Current Employee ,Taulia Rocks!,,0,"The people are amazing! There are genius level folks around every corner and the vibe is support, compassion, and concern for one another. The pace is fast, the work ethic is strong, the management has our back, and the emphasis is on team wins that translate to customer value.

I'd be negligent in my reporting if I didn't also say that the catered lunches are tasty and encourage team unity.","We are a rapidly growing company and must think creatively every single day so that we can meet the changing demands and opportunities for which we are blessed. That's not a con for me, but if you are looking for predictability, this might not be the place for you.","Don't ever forget what got us here...Keep Taulia Weird, and keep on taking care of us.",5.0,5.0,5.0,5.0,4.0,5.0
2015-10-05,,"San Francisco, CA",Current Employee ,Awesome Team!,More than a year,0,"Everyone I've worked with is competent, responsive and a lot of fun to work with. Great professional working environment. Good benefits and great culture.","Taulia is growing, and so there are a lot of new names, and reorganizations in departments seem to happen somewhat regularly.",Maintaining company culture is vital as we expand. I would love to see more systematic effort in developing and training internal talent.,5.0,5.0,5.0,4.0,4.0,5.0
2015-10-08, Account Executive,"San Francisco, CA",Current Employee ,Account Executive,,0,"Every employee will pitch in to ensure the success of a sale to a new prospect and to make sure an installed customer is happy. Our customers love Taulia. I've never worked with a more intelligent, motivated staff in my career. The company culture is terrific and the executives are exceptional.","The company is growing fast so if you like the infrastructure of a large organization, this is not the place for you. You have to be nimble and open to change to do well at Taulia.",Consider hiring more employees in the remote offices.,5.0,4.0,5.0,5.0,4.0,5.0
2015-10-02,,"San Francisco, CA",Current Employee ,Great place to work!,Less than a year,0,"Family like culture, work-life balance and everyone works hard. The people I work with are smart, genuine and fun.",Having 401k would be great.,,5.0,5.0,5.0,4.0,3.0,5.0
2015-10-02, Software Engineer,,Current Employee ,"Visionary Company, Fantastic Culture",More than a year,0,"Taulia is a company with a vision to transform the global supply chain. The culture is fantastic - the right balance between getting things done, and loving what you do. They place a premium on finding the right personalities - those who share the same vision, work ethic, and ability to have fun and keep things exciting.","There are very few downsides to Taulia. The company is growing at a steady pace, which means the occasional growing pain.",,5.0,5.0,5.0,4.0,5.0,5.0
2015-10-01,,,Current Employee ,Grown up company with a start up atmosphere,,0,Taulia is 6 years old and has many of the tools and perks of a mature company but has not lost its start up feel. It is a fast paced business with huge upside. They value their employees and accountability starts with the CEO all the way down the line.,Not everything is 100% figured out so you have to come ready to think and provide solutions to grow into the future.,Keep on keeping on! Great place to work!,5.0,4.0,5.0,5.0,4.0,5.0
2015-09-23, Senior Software Engineer,"Park City, UT",Current Employee ,Great People - Great Product,Less than a year,0,"Taulia offers a really interesting opportunity. Taulia is a growing company and is on the path to continue making disruptions in the market. You get the chance to work with co-workers who are well educated, intelligent, helpful, and overall: a pleasure to be around. Compensation seems very fair and the benefits are average. The work is engaging and the career growth opportunities seem to be present. Taulia definitely has a family like atmosphere: where everyone is encouraged and aided by team members rather than put down for the sake of competition.","If I had to pick a downside to Taulia: I would have to say that the benefits package didn't necessarily stand out compared to other companies, which isn't really a downside, but something that just didn't stand out.","Continue to invest in people like you are currently. Also, keep encouraging cross team collaboration - Taulia has been one of the best at this I have ever worked for.",5.0,5.0,5.0,5.0,4.0,5.0
2015-09-28,,"San Francisco, CA",Current Employee ,The best place to work with endless possibilities.,Less than a year,0,"Taulia is the best company that I've joined in my 18 year-professional career. I joined this startup and market leader mainly because of the company's business model. The people and culture are the reasons that I passionately jump out of bed each morning to get to work.

Taulia does a great job hiring excellent people. Everyone is pleasure to work with and I have yet to experience any friction. There's plenty of guidance but very little hand-holding or micro-management.

Taulia is a steady growing startup that is always open to changes for improvement from top to bottom. These changes provide exciting opportunities for every Taulian to participate and contribute because of Taulia's flat organization structure.

The work/life balance is top-notch. As long as you ""get Sh*t done"", people have flexible schedules, work from home, or even be a remote employee. Some other start-up perks are: coffee/expresso machines, fridge are full of drinks, fruits and snacks to your heart's content, lunch provided twice a week, end of the month celebrations.

The final pro: The Best Location For Most Commuters!!! The corner building is a block away from the Transbay Bus Terminal, a couple of blocks from Embarcadero BART station, three blocks from casual carpool, and surrounded by tons of eateries for the days that Taulia doesn't provide free lunches.

I wished I'd joined Taulia earlier but I am glad I am finally here for the exciting bright future!","- I would love to see 401K matching and paid family leave.
- Once a year company gathering would be great as well.",Please keep the open door policy and valuing your team as much we value you!,5.0,5.0,5.0,5.0,4.0,5.0
2015-10-12, Software Quality Engineer,"San Francisco, CA",Current Employee ,"Great place to learn, work and grow",,0,"Taulia is a fast paced start up involved with many new technologies. The people that work at Taulia, are smart, fun and dedicated to creating a great work environment. They have a great solution that impacts the success of small business and large businesses and the overall world economy. Taulia is involved with numerous fortune 1000 companies and has a huge potential to become very successful.",Being a start-up there are some growing pains and restructuring of the organization that happens from time to time.,,4.0,,,,,
2015-09-27,,,Current Employee ,Great disrupting company,,0,"Great clients, great strategy, great people",Would like to have more company-wide gatherings in person,Keep it up,5.0,5.0,5.0,5.0,5.0,5.0
2015-10-02, Senior Software Engineer,"Park City, UT",Current Employee ,Senior Software Engineer,More than a year,0,"Tight knit. Excellent culture that fosters open communication and trust.
Hardworking environment but not stressful. You are expected to deliver what you commit to and the team may pitch in to bring the work to the finish line.
Great office location (if you are into outdoors).
Excellent equipment for software development.
Your contribution makes a big difference, it's still a start-up.
Excellent perks and benefits (except for medical)","New features often come from sales with no buyin from engineering.
There's fierce competition in the sector. Taulia is coming up with innovative products.
Given those mention 2 factors, sometimes blame is thrown by management around if things don't go according to plan.
Taulia has not been profitable and it won't be in the near future.",,4.0,4.0,4.0,4.0,3.0,4.0
2015-10-09, Program Manager,"Midway, UT",Former Employee ,Program Manage,More than a year,0,The company has excellent people and culture,Not a lot of career growth; path to success unclear,,4.0,4.0,5.0,2.0,4.0,4.0
