date,employee_title,location,employee_status,review_title,years_at_company,helpful,pros,cons,advice_to_mgmt,rating_overall,rating_balance,rating_culture,rating_career,rating_comp,rating_mgmt
2018-05-27,,,Current Employee ,"Manager, IT Delivery","Manager, IT Delivery",0,Good benefits good benefits good benefits good benefits,"Self service for booking tickets, etc",,5.0,3.0,3.0,3.0,3.0,2.0
2018-05-22,,,Current Employee ,Great Place to work,Great Place to work,0,Healthy work environment and located at a place where commute is not an issue at all,Some time work pressure is really high and should work late nights,it would be better if they arrange Social gathering with families at least twice a year,4.0,3.0,3.0,3.0,3.0,3.0
2018-05-28,,"Englewood, CO",Former Employee ,Not recommended,Not recommended,0,Pay is within the industry standards,HR is not supportive or organized,,2.0,,,,,
2018-05-18, Project Maanager,"Denver, CO",Current Employee ,Compliance,Compliance,0,Global peers experience is very engaging.,"mid level managers are incompetent, but, in control.",don't just downsize.,2.0,2.0,4.0,2.0,2.0,2.0
2018-05-30,,,Current Employee ,Not representative of the WU Way - cultural authenticity in question,Not representative of the WU Way - cultural authenticity in question,0,"Egalitarian ""USED TO BE"" our competitive advantage",Profit more important than the employee well being and customer delivery,"VERY disappointed in your recent change to the ""TRAVEL POLICY"" which used to be your defining cultural advantage. It said so much about the values Leadership had for the well being of its employee population. I USED TO BE SO PROUD to tell people that you considered anyone at any level worthy of being treated with respect and invested in their well being by allowing them the courtesy to travel business class regardless of their level in the organisation. By limiting this to VP and above, clearly this is no longer the case and profit over employee well being is way more important to the business. The negative impact this will have on your talented and valued employees will far out-way the benefit you will see in financial return as a result of this initiative. This is not the message you are promoting so passionately under the new WU WAY - makes me seriously question the authenticity behind our new cultural values - this will impact not only the employees but also the families that reside in regions where travel over large distances is required. I WAS one of the company's biggest advocates. What a difference one small but significant change can make. VERY DISAPPOINTED AND DISENGAGED!",1.0,,,,,
2018-05-09,,"Denver, CO",Current Employee ,People Are Not Held Accountable for not Performing,People Are Not Held Accountable for not Performing,0,The company has good benefits and a fairly flexible work schedule.,"The company is constantly saying that they 'Pay for Performance' but yet its difficult to reward good employees and employees that are clearly low performers are never dealt with. When employees do fail there are rarely ramifications for it and in some cases, employees that do minimum work are promoted because they were the only internal candidate that applied.","Employees that work hard and put in extra effort and hours need to be recognized for it, the Compliance department in particular seems to be to be too political and employees that have connections/friendships to leadership are promoted before the hard working employees are.",2.0,3.0,3.0,2.0,4.0,2.0
2018-04-25, Consultant,"Chicago, IL",Current Employee ,Consultant,Consultant,0,Great working environment and great culture.,No cons. Great working environment and great culture.,,5.0,,,,,
2018-05-01,,"San Francisco, CA",Current Employee ,Below Par on Engineering and Leadership Throughout WU Digital,Below Par on Engineering and Leadership Throughout WU Digital,0,"Snacks, open office, 401k matching.","Wrong people in management. Recently lots of offshoring, stifling turnaround time on development, sync on requirements or issues, and meetings with India folks became very early in the morning or late at night. Lots of architectural dependencies on multiple systems, causing long turnaround of product launches that can bring huge value to the business. High turnover rate in staff and management. Because of this, you are constantly spending time dealing with new folks who need to be brought up to speed. Big changes with each new management that come in, without preparation ahead for the negative impacts that should be so obvious to any good leader with a brain. So either they don't care, or they are not experienced enough to foresee them. Be prepared to work with developers with no clue on how to keep the code base intact. Lots of bugs discovered during UAT phase, and often a fix breaks something else. No accountability when escalations occur, which means weak individuals stay for a long time, slowly decaying any motivation and good culture that's left out of the org.
Heavy processes set in place, too many approvals required from various stakeholders before being able to start development or before a launch. The lack of trust is warranted however. So many production bugs found should've been obvious to anyone who knows the business fairly well. Again it's caused by 1) contractors offshore with below average knowledge in the business, 2) product teams are not on the same page in terms of the user experience or prioritization of features. Expect very little before a planned release, something will come up and delay launch.
Diversity is lacking. Prepare to feel out of place if you are a hard working individual who wants to do the right things. You will work lots of hours doing ad hoc stuff for your manager that's not expected any place else, mostly because other people are not doing their jobs.","Keep the good guys, and get rid of the toxicity. Be transparent and keep the egos out of leadership.",2.0,2.0,1.0,2.0,3.0,1.0
2018-04-03,,,Former Employee ,Digital Marketing Manager,Digital Marketing Manager,0,Very kind employees! Felt like a family!,A lot of higher management changes and company reorganization (once or twice yearly) so the consistency wasn’t there from the top.,,4.0,4.0,3.0,4.0,4.0,3.0
2018-03-25, Compliance Director,"Englewood, CO",Current Employee ,Sound Company,Sound Company,0,"Fair wages and benefits
Looking to change culture - involving management more actively involved with employees through regular communication","Long hours, continues to push more work on people. Makes work life balance difficult at time. Moving headquarters from current location to two different buildings - that are more than a mile apart and separated by major highway.","Managing the WU Way (Lean Management) from a cost only perspective will only work in the short term, not good for long term results.",4.0,2.0,3.0,3.0,4.0,4.0
2018-03-30, Individual Contributor,"Englewood, CO",Current Employee ,Company on the move,Company on the move,0,"Always cutting edge technology. I highly recommend this company as first job, 3-5 years tops.",Each year management gets weaker and weaker. Contractors run this company now. 5 year plans have failed each year due to managements limited foresite. limited advancement,"Manage people, not SLA's. To many master degrees who only learned to get other people to do their work.",3.0,,,,,
2018-04-01, Senior Applications Architect,"Washington, DC",Former Employee ,Middle of the pack,Middle of the pack,0,"Work life balance
Decent resource talent for legacy product company( full time employees)
Middle of the pack in technology adaptation. Not too bad compared to other product companies","Most of the workforce is contractors and not talented
Outsourced most of the systems recently
Still a big footprint of legacy systems in some departments",,3.0,4.0,3.0,3.0,3.0,2.0
2018-03-18,,"Englewood, CO",Former Employee ,Global company worth considering,Global company worth considering,0,The company has made some smart changes this last year and is on a good path for the future.,Improvement needed for succession planning,,3.0,4.0,5.0,3.0,3.0,4.0
2018-03-02, Senior Analyst,"Washington, DC",Current Employee ,Senior Analyst,Senior Analyst,0,"Bonus, tuition reimbursement, a lot of PTO, good work life balance","Limited growth opportunities, salaries low compared to similar companies",Express to employees that you care about growth and development,4.0,4.0,4.0,4.0,4.0,4.0
2018-02-09,,"Denver, CO",Current Employee ,Marketing,Marketing,0,"Great benefits, fair pay, good location",Not many people believe in the leadership,,5.0,4.0,4.0,5.0,5.0,3.0
2018-02-19, Analyst,"Denver, CO",Current Employee ,OK as a first job but not as a career,OK as a first job but not as a career,0,"Benefits are very good, flexible schedule, enjoyable work environment, laid back atmosphere, easy to go with the flow, overall a great place to work (for the complacent)","-I'd say that 80% of the managers have no idea how to ""people manage.""
-Upper management is out of touch with the 9-5 employee.
-If you work in Operations just be weary. Your job could be outsourced to Vilnius at really any time.
-The pay is ok for starters (0-4 years of experience), but any manager who is aggressive about career development is under paid. If one isn't a go-getter then his/her salary is probably in-line with the industry, but any go-getter who stays with WU is essentially taking a big pay cut. An analyst role with a big firm will pay one more than a senior manager role with WU. I guess what i'm trying to say is that there isn't much advancement in terms of salary to be found at WU for a serious career minded employee. The company higher ups like to say that they conduct studies to ensure their pay is in-line with the industry, but they don't understand that top talent needs to be paid MORE than the industry. To put it simply, WU is utterly incapable of keeping top talent because they pay an average wage, and what happens when you pay top talent an average wage? Just ask WU HR, they're kept mighty busy filling and refilling the same positions...","-Take down all the signs about how ""the customer always comes first"" or ""it begins with the customer"" and take a page out of Richard Branson's book. Employees should come first and they will take care of your customers. WU has forgotten the employee and drowns them in one customer centric module after another. Look i get it, you tried one approach and a good one too, but after 5+ years here I can say that it hasn't worked and nothing has changed.
-You need to find a way to keep top talent.
-You need to stop promoting people to managers just because they know the systems. Find managers who know how to people manage.",3.0,5.0,2.0,1.0,3.0,1.0
2018-02-20, Business Analyst,,Current Employee ,Good old company but has been going through many changes/restructurings,Good old company but has been going through many changes/restructurings,0,"Good benefits such as tuition assistance and student loan payoff assistance, the global reach and brand, striving to be more agile","Low pay vs the market, high turnover of employees, constant restructuring of the business","Pay well to your employees, be more agile to change to the market demand, innovate for new products",3.0,4.0,3.0,3.0,5.0,3.0
2018-02-20,,"Englewood, CO",Current Employee ,Hard to Swollow,Hard to Swollow,0,"Pay is good for entry level, and the people who do the grunt work are usually pretty awesome.","Layoffs happen every quarter and it’s extremely sad, they aren’t needed if they believed in process improvement. Not many people believe in the leadership as it is do as I say and turn your cheek to what I do. There is no support in growth opportunity unless you are in the inner circle then positions are made for you instead of open to others to apply. There is constant reorganization often caused by layoffs or VP and above leaving.",You may want to reevaluate your business and try to not have layoffs or VP and above leaving every week.,2.0,2.0,1.0,3.0,4.0,1.0
2018-03-11, Account Executive Or Area Sales Executive,"Portland, OR",Former Employee ,Run by criminals,Run by criminals,0,"When I first started the company was a good place to work, ever since the CEO Hikmet the culture changed completely.","They do not recognize talent, they keep the talent boxed where it is, no promotional opportunities. The culture was very abusive here, people will do anything to get ahead. I mean...anything. Better learn Spanish. Quotas are issued after the fact, they cheat you out of your commission. They expect you to buy a new car on your own dollar every few years or you can’t do your job.",Fire your self,1.0,1.0,1.0,1.0,1.0,1.0
2018-01-29, Senior Applications Developer,"Montvale, NJ",Former Employee ,Good Company....,Good Company....,0,Had great fun working at WU. People are very knowledgeable and help each other.,Too many contractors hired to work with employees.,Pay more $$$ to the employees instead of wasting on contractors.,4.0,3.0,3.0,3.0,2.0,2.0
2018-02-14,,"Saint Louis, MO",Former Employee ,Customer service,Customer service,0,Pay was good while they were here,Moved out of The United States,Stay in the United States,3.0,,,,,
2018-02-11, Senior TPM,"San Francisco, CA",Former Employee ,Lots of interesting technical opportunities,Lots of interesting technical opportunities,0,"Competive Pay, Nice Benefits, Location",It's a big financial company so lots of red tape and security hurdles to navigate. The company's core business is under pressure on multiple fronts.,,3.0,4.0,3.0,4.0,4.0,3.0
2018-01-24, Manager,"Denver, CO",Former Employee ,Management,Management,0,Good culture. Good attempts for work/life balance. Competitive environment.,Can be hard to follow work/life balance,,4.0,2.0,3.0,2.0,4.0,4.0
2018-02-20,,"San Francisco, CA",Current Employee ,"Poor at compensation, diversity and growth opportunities","Poor at compensation, diversity and growth opportunities",0,Work life balance and work from home opportunities,"Promotion from within is very limited; compensation improvements within same position do not exist; bonuses rarely paid in full; diversity in SF office product and engineering specifically are basically for H1Bs only....pretty sad. Also, non performers are allowed to keep their job.",,1.0,4.0,2.0,1.0,1.0,1.0
2018-01-17, Senior Leader,"Denver, CO",Current Employee ,great place to grow professionally,great place to grow professionally,0,lots of opportunities to learn and grow as a business leader. the organization is changing ever 12-18 months so you always have a new boss or team. working for a purpose-driven brand gives more meaning to your day-to-day work,"Lots of org changes - the minute everyone is finally working effectively in their new roles, the organization will change again.","The strategy is a good one, fund it, and let the team's do their work.",4.0,4.0,4.0,4.0,5.0,3.0
2018-01-17, Tech Ops,"Englewood, CO",Current Employee ,Talent not really valued,Talent not really valued,0,opportunity to experience chaos and disconnect between business and technology.,"Managers not willing to move past ""that's not how we do it here"" when looking to improve or advance initiatives and given feedback on how to achieve goals.
Views of Info Tech is very old school and seen as a cost center and necessary evil instead of a part of the business strategy.
Sending Technical roles to India under the guise of ""we are creating internal Employees.
Culture has created silo with in silo environments. Fostering teams to spend more time proving they didn't cause an issue verses working together to ensure the issue wont happen again.
Managers are managers not leaders.
Very political internally and externally to the point you don't (not that you should) want to even show a hint that you oppose leaderships views.
Opportunities for North American resources are scarce.","Don't just say you value talent, actually value your talent at all levels of the organization. Info Tech resources should be made just as important to the organization and not a necessary evil/cost center.
Stop pushing your political values in your conversations with employees.
Be straight forward instead of being shady about prepared actions",2.0,3.0,1.0,2.0,3.0,1.0
2018-01-21, Finance,,Former Employee ,Good company to work for.,Good company to work for.,0,Room for advancement. Good colleagues.,"structured, compensation could be better.",,3.0,3.0,3.0,3.0,3.0,3.0
2018-02-09,,,Former Employee ,In Need of Better Leadership,In Need of Better Leadership,0,"Good compensation, interesting international business","Little budget or staff resources to make a difference. Very poor level of leadership talent throughout the company, but most particularly at the senior level.",,1.0,2.0,1.0,1.0,3.0,1.0
2018-01-15,,,Former Employee ,Very Corporate,Very Corporate,0,Salary was respectable and benefits were good.,"Large, corporate company with many divisions. Overall company direction is confusing.",Stop moving technology jobs to offshore companies.,3.0,2.0,2.0,3.0,4.0,2.0
2018-01-30,,"San Francisco, CA",Current Employee ,Not the best place to work,Not the best place to work,0,"Modern office set up, snacks!","lack of diversity, no flexibility, high turn over rate",get it together,1.0,1.0,1.0,1.0,1.0,1.0
2017-11-18, Senior Manager,"Englewood, CO",Former Employee ,Beware of a dying company. The next Blockbuster,Beware of a dying company. The next Blockbuster,0,Talented workforce. Decent pay and benefits. Decent severance package when you get laid off. Nice on-site amenities that will soon go away when they sell their campus and downsize to leased space in a high rise (Red flag),"Where do I begin?
The company is in a constant state of flux and reorganization in hopes of saving what is a company dying a slow death.
Constant...and I mean constant...reorganizations of the business. Not only is this a problem, but the bigger problem is the reorgs involve the same leadership that is still stuck in the prehistoric retail location business model that is causing the company to die to begin with. It’s the same people in different positions. The proverbial shuffling the deck chairs on the ship mentality. No matter how you arrange the chairs...it’s still the same chairs.
There needs to be a complete overhaul of the leadership team. That isn’t happening with the current board. Meanwhile, competitors and fintech startups offering better, cheaper, faster are rapidly eating away at WU’s market share resulting in very low single digit growth.
In order to show growth, the company is cutting in other areas resulting in constant layoffs. Every November a d December involve mass layoffs. It’s a holiday tradition at WU. Although this year it went well into the spring.
The company is closing offices all over the world and consolidating. The most evident is putting their global headquarters campus they own up for sale and leasing several floors of a high rise just north of their current location. Again. Cutting costs in order to show what little growth they can.

To those interested in joining this company:
-Be ready for layoffs. Lots of them...under the disguise of the “WU Way.” AKA how to cut costs but still be able to pay for things like million dollar building ribbon cutting events, $15m logo sponsorships with sports teams and multimillion dollar salaries for execs.

-Be ready to deal with plenty of politics and heiarchy. It’s real at WU which operates very much in an old school heiarchal workforce model, which in turn impedes growth and decision making

-Be ready to work for a company getting its tail kicked by competitors including PayPal, Venmo and Transferwise. WU is trying to market to millennials but missed that boat years ago. It’s only a matter of time before the majority of their migrant market is able to utilize these new services and will leave WU for better, faster, cheaper. Money transfer is becoming a commodity market and will soon go the way of how services are bought such as cable, internet and cell phones. WU can’t get in a price war because they can’t afford to...mainly because they have to keep their 550,000 locations afloat...therefore sticking to the prehistoric business model and continuing in the death spiral.

-Be ready for lots of bosses. Turnover is real and talented execs are leaving and others constantly being forced out.

-Be ready for lots of processes, protocols and review. Thing is it bogs down performance and getting work done. The company has launched one new website the entire year. One. And that was for Kuwait of all places 😂😂",Take your package and leave. Hopefully the company will find a sucker to buy them or a miracle will happen and actually finds a leadership team that operates in the modern day century.,2.0,2.0,3.0,2.0,3.0,1.0
2017-12-14,,,Current Employee ,Pretty Good Company,Pretty Good Company,0,"Pay, work Life balance, benefits, management and flexibility",Seriously hard to think of any at this time. Only gripe would be the layers of bureaucracy,,5.0,5.0,4.0,4.0,4.0,4.0
2017-12-14, Senior Systems Administrator,,Current Employee ,Sr Systems Administrator,Sr Systems Administrator,0,Great people to work with,No downsides to mention about Western Union,,4.0,3.0,4.0,4.0,4.0,4.0
2017-12-11,,,Former Employee ,fraud detection,fraud detection,0,great environment to be in,pay salary is low for job,,5.0,5.0,5.0,2.0,2.0,5.0
2017-11-21,,,Current Employee ,2017,2017,0,Good vision and product set,Many different business units make for complex model,Freshen up and make the tough decisions to free up the potential,5.0,3.0,4.0,4.0,4.0,4.0
2017-12-04,,,Current Employee ,Compliance Manager,Compliance Manager,0,good benefits and ok work environment,"Upper Management, politics, move, future",Involvement,3.0,3.0,3.0,2.0,3.0,2.0
2017-11-10, Software Developer,"Montvale, NJ",Current Employee ,The best company I work for,The best company I work for,0,"Very generous salary, bonus and benefits including 401(k) matching, superb health plan complete with life insurance and all. Many other perks including tuition reimbursement, monthly coupons for free money transfer, rewards points you can use to but stuff online. Satisfying job knowing you help people reach out to their loved ones at crucial moments in their needs.",Non I can think of.,,5.0,5.0,5.0,5.0,5.0,5.0
2017-11-05, Senior Manager,"Denver, CO",Former Employee ,Decent company but leadership needs to learn talent management,Decent company but leadership needs to learn talent management,0,WU is very multinational and multicultural. The people really want to make a difference. Has a great vision ('Moving Money for Better'). Team I was in was very flexible on hours and allowed work from home. Pay was good.,"However, the organization feels to be in a constant state of reorganization. WU senior leadership is more interested in interacting with themselves and no one below their level. VPs come in, go straight to their offices, and shut the door. They barely talk to their staffs. We are just resources to be applied to a problem. Talent turns over pretty fast and there does seem to be a decline in quality of people coming in. I worked in analytics and the same issues existed. Timelines on projects were unrealistic and there is high pressure to work endless hours for no gain.",Get out of your offices and talk to your staffs. Show you actually care about who they are and their goals.,2.0,1.0,5.0,2.0,4.0,1.0
2017-11-04, Director,"Denver, CO",Former Employee ,Director,Director,0,Generally the people are nice once you prove yourself.,Western Union is constantly in a state of re-organization. I had 8 different bosses in 10 years. They seem to lack direction and shift their focus on key priorities way more often than a stable company should.,,3.0,4.0,2.0,2.0,5.0,2.0
2017-10-25,,,Current Employee ,Exciting career and competitive remuneration,Exciting career and competitive remuneration,0,"Work life balance
Exciting work
Salary and benefits",Can encouraged more incentivised benefits,,5.0,5.0,4.0,5.0,4.0,5.0
2017-10-30,,,Current Employee ,WU.com = good leadership; WU corporate = not so much,WU.com = good leadership; WU corporate = not so much,0,Surprisingly strong business latest at WU.com,Extremely bureaucratic and slow; lots of uncommitted people pushing work around and blaming each other,Hire less contractors and more employees,3.0,,,,,
2017-10-26,,"Washington, DC",Current Employee ,Certain business devisions better than others,Certain business devisions better than others,0,Great benefits and if you work in the main Denver office then you have better chance of getting promoted compared to working at any other of their other regional offices.,Western Union has gone through several acquisitions over the years and due that there has been some identity crisis. It also doesn't have a strong leadership and due to this they are not able to drive the change they want to be competitive in the payments business.,Hire leaders who can bring about change and who can clearly define the 2020 vision,3.0,5.0,1.0,3.0,5.0,1.0
2017-10-15,,,Former Employee ,It was fine,It was fine,0,"More or less interesting, many nice people",Nutty management with strange goals,,3.0,2.0,2.0,3.0,3.0,1.0
2017-10-15,,,Current Employee ,Awesome company to work for!,Awesome company to work for!,0,"Culture., salary, work life balance",None at all whatsoever till now,None,3.0,4.0,3.0,3.0,4.0,2.0
2017-09-25,,,Former Employee ,Great Place to work,Great Place to work,0,I had a great experience. Challenging work and surrounded by good people to work with.,"It is a big company, so therefore, alot of bureaucracy.",,5.0,,,,,
2017-09-23, Supervisor,"Englewood, CO",Current Employee ,Great Place to Work,Great Place to Work,0,Work-life balance is great. Salaries are extremely fair.,Office is moving so commutes will be worse. Lots and lots of meetings.,N/A,4.0,4.0,4.0,4.0,4.0,4.0
